Edited,Title,Genre,Author,URL
"ANH MUỐN...
Anh muốn tấn phong em làm hoàng hậu
Dẫu biết rằng anh chẳng phải là vua
Em là biển của muôn đời hiền hậu
Làm lòng anh khắc khoải bốn mùa
Anh muốn chấm em làm hoa hậu
Dẫu biết rằng anh chẳng là chủ khảo
Em đẹp chi mà đẹp vô hậu
Làm lòng anh thấp thỏm dạt dào
Anh muốn ngợi ca em là vũ trụ
Dẫu biết rằng anh hèn mọn ngu ngơ
Em là tiên khắp cùng hoàn vũ
Làm lòng anh say đắm vô bờ
Anh muốn tán thán em là Bồ Tát
Dẫu biết rằng anh tục tử phàm phu
Em giác ngộ tâm luôn có Phật
Làm lòng anh tu tập tâm từ
Trần Minh Hiền Orlando ngày 17 tháng 8 năm 2020",anh muốn...,,Trần Minh Hiền,https://poem.tkaraoke.com/108860/.html
"TRÍ THỨC LƯU MANH
thức khuya dậy sớm cần lao
dầm mưa dãi nắng lẽ nào ký sinh?
những tay trí thức lưu manh
sống nhờ ngân sách chửi công dân mình!
THỨ TRƯỞNG XIN NHÀ
thật tình nghĩ khó tin sao
quan chức học bộ lẽ nào nghèo xơ?
thị lang cũng hàm quan to
về hưu túng thiếu phải lo xin nhà?
SẬP CỔNG CHÀO
lại nghe tin sập cổng chào
tám chục tỉ bạc đổ nhào như không
may mà chẳng có thương vong
cũng là phúc đức ở trong họa này",trí thức lưu manh | thứ trưởng xin nhà | sập cổng chào,,Trần Đức Phổ,https://poem.tkaraoke.com/108861/.html
"EM CŨNG NHỚ ANH
Bài hoạ
Em vội tìm trong giá lạnh mùa đông
Màu nắng ấm nhạt nhoà không còn nữa
Nhớ lắm dạo... tình mình còn chan chứa
Đã rời xa bỏ anh giữa dòng đời
Yêu anh nhiều nhưng đành phải buông lơi
Vì duyên nợ không lời mời mà đến
Cha mẹ bảo làm con thì nghe lệnh
Cải được đâu nhà bên đón dâu rồi!
Đành âm thầm để tình nhạt phai phôi
Em cất bước niềm đơn côi sâu thẩm
Lệ lăng nhẹ hai hàng mi ướt đẫm
Có còn đâu hơi ấm lúc đông về
Em nhớ anh... ngày má thắm môi kề
Nhưng xin lỗi ...em về bên chồng nhé!
Anh đừng khóc mà hãy luôn mạnh mẽ
Bỡi đau buồn tình cũng rẽ làm đôi.
Nguyễn Thuyền
ANH VẪN YÊU EM
Bài xướng
Bao năm rồi em có biết không em
Anh vẫn mãi khát thèm tình em đó
Tình anh đối với em là bé nhỏ
Nhưng với anh thì to lớn rất nhiều
Nhớ ngày xưa ánh mắt em yêu kiều
Làm anh đã những chiều mong với nhớ
Cứ mong ước rồi thật nhiều bỡ ngỡ
Lòng rối bời khi những lúc gần nhau
Anh đâu ngờ tình chợt hoá nỗi đau
Rồi tất cả bỗng nghiêng màu cay đắng
Em cất bước theo chồng trong sầu lặng
Chôn chặt bao thương nhớ chẳng một lời
Cũng vì em anh bỏ mặc cuộc đời
Bao thương nhớ ngàn lời anh chưa tỏ
Anh nghèo khổ nên thật lòng quá khó
Để bên em chăm lo những tháng ngày
Anh yêu em nào trách em đổi thay
Chỉ trôn kính những đêm dài trăn trở
Mà giờ đã nát tan tành duyên nợ
Em bên chồng còn nhớ tới anh không?
Huỳnh Thiên Thanh",em cũng nhớ anh,,Nguyễn Thuyền,https://poem.tkaraoke.com/108862/.html
"VỀ ĐỒI MỘNG MƠ
Về Đồi Mộng Mơ gieo nhớ
Đà Lạt xứ sở ngàn hoa
Sỏi đá cuồng ghen muôn thuở
Dỗi hờn ngày tháng vội xa
Về Đồi Mộng Mơ gió hát
Thông reo khúc nhạc níu lòng
Nhánh cây hòa âm ngơ ngác
Chim chuyền xếp cánh nhớ mong
Về Đồi Mộng Mơ suy ngẫm
Khoảnh khắc thời gian cuống cuồng
Tắm gội mùa thu xa vắng
Đất trời nheo nhéo đòi thương
Về Đồi Mộng Mơ không nói
Se se lành lạnh đầu ngày
Ngoảnh lại cánh chim mòn mỏi
Thương chùm vụn vỡ kẽ tay
Về Đồi Mộng Mơ , mơ mộng
Dòng đời bàng bạc khói sương
Trái tim vỗ về con sóng
Khoảng trời mây trắng tư tương
Về Đồi Mộng Mơ lặng lẽ
Đà Lạt dốc chiều quanh co
Tâm hồn ngồn ngộn giấc trẻ
Nhện giăng rối rắm tơ vò
Về Đồi Mộng Mơ ái ngại
Cỏ hồng còn níu áo em
Đôi vai non tơ mềm mại
Một thuở tóc gió êm đềm
Ngày 17/8/2020
Thiên Ân ( Bình Dương)",về đồi mộng mơ,,Thiên Ân,https://poem.tkaraoke.com/108863/.html
"CHUYỆN ĐÔI TA
Trên đời mọi so sánh đều khập khiễng
Chuyện đôi ta như nhật nguyệt nhỏ nhoi
Thương cuộc tình bị sóng vỗ ra khơi
Hạt cát nhỏ rụng rơi và mất hút
Bánh xe thời gian lăn đi vùn vụt
Chim xoải cánh đo trời tiếng kêu thương
Bài hát xưa lùa giai điệu chán chường
Nước mắt ai còn buông ngập vai áo
Nụ hôn mong manh gieo sầu gượng gạo?
Đường chân trời nương náu góc bơ vơ
Cung đàn xưa như lạc điệu buông tơ
Sầu vội chín nghi ngờ có kẻ hái
Bờ vai non hương thơm mùi cỏ dại
Anh thầm khen mềm mại tuổi xuân thì
Ngày chia tay dùng dằng mỗi bước đi
Trái tim bỗng chai lì vơi cảm xúc
Chuyện đôi ta như rơi vào ngõ cụt
Lá vàng rơi ngậm bút tủi vần thơ
Mai mốt đây gặp gỡ trong tình cờ
Đau khổ đến ván cờ xê dịch mãi
Ngày 7/8/2020
Thiên Ân ( Bình Dương)",chuyện đôi ta 2,,Thiên Ân,https://poem.tkaraoke.com/108864/.html
"VĂN MINH QUÊ TÔI
Ngẫm chuyện thời nay lắm kiểu trò
Anh hùng mọc cánh để rồi lo
Làng trên chém vợ vì men tửu
Xóm giữa nhồi con bởi dạ bò
Lại mấy tay khùng ưa thủ võ
Nên nhiều gã tỉnh muốn nhường kho
Ngày qua một lũ trâu cùng xứ
Xử đẹp đời nhau cũng hét hò ./.
Lê Cảnh Tiến 18/08/2020
(Ảnh mạng)",văn minh quê tôi,,Lê Cảnh Tiến,https://poem.tkaraoke.com/108865/.html
"Trò chơi người khổng lồ đen tự do một mắt
Lý thuyết cân bằng mỗi cá nhân phải độc lập
Người chiến thắng ắt sẽ trở thành một vị Phật
Phải thuyết tương đối hẹp và thuyết tương đối rộng...",trò chơi người khổng lồ đen tự do một mắt,,Mr.Smile,https://poem.tkaraoke.com/108866/.html
"Uất nghẹn từng cơn cuộn sóng trồi
Ôm dòng lệ mặn khóc đời vôi
Ngày qua sóng dập đau bờ cõi
Tháng lại mây vờn xót bãi côi.
Dạ buốt vì sương giăng mịt lối
Lòng tê bởi gió phủ ngăn đôi
Ngàn năm vẫn thế đâu thay đổi
Biển mãi muôn đời vẫn cút côi.
Mì Ngố
19/08/2020",biển mặn,,Mì Ngố,https://poem.tkaraoke.com/108867/.html
"CẢNH BUỒN
Gió thổi đông về lạnh giá băng
Cảnh buồn thoáng nhẹ giọt sầu lăn
Ngồi thầm tưởng nhớ bên ao vắng
Tự hỏi ơi người có nhớ chăng?
Ngắm cảnh (bờ hồ  Công Viên Phú Lâm quận 6 HCM City)",cảnh buồn,,Nguyễn Thuyền,https://poem.tkaraoke.com/108868/.html
"Đếm giọt sầu rơi rụng những mùa qua
Đôi môi chẳng mặn mà như trước nữa
Bao kỷ niệm ngàn lời yêu chan chứa
Thoáng vụt tan nguyện hứa bỗng nhạt mờ
Thôi bây chừ quên hết cả ước mơ
Do cuộc sống đợi chờ thêm mệt mỏi
Nào ai biết theo dòng đời bước vội
Liệu còn chăng một lối rẽ chân thành
Nhớ tháng ngày mộng mị mối tình xanh
Nhưng trắc trở duyên lành không thẻ vén
Ôi ! Ái nghĩa nửa kiếp người nấc nghẹn
Đắng bờ mi xót tiếng hẹn câu thề
Xa nhau rồi nơi góc ruộng triền đê
Em đâu thấy anh về thăm đất mẹ
Thời vụn dại đắm say giờ cô lẻ
Níu đơn côi quạnh quẽ ủ tim hồng.
18/8/2020",tình thoáng xa bay,,YÊU THOÁNG QUA,https://poem.tkaraoke.com/108869/.html
"Đà nẵng ơi, cố gắng lên bạn nhé
Hãy kiên cường, mạnh mẽ cùng vượt qua
Trận chiến này, phần thắng sẽ về ta
Như bao lần ca bài ca chiến thắng
Ai cũng biết, còn vất vả nhọc nhằn
Những đêm dài,  thức trắng lo chống dịch
Hay cách ly, và ảnh hưởng lợi ích
Nhưng chúng ta hãy cùng nhau bình tĩnh.
Mỗi con người, sẽ là một chiến binh
Cùng giãn cách, để bảo vệ lấy mình
Sẽ nhanh thôi, bình mình ta cùng đón
Cả dân tộc,cùng trọn một niềm tin.
VIỆT NAM QUYẾT THẮNG COVID-19
27-07-2020",đà nẵng cố lên-việt nam cố lên,,Đoàn Thế Thanh,https://poem.tkaraoke.com/108870/.html
"Việt Nam! đất nước con người
Rừng vàng, biển bạc, đẹp tươi tuyệt vời
Ông cha, gầy dựng, bao đời
Giặc thù có mạnh cũng rời bỏ đi
Cho dù, nhiều lần lâm nguy
Thì rồi, phần thắng, vẫn quy về mình
Giờ đang, chung sống, hòa bình
Lại lo, chuyện khác, thình lình hiện ra .
Đó chính là , co-ro-na
Vi-rút, chủng mới, thiệt là quá ghê
Lần đầu, Vũ Hán mang về
Làm dân, lo lắng, u mê đủ điều .
Nhưng mà , chính phủ quá siêu
Khoanh vùng, dập dịch, làm nhiều người vui
Tưởng rằng, dịch bệnh, đẩy lùi
Cô Nhung, về nước, tối thui mặt mày .
Hành khách, trên cùng chuyến bay
Đã nhiễm, vi-rút, lại lây nhiều người
Thủ Đô, đang lúc vui cười
Trúc Bạch, phong tỏa, lúc mười, giờ y .
Hôm sau, cả nước, mua mì
Lòng dân, hoảng loạn, thầm thì, oán than
Chính quyền, các cấp, trấn an
Nước mình, nông nghiệp, cả làng, đừng lo
Đau đầu, khó thở, sốt ho
Gọi đường, dây nóng, chớ có đi đâu
Đồng bào, về từ, trời Âu
Khai báo, y tế, đôi câu, thật thà .
Trẻ em, người lớn, người già
Không việc, quan trọng, ở nhà, yên thân
Toàn quân, toàn đảng, toàn dân
Cùng chống, covid, tinh thần, quyết tâm.
Chỉ cần cả nước đồng tâm
Trận này, phần thắng, mình cầm trong tay.
18-03-2020
Đoàn Thế Thanh",việt nam quyết thắng đại dịch covid-19,,Đoàn Thế Thanh,https://poem.tkaraoke.com/108871/.html
"Thời gian năm tháng vô tình
Ai rồi cũng khác chính mình ngày xưa
Ngày xưa dáng dấp thấy bưa
Gầy gò ốm yếu chẳng ưa tý nào
Ngày nay tướng tá hồng hào
Có da có thịt biết bao cô ghiền
Tưởng Thanh uống phải thuốc tiên
Bạn bè gắn hỏi thanh niên ăn gì
Mà sao tướng tá phát phì
Làm sao hay vậy thầm thì tao nghe
Nói ra chẳng phải để khoe
Tại vì tớ uống ly he mỗi ngày (he= herbalife)
Bạn nào đang mãi loay hoay
Tăng cân giảm ký chấm ngay vô bài
Mình đây không có dông dài
Chỉ ngay phát một ngày mai khác liền",đoàn thế thanh,,Đoàn Thế Thanh,https://poem.tkaraoke.com/108872/.html
"Người sáng lập ra tôn giáo phi tôn giáo
Để thay đổi triệt để tâm thức con người
Tinh thần tôn giáo lúc nào cũng thuần khiết
Thông điệp Phật, chưa có một ai làm được...",người sáng lập ra tôn giáo phi tôn giáo,,Mr.Smile,https://poem.tkaraoke.com/108873/.html
"Những nhà sáng lập tôn giáo khác còn nhượng bộ với thính giả
Còn Phật không bao giờ khoan nhượng và đó là thuần khiết
Ông ấy chẳng quan tâm tới điều bạn hiểu chân lý tới đâu
Và ông ấy giãy bày chân lý và chẳng lo liệu bạn hiểu được hay không
Một mặt, làm như vậy có vẻ quá nghiêm khắc, nhưng mặt khác nó chứng tỏ từ bi vô hạn...",còn phật không bao giờ khoan nhượng và đó là thuần khiết,,Mr.Smile,https://poem.tkaraoke.com/108874/.html
"Thiên chúa tạo ra Adam và Eva chỉ một Tâm
Trò chơi mật mã để nhận biết là Facebook
Tức là chỉ yêu bản thân mình trong phút chốc
Và nhớ rằng nó cũng chỉ là điều dối gian...",trò chơi mật mã để nhận biết là facebook,,Mr.Smile,https://poem.tkaraoke.com/108875/.html
"Một thuở tình yêu khỏa nhiệm mầu
Xin Ngài muốn hỏi tại vì đâu
Người đi cách biệt buồn hiu nhớ
Kẻ ở chờ mong nặng gánh sầu
Có phải hương đời không thắm đượm
Hay là sắc nghĩa chẳng bền lâu
Lòng ai bạc bẽo nhiều gian dối
Lối mộng ngày xưa mãi úa màu.
VÕ QUANG HÂN
Đà Nẵng 18 - 08 - 2017",mãi là một dấu hỏi???,,VÕ QUANG HÂN,https://poem.tkaraoke.com/108876/.html
"VỀ ĐI EM
(Bài Xướng)
Em về sưởi ấm lại mùa đông
Để trái tim anh đượm thấm nồng
Héo hắt u sầu vì mãi đợi
Bơ phờ trĩu nặng bởi hoài trông
Bao ngày tủi phận phương trời mới
Vạn buổi hờn duyên ánh lửa hồng
Giá rét hồn loang tình mộng ảo
Nơi nầy lạnh lẽo biết hay không?
VÕ QUANG HÂN
Đà Nẵng 18 - 08 - 2016
******************************
EM SẼ VỀ
(Bài Họa)
Khắc khoải xa người đã mấy đông
Từng đêm lặng lẽ nhớ môi nồng
Mơ màng chốn cũ anh hằng đợi
Thổn thức quê nghèo bạn vẫn trông
Nghĩa đậm tương phùng se chỉ thắm
Tình sâu hội ngộ kết tơ hồng
Thu này nhạn én cùng xây mộng
Bẽn lẽn ơi chàng... có muốn không?
DƯƠNG TUYẾT LUÂN
18. 8. 2016",về đi em,,VÕ QUANG HÂN,https://poem.tkaraoke.com/108877/.html
"EM TRỞ VỀ
Em trở về bên kia nhớ thương
Gặp lại anh người tình chưa cũ
Dòng sông chảy qua hồn cao thượng
Thắp vàng lên ngọn nến xa mù
Em trở về bên kia mùa thu
Ôm kỷ niệm đợi đò qua sông vắng
Anh có còn yêu em mùa bão lũ
Thắp hồng lên ngọn đuốc vĩnh hằng
Em trở về bên kia vầng trăng
Vẽ tia nắng của ngày mai lãng đãng
Mây và gió cùng nhau bay im lặng
Thắp vàng lên hạnh phúc của địa đàng
Em trở về bên kia ngổn ngang
Vẽ ánh mắt của giai nhân hiền dịu
Đợi ngày mới tưng bừng vạn trạng
Mơ thần tiên rực rỡ thật nhiều
Trần Minh Hiền Orlando ngày 18 tháng 8 năm 2020",em trở về 08182020,,Trần Minh Hiền,https://poem.tkaraoke.com/108878/.html
"Ba nguyện làm cánh én
Cho con cả mùa xuân
Ba nguyện làm đôi chân
Đạp mềm đất đá cứng
Ba nguyện làm cơn gió
Thổi những áng mây kia
Cho con được nhìn thấy
Những tinh tú trên cao
Ba nguyện làm bờ ao
Cho con vui tắm mát
Ba nguyện làm khúc hát
Cho con giấc nồng say
Ba nguyện mỗi sớm mai
Được đưa con đến lớp
Hoàng hôn kia rơi vội
Ba nguyện rước con về
Nhìn con bước vào đời
Được nghe con cười nói
Ba nguyện làm như thế
Cả một đời vì con...!!!
P/s Chúc chàng trai vui tính sinh nhật ngày 12/07/2020 luôn hạnh phúc và cười nhiều em nhé...!!!",ba nguyện làm như thế,,Tấn An,https://poem.tkaraoke.com/108879/.html
"Tuổi thơ ơi, nơi phố nghèo lam lũ
Dễ mấy ai quên được gánh hàng rong
Sáng trưa chiều quà vặt đều có đủ
Khúc mía, củ khoai, mỗi lúc đói lòng
Những cái bong bóng xanh vàng tím đỏ
Những chú tò he hình dạng khôi hài
Là mơ ước của bao nhiêu em nhỏ
Trước cổng trường giờ tan học giằng dai
Những người chị, những cô, dì tần tảo
Từ tinh mơ cho đến lúc lên đèn
Nước mắt, mồ hôi đổi từng bát gạo
Đời nhọc nhằn chẳng một tiếng kêu rên
Họ cam tâm nay hy sinh đời bố
Để mai này rạng rỡ cuộc đời con
Đã không hiếm những mẹ cha nghèo khó
Con cái thành danh thơm nức tiếng đồn
Những gánh hàng rong thân quen biết mấy
Nghe tiếng rao hời quá đỗi yêu thương
Như tiếng mẹ, tiếng em hay tiếng chị
Giữa chiều quê, đêm thanh vắng phố phường
Chỉ những kẻ lương tâm không trong sạch
Mới tị hiềm, khinh miệt gánh hàng rong
Bởi có thể ngày xưa còn nghèo kiết
Từng một thời ơi ới gọi...hàng rong!",những gánh hàng rong,,Trần Đức Phổ,https://poem.tkaraoke.com/108880/.html
"Truyện Thơ: Tam Vĩ Hồ – Tập 33
Lối về bản chói chang những nắng
Mưa lốc qua chẳng đặng thấm gì
Cỏ thời vẫn điệu lâm li
Hoa sao nhái rụng rầm rì bướm ong
Tre lểu nghểu oằn cong chịu đựng
Cổ thụ già chưng hửng ngóng trông
Đất nung ẩm thấp khói nồng
Lúa nghiêng hứng giọt, mạ đồng thêm hương
Thấy khập khiễng ngài đương ủ rũ
Dang rộng tay công cụ che đầu
Đoạn rằng “Chớ đọng hạt châu
Ta luôn kề cạnh sớt bầu bạn chia”
Bạch Ngọc Thố đầm đìa xúc cảm
Lửa tình yêu ngớt ảm đạm trời
Dẫu bèo dạt cảnh chơi vơi
Mệnh số bời bời hẩm phận rối ren
Trăng tròn nhị đã chèn phẫn uất
May có Chàng rõ thuật đọc tâm
Chân rơi lỡ chốn thăng trầm
Người đây trí huệ uyên thâm giải buồn
Ngập trìu mến liễu khuôn gửi tặng
Ấm áp ôm, mặn đắng đổi thành
Ngọt ngào ửng mọng long lanh
Nụ say thuần túy xuân xanh thẹn thùng
Tuy ít gặp nhưng cùng sâu đậm
Mật du dương gặm nhấm can trường
Trống lòng trỗi nhịp vấn vương
Dù đang sát cánh lộ đường bên nhau…
August 14, 2020
Tam Muội",truyện thơ: tam vĩ hồ – tập 33,,TamMuội,https://poem.tkaraoke.com/108881/.html
"Truyện Thơ: Tam Vĩ Hồ – Tập 34
Trời nóng bức chuyến tàu rời bến
Hạt mồ hôi ướt quện thiên đình
Dạt dào tha thiết rung rinh
Khăn mùi xoa chặm quả xình xập reo
Tánh mạnh mẽ kèm theo thông thái
Mặt chữ điền ngự tại tâm can
Hồ đích thủy, Vĩ chính đàn
Tam càng tất cả giang san kiếp nầy
Thiếp sở nguyện đó đây vĩnh viễn
Luôn đồng hành, liễu hiến, đào dâng
Đêm buông hóa nguyệt soi vầng
Khi dông bão nổi, đổi tầng nhật may
Cộng sinh tử đến ngày tận thế
Hay tim hồng kiệt quệ khói sương
Dẫu thân cát bụi trải đường
Xác nào quản ngại âm dương đố nề
Đế vương quốc, vàng khê, núi bạc
Cũng không bằng đĩnh đạc Nhất Lang
Bỏ bách tính, để được Chàng
Vạn vật chẳng màng kỳ diệu tình yêu
Làng Mộc Dĩ nắng chiều yếu ớt
Đám sửu nhi bỡn cợt lùa trâu
Hí ha hí hửng dưới cầu
Nắm đuôi bì bõm ngẩng đầu hoan ca
Nhậm Phong Lữ, quán trà ghé lại
Nhấp Ô Long khoan khoái tinh thần
Bỗng đâu thình thịch bước chân
Khâm sai Bách Hạ! Tần ngần phút giây…
August 15, 2020
Tam Muội",truyện thơ: tam vĩ hồ – tập 34,,TamMuội,https://poem.tkaraoke.com/108882/.html
"Truyện Thơ: Tam Vĩ Hồ – Tập 35
Đoạn ám hiệu như nầy tái ngộ
Từ buổi thi khoa đỗ bảng vàng
Kẻ cờ võng lọng gia trang
Người xuôi biên ải đôi đàng ngựa phi
Khúc tương kính mừng li giao hảo
Mượn sương mai nung thảo dược trà
Vị thanh, ngọt hậu, thoảng qua
Tăng phần sang sảng thoắt mà tịch dương
Chàng giới thiệu dáng hường bên cạnh
Bạch cô nương, bạn sánh gót cùng
Hiên lầu bóng thượt thườn lung
Khẩn cấp tháp tùng mỹ nữ về dinh
Vội cáo biệt lộ trình giục tiến
Hốt nhiên luồng gió khiển, vòm khơi
Sấm nhằng chớp nhịt loé trời
Mát lạnh gọi mời, lất phất mưa bay
Ngang eo ếch choàng tay khe khẽ
Mai thẹn thùng, đào nhẹ tựa vai
Mượt mây ngan ngát hương cài
Khiến ong ngây dại, cánh ngài xôn xao
Ôi yêu nghiệt! Đốt bào gan ruột
“Đàn Thanh Kiều” chửa nuốt đã ngoi
Phấn hưng cám dỗ hẳn hòi
Kéo lôi cơ thể rạch ròi chẳng ngoa
Giọt nước đậu đài hoa sen trắng
Đảo gò bồng dựng thẳng thong dong
Đẩy đà tròn trịa nét cong
Lụa tơ ve vãn, quyến phong rủ tình…
August 16, 2020
Tam Muội",truyện thơ: tam vĩ hồ – tập 35,,TamMuội,https://poem.tkaraoke.com/108883/.html
"Truyện Thơ: Tam Vĩ Hồ – Tập 36
Đùng đoàng dội rung rinh trời đất
Ảnh lập loè gió quật ngã cây
Tràng mưa trút xuống nặng giầy
Đường xá bầy nhầy ghịt bước mã đi
Khói mù mịt trước thì chẳng thấy
Đành kiếm nhờ chỗ cậy qua giông
Ngõ kia thấp thoáng đình Rồng
“Lưỡng long triều nguyệt”, bỏ không có người
Cảnh như mực, Chàng bươi nhiên liệu
Gom bùi nhùi chủ yếu vật khô
Lượm thêm gỗ phẳng ván cồ
Khoét chữ V đồ, giữ trục, chắn khe
Đoạn hì hục lăn que đánh lửa
Ma sát phừng, than nhựa đỏ lên
Chu môi huýt sáo nhẹ bền
Đến khi bén ngọn, tiếp trên củi chồng
Thấy nhẫn nại, nhọc công, cặm cụi
Mặt bơ phờ đen đủi châu thân
Lem thanh nhã, luốc phong trần
Yêu mạch bỗng rần rần động buồng tim
Nhịp xao xuyến đã tìm đốt trúc
Dìu dặt bài diễm phúc lương duyên
Sông xanh nước biếc neo thuyền
Bến đậu phỉ nguyền, bồ liễu gửi nương
Chừng cảm thẹn, Nàng dường quá quắt
Tư tưởng nhiều, góp nhặt lung tung
Biết tơ vững chắc tương phùng
Hay chỉ trùng trùng, hủy hoại tào khang?…
August 17, 2020
Tam Muội",truyện thơ: tam vĩ hồ – tập 36,,TamMuội,https://poem.tkaraoke.com/108884/.html
"Truyện Thơ: Tam Vĩ Hồ – Tập 37
Mỗi một khắc nước càng xối mạnh
Sấm kinh hoàng, sét đánh liên miên
Ngây ngô gió rít theo liền
Kiểu ni cũ kĩ đình chiền tan hoang
Chắc thủy tộc đùng đoàng trẩy hội
Mừng tứ vương nạp phối phi tần
Nhuận, Khâm, lĩnh thuyết ái ân
Long sàng Quảng, Thuận, trắng ngần mải mê
Còn Oa Thị chiếu về tướng mạo
Bùn Hoàng Hà lấy tạo Nữ Nam
Thổi pháp thuật, thành kẻ phàm
Ban sinh khí lực ý hàm dụng con
Rồi cảm thán chưa tròn luân lý
Giáng trần gian dạy kỷ cương hầu
Họ chú rể, khác nàng dâu
Đức gìn đạo giữ nghĩa sâu vợ chồng
Bận bịu suốt, bao đồng những việc
Đố ngại ngần, chả tiếc dung nhan
Thạch ngũ sắc, luyện bấy ngàn
Vá trời cứu độ khổ nàn chúng sanh
Xuôi tuế nguyệt vận hành biến đổi
Lỗ thủng khâu lệch mối ít nhiều
Cỗi chân Ngao trụ liêu xiêu
Ngân Hà nhểu giọt tiêu điều bần dân
Thánh quên bẵng thảm lần hoạ xuống
Triều cường dâng, ngập ruộng, vỡ bờ
Vạc cò ngán ngẩm xụi lơ
Hương lân phải điệu Thiên cơ dãi dầu…
August 18, 2020
Tam Muội",truyện thơ: tam vĩ hồ – tập 37,,TamMuội,https://poem.tkaraoke.com/108885/.html
"....MÙA VU LAN 2020....
""Thơ : MC Quang Sáng""
(...Chàng trai xứ nghệ...)
Tiết trời thu ! Rằm tháng bảy hàng năm
Khắp mọi nơi kính dâng mùa báo hiếu
Có đi xa cách nghìn trùng vạn nẻo
Ở nơi đâu cũng nhớ tạ ngày này.
Đứa ở Sài Thành đứa phiêu bạt trời Tây
Bông Hồng Đỏ tặng dành ai đang đủ
Còn Mẹ Cha hãy nâng niu gìn giữ
Để năm sau bông đỏ vẫn còn đeo.
Bông Hồng Phai may mắn chút thương yêu
Mất một nửa ta vẫn còn một nửa
Tình thiêng liêng khi người đi kẻ ở
Sống xa con ! Ai đó lẻ một mình ?.
Cũng có người chỉ còn viếng vong linh
Cõi nhân thế nhìn hình trôi năm tháng
Dịp Vu Lan ngực cài đeo bông trắng
Ơn sinh thành ứa đọng lệ tuôn cay.
Bao năm rồi ta chưa ghé về đây ?
Hỏi đã đủ tháng ngày trong hứa hẹn
Còn bao năm vỡ òa ôn kỷ niệm
Bên gia đình đoàn tụ buổi cơm chung.
Có ai về thăm Mẹ Cha không ?
Có ai về thăm Mẹ Cha không ?
Quang Sáng. 18/08/2020",mùa vu lan 2020,,Lê Sáng,https://poem.tkaraoke.com/108886/.html
"TỰ TÌNH VỚI PHƯỢNG
Thân tặng : H.T N ( GV trường THPT An Mỹ)
Phượng hồng thắp lửa trên cao
Mùa thi qua ngõ nôn nao tâm hồn
Ve sầu  muôn tiếng nỉ non
Bóng mây mùa hạ dỗi hờn xa xôi
Phượng hồng giấu giếm không lời
Giọng ca đứt quãng rã rời không gian
Chia tay luống những ngỡ ngàng
Giật mình thương chiếc lá vàng buông lơi
Phượng hồng khoảnh khắc đầy vơi
Em còn gửi gắm nụ cười trần gian
Thả trôi cái đẹp dịu dàng
Áo dài tim tím hành lang chỗ ngồi
Phượng hồng ngày tháng rong chơi
Giọng Văn ấm áp bên đời nhỏ to
Thương trang giáo án lần mò
Màu quê hương , với cánh cò về đâu?
Phượng hồng in dấu mai sau
Tiếng giảng bài , vội tan mau góc chiều
Sân trường sỏi đá rong rêu
Nằm ôm tóc gió quạnh hiu lưng trời
Phượng hồng từ độ ra khơi
Trường xưa kỉ niệm một thời chưa phai
Em nghe lá đổ thở dài
Mấy mùa bụi phấn thương hoài không thôi!
Ngày 18/8/2020
Thiên Ân ( Bình Dương)",tự tình với phượng,,Thiên Ân,https://poem.tkaraoke.com/108887/.html
