Edited,Title,Genre,Author,URL
"Hơn hai mươi năm trước,ra hải ngoại rồi mới được đọc các tác phẩm phản kháng của Dương Thu
Hương,Trần Mạnh Hảo.Rồi sau đó đọc và ái mộ văn tài của Phạm Thị Hoài,Nguyễn Huy Thiệp.
Thời gian qua mau,tấm tình vẫn còn đó.Vậy mà mới nghe tin Nguyễn Huy Thiệp vừa khuất núi sau thời gian liệt giường,nghèo khó...Vẫn còn nhớ tên các truyện của ông viết .Nhắc lại để tưởng niệm một nhà văn nghèo,hiền,ít nói nhưng ngòi bút từ hình thức đến nội dung đều trực diện,sắc bén,câu văn ngắn mà chữ dùng rất đắt,viết bạo liệt mà nhân văn...Tướng về hưu,Con gái thủy thần,...gần gủi,đồng cảm với người dân.Kiếm sắc,Vàng Lửa,Phẩm Tiết mượn lịch sử đả phá thần tượng hoá.Có lẽ những kẻ chức quyền đã không mấy ưa.Lối viết,nội dung cũng khiến ông tách bạch với ""dàn đồng ca"" trong văn đàn. Đến khi ông viết phê bình văn học""Giăng lưới bắt chim"" thì có lẽ lại càng cô độc...
Ngòi bút sắc,ngắn,lạnh lùng,
Nguyễn Huy Thiệp đã ""Sang sông"" mất rồi...
""Tướng về hưu"" nhớ bồi hồi,
""Ngọn gió Hua Tát ""mím môi thuở nào,
""Những người thợ xẻ"" năm nao
""Kiếm Sắc"",""Vàng Lửa""đả vào chuyện xưa,
""Chuyện tình kể trong đêm mưa""
""Kéo cưa lừa xẻ"" liệu vừa thế nhân,
Khóc thương ""Con gái thuỷ thần"",
""Muối của rừng"" chát mặn phần nhân văn...
""Giăng lưới bắt chim""khó khăn,
Vẹn lời ""Phẩm Tiết"" nhà văn cuối đời,
Mãi còn ""Chảy đi sông ơi""...",nhớ nguyễn huy thiệp,,Trần Lê Tú,https://poem.tkaraoke.com/120675/.html
"""Đà Lạt có thác Cam Ly,
Có hồ Than thở ,chân đi không đành...""
Vướng hoài kỷ niệm ,lòng  anh,
Đã đi xa ngái,trông canh cánh về...
Bước chân lữ thứ lê thê,
Khi nao mới lại tìm về quê xưa?
Chiều trông qua cửa song thưa,
Ngỡ còn chút nắng năm xưa dọi về...
Phất phơ trên lọn tóc thề,
Người em ngày ấy làm mê say hồn,
Lặng trông khói toả hoàng hôn,
Nghe hơi ấm ủ tình thôn xóm gần
...
Chiều nay nắng cũng tần ngần,
Nhớ quê,vương vất nơi chân trời mờ...",xa đà lạt,,Trần Lê Tú,https://poem.tkaraoke.com/120676/.html
"Chiều qua,rảo bước về nhà,
Nhớ Đà Lạt ,đã rời xa,phương nào!
Bao hình bóng cũ hư hao,
Rớt rơi kỷ niệm dần vào hoàng hôn.
Những chiều Đà Lạt ,còn chôn,
Bao nhiêu thơ mộng trong hồn tha hương.
Ánh chiều,cách trở dặm trường,
Vẫn theo nhau,mãi vấn vương,đợi chờ...
Chiều qua,thả bước,bơ vơ,
Nhớ Đà Lạt,nhớ chiều mơ,thuở nào...
Nắng loe từ rặng thông cao,
Rắc vàng lên dốc nhỏ vào Thăng long,
Xuân Hương,bờ uốn cong cong,
Đồi Cù,rải thảm xanh trong mặt hồ,
Ngã dài bóng mấy ngựa thồ,
Bình yên nhơi cỏ quên,vô tư,đời...
Chiều qua,bước nhỏ bên trời,
Nhớ chiều Đà Lạt,một thời ước mơ...
Con gà,trên nóc nhà thờ,
Chiều xoay về dãy non mờ chờ ai?
Linh Sơn lối nhỏ,dốc dài,
Chuông ngân vọng tiếng khoan thai Hoà Bình,
Nước tan,xuống dốc,gập ghình,
Cam Ly,Than Thở đắm mình trong sương...
Chiều qua,bước lạnh trên đường,
Nhớ Đà Lạt,khói vương vương lam chiều,
Nhà xưa,phố cũ liêu xiêu,
Hoàng hôn Trại Mát một chiều lang thang,
Ráng chiều vàng đỉnh Lang Biang,
Hoa Sơn Tay Phật Điền Trang sương mờ.
Chiều qua,nắng nhạt,thẫn thờ,
Hoàng hôn Đà Lạt mộng mơ nhớ hoài...",nhớ đà lạt mộng mơ,,Trần Lê Tú,https://poem.tkaraoke.com/120677/.html
"Sáng,chào Đà Lạt ban mai,
Nóc chùa đã trải bóng dài đổ chuông,
Sương tan,Đà lạt hết buồn,
Cỏ hồng run lượn gió luồn vấn vương,
Chiều,chào Đà Lạt mờ sương,
Làm sao quên những nẻo đường thương yêu...
Quanh,cua,lên,xuống bao chiều,
Núi,đồi mang trĩu nặng nhiều nhớ thương...
Tối,chào Đà Lạt thân thương...
Bao nhau những món quê hương đậm đà.
Bánh căn,bánh ướt lòng gà,
Bánh mì xíu mại,...la cà quán đêm
Đưa nhau về lại nhớ thêm,
Gió hồ xao động sương đêm lững lờ...
Thôi chào,Đà Lạt xa mờ,
Hàng thông xưa đứng thẫn thờ từ đây,
Chập chùng đồi,núi giăng mây,
Sẽ vây nỗi nhớ buồn nầy lặng thinh...",chào đà lạt,,Trần Lê Tú,https://poem.tkaraoke.com/120678/.html
"Cao nguyên ,
Mấy thác,mấy ghềnh,
Mấy niềm ân hận đáp đền công lao...
Sương mù ,
Phủ mấy dốc cao,
Là bao gánh nặng
Mòn hao vai gầy...
Mẹ lo con được đủ đầy,
Ơn sâu này đáp sao tày,
Mẹ ơi...
Nuôi con,Mẹ cực cả đời,
Còn lo chăm cháu,nghỉ ngơi được gì?
Trọn đời như thác Cam Ly,
Nước trong,xuôi chảy chẳng bì,chẳng so...
Bao nhiêu nước,bấy âu lo,
Bấy điều cực nhọc,khổ cho con mình...
Bấy chấp nhận,bấy hy sinh,
Bấy lo chăm sóc,bấy tình yêu thương,...
Một đời an phận thủ thường,
Chỉ lo cung cúc nuôi ,thương con,chồng...
Mẹ nuôi chín đứa ,ẳm,bồng,...
Chín con nuôi Mẹ
Khó công chu toàn...",mẹ cao nguyên,,Trần Lê Tú,https://poem.tkaraoke.com/120679/.html
"Gió còn thơm,
Mùi tóc Mẹ không?
Mùi hương Bồ kết,
Thoảng mênh mông,
Quyện với mồ hôi tần tảo bết,
Bao năm nhớ hệt ,thoáng hương nồng...
Mưa còn thơm nhang Mẹ thắp không?
Những ngày giông bão,
Ngóng cùng trông...
Nửa muốn con đi,
Nửa áo não...
Khấn mong tin báo,
Để yên lòng...
Sương có còn giăng sáng,chiều không?
Dãi theo dáng Mẹ
Ánh dương hồng...
Đổ bóng dài đi khi sớm,tối
Lo con ăn,học,...,gả vợ,chồng,...
Nắng có dịu đi
Trong chiều không?
Nắng thương da Mẹ
Má hây hồng...
Nắng thấm mồ hôi,
Sôi nước mắt,
Còng lưng,cắm mặt cho con,chồng,...
Đà Lạt ,Hoà Bình nhớ Mẹ không?...","gió,mưa,sương,nắng mẹ hiền",,Trần Lê Tú,https://poem.tkaraoke.com/120680/.html
"Ngày nao,
Mỗi sớm tinh mơ,
Mẹ lần xuống chợ
Sương mờ còn giăng,
Trời đen,
Lầm lũi ánh trăng,
Mưa tuôn,gió rét,
khôn ngăn chân người...
Bao nhiêu khổ cực,
Vẫn cười...
Thương con,
Mong chúng nên người,
Làm vui..,
Ngày đêm,
Tất bật,lui cui,...
Trải qua năm,tháng,
Chôn vùi tuổi xuân,
Giờ đây,
Đã quá bát tuần,
Một đời khó nhọc,gian truân chẳng nề.
Gặp con,Mẹ chỉ hề hề...
""Liệu hồn,giấy rách ..giữ lề nghen...
Con!""
Suốt đời,
Trăng Mẹ vẫn tròn.......",suốt đời trăng mẹ vẫn tròn,,Trần Lê Tú,https://poem.tkaraoke.com/120681/.html
"Sương Đà Lạt,hỏi con,
Tóc Mạ,
Có còn xanh hay ngả màu mây?
Ngày xưa ,
Trên mái tóc nầy,
Sớm,chiều sương đọng,
Sợi bay dịu hiền...
Nắng chiều Đà Lạt,
Ngoài hiên.
Hỏi con,
Lưng Mạ,còn nghiêng dáng gầy?
Những chiều,
Nắng đổ về Tây,
Mạ còn tất bật,
Má hây hây hồng...
Mưa phùn Đà Lạt,
Ngóng trông...
Hỏi con,
Mắt Mạ,còn không,xa vời?
Tiễn con
Vượt biển,ra khơi,
Mưa đong mắt Mạ,
Một trời lo âu...
Rặng thông Đà Lạt,
Nghiêng đầu,
Thương con,lòng Mạ,
Biết đâu bến bờ...",đà lạt hỏi,,Trần Lê Tú,https://poem.tkaraoke.com/120682/.html
"Điếu thi viếng Ôn Tánh Hải:
NGUYỆN CẦU GIÁC LINH TRƯỞNG LÃO HOÀ THƯỢNG THƯỢNG TÁNH HẠ HẢI CAO ĐĂNG PHẬT QUỐC.
NGUYỆN CẦU  dâng nén tâm hương.
GIÁC linh thuận thế vô thường ra đi,
LINH Sơn Đà lạt trú trì,
TRƯỞNG lão Thường trực chủ trì Chứng Minh,
LÃO tăng Phước Thiện thân tình,
HOÀ tăng hợp chúng ,lợi sinh nhân quần,
THƯỢNG cầu hạ hoá phân cân,
THƯỢNG TÁNH  HẠ HẢI xa gần kính thương,
CAO minh,hành giải trợ tương,
ĐĂNG diệt còn chút thạnh phương cho đời.
PHẬT Đà tiếp dẫn độ Người
QUỐC độ Cực Lạc là nơi viên phần.",điếu thi viếng ôn tánh hải,,Trần Lê Tú,https://poem.tkaraoke.com/120683/.html
"EM LÀ NỤ HỒNG
Em là nụ hồng
Nở giữa hồn anh
Em là giấc mộng
Hiện thực hiền lành
Em là lấp lánh
Bình minh tuyệt vời
Em là sương lạnh
Phủ đầy trùng khơi
Em là tơ sợi
Quấn quanh tâm hồn
Em là ngày mới
Tươi hồng nụ hôn
Em là dập dồn
Tình yêu nồng cháy
Em là bận rộn
Mọi ngày đắm say
Em là phơi bày
Tiếng yêu rộn rã
Em là nước chảy
Ướt mềm khúc ca
Trần Minh Hiền Orlando ngày 1 tháng 11 năm 2022",em là nụ hồng,,Trần Minh Hiền,https://poem.tkaraoke.com/120684/.html
"CÁI RÉT ĐÊM TÌNH
Trong đêm tối một phòng đơn gối chiếc
Ngoài trời mưa gió lạnh rét căm căm
Ta nằm đó cố quên đi cơn giá
Mắt nhắm nghiền ta cố ngủ cho mau
Nhưng khí lạnh cứ luồn luồn lách lách
Tới bên ta xâm chiếm chút yên lành
Ta nằm đó co ro thê thảm…
Bỗng có tiếng gõ cửa gọi tên
Em quay lại, căn nhà bừng hơi ấm
Đôi mình cùng nhau nói nói cười
Cái rét đông khuất phục trước hai người
Cứ nồng nàn rạo rực đôi trái tim
Và chuyện cũ đôi ta bỏ qua hết
Em ôm ta thì thầm tha thiết
Khiến ta chẳng kìm nổi cảm xúc mình
Ta ngây ngất trong hương thơm êm dịu
Trái tim ta đập nát cả trời đêm
Ta âu yếm xiết chặt em bé nhỏ
Êm ái, nồng nàn – rét nhé quên…
09/2000
Nguyên Hữu",cái rét đêm tình .,,Nguyên Hữu,https://poem.tkaraoke.com/120685/.html
"MẸ
Ba ngàn một bó rau lang .
Còng lưng mẹ đôi quàng gióng mây .
Bàn chân mẹ vẹt gót giày .
Đường làng trũng dấu tháng ngày mẹ đi .
* *
*
Ngày xưa mẹ ! tuổi xuân thì .
Nuôi con mẹ chẵng quản gì nắng mưa .
Một ngàn một bát dưa chua .
Đêm về góp nhặt vải thừa mẹ may .
* *
*
Giồng khoai tưới đẫm mồ hôi .
Cay cay nước mắt mặn mòi cải xanh .
Râu khoai hoa cải ngọt lành .
Khoai thơm áo ấm bát canh mẹ nhường.
* *
*
Vầng trăng mẹ ẳm trên lưng .
Mặt trời của mẹ êm đềm trong nôi .
Nay đà tóc bạc gia mồi .
Mẹ là ngọn gió suốt đời bên con .
Lyhong",mẹ tôi,,Lykimhong,https://poem.tkaraoke.com/120686/.html
"KÝ ỨC  TÌM VỀ
Ta tìm về lối nhỏ chốn quê xưa .
Ve rã rích tiếng mưa buồn chiều hạ .
Con chuồn kim trên mặt hồ lạnh giá .
Nét chân chim nơi khóe mắt đượm buồn .
*       *
*
Chiều êm đềm vương nỗi nhớ dịu êm .
Giọt nắng vàng buông trên cành cọ.
Thoảng hương bưởi nhẹ nhàng theo gió .
Ký ức lạc vào trong nỗi nhớ khát khao .
*       *
*
Ngày xưa ơi ngõ củ đá xanh rêu .
Một mình ta ngập ngừng trên lối vắng .
Lục tìm lại những gì trong sâu thẳm .
Vắt vẻo lưng trâu thổi sáo thả diều .
*       *
*
Ánh đèn dầu leo lét lạc về đâu .
Còng lưng mẹ nét nhai trầu bõm bẻm .
Khói bếp chiều rộn ràng lên hương cốm .
thoáng giật mình tóc đã bóng hoa râm.
Chiều HươngSơn",ký ức tìm về,,Lykimhong,https://poem.tkaraoke.com/120687/.html
"Một sớm thu về theo gió may
Sương thu phơn phớt đọng vòm cây
Bình yên sóng nhỏ lăn tăn nghịch
Lững thững mây ngàn lơ đễnh bay...
Đắm giữa dòng thu trôi lãng đãng
Chìm trong mặt ngọc ngấm men say
Khẽ khàng chiếc lá rơi trên cỏ
Động khoảng trời thu buổi cuối ngày!
nvpk",chớm thu,,Nvpk,https://poem.tkaraoke.com/120688/.html
"NỢ ĐỜI
Anh còn nặng nợ với đời
Với em và cả triệu người anh yêu
Thời gian nắng sớm , mưa chiều
Tiếng chim kêu , tiếng chim kêu ...nao lòng
Bốn mùa XUÂN ,HẠ ,THU ,ĐÔNG
Bên thềm chiếc lá quay vòng về đâu ?
Nỗi sầu giăng kín nỗi sầu
Mùa con gái , đã trôi mau bao giờ ?
Anh còn nặng nợ câu thơ
Gặp em , thuở ấy tình cờ thương nhau
Môi hoa ong bướm bắc cầu
Ngẩn ngơ muôn lối ngõ vào trái tim
Lắng nghe , gánh vác ưu phiền
Ngày nao nhơ nhớ môi em mềm mềm
Đôi lần mơ hái trái duyên
Thương vùng kỉ niệm êm đềm cỏ hoa
Anh còn nặng nợ chiều tà
Trôi theo tà áo em xa mịt mờ
Đốt lòng cho cháy xác xơ
Mùi hương mái tóc phất phơ đường trần
Cho đi một thoáng bâng khuâng
Cho đi  câu hỏi xa gần , gần xa
Thương đôi mắt ướt hiền hòa
Lòng ngân nga , lòng ngân nga ...thẫn thờ
Ngày 13/10/2022
Ân Thiên ( Bình Dương )",nợ đời 2,,Thiên Ân,https://poem.tkaraoke.com/120689/.html
"Thơ hoạ Nguyễn Thành Sáng & Tam Muội (955)
Động Vật
MÈO TRẮNG thu mình tránh gió đông
BƯỚM XANH uốn lượn ghẹo hoa hồng
CHÓ ĐEN lững thững ra khung cổng
VỊT ĐỎ nhẹ nhàng lướt bến sông
CỌP XÁM gầm gừ theo gió lộng
HẠC HỒNG lờ lượn thả non bồng
TRÊ VÀNG đầu bự trong thì rổng
DƠI BẠCH tối về kiếm khoảng không!
Nguyễn Thành Sáng
Muôn Loài Đón Ánh Bình Minh
(TNBC - Ngũ Độ Thanh)
Bên mành nét ngọc thưởng bình minh
Lảnh lót vành khuyên dạn dĩ hình
Lém lỉnh bồ câu hè ngưỡng dựa
Bơ phờ cốc nhỏ lạch mồi rinh
Chai lì lợn béo luôn niềm nở
Bướng bỉnh dê gầy mãi lặng thinh
Khập khiễng bò nông cày đám cỏ
Muôn loài vạn vẻ đón ngày xinh.
February 20, 2019
Tam Muội
NHẤT LANG THƯ QUÁN:  nhatlang.com",thơ hoạ nguyễn thành sáng & tam muội 955.,,Nhất Lang (Nguyễn Thành Sáng),https://poem.tkaraoke.com/120690/.html
"Thơ hoạ Nguyễn Thành Sáng & Tam Muội (956)
Tê Tái Mảnh Hồn Ma
Anh da diết với nỗi sầu khôn tả
Lệ ma hồn rỉ rả nhỏ hư vô
Muốn nằm cạnh bên vợ hiền khuây khoả
Bao năm dài thương nhớ cách xa nhau!
Mà hỡi ôi! Nào đâu còn thân xác
Chỉ vật vờ, khoảnh khắc ảnh mờ thôi
Cho tha thiết đầy vơi nơi phảng phất
Phải nghẹn ngào dằn vặt đỉnh chơi vơi…
Ngoài song cửa từng hồi mưa tí tách
Gió đẩy đưa lách cách vọng âm buồn
Lửa ân ái rực hồng dang dở tắt
Khiến cõi lòng chất ngất mối tơ vương
Anh tiến sát cạnh giường nhìn em ngủ
Mái nhung huyền che phủ vạt đìu hiu
Khom cúi xuống vói khều sang phía đó
Để nhẹ nhàng hơi thở của vợ yêu
Bỗng bất chợt khuôn chiều nghiêng trở lại
Mở bừng ra, nhấp nháy hướng về anh
Em ú ớ lâm râm trong mệt mỏi
Rồi nhấc tay cố vói giữa thâu canh!
Có phải chăng mộng lành nơi giấc điệp
Dẫn u hoài thiêm thiếp thẳng vào mơ
Để năm tháng đợi chờ bên giá rét
An ủi lần chấm hết một vần thơ…
Môi rung rung, lắc lư bờ vai lạnh
Em ngả đầu tiếp nhắm dưới thu đêm
Anh đứng lặng mà tim đau ngút tận
Hận riêng mình và hận cả cho em
Vì sao lại mối duyên tình thắm đượm
Nửa chừng xuân phải hứng chịu phũ phàng
Cho người phải võ vàng từng hôm sớm
Kẻ tái tê lởn vởn bóng lang thang…
19/2/2019
Nguyễn Thành Sáng
Da Diết Vọng Hồn Ma
Tiếng sấm chớp rền vang thêm bấn loạn
Se sắt luồng từng đoạn thắt tâm tư
Quyển nhật ký cánh thư đang trì hoãn
Viết lưng chừng hận oán kiếp lắc lư
Vầng trăng khuyết lừ đừ xuyên song cửa
Rót nghẹn ngào chan chứa nỗi niềm riêng
Tình vạn kỷ xích xiềng tơ hồng hứa
Bão nghiệp trần dứt nửa đổ ngả nghiêng
Hương phảng phất khí thiêng dường sót lại
Thấm mặn nồng ngọt trái của thời qua
Lửa chăn gối đậm đà ngân nga mãi
Du mộng tình gặt hái thủ cung sa
Mình yêu hỡi! Đôi ta hồn vào mộng
Ảnh chập chờn thoáng bỗng tiến gần em
Ngàn tia sét nhá nhem bầu lồng lộng
Thiết tha nhau dang rộng cánh bên rèm
Mình yêu hỡi! Sự thèm vòng khao khát
Nghĩa vợ chồng trôi dạt ngưỡng bể dâu
Gieo nghịch cảnh xám mầu giăng bát ngát
Siết tim buồng tan nát lấp huyệt sâu
Mình yêu hỡi! Canh thâu âm thầm khóc
Sỏi đá đường khiến ngọc vữa héo hon
Duyên diệu vợi bào mòn treo sợi tóc
Vướng thăng trầm trằn trọc gót hài son
Mình yêu hỡi! Chẳng còn nuôi hy vọng
Dẫu tháng dài trông ngóng lệ thênh thang
Nay ảo não bẽ bàng băng tuyết đọng
Giọt ưu hoài quạnh bóng tủi xốn xang
Mình yêu hỡi! Lỡ làng câu hẹn ước
Chốn dương trần độc bước đẫm chua cay
Miền thống khổ đoạ đày tràn phía trước
Thuyền gập ghềnh xuôi ngược ải lá lay
Mình yêu hỡi! Bao ngày sôi nhung nhớ
Hướng phương trời nức nở giữa mênh mông
Ngập da diết bềnh bồng uyên dang dở
Hết thật rồi tận nợ cách ngăn sông
Lại đêm nữa phập phồng chìm hoang vắng
Xót xa trào mặn đắng tím vành môi
Khói sương nhạt bồi hồi trong tĩnh lặng
Mong Mình về gửi tặng chút phai phôi.
February 20, 2019
Tam Muội
NHẤT LANG THƯ QUÁN:  nhatlang.com",thơ hoạ nguyễn thành sáng & tam muội 956.,,Nhất Lang (Nguyễn Thành Sáng),https://poem.tkaraoke.com/120691/.html
"Nắng hình như nhạt bớt
Gió hát khúc chuyển mùa
Một năm qua rồi đó
Sao cứ hoài ngẩn ngơ
Mùa về ngang gõ cửa
Uh thì đông vừa về
Thôi anh về nhóm lửa
Cho mùa bớt lạnh tê..",đông về,,Calong Nguyen,https://poem.tkaraoke.com/120692/.html
"Em đã hiểu tiếng lòng anh đó
Mến thương em từ độ dương xuân
Nay đà lá rụng đầy sân
Ngày ngày ngấp nghé đông lân mấy lần
Anh cứ thấy muôn phần cảm kích
Dáng  đài trang thanh lịch làm sao!
Như vầng trăng tỏ trên cao
Lại tài thi phú dồi dào ngữ âm
Tâm cảm dẫn thương thầm nhớ trộm
Bấy lâu nay như ốm tương tư
Hình em cứ giữ khư khư
Mười ngày như một, chẳng dư một ngày
Non cao nặng chẳng tày tình nặng
Đêm thu sầu ngồi lặng nhìn đêm!
Ước gì có cánh như chim
Bay về phương ấy đi tìm người thương!
2 / 11 / 2022.",ước gì có cánh như chim,,Nguyễn Sông Tiền,https://poem.tkaraoke.com/120693/.html
"ĐIỆU RU DỖI HỜN
Em ru điệp khúc dỗi hờn
So đo , trách móc buồn hơn thu gầy
Nghìn năm mây trắng vẫn bay
Trăm ngày tỉnh , nghìn ngày say thiệt là....
Bướm ong dan díu cỏ hoa
Thương màu nắng đẹp hiền hòa dễ yêu
Đêm nằm gác trọ quạnh hiu
Khóc thầm dang dở trăm điều xót xa
Dỗi hờn mọc nhánh kiêu sa
Đố ai , ai đố đến ba , bốn lần ?
Ta về gánh bóng phong trần
Con đường hun hút tan dần khói sương
Tội anh ôm mộng văn chương
Đam mê cái đẹp đời thường đó đây
Âm thầm theo dấu đôi hài
Đôi chân ngây dại của ai lượn lờ ?
Đôi khi đối mặt bơ vơ
Tiếng buồn não nuột ngậm bờ bến đau
Vì em , ta sớm bạc đầu
Vòng tay bỏ ngỏ mai sau chạnh lòng
Ngày 14/10/2022
Ân Thiên ( Bình Dương )",điệu ru dỗi hờn,,Thiên Ân,https://poem.tkaraoke.com/120694/.html
"Trích Đoạn Bài Thơ: MỘT CÁNH CHIM BAY
Của Nhất Lang (Nguyễn Thành Sáng)
Thôi rồi! Gửi lại mảnh tình quê
Phố chợ, con đường, chuỗi bước đi
Nụ thắm, môi hồng, trăng bến mộng
Dòng sông, đò nhỏ…chẳng còn chi
Rồi đây dưới bóng hoàng hôn đổ
Khách lạ phương này nhỏ vấn vương
Khắc khoải, dạ sầu, đang lững thững
Niềm thương, nỗi nhớ vượt biên cương
Hay sắc hào hoa choá ngợp đầy
Đẩy đời phiêu bạt đến gần đây
Chụp lên cho khuất bầu xưa cũ
Để nhạc, cung đàn thả gió mây…
NHẤT LANG THƯ QUÁN
(Nơi Tinh Hoa Thơ Ca)",1- thơ hay ngắn trích đoạn,,Nhất Lang (Nguyễn Thành Sáng),https://poem.tkaraoke.com/120695/.html
"Trích Đoạn Bài Thơ: EM ĐÃ SAI RỒI
Của Nhất Lang (Nguyễn Thành Sáng)
Anh hiểu em buồn, em khổ đau
Lắm khi thao thức dưới canh thâu
Nhớ nhung dĩ vãng, thời hoa mộng
Buồn bã âm thầm cuộc bể dâu
Phải chi ngày ấy đừng im lặng
Sợ vỡ trăng thanh, rã ánh tàn
Khép kín nỗi niềm, xuôi định mệnh
Để hờn với nghẹn lại cho anh ...
nhatlang.com",2- thơ hay ngắn trích đoạn,,Nhất Lang (Nguyễn Thành Sáng),https://poem.tkaraoke.com/120696/.html
"Trích Đoạn Bài Thơ: NỖI NIỀM CỦA MẸ
Của Nhất Lang (Nguyễn Thành Sáng)
Năm xưa hụt hẫng chuyến đò đời
Sắc thắm nhạt dần, cõi mộng rơi
Lạc lõng, chơi vơi thuyền bến đỗ
Đành dừng ghé lại cất chèo bơi
Nào hay giữa đoạn ánh phai mờ
Mới biết nơi này chẳng có thơ
Nhưng trót cắm sào neo chỗ đậu
Thôi thì gửi gió ảnh hình mơ..
nhatlang.com",3- thơ hay ngắn trích đoạn,,Nhất Lang (Nguyễn Thành Sáng),https://poem.tkaraoke.com/120697/.html
"Trích Đoạn Bài Thơ: CÁM ƠN TÌNH XƯA
Của Nhất Lang (Nguyễn Thành Sáng)
Bởi nhờ hình bóng của yêu đương
Canh cánh lòng tôi suốt đoạn đường
Rồi một chiều kia hồn trở gót
Tìm về bến cũ uống trăng sương
Ôi hỡi! Chẳng ngờ em đợi tôi
Một luồng chấn động tận xa xôi
Xé màn bao phủ hằng muôn cảm
Hồn sĩ ngàn xưa...trở lại đời
Nhập vào chiếc ảnh nghẹn cô đơn
Để mãi từ đây có nhạc đờn
Mỗi lúc ngân nga niềm dĩ vãng
Ru sầu héo hắt dịu từng cơn...
nhatlang.com",4- thơ hay ngắn trích đoạn,,Nhất Lang (Nguyễn Thành Sáng),https://poem.tkaraoke.com/120698/.html
"Trích Đoạn Bài Thơ: HÃY GẮNG ĐI ANH
Của Nhất Lang (Nguyễn Thành Sáng)
Cuộc đời đâu chỉ có lời thương
Lẽ sống mọi bề phải nặng mang
Tay trắng làm sao đan kết mộng
Ấm lòng trăng gió cuộc yêu đương
Mai mốt đi vào cảnh sống chung
Hoa tình thắm đượm cất vào khung
Quay người đối mặt bao gian khó
Túng quẫn khốn cùng có nhạt hương?...
nhatlang.com",5- thơ hay ngắn trích đoạn,,Nhất Lang (Nguyễn Thành Sáng),https://poem.tkaraoke.com/120699/.html
"Trích Đoạn Bài Thơ: MỘT MỐI TÌNH SI
Của Nhất Lang (Nguyễn Thành Sáng)
Thời gian chầm chậm dần luân chuyển
Rực rỡ hôm nào loãng nhạt hương
Xanh, đỏ, trắng, vàng...hờ hững bóng
Đìu hiu lặng lẽ dưới hoàng hôn…
Một thuở ai kia lảy tiếng đàn
Đợi người xuân nữ ngắm nhìn ngang
Giờ đây chỉ thoảng màu dư ảnh
Kẻ để trần gian khúc võ vàng.
nhatlang.com",6- thơ trích đoạn,,Nhất Lang (Nguyễn Thành Sáng),https://poem.tkaraoke.com/120700/.html
"Trích Đoạn Bài Thơ: NỖI LÒNG MỘT CÁNH CHIM
Của Nhất Lang (Nguyễn Thành Sáng)
Còn đâu phố chợ với đường đi
Bến nước, dòng sông, ánh nguyệt thề
Những tiếng ê a thời tuổi dại
Bao chiều kỷ niệm trải lê thê
Ánh mắt người thân đâu thấy nữa
Ngọt ngào gần gũi nghĩa quê hương
Tình yêu đang độ mùa hoa nở …
Tất cả này đây, vỡ đoạn trường ...
nhatlang.com",7- thơ hay ngắn trích đoạn,,Nhất Lang (Nguyễn Thành Sáng),https://poem.tkaraoke.com/120701/.html
"Trích Đoạn Bài Thơ: TÌNH VỠ
Của Nhất Lang (Nguyễn Thành Sáng)
Tôi biết tình tôi đã lỡ làng
Vì không kéo được chút vầng trăng
Cho đêm ửng sáng khi chìm tối
Nên phải đành cam nhận phũ phàng
Em cứ an nhiên với lãng quên
Thuở nào êm ả dưới thênh thang
Anh à! Đẹp quá chiều nay hỉ
Bởi chuỗi cung đàn…giữa trống trơn
Mai mốt này đây những giá đông
Em ngồi đan áo ấm cho chồng
Có nghe bất chợt từ trong gió
Nếu mất nhau rồi … Anh hiểu không?
nhatlang.com",8- thơ hay ngắn trích đoạn,,Nhất Lang (Nguyễn Thành Sáng),https://poem.tkaraoke.com/120702/.html
"THẮP VÀNG LÊN NGỌN NẾN
Thắp lên vàng ngọn nến
Ru hồng lên cánh buồm
Dòng sông không bờ bến
Em hiền lành dễ thương
Anh yêu em vô lượng
Ôi đoá hoa tươi hồng
Mùa tuyệt vời vô thượng
Em dịu dàng mênh mông
Thắp bình minh trên đồng
Cùng em qua ngàn lối
Tình chúng mình thơ mộng
Em ngọt ngào làn môi
Nghe mùa thu bồi hồi
Trái tim và khối óc
Mùa sang mùa tụ hội
Em nhiệm mầu tinh khôi
Trần Minh Hiền Orlando ngày 2 tháng 11 năm 2022",thắp vàng lên ngọn nến,,Trần Minh Hiền,https://poem.tkaraoke.com/120703/.html
