Original,Edited,Title,Genre,Author,URL,"Data
usable"
,"Ta hiện hữu
Lắm bóng hình
Đầy quyền năng sáng tạo
Loài người bảo rằng ta ảo
Giữa cuộc đời đảo điên điên đảo
Lắm mánh mung
Ta kiệt sức vẫy vùng
Vươn mình trong mệt mỏi
Ta có mặt khắp nơi
Bên thiếu nữ yêu đời
Cạnh chàng trai trẻ
Bằng tấm lòng rộng mở
Thủ thỉ
Tâm tình
Dịu ngọt
Rất nên thơ
Đầy huyền bí
Ta là bạn tình chung thuỷ
Nhưng luôn bị bỏ rơi
Bởi lòng người tham mới
Ta gượng sống cố vươn lên
Thay hình đổi lốp
Lại yêu người
Không trách, chẳng hờn ghen
Ta là người đưa tin nhanh nhất trên đời
Đặt bước khắp nơi
Rải tình muôn hướng
Giúp kẻ thế cô
Vạch mặt bọn gian đồ
Ta ghét lời xảo trá điêu ngoa
Bởi thân ta được tạo bằng ngay thật
Có phương thức hẳn hoi
Bằng mồ hôi nước mắt
Của triệu triệu kẻ có lòng
Yêu đời yêu cuộc sống
Ta không là núi cao biển rộng
Nhưng bản chất vô cùng
Nếu loài người hiểu thấu
Xin đừng bảo ta NET ảo
Tự khóa lòng mình
Hãy đến với ta
Bằng con tim chân thật
Bạn sẽ yêu đời
Chẳng mất chi đâu
Chu Hà",lời của net,,Chu Hà,https://poem.tkaraoke.com/28786/.html,
,"Đâu rồi giọt nắng nám trên da
Đâu khoảng mênh mông tiếng gáy gà
Mưa dãi lê thê dài lối nhỏ
Đường về quê mẹ nẻo còn xa
Tìm đâu hương tóc mùi hoa bưởi
Một sớm chung đò buổi chợ xa
Tiếng hò đưa vọng trên sông vắng
Điệu lý thân thương ý đậm đà
Hiu hiu gió thoảng thơm mùi rạ
Vương vấn lòng ai nỗi nhớ nhà
Chỉ là mơ thôi, chỉ mơ thôi
Lối cũ hương xưa quá đậm đà
Chớ nhắc người ơi tôi nhớ quá
Chiếc lá vàng rơi bóng mẹ già
Chớ nhắc người ơi tôi nhớ lắm
Đường về quê mẹ nẻo còn xa
Mưa đêm lạnh buốt sân ga
Tàu khuya lặng lẽ, nẻo qua mịt mờ
Chu Hà",hương xưa,,Chu Hà,https://poem.tkaraoke.com/28787/.html,
,"Đâu đây có tiếng ru hời
Thanh âm trong trẻo mang lời thiết tha
Gió về chấp nhịp đậm đà
Ầu ơ... con ngủ để mà lớn khôn
Tháng năm nắng dãi mưa dồn
Từng cơn khó nhọc về hôn thân gầy
Giữa cơn nắng hạ gắt gay
Oằn đôi vai mẹ gánh đầy tình thương
Nuôi con một giấc mộng thường
Quản gì thân mẹ dặm trường nắng mưa
Bây giờ tuổi nhỏ tóc thưa
Con chưa khôn lớn thì chưa hiểu đời
Ầu ơ... có tiếng ru hời
Tôi nghe thương quá nhớ lời mẹ ru
Tiễn người vào lúc trời thu
Bỗng như nghe lại... tiếng ru của người
jacaranda",tình mẹ muôn đời...,,Jacaranda,https://poem.tkaraoke.com/28788/.html,
,"Em là người vợ chẳng ra gì
Cứ giận dỗi và suốt đời nghi ngại
Nếu có thể cho  một lần làm lại
Anh sẽ bắt đầu từ đâu?
Cái ngày xưa ta quay lại từ đầu
Lần hò hẹn tìm vòm hoa giấy
Cổng nhà em lời yêu trao vội
Em theo anh - nhà cũng thay người
Cái ngày xưa chỉ có hai thôi
Cứ âu yếm cuồng si - vụng dại
Lễ cưới nghèo tưởng không có nổi
Con sinh ra thiếu thốn đến tê lòng
Sẽ bắt đầu từ đâu sau trận bão giông
Căn phòng ngột hơi người oi bức
Mảnh tường nứt đôi tiếng con vụt tắt
Cơn gió nào len lét mát sau lưng
Chẳng bao giờ còn có nữa ngày xưa
Sẽ bắt đầu từ đâu khi làm lại
Cái người vợ guộc gày hay rắc rối
Đòi hỏi suốt đời tình yêu",làm lại,,Bùi Kim Anh,https://poem.tkaraoke.com/28789/.html,
,"Thu mang vào phố chút lạnh lẽo
Phơi lên mặt cây lá vàng
Đi với nỗi buồn của em
là anh
là thu
là ô cửa chiều nhìn ra góc phố
Một đôi trẻ ôm nhau phóng xe qua khung cửa
Chiếc váy của cô gái bay thoáng cả đoạn đường
Bùi Kim Anh",vào thu,,Bùi Kim Anh,https://poem.tkaraoke.com/28790/.html,
,"Em yêu anh bằng tình yêu mùa thu
Như tia nắng chiều ủ vào lòng ấm áp
Như cơn gió thu man mát
Từ từ đánh thức mùa đông
Bao người đàn bà qua cuộc đời anh
Em nào có biết
Tình yêu anh dành cho em
Em chẳng thể nào so với họ
Em uống từng ngụm nhỏ khát khao
Mùa thu có nắng gắt gao
Có cơn mưa rào cuối hạ tràn sang tức tưởi
Mùa thu có heo may se sắt
Đêm cuốn lá rơi lạnh mặt phố phường
Em yêu anh bằng tình yêu mùa thu
Người đàn bà yêu chỉ biết có đợi chờ
Như thưở hồng hoang giữ gìn ngọn lửa
Lửa không tắt khi thu tàn hay đông giá
Người đàn bà như gió đi đâu cũng vội
Căn nhà là chiếc túi
Cuốn về chật chội buồn vui
Em yêu anh bằng tình yêu của người đàn bà",tình yêu mùa thu,,Bùi Kim Anh,https://poem.tkaraoke.com/28791/.html,
,"Anh là gì mà em không xa nổi
Chấp nhận sống một đời gần gũi
Như con sông xuôi theo dòng chảy
Thỉnh thoảng xô lên lại lắng xuống âm thầm
Anh là gì mà khiến em vui buồn
Ngày thường lại điểm trang như đi vào vũ hội
Cứ mỗi chiều bồn chồn ngóng đợi
Anh về dùng dắng nắng nghiêng
Anh là gì giữa bình thường thiêng liêng
Không có chiều nay đâu hiểu mình thương nhớ
Sao thời gian lại có phút lãng quên đến thế
Cho em chỉ gặp lạnh lùng
Anh là gì giữa nỗi riêng niềm chung
Có lúc tưởng mất nhau phần đời còn lại
Trong ý nghĩ đã bần thần tê tái
Anh là gì mà lặng im
Em suốt một đời đi tìm",đi tìm,,Bùi Kim Anh,https://poem.tkaraoke.com/28792/.html,
,"Chỉ có em là hiểu được anh thôi
Khi tai nạn bất ngờ gục anh trên đường phố
Em chẳng nhận ra anh trên bàn phủ khăn trắng xoá
Thần chết đang cướp từng phần của anh
Em chẳng dám xin ở cõi thần linh
Bởi chưa một lần chắp tay cầu nguyện
Nhưng em hiểu là anh sống được
Trên cả lời nguyền và đắc thắng của kẻ ghét ghen
Anh trở về với em
Như bao chuyến xa nhà vội vã
Như bao lần lạnh lẽo bên nhau
Dẫu mất mát đã ghim vào trí nhớ
Dẫu chẳng vẹn nguyên
Anh vẫn là tất cả
Cho con gái con trai cho em cuộc sống bình thường
Anh trở về với bạn bè yêu thương
Với trang báo như con lạc đà cứ nhẫn nại cứ bươn bả vượt qua trảng cát
Những trang báo anh đã lượm thi hài đồng đội
Những trang báo thẳng căng có thể đổi thay sinh mệnh của chính mình
Tai nạn bất ngờ
Tạo hoá lại tái sinh
Đã là rủi đã là may mắn
như con cáo chết giả để thử lòng người cõi sống
Cái giới hạn mong manh
đủ soi rọi lá bài trong canh bạc tưởng phút cuối cùng
cuộc giành giật của con dao mổ và lưỡi hái tử thần
cuộc giành giật của em và cái số tuổi con người nghiệt ngã
đã trả anh về cho em
lời cảm tạ quay về cõi mông lung
lời cảm tạ quay về tám phương bè bạn
lời cảm tạ quay về cho những ai không thiện chí với mình",một lần khác mọi lần,,Bùi Kim Anh,https://poem.tkaraoke.com/28793/.html,
,"Xin đừng viết về mùa thu
Đừng nhắc nhớ chiếc lá thu rơi rồi
Đừng giữ trong lòng tay giọt thu chiều vội vã
Mùa thu là đoá sen nở muộn
Người bán hàng phơi dọc phố phường
Mùa thu là sợi tóc phai màu
Câu thơ dài con nhện vắt tơ giăng
Mùa thu là nhung nhớ làm sao tả được
Cơn bão dập dồn như xé mặt đê
Mùa thu cho tuổi năm mươi in trên giấy những chuyện tình trẻ dại
Yêu lại một người tuổi mộng mơ
Xin đừng viết về mùa thu
Cho nắng cứ vàng như nắng
Cho gió khoe màu trên ngọn lá
Và câu thơ đọng mãi tình yêu",giọt thu,,Bùi Kim Anh,https://poem.tkaraoke.com/28794/.html,
,"Tỉnh tình tinh
Cũng cái tình
Cởi ra
Lại cột
chặt mình với ta
Hết nụ lại nở ra hoa
Đứt thôi lại nối
Những ba bảy lần",tình,,Bùi Kim Anh,https://poem.tkaraoke.com/28795/.html,
,"Anh và em đựng chung tủ áo quần
Đẹp và xấu
Thẳng thắn và xô xệch
Ta cùng nhau mua
Chẳng lẽ vứt đi
Sắp xếp mỗi ngày những gì ta có
Ngăn anh và ngăn em
Căn tủ hẹp
Cất vào và mở ra
Cũ và mới mỗi ngày
Buồn vui",căn tủ hẹp,,Bùi Kim Anh,https://poem.tkaraoke.com/28796/.html,
,"Em chẳng bao giờ thích cô đơn
Thơ chẳng thích buồn dẫu lời say đắm
Anh gói niềm vui trong ngăn tủ hẹp
Con mối gặm rồi còn chiếc vỏ không",chiếc vỏ,,Bùi Kim Anh,https://poem.tkaraoke.com/28797/.html,
,"Người con gái ấy có thể đến với anh
Trừ em ra
Em đã có những ngày trẻ trung bên anh
Người đàn bà ấy có thể đến với anh
Trừ em ra
Em đã có trong anh cũ kỹ
Niềm đam mê của anh không cùng nguồn gốc với thơ
Em có gì
Những câu thơ mà anh là tứ thơ không vơi cạn
Sự ra đi của anh khuấy khoảng trống vắng
Em có gì
Những con chữ ùa vào xếp chặt ngóng trông",em có gì,,Bùi Kim Anh,https://poem.tkaraoke.com/28798/.html,
,"Em cần anh như cô gái muộn mằn cần một người thương
Em cần anh như goá phụ cần nơi nương tựa
Nhưng em có thể bóp chết đi khao khát của mình
Không cầu xin tình yêu ngoái lại",cần,,Bùi Kim Anh,https://poem.tkaraoke.com/28799/.html,
,"Người mà được như trong mơ
Thì ta yêu đến tôn thờ chẳng thôi
Người đi như gió giữa trời
Bỏ ta ngồi khóc cái thời trẻ trung
Gió bơi trong chốn mịt mùng
Mặc cho lá bới tứ tung bụi đường
Người đi tìm chốn yêu đương
Bỏ ta cho nắng cho sương dãi dầu
Bỏ tiền mua cau với trầu
Quên vôi thì  biết tìm đâu giấc nồng
Bỏ ta người có sướng không
Ta về khép cánh cửa đông rũ sầu",rũ sầu,,Bùi Kim Anh,https://poem.tkaraoke.com/28800/.html,
,"Ta bày tình yêu của mình trên lối đi
Thiên hạ bước qua
Thiên hạ ngoảnh mặt
Thiên hạ đều nhìn thấy
Anh dựa vào em khi mỏi mệt
Trắng hàng mi
Trắng tóc mai
Nụ hôn dài của thời son trẻ
Em dựa vào anh sửa sang
Nhan sắc
Những câu thơ
Ta viết tình yêu trên nền giấy trắng
Thiên hạ nghĩ gì
Thiên hạ nói gì
Tình yêu không là hàng chợ
Ta ngồi dưới ánh đèn để yêu nhau
Mặc cỏ mềm
Mặc gạch đá
Trăm năm ai có được
Ta có hôm nay sâu thành chuỗi hạt hôm nay
Là trang sức em đeo cuộc đời này",tình yêu của mình,,Bùi Kim Anh,https://poem.tkaraoke.com/28801/.html,
,"Hình như có mầm của cỏ
Lách lên từ kẽ đất cằn
Chỉ là tình yêu được thế
Hoang sơ chân tóc nỗi niềm
Tình yêu thủa đất bình yên
Tình yêu thủa trời giông bão
Trong em một triền cỏ dại
Bỏ quên rậm lối đi về
Chỉ là tình yêu được thế
Thoả thê lửa dạt nước dào
Cỏ không biết hình dáng cỏ
Chồm mình trong trảng đam mê",mầm của cỏ,,Bùi Kim Anh,https://poem.tkaraoke.com/28802/.html,
,"Sẽ một ngày bình thường
Không chờ mưa chờ nắng
Có thời gian chững lại
Có không gian hai người
Sẽ chỉ có một lời
Trôi ra từ hoài niệm
Anh không trong tưởng tượng
Em không là giấc mơ
Bên lòng bên câu thơ
Khép trong tình âu yếm
Sẽ một ngày rất thực
Vì em mong từng giờ",mong một ngày,,Bùi Kim Anh,https://poem.tkaraoke.com/28803/.html,
,"Vô hình dồn những búi mây thành núi
Núi không chân mây không chỗ dựa doãng ra thay hình biến dạng
Trời bưng gió
Chiếc kim thời gian nấc từng tiếng nhích
Ta đứng một chân cái cò đồng vắng
Ta đứng hai chân dồn hơi thở xuống nền gạch lạnh tanh
Phía ấy là lối anh đi
Gió quét
Mưa quét
Chổi quét mỗi ngày
Dọi nắng không nhìn ra dấu vết
Căng không còn giọt mắt
Chờ đợi
Biết là anh cũng đang chờ đợi
Phía ấy cổng sắt lặng im
Phía ấy đường không lá rụng
Anh không thể đi qua
Em không thể đi qua
Chói trong nắng nhoà trong nắng
Aỏ vọng
Những chú bồ câu đập mỏ xuống khoảng trống
Nhửng chú bồ câu bay lên bay xuống
Chờ đợi",phía ấy,,Bùi Kim Anh,https://poem.tkaraoke.com/28804/.html,
,"Tình yêu như một bến bờ
Mỗi con nước qua thêm phù sa bồi đắp
Tình yêu chẳng bao giờ biết chật
Thêm một lần yêu thêm động cõi lòng
Tình yêu đâu biết chốn tận cùng
Càng gần gũi càng đằm sâu nỗi nhớ
Có một dòng sông biết bên nào bến lở
Bên nào cũng thao thức yêu đương
Em yêu anh như một lẽ thường",lẽ thường,,Bùi Kim Anh,https://poem.tkaraoke.com/28805/.html,
,"Chưa cùng uống chén rượu say
Giấc đêm chưa thoả nỗi ngày mà thương
Em giờ chẳng thể lạc đường
Tóc anh rẽ lối màn sương rủ mòn
Phủ mờ tuổi tác phấn son
Tát trong quá khứ nét còn nét rơi
Rượu em đã uống cùng người
Rượu anh đã uống ở nơi đứng ngồi
Lửa bén cơm chỉ nửa nồi
Tình già uống chẳng cạn hơi rượu đầy
Ngượng ngùng nói ngượng ngùng tay
Tình già uống rượu chẳng say chỉ nồng",tình già,,Bùi Kim Anh,https://poem.tkaraoke.com/28806/.html,
,"Anh là gã tình nhân của thơ
Cho xác chữ hiện hồn cựa quậy
Em chẳng thể đi tìm
Anh chẳng bao giờ tới
Trời trở cơn
Một miền hoang hú lên tiếng gọi
Anh có thể xoa dịu nỗi đau em
Cũng có thể khiến em đau lần nữa
Xé khoảng tâm can trần trụi
Tâng tâng khúc điệu lạc vần
Có thể yêu thêm biết bao lần
Đầy vơi trong mắt của tình nhân
Quơ một nắm tỉnh say mộng mị
Chao đảo em
Ngàn ngạt hơi người
Về một miền xa
Chỉ khói hương thôi
Hay hương khói bay không thể tới
Không có anh
Không có em
Chỉ những hạt không hình không tiếng nói
Hiện hữu trong mắt em khi nhắm lại
Rủ em về hư vô",miền hoang,,Bùi Kim Anh,https://poem.tkaraoke.com/28807/.html,
,"Bất ngờ một chiếc lá rơi
Tưởng đông rớt lại cho người lạnh vai
Tưởng là rét mướt còn dài
ủ trong hơi ấm đợi mai ấm lòng
Tưởng là anh giữa giấc nồng
Nắm vào trống vắng ngả không gối kề
Giữa đời thực giữa cơn mê
Sống trong mộng sống bộn bề lo toan
Bất ngờ hợp bất ngờ tan
Tưởng là thấu cõi ngỡ an tâm thần
Gió thì mát ở sau sân
Nắng thì dội mưa thì dần ước mơ
Bất ngờ rơi xuống vần thơ
Buồn vui xô đẩy vật vờ thành câu
Anh ở đâu em ở đâu
Tưởng không mà có với nhau ở đời",rơi,,Bùi Kim Anh,https://poem.tkaraoke.com/28808/.html,
,"Dại khôn
cũng thể thằng Bờm
Quạt mo giữ
chẳng chịu ơn kẻ giàu
Của nghèo
có đáng chi đâu
Người gạt ta
đổi chín trâu ba bò
Quạt mo
đổi
nắm xôi to
Bờm ăn
bờm ngủ
chẳng lo nghĩ gì",bờm,,Bùi Kim Anh,https://poem.tkaraoke.com/28809/.html,
,"Người đàn bà ngồi sau xe máy
Tựa cằm vào vai người đàn ông
Chị áp má vào mái tóc anh
Lơ đãng nhìn người xe trên phố
Người đàn ông nói gì chỉ hai người nghe rõ
Chị lắc nhẹ đầu ngả xuống vai anh
Họ là ai
Thu vàng rực phố phường",phố thu,,Bùi Kim Anh,https://poem.tkaraoke.com/28810/.html,
,"May mà phố có con hồ
Ta ngồi ngắm được trăng phô sắc ngà
Chú Cuội ngồi gốc cây đa
Thả chân khoả nước cùng ta nói cười
Góc phố có hàng hoa tươi
Cho người mua để tặng người lúc yêu
Bên hồ lũ trẻ thả diều
Phố thả theo cả nắng chiều lên cao",hồ,,Bùi Kim Anh,https://poem.tkaraoke.com/28811/.html,
,"Không ai túng
Chẳng ai vay
Thế mà nợ nần nhau mới khổ
Không là bạc tiền
Thiếu tiền mang đồ tới gán
Không là ơn nghĩa đáp đền
Em là kẻ khốn cùng khất lại
Những bài thơ anh viết cho em
Chúng mình nợ nhau suốt kiếp người
Anh lặng lẽ gió đông khi xuân tới
Em thao thức lời đêm  khép lại
Một đời nghèo mang nợ yêu đương",nợ,,Bùi Kim Anh,https://poem.tkaraoke.com/28812/.html,
,"Tôi không đến viếng được anh chị
Khi dòng tin buồn hoảng hốt đến mọi người
Và tờ báo của ngày
tôi chỉ còn đọc được có vậy thôi
Một góc phố nghẹt người
Ngưỡng mộ và tò mò
Tôi là người đàn bà
nhỏ bé len không thể tới
một mình cắm sao nổi nén hương
Lời bàn dở khen hay
Như mùa hạ lúc này
Vẫn nóng nảy cũng là đã hết
Cái xấu như cỏ cứ lách lên nơi nào có đất
Cái ác tựa con rắn già rồi lột
Còn bao điều phải viết dành dụm tuổi 40
Nhưng chỉ ở cổ tích thôi người mới được hoá kiếp
Việc trên đời biết không thấu lại là cái chết
Mặc biển kia mãi thức trắng đêm ngày
Bao lứa đôi vẫn hát xưa nay
Bài thơ tình yêu không thể chết
Một lời buồn xa như âm dương cách biệt hôm nay",buồn xa,,Bùi Kim Anh,https://poem.tkaraoke.com/28813/.html,
,"Viếng anh TXH
Những vại bia sóng sánh màu hổ phách
Ngả nghiêng trên môi những người đàn ông
Những vại bia ngầu bọt trào ra khỏi cốc
Những kẻ đơm lời lăng nhục
Xúm vào chếnh choáng cơn say
Lật giở một con người
Xoay ngang ngửa lòng tay
Uất hận đẩy cô đơn đến ngưỡng tử thần
Anh ra đi trong bóng đêm vội vã
Khi thể chất bị vùi lấp và tan rã
Anh không còn trông thấy nữa rồi
Anh không còn nghe thấy nữa rồi
Lời công minh soi lại một con người
Hà Nội vào hè
Những vại bia uống cạn dọc phố phường
Người vợ thắp cho chồng nén nhang cháy dở
Oan ức thoát ra
Hồn sang cõi khác
Cho một người hay cho một niềm tin",vào hạ,,Bùi Kim Anh,https://poem.tkaraoke.com/28814/.html,
,"Viếng anh TĐ
Anh ra đi có thanh thản không anh
Khi bè bạn và em không đến kịp
Nhắp chén vơi đầy
Cô đơn mang đi
Dang dở nghĩa trăm năm
ở hiền gặp lành nghe như lẽ tự nhiên
Anh ra đi sao lặng yên đến thế
Bao toan tính mặc cho thiên hạ nghĩ
Trên giá buồn những trang sách bơ vơ
Chiếc cầu thang ọp ẹp vần thơ
Em đến muộn chỉ nhành cây trước cửa
Anh khép lại dưới đôi mắt kính
Như lúc vui giữa bè bạn nói cười
Em lỡ rồi buổi sớm nay
Qua một ngày sang thiên niên kỷ mới
Anh ra đi hiền lành giây phút cuối
Thảng thốt giữa trời hương khói bay bay",ngày hai,,Bùi Kim Anh,https://poem.tkaraoke.com/28815/.html,
,"Giữa chợ người đàn bà ăn mày ngồi bệt
Bế đứa con nhom nhem chưa đầy tuổi
Khóc thét lên thay lời mẹ cầu xin
Góc quán người đàn ông ăn mày chực rình
Mắt ngoá nghiêng tay ống bơ lủng lẳng
Chờ bát phở khách ăn bỏ lại nước chan
Bữa dọn cơm nghe rền rĩ giọng van
Hai chị em ăn mày ngồi chìa nơi cửa
Chiếc bát không đen đúa đôi tay
Lê lết kiếp người như lá lắt lay
Vài hào bạc chẳng làm thay đổi
Vài hào bạc có kẻ không thèm lấy
Tôi cho người là an ủi mình thôi",nợ người,,Bùi Kim Anh,https://poem.tkaraoke.com/28816/.html,
,"Người đừng có ước già đi
Để ta ước lại cái thì còn xuân
Hoa mận mới nở trắng ngần
Tiếng chim líu ríu trước sân sau nhà
Hoa xoan tím tím hoa cà
Thẩn thơ mái tóc xoã xoà ngang lưng
Người đừng nói câu nửa chừng
Để ta tỏ nỗi ngập ngừng với ai
Nửa đêm  nở đoá hoa nhài
Nửa đêm trăng khuyết đi sai đoạn đường
Thoảng trong gió thoảng mùi hương
Chậm chân nhện thả tơ vương cửa buồng",nửa đêm,,Bùi Kim Anh,https://poem.tkaraoke.com/28817/.html,
,"Của tự nhiên cứ phơi bày
có cho ai mà khép lại
nó vung vẩy
giữa phố đông thông thênh một cõi
Trong khùng điên nó bị loại vì chưa biết vò xé thân hình
giữa thiên hạ nó ngu ngơ như lá
gió chừa ra không thổi
nắng chừa ra không soi
nó là ai ai là nó
mà không không có có
Của người  ta vứt đi nó nhồi nhét cho mình
của người ta kiếm tìm nó thờ ơ chẳng biết
thiên hạ là gì
nó quên quên nhớ nhớ
đời lùng bùng
còn nó ngẩn ngơ
Sống giữa trời lo gì ướt mưa
quăng trên đất quật vào với đất
cần chi giả thật
cần chi buồn vui
nó nhung nhăng như cỏ giữa bãi đời",ngẩn ngơ,,Bùi Kim Anh,https://poem.tkaraoke.com/28818/.html,
,"Căn nhà người sống
căn nhà người chết
xoay dọc xoay ngang
theo đường tàu chạy
nhà người sống lúp xúp mái ngói
nhà người chết cỏ dại chân hương
nhà người sống lố nhố nép lùm cây
nhà người chết cong cong hứng trời mưa nắng
Xanh như lá cỏ
bạc như cát trắng
đi qua còn đến mất
con tàu dằng dặc
nghiến mình trên hai thanh sắt
nhồi lắc con người",qua những căn nhà,,Bùi Kim Anh,https://poem.tkaraoke.com/28819/.html,
,"Chỉ có năm ngày năm đêm
trăng lừa dối
sông lừa dối
chuối ưỡn mình
Chỉ có năm ngày năm đêm
cho một người biết mình là đàn  bà
nguây nguẩy
đến tơ hơ cong cớn
biết yêu như đùa bỡn
quên những điều
không được quên
Chỉ có năm ngày năm đêm
cho một kẻ biết mình  là đàn ông
biết dại rồ cơn thèm của xác thịt
cái bát cháo hành thành điển tích
tình yêu
đàn bà và bát cháo hành
để nhớ
những điều phải quên",cho một cuộc tình,,Bùi Kim Anh,https://poem.tkaraoke.com/28820/.html,
,"Nếu tôi là đàn ông
tôi sẽ sống một ngày
không cần biết đến
thời gian
gia đình
bữa ăn
giấc ngủ
và cả điều ấp ủ
tình yêu
Và chính vì ý nghĩ ngông cuồng này
tôi mãi là người đàn bà tội nghiệp",nếu,,Bùi Kim Anh,https://poem.tkaraoke.com/28821/.html,
,"Ta chậm lời không kịp gửi Đông
Để Xuân đến Tết ùa chật ngõ
Ai vác nhành lộc đi lá chạm vào khe cửa
Bật tung
Ta bận rộn sớm chiều
Duyên nợ để quên thơ
Sao Xuân chẳng buông lời trách cứ
Ta hối hả sợ thời gian không đủ
Giật mình tự bỏ quên
Lũ trẻ bây giờ xúng xính quanh năm
Phố nở đầy hoa
Trời quay quắt trở mình cơn nóng lạnh
Ai nhắc ta đâu
Chậm một lời tạ lỗi với Xuân
Ta đi đón bằng sớm mai mồng Một
áo ai mặc sớm mai cũng là áo mới
Lời tốt lành dành mở sớm mai Xuân.",sớm xuân,,Bùi Kim Anh,https://poem.tkaraoke.com/28822/.html,
,"Thời gian kéo tuổi tác trên đoạn trán nhăn nhúm
Nhuộm thời gian xì xịt mụn thâm
Thời gian xơ chẻ đứt cọng khô cằn
Chẳng cần đi tìm
Lặng lẽ thời gian quây ráp
Nực nội lạnh lùng xếp đặt
Tháng năm tươi héo bất ngờ
Không có ngày sinh để tặng hoa
Không có ngày mất để viếng hoa
Thời gian tự đến tự đi
Chẳng thể mời chào níu kéo
Thời gian ngự trị
Biến dạng trong tiềm thức
Nhanh chậm trong tâm thế
Hữu ảnh  vô hình",nhốt thời gian,,Bùi Kim Anh,https://poem.tkaraoke.com/28823/.html,
,"Hãy cho tôi kẽ hở của đời
Tôi lọt xuống như vụn giấy nhỏ
Chẳng có gió nào lùa được nữa
Và bụi thời gian khoả lấp đầy
Hãy cho tôi mặt nạ da người
Tôi vênh váo dạo qua khắp phố
Chẳng còn ai nhận ra tôi nữa
Một người đàn bà lẻ loi
Hãy cho tôi và cho một lần thôi
Thêm và bớt những gì cần thêm bớt
Để chẳng có chiều nay nhức buốt
Thế gian này đủ cả chỉ thừa tôi",có những lúc,,Bùi Kim Anh,https://poem.tkaraoke.com/28824/.html,
,"Ngặt nghèo tạo hoá
Ba điều ước
Ham muốn rắc hạt trên cánh đồng thèm khát
Rủi ro như cỏ lách khe kẽ đời
Con rắn bất lương già lại lột
Trườn trên cánh đồng
Tuồn trong cỏ rác
Nghe chuyện xưa ba điều ước
Từ thủa ấu thơ đến khi trắng tóc
Lẩm nhẩm tính toan suốt chuỗi ngày
Chỉ sợ buột mồm mất đi điều ước
Chỉ sợ xuôi tay
Ba điều ước để lại trên đời",ba điều ước,,Bùi Kim Anh,https://poem.tkaraoke.com/28825/.html,
