Edited,Title,Genre,Author,URL
"“Nỗi đau thảm thiết từ khi anh có
Gặp em tan chảy hóa khói hư vô”
Chiều sương khói mây về che nắng nhạt
Hữu duyên tình hai đứa lại thành đôi
Tình yêu ơi! Người đã đến thật rồi
Buổi gặp gỡ nghe mưa giăng rót mật
Đời rất đẹp khi tình yêu có mặt
Mới đơm bông nay kết trái trong vườn
Hoa hé cười chào đón chút dư hương
Mai góp nhặt những sầu tư cất lại
Ta đã trót lỡ cho mình ngây dại
Dĩ nhiên đời sẽ lắm lúc bi ai
Hôn lên môi thơm ngát cánh hoa lài
Cười âu yếm trao nhau quà hạnh phúc
Anh đã thấy mắt nàng nhìn anh mãi
Hai bờ vai run khẽ nhẹ hàng mi
Anh đã nói là anh không có ngại
Trao cho nhau tươi thắm nụ xuân thì
Anh đã hát bài ca ngày em tới
Có nhạc tình với điệu khúc tango
Gió ngoài cửa nóng lòng không muốn đợi
Xô vào phòng mang cái lạnh hanh khô
Xuân mai thắm hoa đào hồng sặc sỡ
Tiếng trống lân vui vẻ khắp phố phường
Niềm hân hoan trọn vẹn khắp nẻo đường
Đời rất đẹp khi tình yêu có mặt
Khi hạ đến thì âm thầm em nói
“Em yêu anh” Yêu suốt kiếp con người
Từ dạo đó tình yêu đâu có lỗi
Anh với em hai đứa lại cười tươi
Thu về sớm lá vàng vừa rơi rụng
Em vui mau bước nhẹ đến bên người
Mây trắng bay lát đát ở cuối trời
Đời rất đẹp khi tình yêu có mặt
Em có thấy hừng đông là ánh sáng
Ru giọt tình say mộng giữa mù sa
Như ngọn đuốc soi đường đêm tối rạng
Kỷ băng hà như cũng phải tan ra
Rồi ta nhảy trong đêm say cuồng nhiệt
Ta cho nhau cảm giác ái ân nồng
Còn khúc nhạc thì dâng trào khôn xiết
Vỡ tan rồi đêm giá lạnh mùa đông
Đời rất đẹp khi tình yêu có mặt
Có màu hồng xen lẫn nắng thủy tinh
Đời chỉ đẹp khi tình ta là thật
Mãi trăm năm nhớ mãi khúc ân tình…",bài thơ tình thứ hai (khi tình yêu có mặt),,Lê Đức,https://poem.tkaraoke.com/123190/.html
"Nửa đêm chợt thức giấc
Thấy em hát trên đồi
Ta ôm đàn bật khóc
Những kiếp người nổi trôi.
Nửa đêm chợt thức giấc
Nghe mưa gõ hiên nhà
Tháng năm vừa vỡ xuống
Sợi tóc màu sao sa.
Nửa đêm chợt thức giấc
Nhặt chiếc lá cháy vàng
Trời đông sương mù khói
Đốt nửa đời đi hoang.
Nửa đêm chợt thức giấc
Lặng nhớ một ngôi trường
Bạn bè ta nơi đó
Gió phương nào quê hương?
Malaysia 1999
(Tập thơ Cỏ Hoa Thì Thầm - NXB Thanh Niên 2002)",tha hương,,Thanh Trắc Nguyễn Văn,https://poem.tkaraoke.com/123191/.html
"NỖI SẦU VONG QUỐC !!!
Ngày đi với hy vọng ước mong
Thoát vòng kìm tỏa ở trong lòng
Quê Hương đổi dời trong Nước Mắt
Giã biệt Gia Đình Vượt Biển Đông !
Một mai trở lại Nợ Tang Bồng
Tròn thân Kẻ Sĩ cứu Non Sông
'' Sinh Ly Tử Biệt '' rời Cố Quốc !
Hứa Hẹn Ngày Về Thuận Gió Đông ...
Quê Hương một thuở Vàng Son trước
Chỉ còn Trăn Trỡ với Niềm Đau
Ngày Đó dẫu qua Thời Binh Biến !
Lòng Người Dân Việt vẫn chưa Yên ?
Ngày Đó Chiến Tranh không còn nữa
Tôi về Xóm Nhỏ tìm Người Xưa
Mà sao chẳng thấy Hình Bóng Cũ ?
Chỉ còn Nỗi Nhớ với Niềm Đau !!!
Thời gian trôi nhanh như Bóng Câu ...
Phần Hai Thế Kỹ Cuộc Bễ Dâu !
Bốn mươi bảy Năm Ngày Quốc Hận...
Hình Bóng Quê Nhà còn nặng sâu !
Ngày đó trào dâng Niềm Uất Hận !
Quê Hương đã mất trong tức tưởi
Sinh Ly Tữ Biệt trong Cay Đắng !
Quê Người còn mang mãi niềm đau !!!
dang dat HDD",nỗi sầu vong quốc !!!,,Dang Dat,https://poem.tkaraoke.com/123192/.html
"BIỂN ĐỜI !!!
Biển Đời tấp nập ghe Tàu
Vượt khơi cập bến ra vào điểm chung
Thuyền từ lướt sóng bảo bùng
Trãi bao sóng gió vẫn không nản lòng !
Từ khi vượt thoát Biển Đông
'' Sinh Ly Tử Biệt '' Non Sông xa rời
Quê Hương cách biệt muôn đời
Bao giờ trở lại về nơi cội nguồn ?
Tình Yêu Quê Mẹ vẫn luôn
Trong Tim dòng máu trùng muôn nhớ nhà
Dù Đời còn lắm phong ba
Hẹn Ngày trở lại Quê Ta trùng phùng !
Đoàn Viên thăm Mộ Mẹ Cha
Thắp Hương Trầm gởi làm quà Song Thân
Báo đền Công Đức Nghĩa Ân
Sinh Thành Dưỡng Dục đỡ đần các con !
Ơn Cha Nghĩa Mẹ tựa Non
Tình Thương chất ngất nuôi con cả Đời
Dù cho trôi dạt khắp nơi
Kính Cha Thờ Mẹ trọn Đời báo Ân !
Biển Đời như cỏi phù vân
Sớm còn Tối mất Nghĩa Nhân vô thường
'' Sanh Lão Bệnh Tử '' tai ương
Trở về Cát Bụi tiếc thương Cuộc Đời !
'' Sinh Ly Tử Biệt '' ra khơi
Một Mai trở lại Quê Tôi dặm trường
Ra đi còn nhớ Người Thương
'' Châu Về Hiệp Phố ''Đại Dương Thuyền Về !
Dù cho Ngày Tháng lê thê !
Hẹn Ngày Trở Lại Sơn Khê Tao Phùng !!!
dang dat HDD 20 - 03 - 2023",biển đời !!!,,Dang Dat,https://poem.tkaraoke.com/123193/.html
"NƯỚC MẮT NGÀY XƯA
Nước mắt ngày xưa khóc trên phận người
Chiều tàn môi đưa gom tình đánh mất
Bóng tình nhân đôi chân vào ngõ chật
Mùi tháng năm tan vào cõi mịt mờ
Nước mắt ngày xưa dột ướt trang thơ
Lời âu yếm chảy tan vào bóng tối
Gặp gỡ đôi khi mắt tình vướng tội
Tiếng cười đau nát vụn dưới chân người
Nước mắt ngày xưa rớt xuống chơi vơi
Ta ngồi đây nghe tuổi trời già cỗi
Lòng đau đáu ôm mối tình bối rối
Tia nắng mong manh ngủ muộn biếng lười
Nước mắt ngày xưa ngập chốn xa xôi
Hạnh phúc vỡ òa về vùng cỏ dại
Xin ai đó đừng ôm dây oan trái !
Nghìn năm sau sầu lẻ bóng muộn phiền
Nước mắt ngày xưa thui chột nỗi niềm
Mạch yêu thương về neo bờ bến lạ
Dòng sông ái tình bao giờ êm ả ?
Thương cuộc tình sóng gió cuốn ra khơi
Ngày 28/4/2023
Thiên Ân ( Bình Dương )",nước mắt ngày xưa,,Thiên Ân,https://poem.tkaraoke.com/123194/.html
"NGÕ GIÓ CHIỀU
Đã biết trăng tàn trên biển mộng
Sao buồn lá rụng buổi hoàng hôn
Mù rơi trắng sữa lồng quanh hẻm
Tóc ngả màu mây quyện giữa hồn
Tửu thấm môi chờ đêm nghiệt ngã
Khuya vàng vọt bóng đảo bờ chôn
Sầu con nhện bủa từng canh vắng
Lạnh nẻo chiều vây ngõ gió luồn ./.
LCT O6/)O5/2O23",ngõ gió chiều,,Lê Cảnh Tiến,https://poem.tkaraoke.com/123195/.html
"Tiếng xấu lang nhanh trong ngoài nước
Tiếng tốt vang gần tại vì sao
Dân Việt ưa nghe xấu hơn tốt
Bản tánh ưa chê không biết khen
Khẩu xà không bao giờ xin lỗi
Không biết cám ơn lẫn mĩm cười
Già mất dạy chưởi trẻ mất dạy
Cả nước mất dạy dạy mất dạy
Mất dạy dạy tự ái mất dạy
Đỉnh cao cả nước là mất dạy
Mất dạy xuất cảng ra hải ngoại
Hãnh diện dân tộc là mất dạy",hãnh diện dân tộc,,Lê Huy Trứ,https://poem.tkaraoke.com/123196/.html
"Lãnh tụ muốn trị quốc bình thiên hạ
Thì bất cứ việc lớn nhỏ ngoài đời
Đại trượng phu phải về nhà hỏi vợ
Vợ bảo một đường ta làm một nẻo
Thì chắc chắn sẽ đại công cáo thành",bí quyết thành công,,Lê Huy Trứ,https://poem.tkaraoke.com/123197/.html
"TỰ NHIÊN BẬT KHÓC
Trần Minh Hiền Orlando ngày 5 tháng 5 năm 2023
Tôi đã bật khóc khi nghe Hoàng Duy của cuộc The Nail Voice mùa 2 vòng chung kết hát ca khúc Cha Và Con Gái. Ca khúc có ca từ quá hay: và cách diễn tả của Hoàng Duy quá xuất sắc làm tôi (TMH) nhớ Ba tôi Ông Trần Điền (1937-2009) quá chừng và nghĩ về thân phận của người làm cha như tôi. Ba tôi lúc sinh thời rất giỏi nhưng bị xui rủi quá nhiều và cuối cùng chết mà không đạt được ứớc nguyện của mình và chúng tôi thương Má hơn thương Ba và đối xử có phần bất công với Ba. Tôi mong Hoàng Duy có giải và thành công trong sự nghiệp ca hát của mình.
Trần Minh Hiền Orlando ngày 5 tháng 5 năm 2023",tự nhiên bật khóc,,Trần Minh Hiền,https://poem.tkaraoke.com/123198/.html
"Đôi ta lên đỉnh, vươn lên đỉnh
Vách núi mờ sương, vách núi sương
Bàn chân dẫm vượt trăm bậc đá
Bên em vẫn dịu một mùi hương.
Đá to đá nhỏ. Hang rồi hốc
Bò ngửa. Bò ngang. Bò ngược dốc
Em bám vào ta, ta bám lên
Cây bám vào đá, đá xanh thêm.
Ta kéo nhau lên với gió ngàn
Kìa sương lành lạnh khói chưa tan
Đôi mình, đôi bóng cao trên đỉnh
Ngắm nhìn mây trắng, nắng xuân sang.
Đây đỉnh Non Nước với nước non
Mặt trời ngày mới đỏ như son
Em nâng ống trúc cùng ta nhé
Tiếng sáo ngang trời gió véo von.
Đà Nẵng 1995
(Tập thơ Cỏ Hoa Thì Thầm - NXB Thanh Niên 2002)",lên đỉnh non nước đầu xuân,,Thanh Trắc Nguyễn Văn,https://poem.tkaraoke.com/123199/.html
".    PHÚC ĐỌNG VỀ SAU
Khi còn tuổi trẻ hăng say
Bôn ba lặn lội, đêm ngày quản chi
Về già sức lực yếu đi
Chân rung gối mỏi, nhiều khi bệnh đày.
Cho nên mới hiểu đời này
Không còn sức khỏe, kéo cày được sao
Dù cho thần thánh phương nào
Về già sẽ được, liệt vào lão ông.
Còn đâu vượt núi băng sông
Tay chèo tay chống, chơi ngông với đời
Còn đâu thế lực đương thời
Quyền cao chức trọng, cũng rời bỏ ta.
Bao nhiêu tham vọng Ta bà
Xuôi tay nhắm mắt, chỉ là hư không
Khi ta biết cách gieo trồng
Muôn đời phước đức, sẽ không nhạt mờ.
Còn duyên chớ có làm ngơ
Thấy khổ chớ có, hững hờ lãng quên
Thiện lành hậu phúc vững bền
Thành tâm tạo phước, ơn Trên độ trì !
06.05.2023
HOANGHAI",phúc đọng về sau,,HOANGHAI,https://poem.tkaraoke.com/123200/.html
"1. DẪN
“What if I fall? Oh, but my darling, what if you fly?” là những chữ ttích dẫn từ một bài thơ ngắn của nữ sĩ trẻ tuổi người Úc, cô Erin Hanson (sinh năm 1995). Bài thơ chỉ vẻn vẹn có năm dòng mà hai dòng rưỡi đã trở thành châm ngôn cho các ông bố bà mẹ lấy làm lời dạy dỗ, khuyến khích các cô cậu bé hay e dè nhút nhát, làm việc gì cũng sợ thất bại. Những dòng chữ ấy cũng đã được người ta in thành tranh ảnh, Poster để bán trên Amazon. Mời các bạn đọc bài thơ của cô gái sáng tác lúc mới 18 tuổi.
.
2. THƠ
WHAT IF I FALL?
By Erin Hanson
There is freedom waiting for you,
On the breezes of the sky,
And you ask, ""What if I fall?""
Oh, but my darling,
What if you fly?
.
3. PHỎNG DỊCH
NẾU LỠ TÔI TÉ?
Phỏng dịch: Trần Đức Phổ
Tự do đang chờ đợi bạn
Từ những làn gió nhẹ của vòm trời cao
Và bạn vặn hỏi, “Nếu lỡ tôi té?”
Ồ, nhưng bạn thân yêu,
Nếu bạn bay được thì sao?
6/5/2023",nếu lỡ tôi té?,,Trần Đức Phổ,https://poem.tkaraoke.com/123201/.html
"1. DẪN
Tôi thích thơ không những vì nó có vần điệu, đọc nghe du dương mà còn vì điều tuyệt vời hơn ở chỗ: một người trẻ có thể làm một bài thơ già dặn, chín chắn, và đầy triết lý thâm sâu vẫn được công chúng yêu thích; cũng như một người già có thể sáng tác một bài thơ nhí nhảnh, hồn nhiên mà không bị cho là mất nết. Bài NOT của Erin Hanson, một nhà thơ trẻ người Úc, là một trường hợp như thế. Bài thơ với ngôn ngữ thương ngày nhưng đã được rất nhiều người yêu thích khi nó nói lên được cái điều thật đơn giản mà nhiều người trẻ tuổi bây giờ đã quên bẵng đi. Đó là hãy sống với chính mình, đừng khoác lên người những thứ phù phiếm mà cho là đẹp đẽ, cao quý. Cái đẹp nằm ở nội hàm, ở sự tu dưỡng bên trong mỗi chúng ta. Con người khẳng định mình bằng tình yêu, bằng trí tuệ bằng niềm tin... chứ không phải bằng ngoại hình.
.
2. THƠ
NOT
By Erin Hanson (1995 - )
You are not your age, nor the size of clothes you wear,
You are not a weight, or the color of your hair.
You are not your name, or the dimples in your cheeks.
You are all the books you read, and all the words you speak.
You are your croaky morning voice, and the smiles you try to hide.
You're the sweetness in your laughter, and every tear you've cried.
You're the songs you sing so loudly when you know you're all alone.
You're the places that you've been to, and the one that you call home.
You're the things that you believe in, and the people whom you love.
You're the photos in your bedroom, and the future you dream of.
You're made of so much beauty, but it seems that you forgot
When you decided that you were defined by all the things you're not.
.
3. PHỎNG DỊCH: TRẦN ĐỨC PHỔ
EM CHÍNH LÀ
Em không là tuổi tác
Cũng không phải áo quần
Những thứ em đang mặc,
Càng không là ký cân
Hay sắc màu mái tóc.
Em không là cái tên,
Lúm đồng tiền trên má
Em chính là tất cả
Những sách em đọc qua
Những câu chữ em nói
Em là giọng trầm khàn
Mỗi sớm mai thức dậy
Em là nụ cười duyên
Đã cố tình che ấy.
Em là những ngọt ngào
Trong giọng cười, tiếng khóc
Em chính là ca khúc
Hát trong lúc cô đơn.
Em chính là những chốn
Trong đời từng đi qua
Em là nơi em gọi
Rất thương yêu ngôi nhà.
Em chính là những thứ
Em đặt niềm tin vào,
Và những người em đã,
Đang sống yêu thương nhau
Em chính là hình ảnh
Trong phòng ngủ của em,
Và những gì mơ ước
Cho ngày mai đời em
Em chính là tất cả
Mọi vẻ đẹp, đương nhiên
Nhưng dường như, có lẽ
Lâu rồi em đã quên,
Khi em đã chấp nhận
Định nghĩa bằng những điều
Không hề là chính em.
5/5/2023
Trần Đức Phổ",em chính là,,Trần Đức Phổ,https://poem.tkaraoke.com/123202/.html
"Tháng 5 là cuối mùa xuân ở Bắc Mỹ. Thời tiết tuy còn lạnh, nhưng muôn hoa đã đua nở, cỏ đã lên xanh. Thơ làm về hoa mùa xuân xưa nay ít có bài nào được nhiều người yêu thích hơn bài “Daffodils” của William Wordsworth. Bài này còn có một nhan đề khác là “I Wandered Lonely as a Cloud”
Để chào đón tháng 5, tôi xin phỏng dịch bài thơ trên. Dịch là để học. Vì vậy nếu các bạn thấy dịch dở hoặc chưa chính xác thì vui lòng bỏ qua, chỉ nên đọc bản tiếng Anh.
.
I WANDERED LONELY AS A CLOUD
By William Wordsworth
I wandered lonely as a cloud
That floats on high o'er vales and hills,
When all at once I saw a crowd,
A host, of golden daffodils;
Beside the lake, beneath the trees,
Fluttering and dancing in the breeze.
Continuous as the stars that shine
And twinkle on the milky way,
They stretched in never-ending line
Along the margin of a bay:
Ten thousand saw I at a glance,
Tossing their heads in sprightly dance.
The waves beside them danced; but they
Out-did the sparkling waves in glee:
A poet could not but be gay,
In such a jocund company:
I gazed—and gazed—but little thought
What wealth the show to me had brought:
For oft, when on my couch I lie
In vacant or in pensive mood,
They flash upon that inward eye
Which is the bliss of solitude;
And then my heart with pleasure fills,
And dances with the daffodils.
.
HOA THỦY TIÊN VÀNG
Trần Đức Phôt phỏng dịch
Tôi lang thang như một áng mây trôi
Bồng bềnh ngang qua trên những lũng, đồi
Trong phút chốc bỗng dưng chợt thấy
Đám thủy tiên vàng , chủ thể một nơi
Bên bờ hồ, dưới những rặng cây
Đang nhảy múa và rung rinh trước gió
Cứ tiếp nối như những vì sao sáng
Từ Ngân Hà lấp lánh của trời đêm
Chúng trải dài dường như đến vô biên
Dọc theo bên lề một bờ  vịnh biếc
Muôn ngàn hoa hiện ra qua mắt liếc
Lắc lư cái đầu trong điệu múa tươi vui
Những con sóng kề bên xáo động
Nhưng sao bằng sóng lấp lánh hân hoan
Chàng thi sĩ lẽ nào trơ như phỗng
Chẳng hòa mình, nhập bọn để vui chung
Tôi ngắm—tôi nghía—vẩn vơ suy tưởng
Phong phú làm sao quanh cảnh say lòng
Như lệ thường, lúc tôi nằm trên chõng
Đầu trống không hoặc suy tư nghiền ngẫm
Chúng chiếu sáng vào con mắt nhắm
Sự êm đềm hòa trong nỗi cô đơn
Và lúc đó tim tôi ngập tràn vui thú
Nhảy múa cùng hoa thủy tiên vàng.
4/5/2023
Trần Đức Phổ",hoa thủy tiên vàng,,Trần Đức Phổ,https://poem.tkaraoke.com/123203/.html
"Thơ hoạ Nguyễn Thành Sáng & Tam Muội (1084)
Cung Đàn Xưa Đã Vỡ
Em ao ước một tình yêu lãng mạn
Tô sắc hồng thưởng vạn ánh sao đêm
Vai kề nhau trao nụ ngọt hiên thềm
Cùng sánh bước chiều êm trên phố vắng
Nhưng có lẽ cuộc đời treo tĩnh lặng
Luôn ươm mầm mặn đắng bện vành môi
Vẻ thẫn thờ trăn trở ngắm vầng trôi
Hứng sương lạnh buốt nhồi tim đau nhức
Đêm trống trải ngược quay miền ký ức
Đọng trái sầu rớt vực thẳm chơi vơi
Anh bỏ đi theo tiếng gọi chim trời
Vui hạnh phúc nguyệt khơi vùng tăm tối
Vội vứt áo ngăn sông dòng rẽ lối
Thương cánh cò lạc gối mộng uyên ương
Niềm cô đơn nặng trĩu khúc đoạn trường
Thời gánh vác vết thương cào trở lại
Anh hờ hững tách bờ chia xa ngái
Em mỏi mòn vẫn mãi đợi nơi đây
Thầm hằng mong ngày tái ngộ sum vầy
Nâng chén rượu ngất ngây làn môi đỏ
Hoàng hôn tím rải hờn lên lá cỏ
Nhớ về anh lấp ló gợn mi buồn
Hạt mưa nhoà hay nước mắt chợt tuôn
Nghe khắc khoải gió luồn cơn rền rĩ
Xót bến lỡ tưởng duyên trần bền bỉ
Đống tro tàn dung dị cõi nát tan
Thôi từ nay nén dãy ngọc dâng tràn
Đừng nhắc nữa cung đàn xưa đã vỡ.
March 28, 2019
Tam Muội
Trả Mảnh Hồn Tình
Đành trả em về với tự nhiên
Để không còn bận, chẳng ưu phiền
Thầm lo rồi cũng ngày dang dở
Giọt nhểu, vùi chôn một nỗi niềm!...
Bởi bến sông đây vắng mảnh đò
Làm sao có thể bước người qua
Cho thôi héo hắt sầu trông đợi
Cho hết bâng khuâng chuỗi ráng tà
Vườn xuân mộng thắm giữa mông mênh
Sớm tối đong đưa thổi dập dềnh
Chỉ một thoáng thôi trời trút giận
Cuồng phong kéo đến giũ tan tành!
Nụ hoa, đọt nhánh lú bao nhiêu
Nghiêng ngả, rụng rơi dưới ngọn khều
Trăng trắng mảng buồn phơi rũ rượi
Đau hồn ảo ảnh, nghẹn đìu hiu
Âm vang văng vẳng khúc thê lương
Đẩy cánh yêu đương rớt đoạn trường
Sắc tím nghìn năm màu ảm đạm
Phủ trùm che kín bóng tơ vương
Chắc kẻ ra đi đỡ bận lòng
Vì em rồi cũng ấm bên chồng
Dấu chân kỷ niệm, bầu thân ái
Lặng lẽ thời gian chuyển hoá dòng…
Đêm nay loáng thoáng gió rì rào
Thỉnh thoảng ngoài kia lắc xạc xào
Có phải hồn tình đang nức nở
Chạnh lòng cỏ lá trổi lao xao…
1/4/2019
Nguyễn Thành Sáng
NHẤT LANG THƯ QUÁN
(Nơi Tinh Hoa Thơ Ca)",thơ hoạ nguyễn thành sáng & tam muội (1084).,,Nhất Lang (Nguyễn Thành Sáng),https://poem.tkaraoke.com/123204/.html
"Thơ hoạ Nguyễn Thành Sáng & Tam Muội (1085)
Tình Tan
Mỗi độ thu về chạnh vấn vương
Dòng sông năm cũ trải niềm thương
Có con đò nhỏ đưa hồn nhớ
Lạc nẻo tình đau rớt giọt buồn
Lặng lẽ thời gian ôm giá tuyết
Hắt hiu ngày tháng cuốn tàn hương
Đêm sương ấp ủ bao lời nói
Một áng mây trôi rã ánh đường
Nguyễn Thành Sáng
Buồn Đêm Đông
(Nhất Vận - Ngũ Độ Thanh)
Hẩm phận bèo mây rũ dáng hồng
Đêm nằm nức nở động tầng không
Mưa dầm vất vưởng sầu trăng mộng
Bão dạt se lòng tủi gối bông
Mệnh số an bài xuyên lỗ hổng
Duyên trời xếp đặt xỏ luồng giông
Mi hờn lặng lẽ nhìn ra cổng
Suối phủ vai gầy lạnh lẽo đông.
March 31, 2019
Tam Muội
NHẤT LANG THƯ QUÁN
(Nơi Tinh Hoa Thơ Ca)",thơ hoạ nguyễn thành sáng & tam muội (1085).,,Nhất Lang (Nguyễn Thành Sáng),https://poem.tkaraoke.com/123205/.html
"NỤ CƯỜI EM ĐẸP XIẾT BAO
Nụ cười em đẹp xiết bao
Cho anh ngơ ngẩn lao xạo mơ màng
Em là hoa thắm mệnh mang
Cho anh say đắm chứa chan ân tình
Em là bình minh lung linh
Cho anh mê mẩn đôi mình chung đôi
Em xinh đẹp rất tuyệt vời
Cho anh tất cả rạng ngời thiết tha
Em là lấp lánh ngọc ngà
Cho anh hạnh phúc vỡ oà thăng hoa
Trần Minh Hiền Orlando ngày 7 tháng 5 năm 2023",nụ cười em đẹp xiết bao,,Trần Minh Hiền,https://poem.tkaraoke.com/123206/.html
"HƠN MỘT NỖI BUỒN
Hơn một nỗi buồn nằm trong góc tối
Mưa nắng bốn mùa cứ thế xô nhau
Ơi cái nắm tay , em, anh  bối rối !
Hoàng hôn ngập đầy tình vội trót trao
Hơn một nỗi buồn dùng dằng sang ngõ
Hẹn kiếp sau ta hò hẹn vườn trần
Kỉ niệm ngủ yên đó đây , đây đó
Giọt lệ thẫn thờ in bóng bâng khuâng
Hơn một nỗi buồn em gieo đau khổ ?
Bỏ mặc đời anh cuối nẻo đường mây
Đố biết cuộc đời giăng đầy giông tố ?
Mòn gót thời gian rách rưới đôi giày
Hơn một nỗi buồn xách mang đi mãi
Ta khổ vì người , người khổ vì ta
Xa cách , cách xa ôm chùm áy náy
Chuyện mai sau bóng dĩ vãng nhạt nhòa
Hơn một nỗi buồn bến bờ tuyệt vọng
Ơi cuộc đời cứ dâu bể , bể dâu !
Dòng sông biếng lười không ra biển rộng
Vạt tóc tình yêu xô lệch về đâu ?
Hơn một nỗi buồn ăn sâu kí ức
Chuyện đôi mình biết chân tóc kẽ tơ
Đau đáu dối lòng buông dây rạo rực
Đừng phụ nhau với chiếc bóng hững hờ !
Hơn một nỗi buồn gom bi giằng xé
Hạnh phúc là gì câu hỏi đặt ra ?
Ngọn gió đa tình tham lam thèm ghé
Mơn man môi hồng tựa một đóa hoa
Ngày 1/5/2023
Thiên Ân ( Bình Dương )",hơn một nỗi buồn,,Thiên Ân,https://poem.tkaraoke.com/123207/.html
"HƠN MỘT NỖI BUỒN
Hơn một nỗi buồn nằm trong góc tối
Mưa nắng bốn mùa cứ thế xô nhau
Ơi cái nắm tay , em, anh  bối rối !
Hoàng hôn ngập đầy tình vội trót trao
Hơn một nỗi buồn dùng dằng sang ngõ
Hẹn kiếp sau ta hò hẹn vườn trần
Kỉ niệm ngủ yên đó đây , đây đó
Giọt lệ thẫn thờ in bóng bâng khuâng
Hơn một nỗi buồn em gieo đau khổ ?
Bỏ mặc đời anh cuối nẻo đường mây
Đố biết cuộc đời giăng đầy giông tố ?
Mòn gót thời gian rách rưới đôi giày
Hơn một nỗi buồn xách mang đi mãi
Ta khổ vì người , người khổ vì ta
Xa cách , cách xa ôm chùm áy náy
Chuyện mai sau bóng dĩ vãng nhạt nhòa
Hơn một nỗi buồn bến bờ tuyệt vọng
Ơi cuộc đời cứ dâu bể , bể dâu !
Dòng sông biếng lười không ra biển rộng
Vạt tóc tình yêu xô lệch về đâu ?
Hơn một nỗi buồn ăn sâu kí ức
Chuyện đôi mình biết chân tóc kẽ tơ
Đau đáu dối lòng buông dây rạo rực
Đừng phụ nhau với chiếc bóng hững hờ !
Hơn một nỗi buồn gom bi giằng xé
Hạnh phúc là gì câu hỏi đặt ra ?
Ngọn gió đa tình tham lam thèm ghé
Mơn man môi hồng tựa một đóa hoa
Ngày 1/5/2023
Thiên Ân ( Bình Dương )",hơn một nỗi buồn .,,Thiên Ân,https://poem.tkaraoke.com/123208/.html
"THƯƠNG EM
(Tặng Thông Mỹ Linh)
Thương em vất vả đêm ngày
Thương em đau đớn, đong đầy hy sinh
Thương em vi diệu thâm tình cho anh
Thương em mắt biếc long lanh
Thương em mầu nhiệm hiền lành yêu thương
Thương em cùng anh dặm dường
Thương em chăm sóc đêm trường ngày qua
Thương em Bồ tát ngọc ngà
Thương em trong sáng lụa là chăt chiu
Thương em cực nhọc đủ điều
Thương em thấu hiểu rất nhiều, ơn em
Thương em xinh đẹp dịu mềm
Thương em tuyệt diệu êm đềm nàng tiên
Trần Minh Hiền Orlando ngày 6 tháng 5 năm 2023",thương em 05062023,,Trần Minh Hiền,https://poem.tkaraoke.com/123209/.html
