Edited,Title,Genre,Author,URL
"42-Trích Đoạn Bài Thơ:   YÊU CÁI HỒN CỦA TÌNH YÊU
Của Nhất Lang (Nguyễn Thành Sáng)
Ta nát mảnh lòng bởi vấn vương
Không vì óng ả đoá hoa xuân
Chẳng vì da diết sầu dang dở
Mà chỉ vì kia ngự trị tầng
Nhớ nhiều ánh mắt thắm đầy vơi
Suối biếc trong veo ửng sáng ngời
Thỏ thẻ ngọt ngào khơi ý nhạc
Nụ hiền rạng rỡ đọng bờ môi
Thương lắm hồn Ai ẩn mực xanh
Đậm đà thắm thiết gửi trao anh
Để trưa hôm ấy cơm dừng bữa
Bụng đã no rồi một bát canh
Tôi nhớ, tôi thương trọn ảnh hình
Êm đềm lặng lẽ dưới lung linh
Có dòng sông nhỏ trôi lờ lững
Nhấp nhố con thuyền, bọt trắng tinh...
NHẤT LANG THƯ QUÁN
(Từ khóa)",42- thơ hay ngắn trích đoạn,,Nhất Lang (Nguyễn Thành Sáng),https://poem.tkaraoke.com/121488/.html
"Mong manh chiếc lá trên cành
Tâm, thân yếu tựa chỉ mành treo chuông
Vì đâu vương mãi chẳng buông?
Tuổi xuân phung phí với muôn nghìn sầu
Lửa lòng lá tắt từ lâu
Chốn xưa phủ vết thương sâu khó mờ
Lá tim băng giá hững hờ
Tựa hồ sỏi đá trơ trơ chữ tình
Xót xa ai thấu cùng mình
Nỗi niềm chôn giấu, lặng thinh bẽ bàng
Đớn đau nhân thế phũ phàng
Ngắt chi đời lá dở dang, dại rồ
Chán chường lá chẳng điểm tô
Áo hoa son phấn ngây ngô một thời
Thả hồn vào cõi chơi vơi
Giọt thơ lặng lẽ rong chơi cuối ngày
Ủi an trong chén rượu cay
Trăm năm nghe tiếng thở dài : phù du
Vầng trăng khuất giữa sương mù
Đâu người tri kỷ nhẹ ru giấc lành
Đời em chiếc lá mong manh
Gió lay khẽ nhé, động cành ... lá đau
Lá xanh giờ đã úa màu
Ngại cơn dông tố, lá sầu ... rụng rơi.
20070502
Hạ Phượng
!*.*!",chiếc lá mong manh,,Hạ Phượng,https://poem.tkaraoke.com/121489/.html
"CON BƯỚM ĐA TÌNH 1
Con bướm đa tình tung tăng đôi cánh
Trần gian kia ngàn triệu kẻ dại khờ
Thôi , đừng dửng dưng bến bờ ghẻ lạnh
Đường chân trời cánh chim bỗng bơ vơ
Con bướm đa tình gieo bâng khuâng lạ
Tình yêu là gì câu hỏi bâng quơ ?
Thả câu  vu vơ "" Linh hồn tượng đá""
Ông Trời nắng mưa cho đến bao giờ ?
Con bướm đa tình vòng quanh trái đất
Loay hoay như gà mắc tóc vướng chân
Nhẩm tính thời gian rơi dòng nước mắt
Lượm lặt yêu thương  dưới bóng nợ nần
Con bướm đa tình phơi mình dưới nắng
Dệt văn chương , thêu mơ ước hẹn hò
Gom thương nhớ chất đầy bên thềm vắng
Đôi mắt thẫn thờ tâm sự nhỏ to
Con bướm đa tình bay ngang sang ngõ
Mật ngọt... cỏ hoa phơ phất tơ non
Thích sống giang hồ rày đây mai đó
Ôm bóng vầng trăng lúc khuyết , lúc tròn ...
Con bướm đa tình nghiêng vai chở gió
Dịu mát không gian tô điểm môi ngoan
Hãy uống yêu thương thẹn thùng bỡ ngỡ !
Gõ cửa trái tim , lá ngọc cành vàng
Ngày 28/12/2022
Thiên Ân ( Bình Dương )",con bướm đa tình 1,,Thiên Ân,https://poem.tkaraoke.com/121490/.html
"RU GIẤC BÌNH YÊN
(Thuận nghịch độc)
➡️
Mơ từng giấc ngủ được bình yên
Giấu mãi tình xuân tuổi muộn phiền
Mờ bóng mắt xưa buồn gác lại
Lạnh trời thu sớm khổ cao niên
Thơ đau giọt lệ đêm chìm phố
Rượu đắng lòng mưa buổi đắm thuyền
Khờ dại để gan bầm ruột tím
Xơ tàn cảnh khóc kẻ rồ điên...
⬅️
Điên rồ kẻ khóc cảnh tàn xơ
Tím ruột bầm gan để dại khờ
Thuyền đắm buổi mưa lòng đắng rượu
Phố chìm đêm lệ giọt đau thơ
Niên cao khổ sớm thu trời lạnh
Lại gác buồn xưa mắt bóng mờ
Phiền muộn tuổi xuân tình mãi giấu
Yên bình được ngủ giấc từng mơ ./.
Lê cảnh Tiến 29/12/2O22",ru giấc bình yên,,Lê Cảnh Tiến,https://poem.tkaraoke.com/121491/.html
"EM THẦM LẶNG MỘT TÌNH YÊU BIỂN CẢ
Nghe đời sống ru ngoan mùa đông giá
Anh đợi chờ ngày buốt giá trôi qua
Cảm ơn em anh sinh nhật có quà
Em thầm lặng một tình yêu biển cả
Lòng người cũng như là chiếc lá
Vẫn bí ẩn vẫn muôn đời kỳ lạ
Vẫn quyến rũ vẫn vô cùng lơi lả
Vẫn dịu dàng và rất đỗi bao la
Cảm ơn em cho anh biết thật thà
Biết rung động và biết đừng buông thả
Biết nghe ngóng những lời ví thá
Biết nhẹ nhàng và biết thứ tha
Có khổ đau mới hạnh phúc đậm đà
Có mềm mại mới hiểu lòng gỗ đá
Có thệ nguyện mới tình như đã
Có lạc loài mới khóc tiếng đa đa
Trần Minh Hiền Orlando ngày 29 tháng 12 năm 2022",em thầm lặng một tình yêu biển cả,,Trần Minh Hiền,https://poem.tkaraoke.com/121492/.html
"Hết năm... túi rỗng... ôi nghèo
Cũng cày... cũng cuốc... sao nghèo mãi đeo
Lại thêm năm tới gặp mèo
Nó kêu ngheo nghéo... lại nghèo...thêm năm",nghèo,,Thảo Vân,https://poem.tkaraoke.com/121493/.html
"Tặng Em cùng làng!
Xin tặng em gái năm xưa cùng làng
Chẳng giàu, cao, đẹp, nhưng mà  sang
Nhận ra mình cùng quê gắn bó
Những ngày thơ bé, kỷ niệm vàng.
Xin tặng em nụ mai vàng năm mới
Đưa xuân về dệt mộng ở quê hương
Mắt môi em vẫn còn nét mọng đường.
Nơi nhà thờ đời anh đã ghi dấu
Xin tặng em kỷ niệm thời thơ ấu
Trao tin yêu bằng tia nắng lung linh
Long lanh mắt lệ, quệt ngang tay áo tình
Đậm chất quê mà ta mình biết nhau...
Xin tặng em dù xa cách đã rất lâu
Nhưng vẫn  nhớ thuả đời đầu tóc đen
Bây giờ mắt đã kèm nhèm
Nhớ về làng cũ, lại thèm hương xưa...  CH2",tặng em cùng làng!,,Cong Chinh (CH2),https://poem.tkaraoke.com/121494/.html
"Tất niên 2022.
Cuối năm gẫm lại chuyện mình!
Thiên hạ có mến hay khinh là thường...
Cần xem là có ngay đường.
Chỗ ngang chỗ dọc, chỗ vương vấn gì?
Đường thẳng thì vẫn đúng ly.
Cành ngang phải có thế vì để leo...
Có vậy vợ mới bám theo.
Quần Jean áo khoác, vai đeo túi tình...
Một tay vẫn bấm net hình.
Tay kia cầm giỏ vợ mình đã giao.
Tóc bạc nhưng vẫn chênh chao
Vẫn nheo mắt liếc, với bao bạn hiền.
Túi luôn có một chút tiền.
Hòng khi vợ thiếu tớ liền cho vay...
Dù rằng vợ chồng liền tay.
Nhưng phải dứt khoát, tối may có lời...
Cuối năm viết lên sổ đời.
Bảy hai là đã cuối thời tranh đua.
Tớ đây nói thật không đùa!
Nhìn thiên hạ diễn: Bán mua nước Trời
Còn tớ nghèo suốt cả đời
Qúy từng ngày có là lời đó thôi.
Thiên đàng của tớ sau đồi!
Trồng lời gây giống, nảy chồi mai sau...
Cuối năm viết một đôi câu.
Tỏ đôi suy nghĩ chẳng sâu nông gì!
Trình làng ý tưởng nghĩ suy.
Nếu bạn góp ý, tớ thì mừng vui...
CH2",tất niên 2022.,,Cong Chinh (CH2),https://poem.tkaraoke.com/121495/.html
"Một cách sống
.Ai cũng vươn thẳng ngay trong cuộc sống.
Chẳng muốn cong vẹo, mặt hồng hổ ngươi.
Xác thân muốn khoẻ, đừng ươn lười
Nếu không vận động, cuộc đời khổ thân...
Không muốn dựa dẫm, bám víu xa gần
Tìm đưa vào việc tinh thần hăng say
Dẫu bằng trí óc hay là chân tay
Cũng là do sức, từ ngay chính mình
Bước đi vui vẻ, làm nhiệt tình
Hữu ích mang lại gia đình mình thôi
Kẻ mà lợi dụng, công việc bác bôi
Lườn khươn trễ nải, móc moi nhiều điều
Nếu là người xấu, thay đổi nhiều chiêu
Hòng để phúc lộc đổ chiều về ta
Tham lam thu quén, nhìn từ xa
Nhưng đời tinh quái, nhìn ra đuôi thò...
Làm việc chẳng cần cái tiếng hay ho
Nhưng đem hữu ich đến cho mọi người
Đã sinh ra ở trong đời
Nếu có nhân cách thì Trời ban ơn...  CH2",một cách sống,,Cong Chinh (CH2),https://poem.tkaraoke.com/121496/.html
"Cuộc tình buốt gía.
Tuyết rơi lạnh gía đang bay.
Trời đông tim buốt đắng cay một mình...
Đêm đen trống vắng lặng thinh.
Bí lời giải thích, đường tình éo le
Hám đẹp nên mới bị đè!
Quy lụy quen thói nhão nhoè bấy lâu
Muốn em nên đã cúi đầu.
Bao nhiêu năm đã, tật lâu sẹo rồi!
Thân phận hóa kiếp bèo trôi.
Sắc nhan tiền bạc đè lôi một đời
Xác thân hai đứa chơi vơi
Nghe yêu tưởng thật, nghe lời tưởng sang...
Đằng sau sự thật bẽ bàng!
Một cuộc tình đã lỡ làng cả hai
Tuyết rơi buốt gía tim ai?
Thất vọng vì đã, ôm sai cuộc tình...   CH2",cuộc tình buốt gía.,,Cong Chinh (CH2),https://poem.tkaraoke.com/121497/.html
"Gìa vui.
Cái gìa chẳng từ khen chê
Mà từ cách nói vụng về không đâu
Đang nói, đứt ý lạc câu
Chứ đâu từ cái tóc mầu trắng đen...
Dạo này đốc chứng bon chen.
Cáu gắt lẩm cẩm, nói xen hơi nhiều
Tư cách mất vẻ yêu kiều
Suy tư trầm lặng hóa điều gìa nua...
Cái gìa chẳng cần phân bua
Vô tư nó đến, hơn thua cách nhìn.
Gìa vui đáng gía bạc nghìn!
Cho nên hãy giữ niềm tin vững vàng...
Muốn cho được tiếng ""Gìa sang""
Vui tươi thanh thản, nhẹ nhàng bước đi...   CH2",gìa vui.,,Cong Chinh (CH2),https://poem.tkaraoke.com/121498/.html
"Qùa trần gian...
Đêm đông Chúa xuống Thế trần
Cộng đồng Dân Chúa, tới gần Bêlem
Chúng ta lại ngắm nhìn xem
Lắng nghe Thiên xứ hát khen mừng Ngài.
Từ nay có Đấng Thiên sai
Nói lời Công chính, mọi loài tuân theo...
Chúa đến từ nơi khó nghèo
Trong giới lam lũ, bọt bèo nhân gian.
Nhưng có tình hồng chứa chan
Từ lòng chân thật Trời ban ơn màu...
Dân Chúa ở khắp năm châu
Mừng vui ngày Lễ, hát câu Giao hòa.
Trời cao đổ xuống tuyết hoa
Chúa Trời ban xuống: Đây qùa trần gian...  CH2",qùa trần gian...,,Cong Chinh (CH2),https://poem.tkaraoke.com/121499/.html
"Lòng nhớ thương ai thức một mình
Đêm vắng canh dài ngó trời thanh
Nhớ nhớ ai đây buồn tâm cảnh
Cạn ly trà lạnh lòng chẳng yên
Bên ngồi với ai sống một mình
Ngó duyên tình xa buồn trong tâm
Dòng thơ buồn sầu trong đêm vắng
Tìm nhặt trong thơ một chút tình
09.00 đêm 24.06.2018
buồn vơi trong đêm nhớ người",một chút tình,,Bounthanh Sirimoungkhoune,https://poem.tkaraoke.com/121500/.html
"Mấy mùa rồi vẫn còn đây
Đường xa thêm thấy thương rầy tiếc nhau
Mang mang đêm vắng canh sầu
Nhớ em lòng thấy mưa ngâu từng giờ
Ngồi tô vẽ bóng đêm khuya
Vật vờ hình bóng đong đưa cõi buồn
Lòng yêu thấy lạnh như sương
Càng ngồi càng vẽ càng buồn đêm sang
10.50 đêm 24.06.2018
càng ngồi trong đêm càng
thêm buồn",càng buồn đêm sang,,Bounthanh Sirimoungkhoune,https://poem.tkaraoke.com/121501/.html
"Mùa thu sắp tới rồi
Lạnh lùng ngó lá rơi
Thơ thẩn buồn không ngủ
lòng đêm thêm nhớ người
Ngó lá lác đác trôi
Vật vờ cảnh đêm ngồi
Tiếng thở than lá đó
Như lòng anh nhớ người
08.00 đêm 25.06.2018
lòng đêm mãi nhớ người",anh nhớ người 2,,Bounthanh Sirimoungkhoune,https://poem.tkaraoke.com/121502/.html
"Hồn trôi theo mùa trôi lang thang
Cứ mãi chìm trong bệnh thiếu nàng
Bác sĩ nào đâu trị bệnh đó
Chỉ có thời gian cầu mai sang
Từng ngày trôi đến vẫn xa nàng
Vang vẳng tiếng lòng đêm miên man
Càng yêu càng sầu trong đêm vắng
Ghi nét mực lạnh gửi tin sang
11.00 đêm 25.06.2018
trên dòng thơ nhớ thương em",trôi lang thang,,Bounthanh Sirimoungkhoune,https://poem.tkaraoke.com/121503/.html
"Ngồi ngó cây cành lá đong đưa
Ngồi nghĩ tới ai đêm buông thừa
Gió thu viếng thăm cây cành lá
Gợn trong lòng đêm phủ đầy mưa
Ngồi nghe tiếng lá đêm trao thưa
Rụng rời theo gió từng cơn về
Như cuốn hồn anh đi theo lá
Đã bao ly trà trong đêm khuya
09.00 đêm 26.06.2018
nghe tiếng lá theo gió đưa",trong đêm khuya,,Bounthanh Sirimoungkhoune,https://poem.tkaraoke.com/121504/.html
"Yêu nhau thì lại xa ly
Lòng yêu thì vẫn lậm lỳ chờ mong
Đêm về thắp nén hương lòng
Dù cho xa cách mấy năm cũng chờ
Vật vờ nghe tiếng tim khuya
Chẳng ai qua lại vui chia nỗi sầu
Nửa đêm canh vắng nói sao
Đường xa ngõ vắng nghẹn ngào nhớ nhau
10.40 đêm 26.06.2018
khi đêm yêu thương mà
xa nhau",nghẹn ngào nhớ nhau,,Bounthanh Sirimoungkhoune,https://poem.tkaraoke.com/121505/.html
"Sao mình lại yêu nhau
Biển xa núi đêm sầu
Từng mùa trôi đi đó
Lòng thêm tiếc thương nhau
Sao mình mãi ngóng nhau
Yêu thương cứ một màu
Xa trời xa đây đó
Vẫn cầu mai bên nhau
09.00 đêm 27.06.2018
sao đôi lòng lại thấy thương nhau",sao mình,,Bounthanh Sirimoungkhoune,https://poem.tkaraoke.com/121506/.html
"Tìm kiếm hồn anh trôi đâu đây
Hay tới nơi em đêm khuya này
Em kiếm hồn anh trên trời đó
Đừng để lạc ngõ mà chẳng hay
Tìm kiếm bóng em hồn trôi say
Yêu yêu thương thương đêm khuya này
Miên man ngồi ngó chân trời vắng
Sao cạn với anh chén trà đầy
11.00 đêm 27.06.2018
hồn trôi thơ thẩn đêm",sao cạn với anh,,Bounthanh Sirimoungkhoune,https://poem.tkaraoke.com/121507/.html
"Lên cây đừng quên vịn cành
Đường đời hãy làm đừng có vịn ai
Tham bát thì bỏ cả mâm
Khi thấy tiền đồng chẳng nhặt lại chê
Nước sôi ai tưới lên cây
Rượu nào mà uống không say mới là
Bên người trách trách chê chê
Hết duyên rồi lại đứng đi một mình
Lửa nào cũng nóng ai ơi
Đến khi người nóng xa nơi mà ngồi
Mưa nào đổ hạt khăp nơi
Đời người thì cũng mưa rơi bão dầm
Nơi nào không ẩm có rêu
Nơi nào không có tình yêu duyên đời
Trời xanh mây trắng tô màu
Phấn son tô sắc biết đâu lòng người
Nước sông chẳng dừng chờ ai
Làm người đừng chờ giấc mơ đêm về
Trồng hoa lại chẳng có bông
Thành vợ thành chồng mỗi người mỗi đi",ca dao (162),,Bounthanh Sirimoungkhoune,https://poem.tkaraoke.com/121508/.html
"Trồng hoa chẳng tưới nườc hoa
Có cửa có nhà mà chẳng chăm lo
Trời khoe trời rộng hơn ai
Gái khoe sắc đẹp bao người viếng thăm
Nuôi ong thì ngọt bờ môi
Trồng chanh thì lại đứng ngồi chẳng yên
Chua cay mặn ngọt trên môi
Hãy chọn những lời làm người vui nghe
Đâu ai chờ ẵm núi non
Đâu ai chờ vịt ấp con đâu mà
Nuôi cá ăn vẩy đâu ai
Trứng gà ăn vỏ thương người vợ chung
Kiếp tằm cũng khổ vì tơ
Kiếp người cũng khổ khi bơ vơ một mình
Gió chiều thay đổi theo mùa
Biếng làm đừng có đổ thừa cho nhau
Ra đường cơm nóng canh ngon
Ở nhà cơm nguội chẳng còn mà ăn
Đi đêm thì lại sợ ma
Ở nhà sợ vợ thì ra anh hùng",ca dao (163),,Bounthanh Sirimoungkhoune,https://poem.tkaraoke.com/121509/.html
"CON BƯỚM ĐA TÌNH 3
Con bướm đa tình mân mê cái đẹp
Ngang dốc cuộc đời sống kiếp lãng du
Thương đóa hoa kia ngày nao khép nép ?
Ngọn gió mềm lòng thích thú mơn ru
Con bướm đa tình , đa sầu , đa cảm
Rối rắm , đa đoan , đa sắc , đa màu ...
Đậu nhánh tơ duyên bức tranh bừng sáng
Những con đường chầm chậm đã trôi mau
Con bướm đa tình nỗi buồn thầm lặng
Trần gian còn đầy ắp tiếng cười đâu ?
Thế kỉ rong chơi về vùng biển mặn
Ôm nhánh sông dài bãi mía , nương dâu ...
Con bướm đa tình in sâu , ham sống
Vốn mê yêu đương từ độ thiếu thời
Thương dùm đất trời đôi vai mềm mỏng
Nghiêng xuống cuộc tình một góc chơi vơi
Con bướm đa tình đôi khi mỏi mệt
Dừng chân thư giãn ở bến tương tư
Ghé lại vườn thơ tháng năm đã hết
Hái đọt yêu thương nghe tiếng giã từ
Ngày 29/12/2022
Ân Thiên ( Bình Dương )",con bướm đa tình 3,,Thiên Ân,https://poem.tkaraoke.com/121510/.html
"VĨNH BIỆT VUA BÓNG ĐÁ PÊ LÊ
Chia tay vĩnh biệt ""vua"" (bóng đá) Pê lê
Huyền thoại tài năng không chỗ chê
Sút bóng tuyệt vời thế giới thích
Đá banh xuất sắc mọi người mê
Chiếu soi ánh sáng cả ngàn phương
Toả sáng vì sao khắp mọi bề
Thương khóc tiễn đưa người quá vãng
Chia tay vĩnh biệt ""vua"" (bóng đá) Pê lê
Trần Minh Hiền Orlando ngày 29 tháng 12 năm 2022",vĩnh biệt vua bóng đá pê lê,,Trần Minh Hiền,https://poem.tkaraoke.com/121511/.html
"QUÊ BẠN
Ghé thăm quê bạn một buổi chiều
Thấy mặt trời sợi râu thu vén
Thấy hoàng hôn sà xuống đáng yêu
Thấy tầng mây tìm về chỗ hẹn…
Hai bên đường hoa cỏ đan xen
Con kênh nhỏ nước khoe trong vắt
Hơi sương tìm về đó làm quen
Cơn gió vòng quanh chơi đuổi bắt…
Cánh đồng lúa một nỗi băn khoăn
Bẹ sữa cương sắp bung áo mặc
Thơm một vùng lưu luyến sương giăng
Dòng thời gian bỗng nhiên trục trặc…
Đêm trùm lấy để giữ thăng bằng
Như giữ lấy hồn người khách lạ
Thêm một lần về lại đây chăng
Hẹn rồi đấy. Đừng quên khách nhá…
30/12/2022
Nguyên Hữu",quê bạn,,Nguyên Hữu,https://poem.tkaraoke.com/121512/.html
"CÓ NHỮNG GIẤC MƠ LẠ LÙNG
Có những giấc mơ lạ lùng
Sáng ra đã thành sự thật
Em đã trở thành chánh thất
Sao còn khắc khoải thờ ơ
Có những giấc mơ ỡm ờ
Chẳng bao giờ ai hiểu nổi
Em đã là em hiền nội
Sao còn day dứt nguồn cơn
Có những giấc mơ dỗi hờn
Ngây ngô ngượng ngùng ngớ ngẩn
Em đã là hoa hậu ngấn
Sao còn ngần ngại ngây ngô
Có những giấc mơ hải hồ
Ru ngoan cánh buồm kiêu hãnh
Em đã là mùa đức hạnh
Sao còn tê tái tiêu tan
Trần Minh Hiền Orlando ngày 30 tháng 12 năm 2022",có những giấc mơ lạ lùng 12302022,,Trần Minh Hiền,https://poem.tkaraoke.com/121513/.html
"Gió đông se lạnh lùa vai áo
Xuân rón rén về gọi én chao
Cây khẽ cựa mình đơm lộc biếc
Lòng trần xao xuyến, nén xôn xao!
***
Nhớ những xuân xưa của thuở nào...
Nhà nghèo, không áo mới thêu hoa
Anh em mấy đứa đều thơ dại
Xúm xít bên me dưới chái nhà
***
Cùng nhau gói bánh tét quây quần
Bên bếp lửa hồng ngóng chúa xuân
Tiếng pháo rộn ràng vang giục giã
Giao thừa - thời khắc chuyển sang năm!
***
Thấm thoát xuân đi... biết mấy mùa
Bếp hồng ngày ấy đã xa xưa
Rưng rưng quay ngược dòng hồi ức
Dĩ vãng xa rồi... Xuân rõ chưa?!
nvpk",nhớ xuân xưa,,Nvpk,https://poem.tkaraoke.com/121514/.html
"SUY NGẪM CUỐI NĂM 2022
Trần Minh Hiền Orlando ngày 29 tháng 12 năm 2022
1.
Một năm 2022 trôi qua cái vèo trước mắt. Nhìn lại đời mình thấy vẫn còn rất nhiều điều mình chưa làm được dẫu cố gắng rất nhiều. Cuộc sống thật muôn hình vạn trạng và luôn có những điều khuất tất, thế giới ta bà vẫn nhiễu nhương đầy cạm bẫy dối gian lừa mỵ và đầy những điều phù phiếm giả hình. Con người vì lòng ghen tỵ ganh tỵ ghen ghét đố kỵ mà có thể làm nên những điều xấu xa tội lỗi tội ác khôn lường. Khi thấy người khác được nổi tiếng được vinh danh khen tặng thì nhiều người chịu không nổi và lập tức ném đá bôi bác hãm hại kéo xuống. Người ta nhân danh đủ thứ để tấn công kẻ kia. Thật là đáng hổ thẹn và đáng kinh tởm. Hiện tượng nhà thơ Tống Thu Ngân là một ví dụ điển hình. Tôi đọc thơ của TTN và công nhận thơ rất hay và rất mới al5 độc đáo, ẩn dụ rất sâu sắc kín đáo và mang tính cách mạng, phê phán kín đáo rất đặc sắc.
2.
Tin tức về bão tuyết Eliott làm nhiều người bị chết làm anh đau lòng vô cùng đặc biệt là về cái chết của cô gái 22 tuổi đi làm ở viện chăm sóc người trở về nhà khi chỉ còn cách nhà 6 phút lái xe nhưng vì tuyết quá dày không thể chạy xe được nữa. Trước khi chết cô còn nói chuyện với chị và chiếu cảnh tuyết rơi cho các chị xem, vậy mà sau đó đã chết thảm vì tuyết lạnh. Cầu nguyện cho tất cả nạn nhân được đầu thai về cõi an lành.
3.
Con người sống ở đời thật sự ra ai ai cũng bình đẳng như nhau dù có người giàu người nghèo, người tốt người xấu người đẹp người xấu ... nhưng vấn đề nằm ở chỗ người giác ngộ thì sống an nhiên người chưa giác ngộ thì sống trong khổ sở tinh thần. Con người hơn nhau có chăng ở chỗ biết đủ biết thương yêu người khác như chính bản thân mình. Có hiểu biết thì không chết họăc có chết cũng thanh thản về cõi an lành hơn còn khôn cũng chết mà dại cũng chết.
4.
Anh luôn cầu nguyện và cầu xin tất cả chúng sanh trong đó có loài người và nhất là người Việt Nam được bình an, khoẻ mạnh, giác ngộ và tất cả có ngày mai tương lai tốt đẹp.
Trần Minh Hiền Orlando ngày 29 tháng 12 năm 2022",suy ngẫm cuối năm 2022,,Trần Minh Hiền,https://poem.tkaraoke.com/121515/.html
"CON BƯỚM ĐA TÌNH 4
Con bướm đa tình bóng in thấp thoáng
Sớm tinh mơ nghe trăm chuyện cuộc đời
Bài văn ai vẽ vời chia nhiều đoạn
Mở bài , thân bài kết luận đầy vơi
Con bướm đa tình ngày xanh cánh mỏng
Không hiểu vì sao , biết yêu khi nào ?
Đôi mắt mơ màng đôi lần trông ngóng
Trái ngọt lắc lư hớn hở hỏi chào
Con bướm đa tình mở lòng chờ đợi Xuân choàng vai ấm áp trái tim côi
Giọt nắng lang thang tìm niềm vui mới
Giọt sương long lanh như muốn trêu cười
Con bướm đa tình reo thi giai điệu
Ngày trôi đi , tháng lăn vội , năm sang
Vòng kỉ niệm ai dang tay vội níu
Hồn xanh non mộng ướp mật mơn man
Con bướm đa tình vo tròn giấc mộng
Vẫn hồn nhiên , tinh nghịch , suốt bốn mùa
Tình yêu lăn tăn nhẹ nhàng cơn sóng
Ai ngập ngừng chải tóc ở song thưa ?
Ngày 29/12/2022
Ân Thiên ( Bình Dương )",con bướm đa tình 4,,Thiên Ân,https://poem.tkaraoke.com/121516/.html
