Original,Edited,Title,Genre,Author,URL,"Data
usable"
,"Anh em tôi là những người ở lại
Cũng đi tù, cũng ra Bắc vào Nam
Từng in chân nơi Nghĩa Lộ, Văn Bàn
Tưới mồ hôi xuống Hà Tây, Thanh Hoá
Lũ chúng tôi không phải vài ba đứa
Có hàng ngàn hàng vạn kẻ bại vong
Ðem oan khiên ra rửa nước sông Hồng
Mang uất hận trút trên rừng Yên Bái
Ðứa gục xuống bón cây rừng Bắc Thái
Cho lá xanh, cho rừng cỗi đơm hoa
Ðứa truyền rao chính nghĩa khắp Nam Hà
Cho lẽ phải sáng bừng trong đêm tối
Sức chúng tôi cũng mỏi mòn vì đói
Kiếp lưu đày quên hết cả nhân sinh
Tiếc nuối gì đâu những buổi đăng trình
Nuốt tủi nhục ôm riêng mình hệ lụy
Riêng các anh những người hùng thế kỷ
Nghiêng cánh dù ghé đất Bắc đêm đen
Nghe tên anh vùng hậu địch đảo điên
Làm rung chuyển cả thành trì Bắc Việt
Khi hy sinh không một lời vĩnh biệt
Bao kiêu hùng vẫn là lính vô danh
Sống âm thầm khắc khoải giữa rừng xanh
Vượt sự sống để coi thường cái chết
Thân không màng há ngại gì đói rét
Ðòn hận thù chẳng khuất được trung trinh
Dù biệt giam kẻ địch vẫn giật mình
Loài muông thú sợ oai linh thần điểu
Khi sa cơ trong kiếp Sơn Ðầu Khiếu
Có ai đem thành bại luận anh hùng
Lũ chúng ta còn nợ nghiệp kiếm cung
Chưa trả được nên suốt đời ân hận...
Ðông Anh",thơ gửi người biệt kích,,Ðông Anh,https://poem.tkaraoke.com/28624/.html,
,"Mai anh sẽ đưa em về sông Hậu
Một giòng sông thời thơ ấu của anh
Con nước chảy hàng bần xanh gió hát
Chiều lục bình theo sóng giạt trôi xa .
Anh sẽ đưa em thăm miền đất lạ
Mà trong đời em chưa một lần qua
Thăm vườn Nội hàng cây xanh màu lá
Chiều thơm nồng hương buởi nớ đầy hoa .
Nếu em về đúng vào mùa nắng hạ
Chiều đốt đồng làn khói toả lên không
Nghe hăng hắt mùi hương nồng trong gió
Dưới chiều quê nhè nhẹ tiếng ai hò .
Mai em về vào một mùa chướng gió
Anh đưa em qua những chuyến phà đêm
Nghe gió lộng nhìn trăng rơi trên sóng
Mà thấy lòng man mác nỗi buồn êm .
Mai anh kể em nghe từng kỷ niệm
Tuổi đời anh thời niên thiếu học trò
Đã bắt đầu thả hồn ru theo gió
Chiều qua phà sông Hậu tập làm thơ .
Mai em nhé mai mình về em nhé
Anh dìu em đi lại những con đường
Lâu lắm rồi lòng anh như cứ tưởng
Mất hết rồi những kỷ niệm thân thương .
PT.937",mình về nhe em,,Phuongtim,https://poem.tkaraoke.com/28625/.html,
,"Duy Văn Hà Đình Huy
Sinh Quán: Tây Ninh
*Trước năm 1975: SQ/TB/ VNCH.
Cao Đẳng Sư Phạm Văn Khoa (Nhiệm ý Việt Hán) Đại Học Cao Đài.
Cử Nhân Luật Khoa (Ban Kinh Tế ) Đại Học Luật Khoa Saigon.
Giáo Sư Trung Học Đệ Nhất Cấp Trường Trung Học Cẩm Giang Tây Ninh.
*Định Cư Hoa Kỳ : Diện H.O
Cựu Sinh Viên Báo Chí  trường College SF ( Student of College Press & News College San Francisco)
Cựu Tổng Thư Ký Trường Việt Ngữ Âu Cơ
Cựu Tổng Thư Ký Báo Saigon USA
Cựu Phụ Tá Chủ Bút Tuần Báo Đời California.
Biên Tập Viên và Cộng tác các báo: Tuần Báo Mõ SF, Tuần báo Mõ SJ, Báo Saigon USA, Báo Ý Dân, Tuần Báo Đời SanJose, Báo Thời Luận Nam Cali, Đặc San Tập Thể Chiến Sĩ VNCH, Báo Đời Mới.
Hiện Chủ Bút Tuần Báo Đời Mới (Modern Life Weekly Magazine For Vietnamese – Americans)
*Tác phẩm xuất bản: Ngày Xưa Của Mẹ (Thơ) , Nước Mỹ …Ngủ Đường ( Phóng Sự Xã Hội)
Tác Phẩm sắp in: Những Dòng Sông Chết ( Truyện Ngắn), Tuổi Tình Yêu (Thơ).
*Bằng khen “ Vinh Danh Chủ Bút Báo Chí Việt Ngữ” của Hội Đồng Thành Phố và Thị Trưởng San Jose.
Email: hadinhuy2003 @yahoo.com. hoặc duyvan_2000@yahoo.com
*
LỜI NHÀ XUẤT BẢN
Làm con, ai chẳng nhớ công ơn cha mẹ, nhất là hạng văn nhân vốn giàu tình cảm? Vậy mà trong văn học thế giới, những văn thơ khóc cha mẹ lại rất hiếm, so với văn thơ khóc vợ, khóc chồng hoặc khóc bạn: trong văn học Pháp, chúng tôi chỉ nhớ ít hàng “ Ô mon père, ô ma mère” của Pasteur, trong văn  học Trung Hoa chỉ nhớ bài “ Lũng Cương Thiên Biểu” của Âu Dương Tu.  Như vậy là tại sao?  Không phải vì tình riêng mà khó bàn, chắc tại vì tình thiêng mà khó giải, như thi sĩ Đông Hồ đã nói: “ Cứ cầm viết đến thì nước mắt lại giàn giụa, tay run cảm xúc mà không viết nên lời.”
Đây là lời sám hối của bạn  Hà Đình Huy đã gợi lên niềm bi cảm triền miên day dứt của mình. Một số bài thơ ghi lại nỗi đau của người con mất mẹ, văn thể, và lời, đều tuy không một chút trau chuốt nhưng tình  xuất phát từ đáy lòng.
Đọc thơ bạn Hà Đình Huy chúng ta  thấy ngay một bà mẹ quê chất phác, tâm đạo suốt đời tận tụy vì con và chồng quên cả thân mình.
""Ngày xưa mẹ đã nuôi con
Cái nôi chiếc võng, hãy còn xinh nguyên
Cuộc đời mẹ quá  truân chuyên
Dưỡng nuôi con trẻ nhiều phiền hơn vui
Ngày xưa không lúc nào nguôi
Bôn ba khắp xứ ngược xuôi nuôi chồng
Làm vui truyền thống tổ tông
Sinh ra phận gái, một lòng chồng con...""
Chúng ta đọc thơ của bạn Hà Đình Huy cũng không thể cầm được nước mắt, và thấy lời này thật chí lý: “ Một nỗi thương tâm  chung cho loài người là khi hiểu được tình của cha mẹ thì cha mẹ thường đã khuất bóng.”
Nhà Xuất Bản  ĐỜI MỚI",tiểu sử,,Duy Văn Hà Đình Huy,https://poem.tkaraoke.com/28626/.html,
,"Em quay bước bỏ rơi tình tôi lại
Để chạy theo tiếng gọi của giàu sang
Em quên chăng?ngày ấy dưới thu vàng
Lời hẹn ước chúng mình bên nhau mãi.
Dù cuộc đời với muôn ngàn trở ngại
Trăm đắng cay hay cạm bẫy chông gai
Tình đôi ta sẽ chẳng thể nào phai
Mà tỏa sáng như trăng tròn mùa hạ.
Mối tình đầu tôi trao em tất cả
Bao si mê cuồng nhiệt của con tim
Nhưng ngày ấy giờ trở thành xa lạ
Em nhẫn tâm quay lưng lại nhấn chìm.
Em giẫm nát tim tôi trên xác lá
Chẳng mảy may hối hận chút tâm hồn
Cuộc tình này tôi dành em tất cả
Để bây giờ...tay trắng...đợi hoàng hôn.
Em bước đi mà chẳng nói một câu
Hay chia đôi lời hẹn ước ban đầu
Em để lại cho mình tôi day dứt
Một mình tôi ôm trọn mối tình sầu.
Trớ trêu thay tình tôi với mùa thu
Nở thành hoa và cũng phủ sương mù
Tình thu ấy giờ trôi vào dĩ vãng
Để trong tôi một khoảng vắng hoang vu.
Tôi lặng lẽ bước trên thu tàn úa
Lòng nhói đau khi tình đã lìa xa
Nước mắt rơi cho tình yêu một thủa
Đi lang thang như kẻ không nhà.
Tôi muốn thét giữa trời cao vô tận
Cho vợi đi dù một chút tình sầu
Ôi duyên số đời tôi sao lận đận
Giữa dòng đời trôi nổi biết về đâu.
a.phủ",khoảng vắng hoang vu...!,,A,https://poem.tkaraoke.com/28627/.html,
,"Sống ở đời ai cũng chọn cho mình một lối đi
Tôi cũng vậy nhưng tôi chọn một con đường riêng biệt
Một con đường tôi chỉ muốn riêng mình tôi biết
Là con đường dẫn tới...trái tim em.
Nhưng bắt đầu từ đâu thì tôi vẫn đang xem
Chọn một cách làm quen nhưng phải thật lòng nhất
Để em không cười còn tôi thì hoàn tất
Chiến lược mở đầu cho chiến dịch tiếp theo.
Em có biết không?tại đôi mắt trong veo
Đã hút hồn tôi ngay lần đầu nhìn thấy
Trái tim tôi chưa một lần run rẩy
Nhưng khoảnh khắc vô tình lại lỗi nhịp em ơi.
Tâm hồn tôi!kẻ thi sĩ rong chơi
Bỗng thức tỉnh!em thành nguồn cảm tác
Trái tim tôi thay lòng tôi phổ nhạc
Những bài thơ tình tôi viết gửi tặng em.
Và có nhiều lúc tôi ước hóa con tem
Trên phong thư đến tận tay người nhận
Là em đó!em vui hay em giận?
Khi đọc những lá thư này em hãy nói tôi nghe.
Em là tất cả của những si mê
Mà tôi góp nhặt trong cuộc tình này đó
Có khi nào em thoảng nghe trong gió
Lời tỏ tình tôi gửi gió nói hộ tôi.
Có khi nào em thấy một chút thôi
Lòng rung động khi đọc những bài thơ tôi viết
Hồn tôi đó!tình tôi đó!em có biết?
Tôi gửi vào tất cả trong thơ.
Một ánh mắt thôi cũng thắp sáng những ước mơ
Hay một nụ cười cũng đủ làm tôi hạnh phúc
Nếu có thể xin em chỉ đường giúp
Để tôi vào...gõ cửa...trái tim em!.
a.phủ",xin em chỉ đường giúp,,A,https://poem.tkaraoke.com/28628/.html,
,"Xin em trả lại cho tôi
Những gì tôi gửi từ hồi biết nhau
Nhiều thì tôi chẳng nhớ đâu
Những gì tôi nhớ mang mầu riêng tôi
Cái ngày tình cảm lên ngôi
Trót trao ánh mắt để rồi mộng mơ
Tôi đam mê đến tận giờ
Tỉnh rồi mà vẫn ngẩn ngơ cái nhìn.
Trả tôi một nửa!tôi xin!
Tặng em một nửa để tin lòng này.
Hôm nao chẳng rượu mà say
Lạ chưa sao cứ ngất ngây trong lòng
Trả tôi nửa nỗi nhớ mong
Tặng em một nửa để đong đêm dài.
Hôm qua mơ thấy bóng ai?
Để đêm tôi cứ miệt mài làm thơ
Tặng!tôi chưa tặng bao giờ
Nhưng hồn tôi trót thẫn thờ nhiều khi.
Trả tôi em giữ làm gì?
Giờ tôi như vậy cũng vì em thôi...
...Nói gần lại hóa xa xôi
Muốn cho em hiểu lòng tôi lúc này
Yêu em chẳng dám giãi bày
Cố tình mượn cớ nói thay tấm lòng
Lời yêu dù có đi vòng
Nhưng tình tôi mãi sáng trong vô ngần.
a.phủ",trả lại cho tôi,,A,https://poem.tkaraoke.com/28629/.html,
,"Gợn lòng một thoáng vu vơ
Tâm tư bỗng chợt hoang mơ lạ thường
Vì đâu để mặc tơ vương
Trái tim rơi rớt bên tường nhà kia
Một mình ngắm ánh sao khuya
Hồn nhiên đi vắng, buồn va chạm lòng
Trầm mình giưã cơn gió đông
Dẫu đang giá buốt vẫn không biết gì
Có phải cảm giác mất đi
Hay buồn cứ vướng ôm ghì trí tâm
Chút tình đang vướng xa xăm
Như cơn lưả cháy nám bầm hồn ta
Yêu làm chi cho thật thà
Mai kia nếu lỡ...đậm đà khó quên
Thân gầy, sức yếu, lòng mềm
Biết ta có thể đứng lên một mình
Đời người một kiếp phù sinh
Sương Anh",một thoáng...vu vơ...,,Sương Anh,https://poem.tkaraoke.com/28630/.html,
,"Xin cho khi tôi ngủ
Không chút lụy hồng trần
Chẳng làm khổ người thân
Hồn an lành yên à...
Xin cho tôi thong thả
Được nói lên một lời
Em yêu lắm...tình ơi!
Đến người tôi yêu mến
Xin cho đừng mỏi mệt
Đến giây phút cuối cùng
Vui vẻ bên tình chung
Ra đi không vướng mắc
Xin cho khi nhắm mắt
Trên môi vẫn nụ cười
Trái tim hãy còn tươi
Dành tặng người tri kỷ
Xin cho khi an nghĩ
Người ấy không đau buồn
Đừng để giọt lệ tuôn
Yên lòng về với cát
Xin cho...
Sương Anh 26/02/08",xin cho...,,Sương Anh,https://poem.tkaraoke.com/28631/.html,
,"À ơi em hãy ngủ ngoan
Bởi đêm sầu đắng sẽ tan sớm mà.
Bình minh sẽ hát hoan ca
Đón em buổi sớm chói lòa ánh dương.
Nhớ thì nhớ, thương vẫn thương
Cũng đành xếp lại vấn vương trong lòng.
Đừng tìm kiếm cõi hư không
Bóng xưa phai nhạt mà không hẹn thề.
Ngủ đi quên hết tái tê
Cho tim ấm lại, xuân về sớm mai.
Trong mơ xây một lâu đài
Nơi người yêu sẽ ôm hoài vòng tay.
Làn môi ngọt, mắt đắm say
Yêu cạn năm tháng, yêu đầy khát khao.
Lạc trong xuân thắm sắc đào
Lời yêu dẫn bước em vào cõi mơ.
Trăng treo lơ lửng khúc thơ
Thả từng câu chữ xuống bờ mi em.
Ngủ đi cho giấc êm đềm
Sáng mai thức giấc lại thêm yêu đời.
À ơi, đêm đã khuya rồi
Ngủ say em nhé cho vơi muộn phiền!
Nguyễn Hoàng",ru em cho vơi muộn phiền,,Nguyễn Hoàng,https://poem.tkaraoke.com/28632/.html,
,"Qua giọng ngâm của : Hồng Liên , Hồng ngát
Cho anh gom lá mùa Thu lại
dệt áo vàng
trong những buổi hoàng hôn…
Cho anh đan
những tia nắng lại
kết tơ lòng
lót lá em nằm…
Cho anh được hôn lên
mái tóc em bồng bềnh
trong những chiều nhạt nắng
nắm chặt tay em
ngơ ngẩn
giữa trời sao…
Cho anh được ngắm nhìn em
dưới ánh trăng vàng
nhẹ rung dưới tàn lá
giữ mãi nụ cười em mỉm
giữa ánh trăng khuya…
Cho anh được ngồi bên em
để đêm về
chẳng chia nổi tay nhau
trong nỗi nhớ thương bất tận
Cho anh níu lại thời gian
để… kỷ niệm trong đêm nay
không vội vã
vượt khỏi vòng tay anh
cho ta được
bên nhau
mãi mãi…
hoàng nguyên",cho anh gom lá mùa thu lại,,Hoàng Nguyên,https://poem.tkaraoke.com/28633/.html,
,"Buổi sáng hôm nay trời xanh tươi mát
Hồn nhẹ nhàng theo ngâm khúc tình Thu
Nhờ anh gom lá vàng giữ sương mù
Gọi nắng đến cho em niềm vui mới
Đẹp vô ngần hạt sương trong nắng sớm
Ánh lung linh, rực rỡ trên cánh hoa
Thật bất ngờ...một buổi sáng an hoà
Vưà thức giấc, đã thấy anh ngồi cạnh
Bé đã thôi buồn, không còn đơn quạnh
Bởi anh luôn mang gió ấm sang đây
Nhờ sức thổi hồn bật tỉnh rồi này
Phút yếu đuối đã qua...yên lòng nhé!
Em sẽ không để tình thơ lạnh, tẻ
Câu héo buồn như thu lá vàng rơi
Lời nghẹn ngào làm ướt cả mắt môi
Như chim sẻ, thơ líu lo ca hát
Nhờ có anh gom lá muà thu lại
Kết áo vàng màu hoa cúc tặng em
Tình quân vương khiến hoàng hậu say mèm
Hồn ngã xuống trên nệm êm cuả lá...
Ánh trăng vàng ảo huyền, kỳ diệu quá!
Ngồi bên nhau nghe nhịp đập con tim
Chẳng một lời mà như hàng vạn nghìn...
Ta bên nhau...lặng im trong hạnh phúc...
Sương Anh",êm ái tình thu,,Sương Anh,https://poem.tkaraoke.com/28634/.html,
,"Sương long lanh mặt hồ soi bóng ngả
Hoàng hôn chiều, hôn xõa tóc em bay
Nắng sương chiều vẫn ấm mãi cỏ cây
Cho hồn em, thênh thang đời rộng mở…
Hoàng hôn chiều, nhuộm vàng thêm mầu nhớ
Long lanh ơi, hạt sương ấm đôi bờ
Đan cho em, những sương thẫm vần thơ
Để hoa nở, một mùa xuân tình ái…
Long lanh chiều, rắc hạt thương vàng óng
Trên môi em, hoa thắm nở nụ hồng
Mái tóc dài, dấu chiều nhớ vô trong
Cho mầu má, chớm hồng xuân đang tới…
Trải nắng vàng, trên bến xuân mùa gọi
Cho sương chiều, vàng óng đẹp như mơ
Cài trên đường, bằng những vần thơ
Cho em êm, nỗi yêu anh mùa nhớ…
Hãy bên nhau, để mùa không dang dở
Xuân chớm về, cho sương đọng ngàn phương
Thanh thiên ơi, sao cao đẹp lạ thường
Là thương nhớ, trong bốn mùa yêu gọi..
hoàng nguyên","là thương nhớ, trong bốn mùa yêu gọi !",,Hoàng Nguyên,https://poem.tkaraoke.com/28635/.html,
,"Mai tôi về tìm lại làng quê
Hàng cau khóm trúc nắng vàng hoe
Cây đa già nghiêng mình chờ đợi
Năm tháng dài rũ bóng lê thê
Mai tôi về tìm lại đồng quê
Đàn trâu thơ thẩn với con đê
Bông lúa vàng dâng hương ngào ngạt
Tình yêu thương nằm giữa cơn mơ
Mai tôi về tìm lại trường xưa
Gặp thầy cô  mừng sao cho vừa
Hàng cây trứng cá, hoa phượng đỏ
Bao năm rồi buồn ngóng nắng mưa
Mai tôi về tìm lại phố xưa
Đèn mờ lấp lánh ánh sao thưa
Ghế đá công viên thôi hò hẹn
Bụi mờ sương phủ khách vắng đưa
Mai tôi về, mai tôi sẽ về
Với người thân lứa tuổi bạn bè
Năm tháng dài trắng đầu trông ngóng
Tiếng sáo lời thơ khúc trăng thề !
Vivi",mai tôi về,,Vivi,https://poem.tkaraoke.com/28636/.html,
,"Vùi nón sắt cuối chiều xuân lạnh
Tiếng thở dài cô quạnh đêm sâu
Mẹ hiền quằn quại canh thâu
Khăn tang hồn liệm tơ sầu thiên thu
Hoà bình đến non mù hoen ố
Gieo hận thù máu đổ ly tan
Cửa quyền hỗn loạn hiên ngang
Bàn thờ Tổ Quốc điêu tàn đảo điên
Đời dân Việt gông xiềng tăm tối
Ngục trần gian le lói mồ hoang
Ba mươi xuân lẻ cơ hàn
Quê hương đổ nát, lệ tràn bi ai
Đà quá rõ một loài ma quỉ
Lừa dân lương tiêu hủy giống nòi
Cúi đầu Tàu Cộng làm tôi
Đất vàng cống hiến, biển bồi cũng tiêu !
Vivi
Nauy 29.4.06",buồn đời,,Vivi,https://poem.tkaraoke.com/28637/.html,
,"Ta muốn có những đam mê sôi nổi
Cho giòng đời đượm thêm sắc thêm hương
Cho hồn ta khắc khoải giữa canh trường
Ðang khao khát cõi trời thiêng đất lạ
Có trăng mềm trên ngàn cây ẻo lả
Rộn xuân tình chờ đợi gió cuồng si
Có ngàn sao soi lấp lánh diệu kỳ
Như hoa chúc dật dờ bên gối mộng
Có hoa rừng ngọt ngào tươi sức sống
Hé nhụy đài chờ đón bướm ong qua
Em nguyên trinh trên sóng cỏ mượt mà
Làm ngại bước người lữ hành cô độc
Đông Anh",khao khát,,Đông Anh,https://poem.tkaraoke.com/28638/.html,
,"Chưa nói câu gì sao mưa rơi
ngoài hiên tí tách ướt bụi đời
cho kẻ nhìn trời lau nướt mắt
bên dòng lệ chảy thấy chơi vơi
Đôi lúc cánh diều bay rất xa
tình chao lơ lửng nhận không ra
mờ nếp lõm lòi trên mặt giấy
sau trận cuồng phong đã đi qua
Trong lớp màng che sâu vết thương
trải qua sống gió mãi yêu đương
mới biết sông dài hay đoản khúc…!
hoa còn khoe sắc nhuỵ khơi hương …!
2008
Bạch Vân Nam",trải yêu,,Bạch Vân Nam,https://poem.tkaraoke.com/28639/.html,
,,bi vọng,,Huongtuyet274,https://poem.tkaraoke.com/28640/.html,
,"Anh gửi về em một chút mùa thu
Có nắng gió với khí trời nơi anh sống
Có màu của cỏ cây không gian chuyển động
Gửi về em...anh đổi chút thu nhà.
Mùa thu bên anh!mùa thu phương xa
Cũng lá vàng rơi mặt trời tắt vội
Sao anh mãi nhớ mùa thu hà nội
Anh nắm tay em dạo bước hồ tây.
Vẫn con đường cũ ghế đá hàng cây
Đã quen thuộc với chúng mình quá đỗi
Bên gốc sấu già nhiều năm cằn cỗi
Ghi lại bao nhiêu câu chuyện tình yêu.
Mùa thu Hà Nội thêm đẹp trong chiều
Thêm lộng lẫy trong hoàng hôn nhuốm đỏ
Hương hoa sữa ngạt ngào bay trong gió
Để ai xa...thu đến...lại nhớ về.
Mùa thu bên anh!cháy bỏng đam mê
Có một chút hương mùa thu Hà Nội
Chút sắc màu nơi phồn hoa đô hội
Chút kỷ niệm xưa em sẽ gửi cho anh.
Đã mấy mùa thu lạnh lẽo vắng tanh
Không có em tay trong tay cùng bước
Anh thấy mùa thu nhạt màu hơn trước
Đi trên lối quen sao vẫn lạ xa.
Mùa thu bên anh!hình bóng quê nhà
Mùa thu phương xa!nhớ mùa thu Hà Nội
Và anh yêu em!càng thêm gấp bội
Lá vàng rơi...hay nỗi nhớ...đang rơi!
a.phủ",mùa thu phương xa nhớ mùa thu hà nội!,,A,https://poem.tkaraoke.com/28641/.html,
,"Người đàn ông của tôi
Trách anh mang tôi khỏi
Tháp ngà tuổi tinh khôi
Nở để tôi xa lạ
Giữa dòng đời xa xôi..!
Người đàn ông của tôi
Nào đâu tôi hiểu thấu
Bao mặt trái cuộc đời
Chưa một lần chạm đến
Ðể giờ tình chia phôi..!
Người đàn ông của tôi
Biết đời mình vướng mắc
Sao cứ giao ước lời
Ðể tim non rướm máu
Ðau thương cho kiếp người !
Người đàn ông của tôi
Quên rồi lời hẹn ước
Chim Phụng Hoàng liền đôi
Thác đồng quan đồng quách
Sống đồng tịch đồng thời...
Người đàn ông của tôi
Hãy trả tôi tuổi ngọc
Tuổi dại khờ ô môi
Bởi tình đầu vụng dại
Giờ tình xa...xa thôi..!!
(Tạ tội em)
Nguyễn Thế Hoàng
vdn st",người đàn ông của tôi,,Nguyễn Thế Hoàng,https://poem.tkaraoke.com/28642/.html,
,"Biển Đông mãi âm vang tiếng hát
Đảo Trường Sa tổ quốc thân yêu
Hoàng Sa… con nước thuỷ triều
Vẫn còn cao mặt chứng điều tang thương!
Tàu ỉ thế đưa quân xăm chiếm
Đảo Hoàng Sa vùng biển Việt Nam
Hận thù dân Việt khó quên
Hẹn ngày thu lại giang sơn vẹn toàn.
Nay thế yếu cam lòng nhẫn nhục
Máu căm hờn sôi sục tâm can
Quyết lòng bảo vệ non sông
Hẹn ngày diệt bọn xăm lăng bạo quyền.
Và loại cả cái phường bán nước
Cho nhân dân có dịp vùng lên
Đòi quyền toàn vẹn non sông
Nam Quan, Bản Giốc, Biển Đông đất trời.
Hỡi các bạn - những người yêu nước !
Hãy vùng lên cứu quốc phò nguy
Quân Tàu ta đuổi về Tàu
Cùng nhau vá lại bản đồ Việt Nam.
MỘC ĐINH NHÂN
(Chicago, ngày 23-2-2008)",biển đông vẫn âm ỉ,,MỘC ĐINH NHÂN,https://poem.tkaraoke.com/28643/.html,
,"Nửa ánh trăng xuân hoài vọng
Hạt tình rơi đọng hồn quê
Để cho Huế bớt não nề
Khăn tang khâm liệm trả về thiên thu
Núi Ngự âm u mây phủ
Cành thông ủ rũ buồn trao
Trăng nghiêng trải mảnh lụa đào
Trên thành phố Huế nghẹn ngào đau thương
Sóng nước sông Hương cô quạnh
Hôn vầng trăng lạnh bạc đầu
Thuyền yêu chở nặng tang dâu
Hồi chuông Thiên Mụ buông sầu trầm tư
Cố Huế bây chừ sót lại
Vầng trăng quằn quại xuân về
Vầng trăng khao khát tình quê
Vầng trăng thổn thức não nề khăn sô
Xương núi chôn mồ tập thể
Tang sầu từ thuở xuân nao
Trẻ thơ, thiếu phụ lệ trào
Nhấp nhô đất Huế, lao xao mây trời !
Vivi
Norway 01.3. 2008",trăng xuân hoài vọng,,Vivi,https://poem.tkaraoke.com/28644/.html,
,"Trong nỗi đau chợt lao xao hạnh phúc
Những đợi chờ bỗng mim mỉm cười duyên
Đáy mắt em hiện bóng những con thuyền
Đang lướt sóng lênh đênh theo dòng nước
Anh còn nhớ của những mùa thu trước
Lá vàng vui, mừng đón bước chân Anh
Sao bây giờ mây xám phủ trời xanh
Lá im lặng, nghe hồn đang thổn thức !!
Còn đâu nữa những ngày xưa nao nức
Thả hồn mình cho mặc gió cuốn trôi
Mắt tình đưa, tim rộn rả reo vui.
Quên đi hết những tháng ngày mong đợi .
Việt Dương Nhân
(Paris, đêm thu 27.10.2007)",những mùa thu trước,,Việt Dương Nhân,https://poem.tkaraoke.com/28645/.html,
,"Sót lại cành đào cố xứ
Cánh chim lữ thứ nhủ về
Quê hương mây bạc lê thê
Khung trời u uẩn tình quê lạc loài
Đất khách nắng cài tuyết vỡ
Nhà thờ nức nở chuông ngân
Tình yêu phong kín hồn xuân
Núi trôi sông lở người thân nhặt sầu
Năm tháng chất sâu tình lỡ
Thuyền yêu dang dở vô bờ
Sông Ngân vắng khách đợi chờ
Em ơi ! Lệ nhớ thẫn thờ duyên xưa
Trời Mẹ chiều mưa tang trắng
Xuân treo vạt nắng ngỡ ngàng
Não lòng Mẹ vá khăn tang
Cài lên hoang mộ da vàng bi ai !
Vivi
Norway 01. feb. 2008",xuân cài quê mẹ,,Vivi,https://poem.tkaraoke.com/28646/.html,
