Edited,Title,Genre,Author,URL
"MÙA THU .
Thu về mát dịu giọt Ngâu rơi
Thu gọi yêu thương hạnh phúc ngời
Thu thả vầng trăng in đáy nước
Thu đưa tiếng sáo vọng lưng trời
Thu vàng khóm Cúc êm câu hát
Thu biếc vườn Lan ấm nụ cười
Thu đẹp tuyệt vời như bức họa
Thu tràn nhựa sống khắp nơi nơi
10/8/2020 .NQH .
MÙA THU.
Thu đến mưa chiều lác đác rơi.
Thu sang nắng đẹp bóng xanh ngời.
Thu cho vạn vật bao điều ước.
Thu tặng cho đời cảnh đất trời.
Thu chết đi rồi bao kẻ khóc
Thu vàng lá rụng lắm người cười.
Thu thêm sức sống cho muôn vật.
Thu thả hồn thơ khắp mọi nợi.
VH.",mùa thu .,,Vũ Vệt Hùng,https://poem.tkaraoke.com/108222/.html
"BỂ RỘNG KHÔN BÌ ƠN NUÔI DƯỠNG
NÚI CAO KHÓ ĐỌ ĐỨC SINH THÀNH
(khoán thủ)
BỂ tình cha mẹ thấu trời xanh
RỘNG lớn bao la rõ trọn vành
KHÔN trẻ cầu mong ra trĩu quả
BÌ non ao ước tỏa tươi cành
ƠN luôn ghi tạc công rèn dũa
NUÔI mãi chăm lo việc học hành
DƯỠNG dục cho con nay đã lớn
NÚI CAO KHÓ ĐỌ ĐỨC SINH THÀNH
6-3-2018
Đỗ Xuân Đào
BỂ RỘNG KHÔN BÌ ƠN NUÔI DƯỠNG
NÚI CAO KHÓ ĐỌ ĐỨC SINH THÀNH
BỂ tình phụ mẫu tựa non xanh.
RỘNG Khắp muôn nơi phủ mọi vành.
KHÔN trẻ mong cầu cây lắm quá
BÌ non ao ước gốc nhiều cành.
ƠN người, hết sức tu và tập
NUÔI chí, ra công học với hành.
DƯỠNG đức dạy con điều lễ nghĩa.
NÚI CAO KHÓ ĐỌ SỨC SINH THÀNH.
Vũ Việt Hùng",bể rộng khôn bì ơn nuôi dưỡng,,Vũ Vệt Hùng,https://poem.tkaraoke.com/108223/.html
"MẬN ĐÀO ĐUA NỞ MUÔN NƠI ĐẸP
MẬU TUẤT THEO XUÂN ĐÃ ĐẾN NHÀ
(khoán thủ – bát vĩ đồng âm)
MẬN trắng tinh khôi quá tuyệt mà
ĐÀO hồng phơn phớt dáng kiêu sa
ĐUA cành nảy lộc tươi màu lá
NỞ đóa bung chồi thắm sắc hoa
MUÔN ánh đèn lồng lan mọi ngả
NƠI lời chúc tụng tỏa gần xa
ĐẸP quần áo mới bao trang nhã
MẬU TUẤT THEO XUÂN ĐÃ ĐẾN NHÀ
4-2-2018
Đỗ Xuân Đào
MẬN sắc thắm tươi đẹp mượt mà.
ĐÀO xinh tựa cá lặng chim sa.
ĐUA nhau ươm chồi xanh cành lá.
NỞ nhụy vươn mình trổ nụ hoa
MUÔN vạn người mua về mọi ngả.
NƠI đâu danh tiếng vẫn vang xa.
ĐẸP lòng vừa dạ không suồng sả.
MẬU TUẤT THEO XUÂN ĐÃ ĐẾN NHÀ.
Vũ Việt Hùng",mận đào đua nở muôn nơi đẹp (khoán thủ – bát vĩ đồng âm),,Vũ Việt Hùng,https://poem.tkaraoke.com/108224/.html
"TÁO VỀ CHẦU
(bát điệp)
Mỗi năm một lượt Táo về chầu
Trước mặt Ngọc Hoàng Táo thẳng tâu
Táo trách Nam Tào hay chọc quấy
Táo chê Bắc Đẩu vẫn gây sầu
Táo cười mặt đất không hoàn chỉnh
Táo mỉa trời mây lắm cảnh rầu
Táo được trần gian trao bản sớ
Táo cầu bình đẳng trọng làm đầu
31/1/2016
Đỗ Xuân Đào
TÁO CHẦU TRỜI.
Tháng chạp hai ba Táo phải chầu.
Thiên Đình Ngọc Đế Táo trình tâu.
Táo thưa kẻ xấu còn hay huậy.
Táo báo người ngay lại mãi sầu.
Táo hỏi sao đời nhiều rắc rối.
Táo mong nhân thế gắng đừng rầu.
Táo xin quan lớn luôn gương mẫu.
Táo muốn cầm cân xữ đứng đầu.
VH.2018",táo chầu trời. (táo về chầu (bát điệp)),,Vũ Việt Hùng,https://poem.tkaraoke.com/108225/.html
"HỎI MỘNG BAN ĐẦU CAO TỰA NÚI
SAO TÌNH PHÚT CUỐI BẠC NHƯ VÔI
(họa thơ Thiết Dương – bát vĩ đồng âm)
HỎI diều bay bổng cõi đơn côi
MỘNG mị xa xăm khắc khoải rồi
BAN tối chênh chao nghe sáo thổi
ĐẦU hôm khoan khoái ngắm mây trôi
CAO sơn lảng vảng màn sương khói
TỰA ngọc lô nhô những đỉnh đồi
NÚI biết lòng này không biến đổi
SAO TÌNH PHÚT CUỐI BẠC NHƯ VÔI.
2-2-2018
Đỗ Xuân Đào
HỎI MỘNG BAN ĐẦU CAO TỰA NÚI
SAO TÌNH PHÚT CUỐI BẠC NHƯ VÔI
(họa thơ Thiết Dương – bát vĩ đồng âm)
HỎI lòng do đâu lại mồ côi.
MỘNG đã tàn theo buổi ấy rối.
BAN sáng ngồi nhìn giòng nước chãy.
ĐẦU đêm đứng ngắm đám bèo trôi.
CAO xa ẩn hiện vầng mây khói.
TỰA cảnh sương rơi phủ dốc đồi.
NÚI thẳm rừng xanh nào dể đổi.
SAO TÌNH PHÚT CUỐI BẠC NHƯ VÔI.
VH.",sao tình phút cuối bạc như vôi (họa thơ thiết dương – bát vĩ đồng âm),,Vũ Vệt Hùng,https://poem.tkaraoke.com/108226/.html
"QUA LẠI THÂM GIAO TRỜI ĐẤT RỘNG
PHONG LƯU CỐT CÁCH VẸN TÌNH XUÂN
Tung hoành – độc vận “
QUA rồi cái lạnh đã nhường Xuân
LẠI thấy nôn nao đón rước xuân
THÂM thúy lời thơ chào đón tết
GIAO hòa câu đối chúc mừng Xuân
TRỜI xanh bát ngát vui ngày hội
ĐẤT thắm bao la sướng tiết Xuân
RỘNG bước cùng nhau ta với bạn
PHONG LƯU CỐT CÁCH VẸN TÌNH XUÂN
23-1-2018
Đỗ Xuân Đào
XUÂN TÌNH.
QUA hết năm rồi sẽ tới Xuân.
LẠI cần đông mãn đón mừng Xuân.
THÂM tình trao Ý mong chờ tết.
GIAO nghĩa gởi lời ước đợi Xuân .
TRỜI sáng mênh mông cùng mở hội..
ĐẤT dày dằng dặc góp vui Xuân.
RỘNG lòng nhịp bước tôi và bạn.
PHONG VŨ YÊN HÀN THẮM SẮC XUÂN
VH.",qua lại thâm giao trời đất rộng (xuân tình“họa thơ tung hoành – độc vận “),,Vũ Vệt Hùng,https://poem.tkaraoke.com/108227/.html
"MỜI RƯỢU
Tam xà, ngũ tửu đứng hàng đầu
Rắn ráo, hổ mang bắt tận Tầu
Toàn tính niêm phong ngâm thật kỹ
Thêm gừng lưu giữ ngấm càng sâu
Còng lưng nửa lít không cong vẹo
Mỏi gối vài li hết lượn cầu
Chữa đủ hàn phong ai có bệnh
Tới đây khoản đãi một đôi chầu
18-12-2017
Đỗ Xuân Đào
Y ĐỀ
Cách làm Xà Tửu loại hàng đầu.
Mang, Trâu, Chỉ,Ráo tậu từ Tầu.
Sấy khô từng khúc ngâm cho kỷ
Cho rượu, quế, gừng ngấm thật sâu.
Nữa tháng trở lên là hữu dụng.
Hằng ngày cơm tối đúng nhu cầu.
Bán thân bất toại  đều dùng  cả.
Chỉ cần  ráng uống  mươi chầu.
Vũ Việt Hùng",mời rượu,,Vũ Vệt Hùng,https://poem.tkaraoke.com/108228/.html
"RẮN ĐẦU BIẾNG HỌC
(tính danh)
Cách làm Xà Tửu loại hàng đầu.
Mang, Trâu, Chỉ,Ráo tậu từ Tầu.
Sấy khô từng khúc ngâm cho kỷ
Cho rượu, quế, gừng ngấm thật sâu.
Nữa tháng trở lên là hữu dụng.
Hằng ngày cơm tối đúng nhu cầu.
Bán thân bất toại  đều dùng  cả.
Chỉ cần  ráng uống  mươi chầu.
Vũ Việt Hùng
RẮN ĐẦU BIẾNG HỌC
(tính danh)
Liu điu bé xíu nhất trong nhà
Chửa rắn đầu, thành dễ được tha
Cứ sớm mai gầm vang tiếng mẹ
Để chiều hủ lửa vọng lời cha
Ráo khô chẳng thấy đau mồm miệng
Lằn tím không hề xót thịt da
Quyết trí canh này Trâu, Lỗ sẽ
Tạo thành uy lực hổ mang gia!
13-12-2017
Đỗ Xuân Đào",rắn đầu biếng học (tính danh),,Vũ Vệt Hùng,https://poem.tkaraoke.com/108229/.html
"RẮN ĐẦU BIẾNG HỌC
(tính danh)
Liu điu bé xíu nhất trong nhà
Chửa rắn đầu, thành dễ được tha
Cứ sớm mai gầm vang tiếng mẹ
Để chiều hủ lửa vọng lời cha
Ráo khô chẳng thấy đau mồm miệng
Lằn tím không hề xót thịt da
Quyết trí canh này Trâu, Lỗ sẽ
Tạo thành uy lực hổ mang gia!
13-12-2017
Đỗ Xuân Đào
Y ĐỀ
Cậu út liu điu nhỏ nhất nhà.
Rắn đầu nhác học dể gì tha.
Mai gầm khờ khạo buồn lòng mẹ.
Hổ lửa ngu ngơ khổ bụng cha.
Chú Ráo ngông nghênh đày sướt trán .
Cô lằn xấc láo phạt trầy da.
Hai anh Trâu- Lỗ thời chăm học.
Để khỏi hổ mang tiếng thế gia.
VH.",rắn biếng học (tính danh),,Vũ Vệt Hùng,https://poem.tkaraoke.com/108230/.html
"THƯƠNG NHỚ MỘT NGƯỜI.
(thể lộc lộc lư - xa luân ngũ bộ)
I
HÌNH NGƯỜI TRÊN MẠNG MỎI MÒN TRÔNG
Khuôn mặt trái xoan má thắm hồng
Căng mọng bờ môi xao xuyến dạ
Long lanh ánh mắt đắm say lòng
Đăng bài mời họa rồi ngồi đợi
Viết khúc liên ngâm lại đứng mong
Tôi xướng bài thơ tình ướm hỏi
Nàng đưa bài đáp vẫn chưa chồng.
II
Khuôn mặt trái xoan má thắm hồng
HÌNH NGƯỜI TRÊN MẠNG MỎI MÒN TRÔNG
Lướt nhanh trang oép cho yên dạ
Đọc kỹ i mêu để vững lòng
Một buổi đi xa xao xuyến nhớ
Vài hôm cách biệt dạt dào mong
Lưu li vạn dặm tình bè bạn
Mong được nên duyên để lấy chồng
III
Long lanh ánh mắt đắm say lòng
Thi sĩ mơ màng thỏa sức mong
Ảnh ấy ngoài đời thơ thẩn ngóng
HÌNH NGƯỜI TRÊN MẠNG MỎI MÒN TRÔNG
Ước ao sánh bước chàng cùng vợ
Khao khát song đôi thiếp với chồng
Từ ảo ra đời xây hạnh phúc
Tình yêu đôi lứa được tươi hồng
IV
Viết khúc liên ngâm lại đứng mong
Có ai yêu đến để theo chồng
Cây đời tươi tốt rồi xanh biếc
Quả ngọt xum xuê sẽ đỏ hồng
Cảnh tượng trong mơ thao thức ngắm
HÌNH NGƯỜI TRÊN MẠNG MỎI MÒN TRÔNG
Mơ màng mộng đẹp càng bền chí
Bầu rượu túi thơ quyết tỏ lòng
V
Nàng đưa bài đáp vẫn chưa chồng.
Ý đã mời tôi buộc chỉ hồng
Bờ lốc* đưa đường vui gặp mặt
Pha ce** dẫn lối thỏa ưng lòng
Đến nay gắn bó kìa đang đợi
Từ ấy keo sơn nọ đã mong
Bao giờ cõi ảo thành sự thật
HÌNH NGƯỜI TRÊN MẠNG MỎI MÒN TRÔNG
24/7/2016
Bài họa của VH.
I/
MẾN NHỚ MỘT NGƯỜI MÃI NGÓNG TRÔNG
Làn môi chín mọng má ươm hồng.
Nụ cười hiền dịu nghe yên dạ.
Tiếng nói thanh tao thấy mát lòng.
Mấy lượt sang thăm còn phải đợi.
Bao lần đến gặp lại chờ mong.
Dịp may liền hỏi về duyên phận
Em trả lời tôi vẫn chửa chồng.
II/
Làn môi chín mọng má ươm hồng.
MẾN NHỚ MỘT NGƯỜI MÃI NGÓNG TRÔNG.
Vóc dang thướt tha nhìn mát dạ
Nết na thùy mị thấy yên lòng.
Nhiều khi muốn gặp nhưng mà đợi.
Lắm lúc ghé thăm phải ngó mong.
Xin hỏi xuân xanh đà mấy buổi
Tuổi em mười tám vẫn chưa chồng.
III/
Đôi mắt u buồn đến não lòng.
Vì ai em lại phải chờ mong.
Yêu thương ai dó nên thường đợi
MẾN NHỚ MỘT NGƯỜI MÃI NGÓNG TRÔNG.
Chẳng phải tròn duyên sao gọi vợ,
Không là chung phận lẽ nào chồng.
Xuân xanh mới lớn còn tươi sắc.
Em cứ mà vui đẹp má hồng.
IV/
Chiều buồn lặng lẽ em dang mong.
Chẵng biết khi mô sẽ lấy chồng.
Giọt lệ long lanh trên mắt biếc.
Phấn son nhòa nhạt dưới môi hồng.
Thương yêu kẻ ấy mà luôn đợi.
MẾN NHỚ MỘT NGƯỜI MÃI NGÓNG TRÔNG.
Nguyện ước cho tình luôn vẫn đẹp.
Vòng tay nồng ấm đến say lòng.
V/.
Em cũng như xưa vẫn chửa chồng.
Chờ người kết mối dệt tơ hồng.
Mong sao duyên thắm mau an dạ.
Ước muốn tình nồng sớm đẹp lòng.
Quân tử người ơi xin chớ đợi
Quần thoa em được thỏa chờ mong.
Hẹn ngày hội ngộ tròn mộng tưởng.
MẾN NHỚ MỘT NGƯỜI MÃI NGÓNG TRÔNG
VH",thương nhớ một người. (thể lộc lư xa luân ngũ bộ),,Vũ Vệt Hùng,https://poem.tkaraoke.com/108231/.html
"CŨNG NGẨN NGƠ
(mỹ lục thanh)
Gửi bạn xa gần những áng thơ
Sẻ chia vạn nỗi sướng vô bờ
Mỹ thanh thử sức còn đang mộng
Ngũ độ đua đòi chửa hết mơ
Gọt rũa xuôi vần thêm óng ả
Lược tô bóng chữ khỏi lu mờ
Quý nhau nặng nghĩa giàu tâm tưởng
Tuyệt quá đôi lần cũng ngẩn ngơ
2-12-2017
Đỗ Xuân Đào
ĐỪNG LÀM NGƠ.
Thương em tôi dệt mấy vần thơ.
Lòng mãi nhớ ai chả bến bờ.
Tối đến xem chừng luôn cứ mộng
Ngày qua những tưởng lại đang mơ.
Hoài mong duyên kiếp không phai nhạt.
Ước muốn tình ta chẳng mịt mờ.
Hy vọng mai nầy mình hội ngộ
Xin đừng ngoãnh mặt cả làm ngơ.
Vũ Việt Hùng",cũng ngẩn ngơ (mỹ lục thanh) (đừng làm ngơ),,Vũ Việt Hùng,https://poem.tkaraoke.com/108232/.html
"TRE, NỨA, TRÚC, MAI, VẦU
(bát vận đồng âm)
Dòng giống vầu tre đúng chửa nào?
Vươn dài cho tới hết tầm cao
Ngọn mềm dai dẳng qua giông bão
Gốc cứng hiên ngang vững lũy rào
Ngon tuyệt, măng tay mà đảo sáo
Ngọt thay, mầm củ để hầm sào
Cành trên già để đan sàng gạo
Nhành dưới non dùng buộc miệng bao
15-9-2017
Đỗ Xuân Đào
Y DỀ
Trúc tre dáng thẳng đúng chưa nào..
Mọc khắp đồng bằng đến rẻo cao.
Thân cứng kiên cường qua gió bão.
Lá mềm vững chải vượt mưa rào.
Nhiều người rất thích đem làm sáo.
Lắm kẻ ưa dùng lấy dụng sào.
Quân tử ví von là phải đạo.
Sâu tình , nặng nghĩa có là bao.
VH.","tre, nứa, trúc, mai, vầu (bát vận đồng âm)",,Vũ Vệt Hùng,https://poem.tkaraoke.com/108233/.html
"THƠ THẨN
Thơ thẩn trong tôi nặng nỗi sầu
Bao niềm u uất đổ về đâu
Sướng vui bảy chục xuân chưa thấu
Nỗi khổ dăm ba tuổi đã ngầu
Nét bút cương trường như mã tấu
Vần thơ mềm mại tựa đàn bầu
Vậy mà số kiếp đời ruồi bậu
Mọt sách xưa nay chẳng đứa giầu
8-9-2017
Đỗ Xuân Đào
Y ĐỀ.
Nhìn trông thế sự cứ vương sầu.
Cuộc sống con người sẽ đến đâu.
Bóng xế chiều tàn đời chửa thấu.
Canh dài khắc vắn kiếp thêm ngầu.
Buồn vui nặng nợ thân thơ túi.
Sướng khổ mang thêm phận rượu bầu.
Ngiêng bút mãi theo càng tụt hậu.
Văn chương tự cổ mấy ai giầu.
Vũ Việt Hùng",thơ thẩn,,Vũ Vệt Hùng,https://poem.tkaraoke.com/108234/.html
"THƠ THẨN 2
Canh Dần sáu tám tuổi luôn sầu
Gánh dẫu mòn vai chẳng ích đâu
Vùi dập chông gai xương đủ ngấu
Dày vò sương tuyết thịt thêm ngầu
Khó làm thì bá vai “mình, cậu”
Dễ nhắm là quên mặt bạn bầu
Khối đứa trên đời đầu củ đậu
Số hên nên nó vẫn thành giàu
15-9-2017
Đỗ Xuân Đào
SỐ PHẬN CANH DẦN.
Sáu tám mùa thu cứ mãi sầu.
Canh Dần mạng Mộc chả vui đâu.
Rừng hoang bương chải đầu đen ngấu.
Núi thẳm xuống lên mắt đỏ ngầu.
Huynh đệ bà con thua tớ, cậu.
Anh em dòng họ kém ""mình bầu'
Cả đời thi thố đều không đậu.
Số phận trời ban chẳng thể giàu.
VH.",thơ thẩn 2,,Vũ Vệt Hùng,https://poem.tkaraoke.com/108235/.html
"MỜI GIAO LƯU
Cùng nhau xướng họa những vần thơ
Thấp thỏm mừng vui lẫn đợi chờ
Chọn ý buông vần không ảo mộng
Tìm lời thả luật chẳng hồ mơ
Chim trời rong ruổi ta sao hiểu
Cá biển tung tăng bạn vẫn ngờ
Cùng cảm mến nhau thì hội tụ
Giao lưu học hỏi nỡ nào ngơ
5/8/2014
Đỗ Xuân Đào
MỐI DUYÊN THƠ.
Bạn hữu giao lưu dệt ý thơ..
Vui buồn chia sẻ cả mong chờ.
Gieo vần nhả chữ xây hồn mộng.
Thả vận buông câu dựng cõi mơ.
Nghĩa thắm đậm đà nào thể hiểu.
Tình nồng tha thiết dể đâu ngờ.
Tri âm ái mộ lòng thương mến.
Cảm xúc dâng tràn dạ ngẫn ngơ.
VH.11/08/2017.",mối duyên thơ (.mời giao lưu),,Vũ Vệt Hùng,https://poem.tkaraoke.com/108236/.html
"SUM VẦY
(bát láy – lộn ngược – song đồng)
Cây rừng bát ngát biếc rừng cây
Đầy đủ lá hoa quả đủ đầy
Dậy ước tơ duyên ao ước dậy
Say mê hạnh phúc mải mê say
Ấy nơi hò hẹn xưa nơi ấy
Đây chốn tâm tình mới chốn đây
Vậy đẹp uyên ương ôi đẹp vậy
Vầy như khao khát được như vầy
25/3/2017
Đỗ xuân Đào
Y ĐỀ.
Cây cỏ xanh màu đẹp cỏ cây.
Đầy thêm tinh khì cảnh thêm đầy.
Dây mơ tình thắm mong mơ dậy.
Say đắm duyên nồng ước đắm say.
Ấy chốn hẹn thề kia chốn ấy.
Đây nơi gặp gở ở nơi đây.
Vậy là cảm mến yêu là vậy.
Vầy phải tình anh, em phải vầy.
VH.",sum vầy (bát láy – lộn ngược – song đồng),,Vũ Vệt Hùng,https://poem.tkaraoke.com/108237/.html
"VIẾNG THĂM BLOG CŨ
Anh vẫn thường xuyên thăm nơi blog cũ
Tìm cây đàn Vĩ Cầm Trắng xa xưa
Tìm lại bài thơ đoản khúc đêm mưa
Lá thu vàng bay, êm đềm óng ả
Người đi đâu để vườn hoang cỏ lá
Vắng tiếng đàn cùng tiếng hát thân quen
Nhà im lìm không thắp sáng ánh đèn
Nhớ nhung lắm tiếng tơ lòng da diết
Gọi tên em – anh gọi em gọi miết?
Em nơi đâu mà nhà cũ đã quên?
Nhớ không em bao kỷ niệm êm đềm
Hừng hực trào dâng như đang bùng cháy
Yahoo xưa thật đáng yêu như vậy
Luôn bồi hồi canh cánh ở nơi tim
Nói đi em đừng thin thít lặng im
Để kỉ niệm xưa trôi đi xa lắc
Đừng vứt đi như đồ chơi, chiếc xắc
Anh nâng niu từ thưở đó tới nay
Tình trong ảo cũng đằm thắm tràn đầy
Blog em là nơi anh nhớ nhất
Xuân Đào 26-4-2017
ANH HÃY VỀ CÙNG XÓM LÁ.
Bạn bè đợi anh về thăm lối cũ.
Xóm lá thân thương, bằng hữu ngày xưa,
Chắt lọc câu thơ ngày nắng đêm mưa.
Tình tri kỷ theo giòng đời êm ả.
Anh về nhé, cùng bà con xóm lá.
Viết câu thơ thắm tình nghĩa thân quen.
Thắp sáng đêm đen bằng những ngọn đèn.
Vui sum họp vơi nỗi buồn da diết.
Anh biền biệt thời gian trôi mãi miết.
Chốn quê nhà bè bạn có nào quên.
Kỹ niệm xưa còn đó rất êm đềm.
Chờ đốt lửa cho tim lòng rực cháy.
Bờ LOG VIỆT thân yêu là như vậy.
Lý do nào mà anh lại lặng im.
Ở nơi nầy còn cả ngàn con tim.
Đang khắc khoải chờ người đi xa lắc,
Bạn bè mến thương cảm tình sâu sắc.
Đợi anh về thắt chặt nghĩa từ nay.
Vui bên nhau hạnh phúc thật đong đầy.
Thỏa mơ ước với nỗi lòng sâu kín nhất.
VH.",viếng thăm blog cũ,,Vũ Vệt Hùng,https://poem.tkaraoke.com/108238/.html
"TÙY DUYÊN
(họa thơ Xuân Phương - Xuan Phuong Tran)
Blog ngày xưa bạn rất nhiều
Ngày nay chốn ấy vắng bao nhiêu
Nhớ nhung spot tìm bè bạn
Quyến luyến yahoo gặp mọi điều
Đông đúc làng phây ôi thích thú
Im lìm xóm lá thật cô liêu
Tùy duyên nên nghĩa như đời thực
Em nhé cùng anh sớm đến chiều!
Xuân Đà30-4-2017
o
TÙY NGƯỜI.
Vào phây đúng thật bạn thì nhiều.
Tình nghĩa đậm đà chả bấy nhiêu.
Phúc đáp vài từ sao hết ý.
Bấm like một cái được bao diều.
Làng Fay náo nhiệt lòng không thích.
Xóm lá im lìm dạ lại yêu.
Để có bài đăng cần nghĩ kỷ.
Tùy người đăng nhấp sáng hay chiều.
VH",tùy duyên (họa thơ xuân phương - xuan phuong tran) (tùy người.),,Vũ Vệt Hùng,https://poem.tkaraoke.com/108239/.html
"Thơ Cầu Hôn
Tháng bảy hôm nay mười chín
Có phải ngày lành để tính giăng tơ
Bỏ đi kiếp sống bơ vơ
Vần thơ gieo xuống cầu hôn với nàng.
Vàng trong nắng hạ mơ màng
Hỏi người con gái duyên thề hay chưa
Nếu chưa thì để anh đưa
Đi may áo cưới hè trưa em về.
Ngày xưa em để tóc thề
Áo em trắng tuyết bên thềm tường vi
Cầm tay hôn vội lướt mi
Em ngồi hong tóc hồng son trái đào.
Hoa đào e ấp khát khao
Cái răng em khểnh đêm nao anh chờ
Chờ em trăng tỏ trăng mờ
Mười thương anh được em cười xuyến xao.
Đồi thông lộng gió lao xao
Mấy tầng mây trắng bay cao trên trời
Xin trời phù hộ cho con
Kết duyên lấy được eo nàng lưng thon.
Ông tơ bà nguyệt tô son
Làm ơn đi nhé chỉ hồng xe duyên
Thuyền tình nhộn nhịp hoa viên
Kiệu hoa đến rước cõi tiên bước vào .
Thiên thai dồn dập tuôn trào
Sóng tình thức dậy men nồng rực say
Ngất ngây ghì chặt chân mây
Khăn san đỏ thắm đào tiên trắng ngần .
Triệu Nguyên Tâm
Blue Mountain, California
July 19, 2020 .",thơ cầu hôn,,Triệu Nguyên Tâm,https://poem.tkaraoke.com/108240/.html
"CHƠI CỜ
(tập danh, nhị bát điệp, bát vĩ i)
Thiếp, chàng rỗi rãi đấu CỜ chơi
Khiển TƯỚNG thiếp, chàng sướng quá trời
Thiếp muốn trêu chàng bèn ghểnh SĨ
Chàng thèm ghẹo thiếp lại lùa VOI
PHÁO lồng thiếp với chàng mê mải
XE lệch chàng cùng thiếp nổi trôi
Nhảy MÃ thiếp chàng đang hứng khởi
Thiếp chàng để TỐT nhập cung rồi
XUÂN ĐÀO1/5/2016
Y DỀ.
Chàng thiếp bày CỜ mở cuộc chơi.
Điều binh khiển TƯỚNG tiếng vang tròi.
Chàng ưa giỡn thiếp liền lùa SĨ.
Thiếp thích đùa chàng cố bắt VOI..
PHÁO tiến thiếp thua chàng sướng mãi
XE lùi chàng thắng thiếp buông trôi.
Sang sông TỐT DÍ chàng mong đợi.
Cung nhập MÃ XÔNG thiếp đạt rồi.
Vũ Việt Hùng","chơi cờ (tập danh, nhị bát điệp, bát vĩ i)",,Vũ Vệt Hùng,https://poem.tkaraoke.com/108241/.html
"LƯU BÚT ĐƯỜNG THI
Gặp gỡ tao nhân xướng họa thi
Mừng vui khôn xiết ước mong gì
Nâng ly rượu ngọt nào thanh nhã
Đón chén trà ngon hỡi dũng nhi
Ý đẹp trao đi tươi mỹ mãn
Lời hay gửi đến đẹp vân vi
Bạn bè bốn biển cùng lưu bút
Tình nghĩa thiêng liêng chẳng có kì
19/6/2016
Đỗ Xuân Đào
TÌNH BẠN ĐƯỜNG THI.
Bên nhau xướng họa những vần thi.
Bạn hữu ta ơi sẽ nghĩ gì.
Rượu quý vài ly nào cùng uống.
Trà thơm một chén hãy nhâm nhi.
Trao lời gởi ý đừng bi lụy.
Thã chữ buông câu chớ tự ti.
Kết nghĩa giao lưu tình thắm thiết.
Chia tay bịn rịn buổi phân kỳ.
VH.",tình bạn đường thi. (lưu bút đường thi),,Vũ Vệt Hùng,https://poem.tkaraoke.com/108242/.html
"Ba chạc
(thủ vĩ ngâm)
Gốc cây ra chạc khéo mơ màng
Thật giống ngã ba bộ hạ nàng
Ảnh chụp vô tình làm ngượng thiếp
Hình ghi hữu ý khiến mê chàng
Thiên nhiên ôm ấp công trình ngọc
Tạo hóa nâng niu sản phẩm vàng
Ngắm nghía say sưa như giấc mộng
Gốc cây ra chạc khéo mơ màng
Đổ Xuân Đào15/6/2016
Y ĐỀ
Chẳng biết do đâu giống của nàng.
Làm cho thiên hạ phải hoang mang.
Xem qua đã thấy buồn lòng thiếp.
Ngắm kỳ càng thêm khổ dạ chàng.
Xấu hổ vô cùng cho dáng ngọc.
Ê chề biết mấy với thân vàng.
Thiên nhiên biến hóa gây nên chuyện.
Chẳng biết do đâu giống của nàng.
VH.",ba chạc (thủ vĩ ngâm),,Vũ Vệt Hùng,https://poem.tkaraoke.com/108243/.html
"Hồn Lang Trở Về Âm Giới (9)
Tuyến, Nhân ơi! Cha sắp về âm cảnh
Kể từ nay vĩnh biệt các con rồi
Từng khoảnh khắc thời gian tình sâu nặng
Sẽ gom tròn, khuất tận nẻo xa xôi!
Không còn nữa ngày tháng của yêu thương
Được ấp ủ giữa màn sương lạnh lẽo
Dưới canh khuya vung chèo tìm cửa lớn
Trên phong cuồng lởn vởn mãi lần theo
Còn đâu nữa hình ảnh của năm xưa
Sợ canh đêm gió lùa con trở giấc
Nối chiếc giường hẹp chật rộng thêm ra
Trẻ thơ giữa, mẹ cha hai bìa gác
Đâu những chiều cha con mình ngồi đó
Cùng quay quần theo gió thoảng ru êm
Cha cảm xúc lặng yên, nhìn sáng tỏ
Say sưa ca, mà rỏ máu về tim!
Cha vẫn nhớ trưa nọ với thằng Nhân
Giỡn bắt trốn, con đâm đầu va chậu
Nhìn trán vỡ cha đau lòng ngút tận
Nghe nỗi niềm ân hận mãi về sau
Còn con Tuyến, cha bồng ở trên tay
Đường phố chợ không dài hơn thân nhỏ
Con ngắm nhìn đây đó ngất ngây say
Vui bao nhiêu cha đây đầy lộng gió…
Bóng thời gian, hai con nuôi dưỡng chí
Dẫu cảnh nhà, âm ỉ vẫn ngầm loang
Đợi một ngày nước tràn ra sông bể
Nâng thuyền ta vượt xế để tìm trăng!...
Hồn ma thổn thức….
15/7/2016
Nguyễn Thành Sáng",hồn lang trở về âm giới (9)..,,Nguyễn Thành Sáng,https://poem.tkaraoke.com/108244/.html
"Hồn Lang Trở Về Âm Giới (10)
“Hồn ma vẫn lưu luyến,
Thổn thức với hai con”
Cha ra đi, thấy lòng đầy thanh thản
Bởi tâm hồn rực sáng chẳng hề lu
Dẫu chuỗi sống ngàn thu ôm biển hận
Chính khí nầy vút tận vẫn chu du!
nhatlang.com",hồn lang trở về âm giới (10)..,,Nguyễn Thành Sáng,https://poem.tkaraoke.com/108245/.html
"Hạ đốt mùa thương rát bỏng rồi
Cành hồng quên thắm hững hờ trôi
Đường loang bóng ngã mờ phai dấu
Lối dẫm sương gầy nhạt tiếng môi.
Nhụy rửa gieo mình nơi phố cũ
Hoa tàn lặng chết bến sông côi
Đường xa vạn nẻo xin đừng nhớ
Hạ đốt mùa thương rát bỏng rồi.
Mì Ngố
20/07/2020",hạ vắng,,Mì Ngố,https://poem.tkaraoke.com/108246/.html
