Edited,Title,Genre,Author,URL
"HẠNH PHÚC
Hạnh phúc bên người yêu dấu
Ơn em anh nợ muôn đời
Ngày tháng chập chùng nhiên hậu
Mặt trời lấp lánh ngàn khơi
Hạnh phúc lung linh tuyệt vời
Bao la biển trời sóng sánh
Em là giấc mơ vời vợi
Ngọt ngào ngơ ngẩn long lanh
Hạnh phúc miên man chân thành
Thiết tha thẹn thùng xao xuyến
Buồm căng đại dương đức hạnh
Dạt dào da diết uyên nguyên
Hạnh phúc thiêng liêng mộng huyền
Xôn xao xạc xào huyền ảo
Tình yêu nhiệm mầu ước nguyện
Lạ lùng lóng lánh chiêm bao
Trần Minh Hiền Orlando ngày 30 tháng 8 năm 2019
HOPE
We are painting our soul the color of hope
To entertain ourselves in the realm of horoscope
You are the angel of the paradise of telescope
I am the soldier of the universe of microscope
Trần Minh Hiền Orlando August 30, 2019",hạnh phúc 08302020,,Trần Minh Hiền,https://poem.tkaraoke.com/109116/.html
"Ta rời nẻo cũ mộng tình nhân
Cái thuở nồng say bỗng nhạt dần
Lối ngược nên mình côi một bóng
Duyên hờ bởi nghĩa quạnh đường ân
Đành thôi giã biệt thời in dấu
Chấp nhận từ ly số bạc phần
Kỷ niệm ngày xưa thầm giữ khẽ
Mơ về cuộc sống nhẹ nhàng thân.
30/8/2020",mộng tình nhân,,YÊU THOÁNG QUA,https://poem.tkaraoke.com/109117/.html
"Đêm Sông Công
Đêm xuống sông Công sóng chập trùng,
Khói sương lạnh lẽo tỏa mông lung!
Vẳng nghe bìm bịp bên bờ nước
Tha thiết gọi con giữa mịt mùng!
Lạc bước tha hương nơi dặm khách,
Trăng non hờ hững thả không trung
Giữa dòng một bóng người đơn độc!
Chưa hết âu sầu, lại nhớ nhung.
HV 8/2020 (sông Công – Thái Nguyên)",đêm sông công,,HẠO VŨ,https://poem.tkaraoke.com/109118/.html
"Tháng Mười Suối Yến
**
Tháng mười hoa Súng nở
Suối Yến đẹp như mơ
Chòng chành trên sóng nước
Thuyền nan rẽ sương mờ
Hai bên rừng hoang vắng
Tiếng chim hót líu lo
Lãng khách thời mê mẩn
Đắm chìm vào biển thơ
HV (Hương Sơn 2020)",tháng mười suối yến,,HẠO VŨ,https://poem.tkaraoke.com/109119/.html
"Trăng Sáng
Đêm rừng hoang trăng sáng
Chiếu dọi khắp nhân gian
Chị Hằng cùng thỏ ngọc
Có ngắm nhìn hay chăng?
Có thấy người thi sĩ?
Cô đơn với vĩnh hằng?
Ngồi như muôn đêm cũ
Ngẩng đầu ngóng thở than.
HV",trăng sáng,,HẠO VŨ,https://poem.tkaraoke.com/109120/.html
"Thu Vọng 2
Gió thổi hoa lay cánh úa tàn
Sang thu lá đỏ rụng miên man!
Ngày dài mượn rượu tan sầu khổ!
Cạn chén chẳng say mới phũ phàng.
HV 8/2020",thu vọng 2,,HẠO VŨ,https://poem.tkaraoke.com/109121/.html
"Một Thằng Say
Nửa đĩa cà dưa, bát ớt đầy
Lưng chai rượu đế, một thằng say
Đôi ba cái chuyện vui, sầu, hận!
Thấu hết đắng cay nửa kiếp này.
HV",một thằng say,,HẠO VŨ,https://poem.tkaraoke.com/109122/.html
"Ham Nên Tội
Lo lắng quanh năm chuyện áo cơm
Thân nghèo rách nát, ốm lom nhom!
Vẫn còn thơ thẩn, ham du ngoạn
Phụ mẹ, phụ cha, phụ cả em.
HV",ham nên tội,,HẠO VŨ,https://poem.tkaraoke.com/109123/.html
"Sang Chơi Anh Họ Bên Chợ Cá Yên Sở
Chợ Cá chưa đi đã thấy tanh
Sáng ra lỗ nhĩ chẳng yên lành!
Khéo sao phòng trọ ngay bên cạnh?
Ham rẻ nên đừng đổ lỗi anh.
HV (Yên Sở 8/2020)",sang chơi anh họ bên chợ cá yên sở,,HẠO VŨ,https://poem.tkaraoke.com/109124/.html
"Thơ Tiễn Nguyên Tiên Về Nam
Tiễn bạn về nam giữa hạ tàn
Rừng thu vàng lá sắp tràn lan!
Người về mây rủ buồn ly khách
Ở lại còn ta với gió ngàn.
HV (8/2020)",thơ tiễn nguyên tiên về nam,,HẠO VŨ,https://poem.tkaraoke.com/109125/.html
"Hẹn Gặp Nhé Đắk Bla
Đắk Bla cuộn chảy ngược về tây,
Thác đổ đèo cao, suối nước đầy
Hẹn nhé Kon Tum ngày gặp lại!
Sê san sông mẹ, nhớ vườn cây.
HV, 6/2020",hẹn gặp nhé đắk bla,,HẠO VŨ,https://poem.tkaraoke.com/109126/.html
"Độc Lộ Hành
Nâng chén sầu đắng cay đủ vị,
Nhân gian buồn nhất buổi chia ly.
Hát Giang trăng sáng lạ kỳ,
Long lanh sóng nước người đi xuôi dòng.
Sương se lạnh, đêm dài trơ bóng,
Chén cuối cùng xuống họng chẳng xuôi.
Xa xăm một dải núi đồi,
Trông lên sao sáng, mơ bơi ngân hà.
Có những lúc vui cười hỉ hả,
Ngoài mặt vui, trong dạ buồn thênh!
Đường xa muôn lối gập ghềnh,
Liên Sơn cao ngất, mấy lần ghé thăm.
Đá lởm chởm, thung sâu vực thẳm,
Lối quanh co lưng chạm mây mù.
Chim kêu, suối chảy như du,
Nằm trên đệm đá, gật gù ca thi.
Hai hớp rượu, lấy thêm dũng khí,
Bước về xa thỏa chí tung hoành.
Trời cao, nước biếc, mây xanh,
Rừng hoang vắng vẻ, độc hành xênh ca.
Ăn rau dại, làm lều bằng lá,
Săn thú rừng, xứ lạ dọc ngang.
Đất trời làm chiếu làm màn,
Trời nam đất bắc, chẳng màng thế nhân.
HV (Sông Đáy 8/2020)",độc lộ hành,,HẠO VŨ,https://poem.tkaraoke.com/109127/.html
"HOA ĐIỂM MƯỜI
Thân tặng : D.N.T ( Lớp 12C7 , Trường THPT Chu Văn An , An Giang ).
Điểm mười môn Văn về ghé
Đậu kín trang giấy âm thầm
Mát mẻ như làn gió nhẹ
Cung đàn trầm bổng thanh âm
Điểm mười môn Văn bừng nở
Đóa hoa hạnh phúc vỡ òa
Ngòi bút tuôn trào muôn thuở
Ngôn từ lạ lẫm lăn qua
Điểm mười môn Văn gói ghém
Lời lẽ ngọt ngào mê say
Mùa xuân mơn ru cánh én
Lập luận muôn câu ngắn , dài
Điểm mười môn Văn vun vén
Đất nước đẹp như bức tranh
Người người buông câu hò hẹn
Êm đềm một góc trời xanh
Điểm mười môn Văn lấp lửng
Nguồn vui chạy nhảy dòng đời
Cho em muôn vàn cảm hứng
Mạch nguồn suối mát ai khơi?
Điểm mười môn Văn sâu lắng
Cội nguồn gốc rễ là đây?
Nghiêng vai gánh mùa mưa nắng
Hạnh phúc mở trang tràn đầy
Ngày 30/8/2020
Thiên Ân ( Bình Dương)",hoa điểm mười,,Thiên Ân,https://poem.tkaraoke.com/109128/.html
"VỀ CHỐN XƯA
Về chốn xưa người đà xa vắng
Cọng cỏ gầy thầm lặng héo khô
Thời gian màu tóc đẩy xô
Lối mòn qua lại đắp mô nỗi buồn
Về chốn xưa chuồn chuồn trốn mất
Gom tháng ngày chật vật bay đi
Rong rêu ủ rũ bờ mi
Vùi chôn giấc điệp xuân thì bao năm
Về chốn xưa thoáng âm thanh vỡ
Hoàng hôn rơi muôn thuở trở chiều
Nhú mầm mấy nhánh thương yêu
Đọt sầu dĩ vãng ít nhiều đau thương
Về chốn xưa biết nương ai đấy?
Những bọt bèo thức dậy được chăng ?
"" Hòn đất không biết nói năng ""
Áo người năm cũ vết nhăn mỏi mòn
Về chốn xưa dỗi hờn oán trách
Lạ lẫm đời ọc ạch ruột gan
Mùa thu tan tác dung nhan
Thương mùa chim én sang ngang lưng trời
Về chốn xưa dấu hời hợt rụng
Chuyện mai sau trào phúng ngẫm cười
Ai còn mua bán nguồn vui
Ai còn ngụp lặn bùi ngùi hỡi ai?
Ngày 12/8/2020
Thiên Ân ( Bình Dương)",về chốn xưa,,Thiên Ân,https://poem.tkaraoke.com/109129/.html
"Truyện Thơ: Tam Vĩ Hồ – Tập 43
Không một chữ khiến Ta thấp thỏm
Sáng trưa chiều lọm khọm dò la
Nhánh sông, đồng ruộng, bến phà
Bặt tin tiểu tử để Già lo âu”
Nàng phủ phục gối đầu chân Mẹ
Khúc vân vi mọi lẽ kính trình
“Quyết lòng khăn gói đến kinh
Dộng lên tiếng trống bất bình án oan
Ghét quan lại, chẳng toàn đạo lý
Tham nhũng ngân hoán vị luân thường
Bụi trần lấn loát kỷ cương
Suy đồi đức hạnh, khoét tường thanh liêm
Đố màng tới, nỗi niềm, tìm hiểu
Thủ tiêu thư, bịt khiếu nại lời
Hưởng trục lợi, thú ăn chơi
Mặc tình ai oán, phó đời than van
Đang hậm hực gặp làn lốc xoáy
Cuốn cuộn Chàng ngọ ngoạy bên trong
Chừng ngơ ngác, bị hút vòng
Thì ra hữu phận ruổi rong tơ hồng”
Nghe con trẻ cất công luyến láy
Giọng bổng trầm phím khảy say mê
Như mưa trút ngọn dầm dề
Đất đai mầu mỡ sơn khê xanh rờn
Dường sâu thẳm dậy cơn canh cánh
Nhóc trưởng thành tức hạnh phúc lung
Nhưng sao cõi dạ bập bùng
Biết đâu xán lạn, ý trung nhân mà!…
August 24, 2020
Tam Muội",truyện thơ: tam vĩ hồ – tập 43,,TamMuội,https://poem.tkaraoke.com/109130/.html
"Truyện Thơ: Tam Vĩ Hồ – Tập 44
Có hệ lụy bôn ba thao tác
Có thăng trầm, mây bạc, gió sương
Có thân dấn chốn đoạn trường
Có sầu khoé ngọc, tổn thương vóc ngà
Khi rời tổ quan hà muôn dặm
Liệu gót nào khỏi giẵm chông gai
Ấm no trướng phủ trang đài
Hay tủi miệt mài trống trải phòng loan
Ai bảo bọc chu toàn cuộc sống
Ai đắp chăn ướp mộng vuông tròn
Ai tình vẹn nghĩa sắt son
Ai chia sẻ những tấm đòn gian truân?
Nhớ năm ấy hạ tuần âm lịch
Bậc thang vàng kỳ tích nhà nông
Mùi hương ngan ngát ruộng đồng
Nhặt khoan rôm rả, cò gồng cánh bay
Đang đếm lúa tính ngày thuê gặt
Giá thủ công lắt nhắt từng sào
Rộ mùa tiền mướn tăng cao
Cũng đành bấm bụng hầu bao dốc từ
Nếu trì hoãn chắc hư hao nặng
Nào gió mưa dai dẳng tiếp về
Hạt thời rớt rụng phủ phê
Mọc mầm, thất thoát, còn thê thảm nhiều
Thì ngoài cổng xảy điều lạ lẫm
Một tốp người vận gấm áo hoa
Trống chiêng như thể rước toà
Ngựa xe tấp nập cờ khoa rộn ràng…
August 25, 2020
Tam Muội",truyện thơ: tam vĩ hồ – tập 44,,TamMuội,https://poem.tkaraoke.com/109131/.html
"Truyện Thơ: Tam Vĩ Hồ – Tập 45
Thiếu phụ khoác khăn quàng sặc sỡ
Dáng đẫy đà lớ ngớ khô khan
“Đâu trụ chắn, thập lục đàn
Có dây chi gõ mê man lắm người?”
Lối trịch thượng bười bươi sành sỏi
Chính hiệu phường học thói kiêu căng
Bạch tướng công, đối đáp rằng
“Phận bèo trôi nổi, dám chăng nguyệt cầm!”
Vẻ lườm nguýt ó đâm dằn bước
Lệnh a hoàn trở ngược ra xe
Đem mâm sính lễ rượu, chè
Bạc vàng tơ lụa nửa bè cẩm lai
Tay phe phẩy đoạn mài khủng khỉnh
“Phú hộ Khâm muốn đính hôn cùng
Nha đầu nhặt phước cũng lung
Oai hổ tháp tùng, vợ lẽ nhà buôn”
Tiểu Ngọc Thố ngọn nguồn kháng cự
Bảo thức linh tình sử định rồi
Gióng rồng cưỡi phượng một đôi
Tào khang tiền kiếp lở bồi ly tan
Hẹn tái ngộ trần gian tiếp nối
Nay hoa quèn nỡ vội phụ vong
Duyên sâu nghĩa thẳm khắc lòng
Rộng thương để trẻ ruổi rong kiếm tìm
Rồi chẳng biết mò kim đáy biển
Hay trùng phùng hiển hiện uyên ương
Bởi gia cảnh, nạn phủ đường
Đã quên bẵng chuyện hỏi tường tận sao…
August 26, 2020
Tam Muội",truyện thơ: tam vĩ hồ – tập 45,,TamMuội,https://poem.tkaraoke.com/109132/.html
"Truyện Thơ: Tam Vĩ Hồ – Tập 46
Nay lời lẽ ngọt ngào thân thiết
Cùng chàng trai hào kiệt tới đây
Ắt sen hé nhụy giữa lầy
Hồ say thuần khiết điệp vây không chừng!
Đầu gật gật dường ưng thuận lắm
Đoạn thở dài hướng dặm xa xăm
Thương da lao lý lạnh nằm
Xót thịt những giằm máu rỉ đòn roi
Bao vành vạnh về soi cung quế
Bấy rêu phong bén rễ phơi thềm
Cỏ nào cõng gót chân đêm
Gió đâu chẳng thổi êm đềm tiếng Ai
Giọt ngân ngấn lại cài khoé mắt
Rũ thượng đình góp nhặt hoa râm
Lửng lơ cánh hạc tủi thầm
Nhớ nhung gặm nhấm dạ trầm lòng u
Vĩ quan sát rừng thu chuyển lá
Vàng phất phơ, đọt lã chã sầu
Đoạ đày chi hỡi bể dâu
Lục Trần còn mấy nông sâu để gò?
Cúi hỏi địa, địa pho thinh lặng
Ngẩng vấn thiên, thiên chẳng trả lời
Bận lo khuấy động trùng khơi
Tạo nhân gieo nghiệt vẽ đời bấp bênh?
Bạch bá mẫu lênh đênh biển rộng
Ngọc Thố Nương chèo chống một mình
Nắng dầu mưa dãi nét xinh
Mà sôi căm phẫn, mà khinh nghịch thần…
August 27, 2020
Tam Muội",truyện thơ: tam vĩ hồ – tập 46,,TamMuội,https://poem.tkaraoke.com/109133/.html
"Truyện Thơ: Tam Vĩ Hồ – Tập 47
Phút bịn rịn lần khân tâm khảm
Bóng tịch dương phủ xám tiêu điều
Vó nào ghịt bước cô liêu
Cát đâu bụi gióng, hoen chiều chia tay
Hẹn sum họp cận ngày sắp tới
An ủi Nàng, “Hãy đợi chờ Ta
Chóng xong việc nước nghĩa nhà
Xe hoa lộng lẫy điệu đà rước Nương”
Rừng rực lửa yêu đương nồng thắm
Thố nghẹn ngào soi dặm quan san
Trăng lên trĩu nặng sương màn
Gót thềm thất thểu sầu đan liễu bồ
Bưng bửng sáng triệu vô Bách Hạ
“Chuyện đuôi đầu xảo trá phân minh
Án tra tẩn mẩn sự tình
Tảo nâu, cơm nguội, mồi kình mấy con?”
Vẻ cung kính Chàng đon đả tấu
“Chốn kinh thành có nậu lái buôn
Ngầm chuyên giao dịch lách luồn
Danh gia vọng tộc thuộc nguồn bậc cao
Tiết đông chí tiệc khao thuyền ngoạn
Tuyển ả Đào thác loạn làm vui
Chén ngả ngớn, lẳng lơ mùi
Thâu canh suốt khắc, thoả dùi, dục say
Làn trắng nõn, rậm mày, thon đuột
Khách làng chơi mê vuốt mải ve
Nảy sinh bỡn ý cợt bè
Cưỡi yên lừa gỗ, cá khè độ chung…
August 28, 2020
Tam Muội",truyện thơ: tam vĩ hồ – tập 47,,TamMuội,https://poem.tkaraoke.com/109134/.html
"Truyện Thơ: Tam Vĩ Hồ – Tập 48
Bầu quốc lủi, men lùng, rượu lạ
Nốc một ly nghiêng ngả đất trời
Hai ly trí rụng tả tơi
Vào Mê Hồn Tán, ai thời trộn pha?
Tai văng vẳng độc tà khí trúc
Bản du dương thúc giục cõi lòng
Ả Đào bí tỉ thong dong
Có hay nào biết cái còng tử đeo
Chuỗi lung lạc, kẻ chèo, người đẩy
Tấm lõa lồ cắm gậy “mộc lư”
Ngồi chễm chệ, để dập đừ
Nhị tì phách trụ, xác nhừ cú đêm
Gieo kênh Dĩnh nước êm phiêu bạt
Trận mưa xui mưu sát kiến hồi
Oan đời thi thể bận trôi
Tận nơi Kỹ Viện ngụp lồi nhấp nhô
Tiểu Hàm Yến nghĩa nô phục dịch
Cùng ả Đào thân thích tay chân
Chợ ngang thấy đống bó bần
Men theo mặt thủy dạt lần mé sông
Tánh thóc mách lộng lồng phèo phổi
Sóng tò mò dữ dội gầm vang
Túi tham nhen nhóm loé tràng
Ngũ tạng mơ màng được gấm lụa châu
Đành mạo hiểm giữa cầu đứng đợi
Dụng tre sào chới với vớt lên
Tháo dây gỡ lớp chiếu mền
Trợn tròng sợ hãi chính bên trong là!…
August 29, 2020
Tam Muội",truyện thơ: tam vĩ hồ – tập 48,,TamMuội,https://poem.tkaraoke.com/109135/.html
"Truyện Thơ: Tam Vĩ Hồ – Tập 49
Té bật ngửa kêu ca khóc lóc
Vật vã gào tiếc ngọc xót hương
Hồng nhan phải dấn đoạn trường
Thiên già địa cỗi tập phường ghét ghen
Tốp xúm lại, nam chèn, nữ lấn
Soi mói điều hẩm phận bởi nhân
Đó thương thiện ý sáng ngần
Nọ ganh dè bỉu tối vần đục văn
Mị Trúc Uyển đũa dằn chén xáng
Kiếp tú bà cũng rạng tiếng tăm
Mà nay dám kẻ xắt vằm
Nhành bông nở muộn ắt nhằm thị oai
Biểu hiền tế ra ngoài chuẩn bị
Ngựa hồng mao, nửa kí bạc vàng
Tìm Án Sát, Khải Phong đang
Nhiệm thời đô đốc lẹ làng xuống đây
Lệnh nô bộc canh thây ma ngặt
Đợi quan trên xuống cắt việc làm
Xua giải tán, đuổi đám ham
Tò mò tọc mạch lại nham hiểm lòng
Đoạn bực tức châu nong gò má
Giọt đổ thừa, giọt giả nghĩa ân
Chứ nào tốt bụng ân cần
Chỉ vì mặt mũi tệ ngân đo lường
Tia chớp lục, tịch dương túy lúy
Xót tử thi phân hủy trương phềnh
Vong hồn vất vưởng chênh vênh
Về từ hoả ngục, oan thênh thang tròng…
August 30, 2020
Tam Muội",truyện thơ: tam vĩ hồ – tập 49,,TamMuội,https://poem.tkaraoke.com/109136/.html
"Truyện Thơ: Tam Vĩ Hồ – Tập 50
Ngõ u hiển long đong kiếp nạn
Nghiệt kính đài soi bản hành vi
Mệnh đâu thể ngưỡng A-Tì
Còn mắc đoạ thì, tang hải ba sinh
Đuốc giác ngộ chưa hình tỉnh thức
Vướng đường hầm nghiệp lực mang mang
Sân ngạ quỷ, cổng thiên đàng
Gót mê khập khiễng muội quàng lửng lơ
Thủa côi cút sống nhờ thúc phụ
Thiếm gian manh bày đủ thứ trò
Tính tình ích kỷ so đo
Cơ ngơi bề thế vàng kho chật nhà
Vẫn bắt cháu khi gà chửa gáy
Giặt giũ đồ xong chạy tằm dâu
Chang chang cõng nước vượt cầu
Trăng dòm dưa muối gián bâu chẳng thèm
Vừa thập tứ bị đem gạ bán
Chốn thanh lâu để gạn trăm đồng
A hoàn phục vụ cửa hông
Vợ khách kiếm chồng phải ứng phó ngay
Tú bà Uyển thấy mày lá liễu
Suối mây bồng, yểu điệu chín phân
Cẳng nhền nhện, bọc tuyết ngần
Cuồng nhiệt nóng rần đôi hoả diệm sơn
Kiêm thiên phú ngón đờn ma mị
Khúc lâng lâng nghê nỉ non thường
Bạc ngàn trích vốn khuếch trương
Mỡ bôi dẻo miệng, ban phường xướng ca…
August 31, 2020
Tam Muội",truyện thơ: tam vĩ hồ – tập 50,,TamMuội,https://poem.tkaraoke.com/109137/.html
"Sương giăng trắng lối hồng trần
Thoáng nghe thế tục bao lần trả voy
Phàm thân tựa áng mây bay
Cõi nào nương trú nơi này là đâu
Đêm dài mở mịt đã lâu
Ai người khơi cảnh xoá màu vô minh
Bóng chiều cô tịch lặng thinh
Nguyện cầu thế sự thanh bình an nhiên
Với tay vịn lấy cõi thiên
Nghiệp quả còn lắm ưu phiền đeo mang
Trong dạ sân hận chưa tan
Đường về giải thoát muôn vàn khó khăn
Tham si như lưới bủa giăng
Hoá thành cội rễ khô cằn đã lâu
Trời đêm dai dẳng canh thâu
Đời người muôn sự cơ cầu bủa vây
Bước trên danh lợi vòng xoay
Lay hoay sáu nẻo đoạ đày tan thương
Hạt sen tâm thức tựa nương
Rưới nước cam lộ tỏ tường đục trong
Mai rày muôn hướng rủi rong
Trụ vào chánh giác trọn lòng từ bi
Lạy trên tam bảo quy y
Buông câu đà Phật tức thì vãng sanh !
08 - 30 - 2020",bờ giác,,Nguyễn Tâm,https://poem.tkaraoke.com/109138/.html
"ĐÃ MẤT NIỀM TIN
(THTK, 1 Giao duyên đối)
*
""Ví mà tôi đổi thời gian được
Đổi cả thiên thu tiếng mẹ cười""
(Trần Trung Đạo)
*
VÍ trở vòng quay sẽ gặp Người
MÀ ngày tháng mãi lạnh tròng ngươi
TÔI vầng nguyệt khuyết chiều đông chuyển
ĐỔI nắng bờ hoang chiếu bãi đời
THỜI thế suy đồi nhân nghĩa cạn
GIAN trần lũng đoạn ái tình vơi
ĐƯỢC không cũng phải ôm lòng đất ?
ĐỔI CẢ THIÊN THU TIẾNG MẸ CƯỜI.
Lê Cảnh Tiến 31/08/2020",đã mất niềm tin,,Lê Cảnh Tiến,https://poem.tkaraoke.com/109139/.html
"HOÀNG HÔN CHIỀU THU
Thu tiễn hạ mười ba ngày( 13-7 ) thì phải
Như vẫn còn ở lại nắng đong đầy
Trời chiều thu mấy chiếc lá vàng bay
Nắng hôn nhẹ áng mây hờn che khuất
Chuyện lứa đôi ôi nhiệm mầu phép thuật
Thoáng qua mau lưu ký ức dài lâu
Mùa đông về rét buốt suốt canh thâu
Hoa phượng nở ve sầu ngân não ruột
Xuân đong đầy mặc tay nào đỏ đuốc ?
Xuân yêu thương vẫn chẳng thuộc về nhau
Lá vàng bay gợi nhớ những ngày đầu
Thu man mác chiều mưa ngâu sầu nhớ
Ta với nàng quen nhau từ một thuở
Thuở kề bên mình trộm nhớ thầm thương
Giờ lạc bước không cùng bến thuyền tương
Thôi đành vậy dù hai đường hai lối
Mai, ngày sau gặp nhau đừng bối rối
Chuyện yêu đương đâu có tội người ơi ?
Hạnh phúc nhà niềm khao khát nào vơi...
Mình cùng chúc trọn đời luôn viên mãn...
HNL  13-7-2020",hoàng hôn chiều thu,,Huỳnh Ngọc Lợi,https://poem.tkaraoke.com/109140/.html
"Tôi cữ tưởng mình là người hoàn hảo
Sống đôi khi dường như thật ảo não
Buồn vui cữ thế làm tôi tuôn trào
Giọt lệ rơi thấm nhuần mi áo
Tôi khoác trên vai hai dòng nước mắt
Lặng nhìn đời không một chút bâng khuâng
Tuổi thơ tôi như chiếc lá xa dần
Vội rời đi không cần quay trở lại
Vì cuộc đời cữ xô đẩy tôi mãi
Buộc tôi phải dần tập đứng lên
Tôi vẫn còn nhớ những màn đêm
Che khuất đi mảng bầu trời ánh sáng
Vì cuộc đời này, tôi không đáng
Sống vì đam mê sẽ không thể thãi thừa
Cho dù trời có đổ cơn mưa
Thì cơn mưa kia cũng không thể nào dập tắt
Sống là cho không cần tự dằn vặt
Hoàn hảo là hai mặt của cuộc đời
Vì thế nên hỡi bạn của tôi ơi
Tôi xin cậu đừng buồn nữa nhé
Vì cuộc đời này còn rất nhiều ngã rẽ
Hãy vì tuổi trẻ, hết mình vì thanh xuân ,
Tác giả : Phan Thị Hoài Thanh",cuộc đời,,Phan Thị Hoài Thanh,https://poem.tkaraoke.com/109141/.html
"Tái Ngộ Duyên Tiền Kiếp -36
""Giây phút tâm tình""
Nữ Vương ạ! Tiếng ""Nàng"" thân ái
Ta khát khao được gọi, muốn nghe
Nhưng vì khoảng cách quá xa
Say vầng rực rỡ, đành là mộng mơ,,,
Chìm lặng lẽ bên bờ dào dạt
Giữa canh trường bàng bạc ánh trăng
Tình cờ tia điểm sương giăng
Bật lên lấp lánh, phả làn giá đông
Niềm vương vấn, cõi lòng xao xuyến
Khiến đôi hồn hoà quyện dịu êm
Lâng lâng cảm xúc bồng bềnh
Dưới bầu quang đãng, thang thênh tuyệt vời
Nụ e ấp một thời đã nở
Hương dịu dàng loang toả nhẹ bay
Khu vườn thượng uyển từ nay
Đêm thanh huyền diệu chan đầy dấu yêu...
Aither chàng ơi! Đây tửu ngọc
Thiếp mời chàng hãy cạn cùng nhau
Sẻ chia giây phút ngọt ngào
Men nồng ấm áp lan vào châu thân
Giải tan hết bao luồng buốt lạnh
Giúp quả hồng sóng sánh trào dâng
Ngân nga điệp khúc cung đàn
Nhịp nhàng lai láng, vô vàn thiết tha
Để lờ lững la đà lam khói
Cho thẫn thờ ngõ lối chơi vơi...
Chỉ còn lởn vởn mà thôi
Rồi xuôi theo gió, tan trôi dặm ngàn...
27/08/2020
Nguyễn Thành Sáng",tái ngộ duyên tiền kiếp -36,,Nguyễn Thành Sáng,https://poem.tkaraoke.com/109142/.html
"Tái Ngộ Duyên Tiền Kiếp -37
""Điệp khúc tình yêu""
Sophia Loren*! Tiếng đàn nàng vừa khảy
Tợ suối dòng, êm ái lững lờ trôi
Tai lắng nghe, cảm xúc trỗi đầy vơi
Tận tấc dạ từng hồi dâng ý nhạc...
Kể từ nay không còn chiều ráng tắt
Lá thu vàng rải rảc, bước người đi
Thôi canh trường thắt thẻo, tím bờ mi
Thổn thức mãi thầm thì trong nỗi nhớ
Chẳng sương lạnh, lạnh gieo sầu trăn trở
Giấc chập chờn, hạnh ngộ bóng giai nhân
Chợt giật mình, ngớ ngẩn, hãy còn lâng
Hình thực tại, ngỡ ngàng! Đau mộng mị...
Ta sẽ say! Say men tình tuý luý
Rồi quyện hoà, thủ thỉ chuyện gần xa
Chìm mơ màng giữa nhịp đập ngân nga
Đỉnh ngây ngất, đậm đà hương mật ngọt...
Đêm thanh đãng, cung lầu vui thưởng nguyệt
Tửu vang hồng thiếp rót ngập tràn chung
Dưới khung trời lấp lánh toả mênh mông
Kề ấm áp, và cùng nhau nhấm nháp
Đàn Harpe, chàng rung tơ, thiếp hát
Tặng sương buồn, cỏ lá khúc du dương
Cho phôi pha giây phút nghẹn bên đường
Chìm mưa đổ, trắng hàng mây phủ xám
Thiếp tự tay dệt nhiều nhung lụa gấm
Lót trải vào thăm thẳm đáy con tim
Hái vầng trăng đan kết chuỗi ánh huyền
Để thấp sáng, chàng thả hồn vào ấy...
*Tên của Nữ Vương
28/08/2020
Nguyễn Thành Sáng",tái ngộ duyên tiền kiếp -37,,Nguyễn Thành Sáng,https://poem.tkaraoke.com/109143/.html
