Content,Title,Genre,Author,URL
"Dòng nước mát trong xanh
Uốn mình theo vách núi
Mái tóc thề em búi
Để trần một bờ vai
Thổn thức cả lòng ai
Ngọc ngà mà đằm thắm
Ngực trần em toả nắng
Làm say ngất trăng chiều
Núi đồi cũng nghiêng theo
Sóng tràn bờ cỏ mướt
Chim rừng ngưng tiếng hót
Trời Tây Bắc chênh chao
Suối ngàn vẫn dạt dào
Khép hờ ....tà áo nước
Cất lên lời tha thướt
Nghe như là ....nọong ơi !!",tắm tiên,,Khánh Linh,https://poem.tkaraoke.com/65186/.html
"Hôm nay em xuống chợ phiên
Xốn xang váy áo chỉ viền bờ mi
Nắng vàng trải lối em đi
Bên con suối nhỏ rầm rì lời thương
Kèn môi dìu dặt trên nương
Bắp vừa ngậm sữa vấn vương lòng người
Xuyến xao tim nhỏ bồi hồi
Ngựa vàng ai hí chạy vời lên non ....
Rừng mơ, lời hứa vẫn còn
Lạc vào ngơ ngác như con nai rừng
Ngàn hoa khoe sắc chào mừng
Rượu đào bản Phố thơm lừng hơi men
Tay em chọn lá làm kèn
Tấu lên bản nhạc say men tình nồng
Rộn ràng vó ngựa đồi thông
Hoa ban đã nở ngóng trông anh về !",xuống chợ,,Khánh Linh,https://poem.tkaraoke.com/65187/.html
"BỤI MƯA
Phạm Ngọc Vĩnh
Bụi mưa xoá dấu chân lối ngõ
Trở về tìm vết thời gian
Lốt guốc người xưa tím nền đất đỏ
Thẫn thờ lòng ai chiều gió ngàn .
Ai đi tìm ai với dấu xưa
Liệu có còn bóng sớm hình trưa
Như tôi tìm về một thuở
Bước chân tan trong nhạt nhoà .
Lồng vết nay lên vết qua
Lần đi liêu xiêu trong trơn trượt
Chỉ một vết thôi cũng đủ lòng thoả ước
Mà nào ngờ ta lại trách ta .
Bụi mưa xưa đã xa
Bụi mưa nay thẫm dấu
Bao nhớ thương trong nhau hằng đau đáu
Một thời ẩn náu đường trơn .
.*****
Bài Hoạ CỦA KỲ GÀN
Cơn mưa đổ dáng ai qua ngõ
Sao không dừng tạm trú thời gian
Nhòa má hồng thâm cả môi đỏ
Tóc ướt kia hỏi có nhớ ngàn
Sao hờn sao giận chuyện ngày xưa
Chuyện của ông trời lúc nắng trưa
Nắng đổ làm cho ai lỗi hẹn
Dấu chân ngày cũ đã phai nhoà
Vô tình từng bước vết chân qua
Tránh vết đường đi ai mới trượt
Như sao sa nào ai kịp ước
Cũng vô tình ta ngã vào ta
Đường về còn quá xa
Mà sao người cố giấu
Để anh dìu từng bước chân đau đáu
Tay trong nhau tránh những đường trơn
23:12 08-01-13",bụi mưa (2),,Phạm Ngọc Vĩnh,https://poem.tkaraoke.com/65188/.html
"Tuyết có rơi khi đông không ở lại
Em có đi khi yêu thương khờ dại
Em có lại ngôi nhà ta từng mong
Hay em che những ký ức trong lòng ?
Chút yêu thương mùa đông không lành lặn
Giữ hơi ấm người thương lời tôi dặn
Mặn bờ môi tôi theo làn khói trắng
Vá khoảng trời vẽ vệt nắng người thương
Những ngày nắng đan xen những ngày mưa
Con đường xưa đan xen khung trời vắng
Dấu chân ai đan xen từng khoảng lặng
Chặng đường dài, liệu có quên được nhau ?",mai..,,Đại Lê,https://poem.tkaraoke.com/65189/.html
"Giọt sương lay động ... nụ hoàng mai
Lọn gió heo may lặng nhạt phai
Tia nắng bình minh he hé lại
Trời cao cánh én chợt bay dài
**
Tiếng ai đang hát vọng bên tai
Lồng lộng sau đêm giấc ngủ say
Ánh mắt săm soi ta nhìn mãi
Nghiêng nghiêng dáng liễu em là ai ?...
**
Cánh xuân nhè nhẹ ... bỗng bay bay
Chiều xuống trăng lên bóng nẫy đầy
Mặt nước rung rinh mây động đẫy
Ánh trăng nhẹ bổng rớt trên  tay
**
Ánh trăng  hôn mãi cánh hoa lài
Mạc khách tao nhân hồn chợt lay
Câu đối .. gieo vần lòng muốn trãi
Chớm xuân trời đất chuyển đêm ngày....
ĐH, QT, 07.01.017",chớm xuân...,,Hồng Dương,https://poem.tkaraoke.com/65190/.html
"Paris nỗi nhớ một chiều mưa
Tím cả hoàng hôn lúc tiễn đưa
Chỉ lặng nhìn thôi mà chẳng nói
Lòng lưu dấu mãi mộng hoa xưa",chiều tiễn đưa,,Hoàng Thanh,https://poem.tkaraoke.com/65191/.html
"Mùa thi đại học mới quen nhau
Chiếc áo bà ba đậm tím màu
Dáng liễu tóc mây dài óng ả
Hương yêu cuốn hút đã dâng trào
Mái trường rợp bóng hàng hoa phượng
Thắm đỏ tình ta vị ngọt ngào
Giữ lại trong tim màu kỷ niệm
Lòng thầm nguyện ước mộng ngày sau",gặp nhau,,Hoàng Thanh,https://poem.tkaraoke.com/65192/.html
"Những ngày tình nhớ chơi vơi
Bao năm lưu luyến bên đời gọi em
Muôn trùng đất khách chưa quen
Hỏi rằng em đã gieo neo phương nào
Biển khơi dậy sóng hồn đau
Mòn thân đá cuội nghìn sau vẫn chờ
Tình xa duyên nợ hững hờ
Sầu dâng quầng mắt đường tơ bẽ bàng",mãi còn gọi tên,,Hoàng Thanh,https://poem.tkaraoke.com/65193/.html
"CỨ NGỠ LÀ…
(Tam bát cửu)
Bước chân đi
Anh chưa lần nghĩ suy ngày gặp lại
Vùng trời xa: xấu hay đẹp, dải mầu nào…
Phải làm sao
Hỡi thiên thần áo dài xanh nước biển
Ngày hờn ngày, khi anh đã biết: yêu em…
Tà áo mềm
Cứ tìm về từng đêm không cho ngủ
Anh đuổi bắt bằng vần thơ đủ sắc mầu…
Chợt… em đâu?
Ngác ngơ vần thơ rầu rĩ tìm kiếm
Lặng thẫn thờ, anh thật phù phiếm làm sao…
Những lầu cao
Đôi tay trần làm sao leo lên được
Anh ngậm cười, còn thơ đẫm nước mắt rơi…
Phải đổi đời
Anh khăn gói xa rời quên tất cả
Chưa một lần dám nghĩ - em ạ: còn duyên…
Không để yên
Sao lại gọi – lại phiền anh lần cuối
Tà áo dài xanh nước biển với lời yêu…
Khổ trời chiều
Anh lưỡng bước bởi điều vừa nghe thấy
Đợi anh về, anh hứa phải lấy em nghe…
Cơn mộng mê
Chợt vỡ òa tìm về nơi thực tại
Đợi anh nghe - anh đi – quay lại sớm thôi…
05-01-2016
Nguyên Hữu",cứ ngỡ là…,,Nguyên Hữu,https://poem.tkaraoke.com/65194/.html
"Lệnh - một tên giặc lái
Vừa bị ta bắn rơi
Cần vây tròn, bắt sống
Toàn đơn vị chia đôi...
Chỉ huy đeo súng gỗ
Ngời ánh mắt bồ câu
Dõi khu đồi trước mặt
Nắng hồng, má đỏ au...
Hai cánh dồn ép chặt
Quân phòng vượt như tên!
Bướm vàng theo chấp chới
Vòm xanh rộn tiếng chim...
Bỗng thoáng qua khe lá
Nom rõ một bàn tay
Sim mùa đang chín mọng
Nhành sim còn lung lay...
Tên phi công chắc đói?
Cho phép được ăn no
Thấy động, y hốt hoảng!
Vùng lên định bóp cò
Nhưng, quân ta xuất hiện
Bình tĩnh và hiên ngang
Bắt kẻ thù hạ súng
Giơ tay lên, đầu hàng!
Tên phi công đứng sững
Nhìn khắp phía bủa vây
Hai má bỗng đỏ gay
Xoay vòi, hét ầm ĩ
- Tớ cóc làm quân Mỹ!
- Tớ cóc cần giơ tay!...
Chim chuyền tung cánh hót
Bướm vàng chấp chới bay!...
1965
Nguồn: Hương cỏ mặt trời (thơ), Tô Hà, NXB Hà Nội, 1978",trên đồi sim,,Tô Hà,https://poem.tkaraoke.com/65195/.html
"Em chờ anh ở cuối cánh đồng
Nơi tít tắp máy cày anh sẽ tới...
Hanh hao gió đất đang chờ lật ải
Nước mương đầy sau mưa...
Em chờ anh ở cuối cánh đồng
Nghe tay cấy ruộng ngấu đều chân mạ
Năm ngón buốt tưởng rơi vào sương giá
Lúa chẳng chăng dây vẫn thẳng hàng...
Em chờ anh ở cuối cánh đồng
Tháng giêng rét đài, tháng hai rét lộc
Tháng ba nắng nụ mưa hoa
Tháng tư bờ bời lúa trổ...
Ta đón gặt một mùa vàng nắng nỏ
Cho tưng bừng ngày hội tháng năm
Bếp làng xanh khói - chiều thơm phức!
Bay giữa đêm chèo nhịp trống trăng...
Phải tít tắp máy cày anh đang tới?
Em chờ anh ở cuối cánh đồng...
1977
Nguồn: Hương cỏ mặt trời (thơ), Tô Hà, NXB Hà Nội, 1978",ở cuối cánh đồng,,Tô Hà,https://poem.tkaraoke.com/65196/.html
"Giữa hàng cây xanh thắm
Nghiêng soi xuống mặt hồ
Bóng lá cành long não
Đan một vùng non tơ...
Đừng tưởng là trẻ đâu
Cây đã già lắm đấy!
Cứ nhìn lớp hoa rêu
Phủ khắp cành sẽ thấy
Bởi cây rất yêu đời
Nên mãi xanh bóng mát
Chắt chiu từ lòng đất
Tinh chất quý trao người...
Coi, mùa qua bão lớn
Cây cao dẫu sạt cành
Củi cây cho rất đượm
Gỗ cháy rồi vẫn thơm
Yêu cây lắm, cây ơi!
Cây già mà rất trẻ
Sống ở đâu cũng khoẻ
Cũng bốn mùa xanh tươi!...
1971
Nguồn: Hương cỏ mặt trời (thơ), Tô Hà, NXB Hà Nội, 1978",cây long não,,Tô Hà,https://poem.tkaraoke.com/65197/.html
"Tôi vượt qua những dấu bom vào thị trấn
Không một mái nhà cao quá ngọn xoan
Chim rẽ nắng bay sà trước mặt
Khóm hoa trinh nữ nép bên đường...
Ai hát đó - một điệu trầm và mộc
Rất bình yên cùng rất quê hương...
Tiếng thoi dệt rào rào cánh vỗ
Tiếng ong bay - tiếng cu gáy vào hè
Chân bờ cõi tiếng gà con túc tích
Vườn chuối xanh hoa trổ thắm rồi kia...
Tôi qua trước thềm rêu, mái sập
Vết tàn phá ngoái trông còn cháy mắt!
Vồng dây leo lần khe vỡ bò ra
Bám lên tường ngơ ngác một nhành hoa...
Ngã ba hẹp rẽ vào ngõ chợ
Dưới gốc bàng già tán lá tươi xanh
Nằm nhẵn bóng một vỏ bom không nổ
Khách qua đường thay ghế đá nghỉ chân...
Tôi qua suốt niềm tin - tôi xúc động
Dừng lại góc tường gạch vẽ linh tinh
Như một chú bé con đã lâu ngày sơ tán
Về gặp ngây thơ nét vẽ của mình...
Vĩnh Yên, 1973
Nguồn: Hương cỏ mặt trời (thơ), Tô Hà, NXB Hà Nội, 1978",qua thị trấn,,Tô Hà,https://poem.tkaraoke.com/65198/.html
"Anh trao em nắm đất
Trên đê - giờ giải lao
Như buổi đầu dựng nước
Lứa đôi nào trao nhau...
Đưa bàn tay rám nắng
Em xoè tung ngón hoa
Trước đông vui bè bạn
Đang ngắm cười hai ta...
Tiếng ai đùa trong gió
Mong đất biến thành vàng
Ta trao nhau thời gian
Từng thép mai đào gấp
Lúa đôi bờ xanh tắp
Rặng xoan mùa đang hoa
Ngang trời con chim ca
Em cười, bay mái tóc!...
Lòng ta như cỏ biếc
Vỗ cao bờ đê xuân
Ôi! Mảnh đất yêu tin
Của muôn đời lẽ sống
Giọt mồ hôi cháy bỏng
Soi hạt vàng trong tay
Anh trao em nắm đất
Trên đê - giờ giải lao
Như buổi đầu dựng nước
Lứa đôi nào trao nhau
Sách ""Lĩnh Nam chích quái"" thế kỷ XV viết thời Hùng Vương đã có tục hôn thú bằng cách trao nhau nắm đất làm đầu.
Thanh Trì, 1968
Nguồn: Hương cỏ mặt trời (thơ), Tô Hà, NXB Hà Nội, 1978",nắm đất trên bờ đê xuân,,Tô Hà,https://poem.tkaraoke.com/65199/.html
"Quà cho em anh sẽ đem về
Không phải nhành phong lan nở thắm
In rực rỡ trong mắt người ra trận
Như nụ cười em đưa tiễn anh...
Quà cho em anh sẽ đem về
Không phải kỷ niệm trong tay sau trận đánh
Chiếc vòng sáng bom bi còn nóng bỏng
Sợi tao dù bè bạn trao đưa...
Viên đạn nào bay xé giấc mơ
Trái bom nào xoáy lao đáy mắt
Trong máu lửa tháng ngày khốc liệt
Có thể nào anh không nghĩ tới em?
Dù cách xa nhau suốt dải Trường Sơn
Dù hung hãn quân thù trước mặt
Niềm tin
Như những rễ lim bạnh ra bám vào đá chắc
Như sức mạnh không cùng của đất
Đang bồi hồi giục giã bước chân anh...
Quà cho em anh sẽ đem về
Là ngọn lửa tình anh - không thể khác
Tan khói bom - là lộng lẫy trời xanh
Và nụ cười em bay đến với anh...
Pha-băng-nưa, 3-1971
Nguồn: Hương cỏ mặt trời (thơ), Tô Hà, NXB Hà Nội, 1978",quà cho em,,Tô Hà,https://poem.tkaraoke.com/65200/.html
"ANH NGỠ HỒN MÌNH HẾT NGỔN NGANG
Năm mới đã về rất nhẹ nhàng
Tựa hồ cánh bướm đợi xuân sang
Lượn lờ lơ lửng vùng mơ ước
Lấp lánh long lanh cõi địa đàng
Bài hát ngày xưa còn vọng mãi
Tiếng đàn năm cũ vẫn âm vang
Mơ hồ bên những vườn hoa đẹp
Anh ngỡ hồn mình hết ngổn ngang
Trần Minh Hiền Orlando ngày 7 tháng 1 năm 2017
TO REGRET
There are always something to regret
Are you sorry for the time we haven't met
Everything is nothing to reset
Sometimes I play with the words as if I play with my soul to bet
Trần Minh Hiền Orlando January 7, 2017",anh ngỡ hồn mình hết ngổn ngang,,Trần Minh Hiền,https://poem.tkaraoke.com/65201/.html
"Từ thuở xa xưa đã có làng
Duy một điều cháu con chưa biết
Tên nhà thơ có trước hay tên làng có trước
Phi Khanh - Nhị Khê, khe nước thơm...
Sông qua làng lấp loáng ánh trăng xanh
Câu hát cũ vẫn bắc cầu dải yếm
Em - gái Khánh Vân - anh, trai Dũi Tiện
Đẫ yêu nhau ta rủ nhau về...
Làng êm đềm bóng lá xanh che
Đường gạch chỉ lát hồng tận ngõ
Dậu ô rô lá khoe bướm vẽ
Ổi vườn ai cành mọc vói qua đường
Trại Ổi xưa còn dấu tích đó chăng
Người bộ tộc nào đến đây quần tụ
Đất thấm máu bao phen giặc giã
Cổng chòi xây bền chắc bấy rêu xanh?...
Như ong bày cần mẫn trước thời gian
Làng Dũi Tiện - còng lưng vẫn tiện
Ngón tay xiết vẹt cán vồ gỗ nghiến
Mà cuộc đời cơ cực có ra sao?...
Lương Văn Can nổi sóng một phong trào
Lương Ngọc Quyến đông du chống Pháp
Con nối cha, đời nối đời, quyết liệt
Cùng quân thù không đội trời chung
Làng sĩ phu vó ngựa thảy dừng cương
Đền Nguyễn Trãi - ngựa qua phải dắt
Ngõ chính vào làng, đây - Ngõ Quốc
Con đường sửa mới rộng thênh...
Nước đã thanh bình - cây thắm xanh
Giêng hai này nhé bạn qua thăm
Biết đâu chẳng gặp trên đồng Nguyễn
Người về nón lá vác bừa xuân
Nhị Khê, 22-1-2978
Dũi Tiện, Trại Ổi: Tên cũ làng Nhị Khê
Người về nón lá vác bừa xuân
Từ một ý thơ Nguyễn Trãi: ""Tha niên Nhị Khê ước, Đoản lạp hạ xuân sừ.
Nguồn: Hương cỏ mặt trời (thơ), Tô Hà, NXB Hà Nội, 1978",nhị khê - làng nguyễn trãi,,Tô Hà,https://poem.tkaraoke.com/65202/.html
"Tặng Khánh Hoà
Con đường dẫn tới bờ sông...
Bờ cỏ xuân nước dâng đầy mấp mé
Đôi nhịp cầu tre bỗng trở thành ý nghĩa...
Em thấy không?...
Đồng ruộng sinh sôi
Hạt của ta gieo đã lên xanh rồi...
Em giơ tay đón chiếc lá tre từ ngọn cao xoáy tít
Và mỉm cười - với những gì không biết...
Nguồn: Hương cỏ mặt trời (thơ), Tô Hà, NXB Hà Nội, 1978",con đường dẫn tới bờ sông,,Tô Hà,https://poem.tkaraoke.com/65203/.html
"Bên tấp nập Hồ Gươm
Bỗng bàng hoàng con mắt
Ôi cái nụ em cười
Có thể nào khác được?
Cả hai cùng sững bước
Cả hai cùng vui reo...
Gặp em đỉnh đèo cao
Với ríu ran bè bạn
Mồ hôi còn đẫm trán
Gương mặt còn xanh sao
Mà mắt cười tươi đó
Mà gùi nặng trên lưng
Mà dừng chưa kịp thở
Đã thoắt dồn bước chân...
Vai áo bà ba đen
Cánh mũ tai bèo nhỏ
Em qua mặt trời tỏ
Em qua vầng trăng lên
Đã bao ngày không đêm
Cái ngủ đè mi mắt
Chim rừng kêu khó khăn
Chim rừng kêu khắc phục
Ơi Kơlang, Tatách
Arôn, rồi Kôbung...
Chân dốc mới nhác trông
Đã chờn khoeo, chóng mặt
Đêm lạnh hồ dao cắt
Ngày nóng tựa cát rang
Con gái như đồng đen
Ngắm nhau cười khúc khích
Rồi mưa ngàn xối đất
Rồi thác réo bom gầm
Bữa củ nâu, môn thục
Bữa măng rừng thay cơm
Cái sốt vừa lui cơn
Đã vùng theo trận đánh
Hai vai như mọc cánh
Gùi đạn xốc lên đường
Vuốt mặt trong mưa trút
Ngã, cười vang dốc trơn!...
Ngày đánh giặc gian truân
Cháy lòng theo nỗi nhớ
Góp muôn nụ em cười
Cho một ngày đoàn tụ
Liễu hồ thao thiết gió
Nắng bay tròn ngang vai!...
Pà Ngà, 1971
Hà Nội, 1977
Nguồn: Hương cỏ mặt trời (thơ), Tô Hà, NXB Hà Nội, 1978",gặp lại o chín,,Tô Hà,https://poem.tkaraoke.com/65204/.html
"Một buổi mai nào đó
Như buổi mai nay
Hồ Gươm rực rỡ
Cành bàng nảy lộc xanh tơ
Cánh én say như bất cứ bao giờ
Đan chấp chới chao mình soi bóng nước...
Bên luống hoa
Lứa đôi nào vừa dạo gót
Còn lại đây rạo rực dấu chân
Người yêu tôi buổi ấy lên đường
Phút quên cả những điều hò hẹn
Dưới gốc bàng này
Chúng tôi đã cùng nhau trò chuyện
Về một loài hoa hai đứa chẳng biết tên
Ánh hoa cười trong gió nghiêng nghiêng
Tôi đứng đây
Hôn mở tung cánh cửa
Điều muốn nói bay vào nỗi nhớ...
Một buổi mai nào đó - bạn ơi
Khi chúng ta tuổi đã già rồi
Vẫn đến đây một lứa đôi nào khác
Vẫn như ta
Như buổi sớm mai nay
Với chim mùa hót nắng dưới trời mây
Với bờ liễu
Với Tháp Rùa trầm mặc
Với rặng sấu ven hồ in bóng nước
Tàu điện qua như một dải băng xanh...
Bạn thấy không?
Họ đến rất thanh bình
Sau trận đánh hôm nay tôi đã nhìn thấy họ...
1968
Nguồn: Hương cỏ mặt trời (thơ), Tô Hà, NXB Hà Nội, 1978",một buổi mai nào đó,,Tô Hà,https://poem.tkaraoke.com/65205/.html
"Như dòng tên xanh
Đoàn ta xuất phát
Hàng ta đã chắc
Xe ta đã đầy
Ta là máy bay!
Ta là nắng sáng
Xe ta theo bạn
Như chim theo bày
Hàng cây hàng cây
Trổ đều búp lửa
Nhịp cầu mới gỗ
Bụi hồng dấu son
Hố bom hố bom
Dọc đường chi chít
Cỏ xuân đã khép
Hoa xuân đã bừng
Hỡi em trên đồng
Tựa đùa lưng nghé
Có gì vui thế
Đang cầm trong tau
Đua cùng ta bay
Cánh buồm xé gió
Biển tung sóng vỗ
Trong ta dạt dào
Ta băng qua đèo
Ta băng qua dốc
Con sông trước mặt
Bến phà sau lưng
Hôm qua đang rừng
Hôm nay đã biển
Tên sông tên bến
Đều thành tên thương
Theo ta - mùa xuân
Trùng trùng mặt đất
Quân thù trong mắt
Đang còn lao bay
Cái chết đâu đây
Còn rình chưa nổ
Trong từng vạt cỏ
Trongh từng búi sim...
Con đường xuyên dọc
Con đường xuyên ngang
Mắt nhìn chưa quen
Nhưng lòng khắc nhớ
Nghe ran súng nổ
Lối xe bỗng tỏ
Niềm vui thoắt bừng...
1969
Nguồn: Hương cỏ mặt trời (thơ), Tô Hà, NXB Hà Nội, 1978",con đường trước mặt mùa xuân,,Tô Hà,https://poem.tkaraoke.com/65206/.html
"Trước kia là chỗ bồn hoa
Xanh tươi lối cỏ em ta nô đùa
Ngay sau ghế đá, bên hồ
Nóc hầm cỏ đã xanh tơ mắt nhìn...
Tay cầm viên gạch. Thời gian
Qua rêu phong vẫn rỡ ràng đỏ au
Đáy hầm nạy bật, xôn xao
Đất hiện ra - quá mỡ màu, đất ơi!
Các em xúm xít lại coi
Trắng ngần ngọn cỏ mọc chồi dưới khe...
Hồ Gươm, 1975
Nguồn: Hương cỏ mặt trời (thơ), Tô Hà, NXB Hà Nội, 1978",lối cỏ,,Tô Hà,https://poem.tkaraoke.com/65207/.html
"Ở nhà coi mạnh khoẻ
Vào viện hoá bệnh nhân
""Y lệnh như quân lệnh""
Nụ em cười hồn nhiên...
Chỉ huy là em đó
Cô bác sĩ trẻ măng
Đâu bệnh nhân đau đớn
Đó có em dịu dàng
Em ủ chăn, cặp sốt
Em xem mạch, hỏi han
Đôi mắt ngời đăm đắm
Dấu bao điều lo toan
Dao kéo là vũ khí
Bàn mổ là chiến trường
Trán đẫm mồ hôi hột
Trước ca mổ an toàn
Với thế giới bên ngoài
Ở đây xa cách hẳn...
Cây mạ đang dở cắm
Ổ máy mới tra dầu
Bài soạn chưa lên lớp
Lưu giữa chừng cơn đau
Em đến với thời gian
Hồn nhiên như suối mát
Tôi ngày tháng vô tình
Đâu biết mình đang bệnh
Hứa trước nụ em cười
Xin bước vào trận đánh...
Bệnh viện Bạch Mai, 20--2-1978
Nguồn: Hương cỏ mặt trời (thơ), Tô Hà, NXB Hà Nội, 1978",trước nụ cười em,,Tô Hà,https://poem.tkaraoke.com/65208/.html
"Cột điện cong queo
Đèn khuya vẫn tỏ
Sắc cốt đung đưa
Bước lên thềm vỡ
Tường nhà nghiêng đổ
Cột gỗ cháy đen
Con mèo nép gió
Ngước nhìn sao đêm...
Thư từ mặt trận
Dấu đóng lâu ngày
Lửa đốt trong tay
Giục tìm người nhận
Hỏi nhà bên cạnh
Nhà đi ngủ rồi
Hỏi qua trạm gác
Gót chân bồi hồi...
Ơi! Các vì sao
Xa nhau thế ấy
Chuyện chi nhấp nháy
Có cần đưa thư?...
Yên Bái, 10-1965
Nguồn: Hương cỏ mặt trời (thơ), Tô Hà, NXB Hà Nội, 1978",thư đêm,,Tô Hà,https://poem.tkaraoke.com/65209/.html
"Đêm biển - sóng dồn những chấm hoa
Em ngồi khâu lưới tận bờ xa
Chừng nghe tiếng động cành khô gãy
Từ nẻo rừng dương anh rẽ qua
Mạng lưới, tay xinh phút tạm ngừng
Ghim tre cài đó - đạn lên nòng:
- ""Ai kia, đứng lại!"" Ồ, hay lạ!
Tiếng quát mà nghe như suối trong
Khi rõ anh là cán bộ xa
Trăng ngời bên súng - nụ cười hoa
Sao bay trắng cát mênh mông gió
Xóm biển - theo anh, chỉ tận nhà...
Cảnh Dương, 1964
Nguồn: Hương cỏ mặt trời (thơ), Tô Hà, NXB Hà Nội, 1978",xóm biển,,Tô Hà,https://poem.tkaraoke.com/65210/.html
"Mừng ngày sinh nhật con
Mừng ngày xuân thống nhất
Cái mắt con cười tít
Cái răng mọc trắng ngần
Hai má đỏ bồ quân
Ngón tay xoè chớp vẫy!
Bố đón con theo, bải
Ôm xiết con vào lòng
Thơm cái miệng con thơm...
Hạt sương vườn long lanh
Nắng hừng trên mái phố
Cành bàng ran búp trổ
Đã xanh màu lá non
Tranh áp phích trên tường
Giục mắt người đi tới
Cuộc đời lên tiếng gọi
Bước chân dồn thiết tha
Nhành hoa gặp nhành hoa
Tíu tít hồng gương mặt
Chao ôi! là tít tắp
Cái bầu trời trong xanh!...
Con là hạt máu mừng
Giữa vẹn toàn cơ thể...
Dành con cho mẹ bế
Bố đi chợ, đảm đang
Quả cà chua chín đỏ
Củ su hào non xanh
Con cá tươi trong rổ
Sau niềm vui xếp hàng...
Gạo nhặt vo trắng muốt
Bếp quen lửa bập bùng
Hành phi thơm nức mũi
Râu chú mèo rung rung...
Mừng ngày sinh nhật con
Bố tặng quà nấu nướng
Con ăn và con lớn
Con tập gọi ""pa! pa!""
Con dang tay chập chững
Con ríu ran đầy nhà
Con có ông có bà
Con có nguồn có cỗi
Tha hồ con cao vợi
Tha hồ con mênh mông...
Bố mẹ đang là sông
Con phải là biển cả
Con có nhìn cờ lửa
Bay sắc máu anh hùng
Chào Tổ quốc rưng rưng
Bốn ngàn năm thắng giặc
Mở cho con trước mặt
Một kỷ nguyên tuyệt vời!
Hôm nay đôi bàn tay
Con bám tròn ngực bố
Ngày mai dang cánh vỗ
Con bay vào tương lai!...
5-2-1976
Nguồn: Hương cỏ mặt trời (thơ), Tô Hà, NXB Hà Nội, 1978","mừng ngày sinh nhật con, mừng ngày xuân thống nhất",,Tô Hà,https://poem.tkaraoke.com/65211/.html
"Chú bé đầu têu đuổi theo xe ngựa
Nắng tròn xoe - đường xóc nảy ổ gà
Bọn trẻ phố cùng trò nghịch giặc
Tan học về tất cả ùa ra!
Bà hàng tò te mẹt bày xanh đỏ
Thím Hoa kiều với gánh thạch găng
Chậu than quạt thơm lừng ngô nướng
Cổng chợ Con chưa sáng đã ra hàng
Cụ phó cạo với hòm thợ cạo
Chiếc gương treo lấp loá thân bàng
Bác thợ đường dây giải lao ngồi đọc báo
Dưới tàn xanh gió lá tiếng ve ran...
Ngày tấp nập - đêm bộn bề cần mẫn
Tiếng thợ tan ca, tiếng máy vọng liên hồi
Phố tôi đó - bà con tôi đó!
Chú bé đầu têu nghịch ngợm chính là tôi...
Bọn trẻ chúng tôi trưởng thành mỗi đứa
Cậu kỹ sư nhà máy xi măng
Cậu dạy học, cậu khoan dò địa chất
Cậu tung hoành đánh giặc suốt mười năm...
Phố nao nức sau ngày thắng giặc
Người về vó ngựa giòn tan!
Các em bé đã nghịch theo kiểu khác
Trước thơ ngây tôi vẫn nhận ra mình...
Cùng đất nước công trường đang vỗ cánh
Phố ngoại ô - đường xé nắng xe đan...
Ngày bạn đến có thể là khác lắm
Nhưng còn đây - tên phố lẫn tên làng...
1976
Nguồn: Hương cỏ mặt trời (thơ), Tô Hà, NXB Hà Nội, 1978",phố ngoại ô,,Tô Hà,https://poem.tkaraoke.com/65212/.html
