Content,Title,Genre,Author,URL
"DUYÊN TÌNH
Đêm qua về ngõ nhà em
Đèn khuya mờ tỏ,bức rèm buông lơi
Cửa phòng ai đóng lâu rồi?
Đâu còn giọng nói tiếng cười thân quen?
Chỉ còn chiếc lá bên thềm
Nghiêng nghiêng một chút tơ duyên cuối ngày
Thẫn thờ nhìn áng mây bay
Những vì sao lạc mọc đầy trời xa
Lắng nghe,một khúc dân ca
Yêu nhau cởi áo …cho ta,cho mình…
Buồn trông điệu lý chung tình
Môi nghe nằng nặng ,lặng thinh nỗi niềm
Êm êm,chân bước lãng quên
Tìm em ,đôi mắt lim dim đợi chờ
Đêm về đầy ắp mộng mơ
Biết ai có nhớ ,có chờ ai không?
Tự nhiên,lòng lại dối lòng
Lẽ nào ,em lại có chồng …phụ nhau ?
Phũ phàng ôm giấc chiêm bao
Lối về ngõ vắng, nôn nao tâm hồn
Người đi khuất bóng hoàng hôn
Tuổi xuân khép lại, dỗi hờn vu vơ
Hỏi người ta,anh đâu ngờ…?
Em đi từ độ ,trăng mờ phố xa
Dưới cầu nước vẫn chảy qua
Trên trời mây vẫn la đà đưa duyên
Đêm qua ,về ngõ nhà em
Giật mình,tình đã về miền ca dao
Ân Thiên( Bình Dương)",duyên tình,,Thiên Ân,https://poem.tkaraoke.com/64389/.html
"Nỗi đau qua rồi
Vết sẹo vẫn chưa phai
Lòng sân hận
Buông trôi vào dĩ vãng
Ta xin người
Lần bước theo năm tháng
Sám hối tâm mình
Cho vết sẹo dịu êm
Khi niềm tin chập choạng giữa trời đêm
Lòng con người chông chênh vô định
Hơn thua chi mà ngồi toan tính
Quay lại thôi
Trước mặt đã là bờ
Phía trước kia tối sáng lập lờ
Là ảo ảnh cho bước người lạc lối
Là mộng mị hóa cõi lòng nông nỗi
Là mê cung tìm chẳng được ngõ về
Ta cầu mong
Từ trong cõi u mê
Người quay lại
Với bến bờ ngày cũ
Vết thương xưa dịu êm tìm giấc ngủ
Để cho ta thanh thản cuối phần đời",cho vết sẹo dịu êm,,Trinhcamle,https://poem.tkaraoke.com/64390/.html
"Dông bão đi rồi
Tình cũng đã phôi phai
Niềm uất hận
Xin chôn vào dĩ vãng
Cảm ơn người
Đã gọi về năm tháng
Nghĩ cuộc đời mình
Chẳng giây phút dịu êm
Ta bước đi trong thăm thẳm trời đêm
Phía tương lai mịt mờ câu vô định
Kiếp rong rêu chưa lần toan tính
Quay lưng thôi
Chẳng biết được bến bờ
Sóng xa khơi cứ mãi lượn lờ
Đêm vắng sao sỏi gập ghềnh dẫn lối
Thân lục bình tháng ngày dài trôi nổi
Xấp mặt lãng quên một cõi đi về
Ta vẫn mong
Buông bỏ nỗi đam mê
Để tìm lại
Nét hồn nhiên ngày cũ
Khép kín vần thơ bình yên giấc ngủ
Ốc đảo thong dong tận đến cuối đời",khép lại vần thơ,,Đỗ Mỹ Loan,https://poem.tkaraoke.com/64391/.html
"Vỏ xù xì gai góc
Mới nhìn chẳng ai khen
Bửa ra thơm ngào ngạt
Ăn một miếng mê liền !
Sầu riêng kỳ diệu thế
Cho ta một lời khuyên !./.",sầu riêng (2),,Đỗ Hữu Tich,https://poem.tkaraoke.com/64392/.html
"Quả bồ hòn tròn tròn
Vỏ thẫm đen mầu mật
Tưởng ăn thời ngọt ngon
Nào ngờ trong đắng ngắt !
Quả mít vỏ thô ráp
Chi chít nghìn gai chông
Múi vàng ươm thơm lựng
Ngọt ngào như mật ong !
Sự đời kỳ lạ vậy
Ruột-vỏ chẳng tương đồng
Khiến ta nhiều nhầm lẫn
Hình thức với nội dụng./.",nội dung và hình thức,,Đỗ Hữu Tich,https://poem.tkaraoke.com/64393/.html
"HƯ HAO TÌNH XA XƯA
Em về bên đồi vắng
Tìm giấc mơ lạnh lùng
Nghe hồn mình trong nắng
Lao xao ngày mông lung
Em về bên ngại ngùng
Tìm nỗi đau còn mới
Nghe hồn mình xưng tụng
Lao đao mùa chơi vơi
Em về bên sông đời
Tìm khát khao ngày cũ
Nghe hồn mình vời vợi
Nôn nao thời âm u
Em về bên mịt mù
Tìm mùa đông cháy lửa
Nghe hồn minh lụ mụ
Hư hao tình xa xưa
Trần Minh Hiền Orlando ngày 21 tháng 12 năm 2016
SOPHISTICATED
Life is complicated and sophisticated
Are you feeling sometimes the unwanted
The clouds are flying onto the filed unyielded
We have to overcome our worst fear fabricated
Trần Minh Hiền Orlando December 21, 2016",hư hao tình xa xưa,,Trần Minh Hiền,https://poem.tkaraoke.com/64394/.html
"THIÊN TÀI STEVE JOBS
(Kính lạy thiên tài Steve Jobs)
Steve Jobs quả thật một thiên tài
Một kiếp đấu tranh với nạn tai
""Pixar"" tuyệt vời cho hậu thế (1)
""Apple"" rực rỡ để tương lai (2)
Chấn hưng nhiều thứ không đen trắng
Thay đổi mọi điều chẳng đúng sai
Đem lại cho đời bao tiện ích
Năm mươi sáu tuổi đến thiên thai
Trần Minh Hiền Orlando ngày 21 tháng 12 năm 2016
Steven Paul ""Steve"" Jobs (  24 tháng 2 năm 1955 –5 tháng 10 năm 2011) là doanh nhân và nhà sáng chế Hoa Kỳ. Ông là đồng sáng lập viên,chủ tịch, và cựu tổng giám đốc điều hành của hãng Apple,là một trong những người có ảnh hưởng lớn nhất ở ngành công nghiệp vi tính.
(1) Hãng phim hoạt hình Pixar của ông.
(2) Hãng Apple do ông sáng lập năm 1976, ngày nay là một trong hãng lớn nhất thế giới.",thiên tài steve jobs,,Trần Minh Hiền,https://poem.tkaraoke.com/64395/.html
"Có người đàn ông nọ
Đi săn thú trên rừng
Ông để đứa con nhỏ
Cho chú chó canh chừng
Lúc việc săn bắn ngừng
Ông về nhà khi ấy
Chú chó vẫy đuôi mừng
Trên miệng đầy máu vấy
Rồi người ông run rẩy
Khi ông thoáng nhìn quanh
Đứa con đâu không thấy
Ông nổi trận lôi đình
Rút con dao bên mình
Ông đâm xuyên bụng chó
Thét một tiếng thất kinh
Nó gục đầu xuống đó
Lúc này đứa con nhỏ
Đang ngủ ngon trong mùng
Tiếng thét to của chó
Làm cậu tỉnh giấc nồng
Bất giác người đàn ông
Chợt nhìn ra phía vách
Một con sói rậm lông
Đã chết lòi lá lách
Ông ăn năn thầm trách
Giết chú chó trung thành
Rút dao là hạ sách
Khi chưa rõ sự tình
Suy xét cần phân minh
Dù tai nghe mắt thấy
Sự thật thường rối tinh
Chứ không đơn giản vậy
Từ sau sai lầm ấy
Ông bỏ thú săn mồi
Thú cũng như người đấy
Chỉ chết một lần thôi
Dạ thú và lòng người
Đều chứa điều sâu thẳm
Chuyện hai năm rõ mười
Lắng nghe và suy ngẫm",dạ chó lòng người,,Đinh Kim Chung,https://poem.tkaraoke.com/64396/.html
"GÓT HÀI VẠN LÝ
(Ngũ độ thanh, nhất vận)
Dẫu thiếu bàn chân chẳng bận lòng
Coi là trả nghiệp kiếp này xong
Chưa từng nhỏ lệ đêm trời cóng
Lại vẫn cười môi buổi gió nồng
Giữ lạc quan đời thong thả sống
Mang bình thản phận sẵn sàng xông
Đôi hài vạn lý làm mô phỏng
Để mãi ngàn sau đẹp gót hồng",gót hài vạn lý,,Đinh Kim Chung,https://poem.tkaraoke.com/64397/.html
"(Ngũ độ thanh, bát láy)
Nhìn em bỗng chợt tái tê lòng
Khoảnh khắc yêu đời dẫu tạc xong
Phận hẩm hiu rèn tâm mãi trắng
Thân tàn tật giữ má luôn hồng
Thương người cẳng cụt vui vầy sống
Trách kẻ chân dài não nuột xông
Chỉ tấm gương vàng soi lặng lẽ
Mà sao dạ vẫn xót xa nồng",khoảnh khắc vàng,,Đinh Kim Chung,https://poem.tkaraoke.com/64398/.html
"Thuyền càng trống rỗng trong lòng
Lại càng khó đắm trên dòng Tương Tiêu
Lòng người trống rỗng đã nhiều
Cớ sao vẫn đắm trong yêu dại khờ?.",lòng thuyền lòng người,,Đinh Kim Chung,https://poem.tkaraoke.com/64399/.html
"Phố xưa lạnh lẽo heo may
Nhấp nhô mái nhà sương phủ
Phù vân che khuất trăng gầy
Hàng dương liễu buồn tóc rũ
Có một người đi trốn ngủ
Bước chân như đếm gạch đường
Ôm hoài niệm xưa ấp ủ
Bao ngày tháng cũ sầu vương
Lối xưa cỏ lạ vô thường
Người chưa nói lời ly biệt
Ngày xưa lũ muỗi ghen tuông
Ghé vào nụ hôn tha thiết
Người mang những điều bất diệt
Đi theo phía cuối chân trời
Để cho nỗi buồn da diết
Dâng trào như sóng biển khơi
Phố xưa mưa vẫn tả tơi
Những ngọn đèn khuya vẫn sáng
Nhưng mùa yêu đã qua rồi
Nên lời ngọt xưa cũng đắng
Người đi đã sờn áo trắng
Người về ôm bóng cà sa
Còn nghe nhạc tình văng vẳng
Len trong tiếng khấn Di Đà
Lũ côn trùng hát đồng ca
Hình nhân chập chờn nhảy múa
Nàng trăng trẻ mãi không già
Cởi đi áo mây vàng úa
Phố xưa nhà ai hé cửa
Chiếu chăn lay lắt rơi thềm
Có một người châm đốm lửa
Lập lòe đom đóm vào đêm
Lối xưa bước lạ đường quen
Tình đâu phải rao bán chợ
Bỗng nghe sầu đắng lên men
Nghẹn ngào cất trong tiếng thở
Đàn không có người nghe nữa
Bá Nha mới đập dao cầm
Phố xưa cố quên càng nhớ
Cung tình lỗi nhịp tri âm...",phố xưa,,Đinh Kim Chung,https://poem.tkaraoke.com/64400/.html
"Hôm qua có một chú nhờ:
Anh ơi trừng trị con bồ giúp em!
Bởi vì nó có thói quen
Nó dùng từ ""Ứ!"" với em quá nhiều!
Ngỏ lời nó bảo ""Ứ yêu!""
Rủ bơi nó dọa ""Ứ liều...Si đa!""
Đến nhà nó bảo ""Ứ ra!""
Bỏ về nó nguýt ""Ứ là đàn ông""
Liếc tình nó bảo ""Ứ trông!""
""Lớp viu"" nó giả ""Ứ! Không hiểu gì!""
Mời ăn nó bảo ""Ứ chi!""
Tặng hoa nó quát "" Vứt đi Ứ cần!""
Ghé ngồi nó bảo ""Ứ gần""
Rủ đi hiphop ""Ứ! Chân đau nè""
Thầm thì nó bảo ""Ứ nghe!""
Nói to nó quở ""Ứ đe dọa à?""
Ngắm trăng nó bảo ""Ứ ma!""
Hát vui nó lắc ""Ứ ka ô kề!""
Khen xinh nó bảo ""Ứ chê""
Hứa thì nó vẹo ""Ứ thề thốt điêu""...
Biết anh phù thủy tình yêu
Giúp em cho biến mất tiêu từ này
Ồ zê! Anh giúp chú ngay
""Lại đây anh mách (...) chú mày nhớ nha!""
Hôm nay thấy nó ghé nhà
Dáng người mệt nhọc kề cà vuốt râu
Anh ơi! Vẫn chẳng được đâu
Đêm qua nó nói tỷ câu ""..Ứ..ừ!""
Nói đâu! Bố tổ thằng ngu!
Đấy là nó sướng đứ đừ nó rên...",phù thủy tình yêu,,Đinh Kim Chung,https://poem.tkaraoke.com/64401/.html
"Một hôm ta hỏi hoàng hôn
Bao giờ trăng sẽ vùi chôn mặt trời?
Hoàng hôn tím mặt trả lời
Khi nào Nhật thực trăng lơi lả tình
Một hôm ta hỏi bình minh
Bao giờ trăng sẽ tái sinh mặt trời?
Bình minh đỏ mặt trả lời
Khi nào Nguyệt thực trăng rơi rớt thềm
Một hôm ta hỏi bóng đêm
Bao giờ trăng sẽ bỏ quên mặt trời?
Bóng đêm tối mặt trả lời
Khi nào cõi thực sống hời hợt thêm
Một hôm ta hỏi chính em
Bao giờ em sẽ đến bên cuộc đời?
Bỗng em ngoảnh mặt trả lời
Khi nào hiện thực không vời vợi xa",nhật vấn,,Đinh Kim Chung,https://poem.tkaraoke.com/64402/.html
"(Ngũ độ thanh, liên hoàn thuận nghịch vận*)
Đời ai cũng có nụ hôn ĐẦU
Tưởng dễ quên mà khắc đậm SÂU
Bởi cứ êm đềm khi nghiệt ngã
Vì không nhạt nhẽo lúc cơ CẦU
Lần nghe nhạc trỗi nồng ân trước
Buổi ngắm mây vờn vẹn nghĩa SAU
Vỉ thuốc thời gian rồi sẽ kiệt
NÀO KHÔ CẶP MẮT ĐÃ HOEN SẦU
NÀO KHÔ CẶP MẮT ĐÃ HOEN SẦU
Dẫu hận trong lòng kẻ đến SAU
Ái nặng ngàn cân còn nỡ bỏ
Tình xa vạn lý chẳng mong CẦU
Gieo thầm nỗi nhớ trong tàn lụi
Giữ trọn câu thề chốn thẳm SÂU
Lặng lẽ mình ta sầu khắc khoải
Buồng tim rũ rượi tiếng yêu ĐẦU
Ghi chú:
* Liên hoàn thuận nghịch vận: Bài sau liên hoàn bài trước, câu cuối bài trước là câu đầu bài sau, vận bài sau ngược vận bài trước, các từ còn lại không được trùng.",nụ hôn đầu,,Đinh Kim Chung,https://poem.tkaraoke.com/64403/.html
"Có người quả phụ sống làm thuê
Phận lấy chồng xa khổ tứ bề
Của ít con nhiều thân héo hắt
Từ ngày xuất giá chửa về quê
Một chiều buốt lạnh gió mùa Đông
Bà tạm biệt con với mẹ chồng
Về đội tang cha vừa bệnh thác
Lệ nhòa đôi mắt mỏi mòn trông
Con tầu đã chuyển mấy sân ga
Những gánh hàng rong, những cụ già
Những cánh đồng hoang vừa hết vụ
Xứ người từa tựa giống quê cha
Ai đời hiểu hết chữ ngờ đâu
Tiếng điện thoại reo át tiếng tầu
Bà ngất lịm vì tin dữ đến
Mẹ chồng đuối nước giữa dòng sâu
Họa vô đơn chí, họa liền thân
Phúc bất trùng lai, phúc chửa lần
Đi tiếp hay là quay trở lại?
Sao bà nghĩ được để bày phân
Trên tàu lữ khách cũng buồn lây
Họ mách bà nên ngược chuyến này
Phận nữ tam tòng, câu hiếu lễ
Con đầu dâu trưởng hãy về ngay!...
Xuống ga bà trở lại quê chồng
Một phúc phận người một số không
Hai mất một đau ba bốn khổ
Chít tang đâu quấn được năm vòng!
Thôi thì cũng một kiếp làm dâu!
Tàu ngược thành xuôi nếu đổi đầu
Phận bạc đời đen tang đội trắng
Chung đường, khác bến khách về đâu?!...
Bài họa nối Nguyễn Văn Vũ
NỖI NIỀM NGƯỜI QUẢ PHỤ
Ba tháng mười ngay cúng mẹ chồng
Thân gầy trĩu nặng mấy đầu cong
Con còn nhỏ dại bà đem gửi
Trở lại quê cha cháy bỏng lòng
Vượt quãng đường xa qua mấy sông
Mênh mông sương khói gió hanh nồng
Mồ cha đã lạnh chiều sương phủ
Táng ở nơi nào ai biết không!?
Lệ chảy trên môi héo hắt gầy
Đây rồi lối ngõ tuổi còn ngây
Đèn hương đã lạnh trùm linh vị
Nỗi xót xa đau quặn tháng ngày
Mấy cậu mấy cô biết đã về
Băng rào gai nhọn đến xun xoe
Rủa nguyền táng tận bà vô nghĩa
Xả hết gắt gao những chửi thề..
Nuốt lệ tuôn tràn cay đắng chan
Cồi hương đã lạnh gió lay mành
Run run tay vặn đèn dầu cạn
Di ảnh cha già sao héo khan!
Trước cửa bà con vẫn nặng lời
Trong nhà lệ mót cứ tuôn rơi
Nào ai thấu được lòng đang chết
Chết bởi nhân tâm chết bởi đời
Nâng mảnh khăn tang trắng rợn người
Đeo vào tóc bạc trắng hơn vôi
Được dăm ba phút bà treo lại
Có hiểu lòng con hỡi cuộc đời!
Đó kiếp làm dâu,kiếp mẹ chồng
Xoay người phụ nữ lắm long đong
Trọn đạo nơi này tan hiếu nọ
Chẳng vẹn còn oan bởi lộn sòng!
Hỡi thế nhân ơi hãy thấu giùm
Tâm người phụ nữ lắm bao dung
Xin đừng nặng nhẹ thêm tàn nhẫn
Để nửa bên kia phải não nùng",chuyện người quả phụ,,Đinh Kim Chung,https://poem.tkaraoke.com/64404/.html
"(Lục bát trường điệp)
Một hôm ta ngắm CHÂN ta
Ngỡ ai nu nống nu na CHÂN mình
Còn mang nặng tấm CHÂN tình
Ngày em đặt dấu CHÂN xinh vào đời
Ta ngồi vẽ lại CHÂN trời
Chìm trong bọt sóng xa vời CHÂN mây
CHÂN thành ta với vòng tay
Yêu em CHÂN thật đến day dứt lòng
Rồi tình nhẹ tựa CHÂN không
Dấu CHÂN người bước còn lồng qua tim
Lệ trào khóe mắt CHÂN chim
Người đời gian dối sao tìm CHÂN phương
Tình yêu dồn đến CHÂN tường
Đớn đau một kiếp vô thường CHÂN nhân
Đã từng chung bước CHÂN trần
Sao tình chết đứng như CHÂN cột đèn
Dốc tình in gót CHÂN êm
Câu CHÂN, thiện, mỹ người quên thật rồi
Cuộc tình CHÂN thực chia phôi
Mình ta mỏi bước CHÂN côi địa đàng
Hương tình rớt rụng CHÂN nhang
Từ khi người bước CHÂN sang vĩnh hằng
CHÂN ta mỏi bước đường trăng
Đành xoa dấu vết dịu dàng CHÂN em
Hồn xưa tạc dấu CHÂN quen
Bước so lại bước CHÂN thêm nhạt nhòa
Ngày phai nhạt dấu CHÂN qua
CHÂN thành giữ lại, ngọc ngà đánh rơi",phai dấu chân qua,,Đinh Kim Chung,https://poem.tkaraoke.com/64405/.html
"(Ngũ độ thanh)
Cứ tưởng làm thơ sẽ vợi sầu
Nhưng rồi có nở được cười đâu
Ông Hàn bán nguyệt đâu ngồi chỗ
Lão Khuyến ôm cần chả giật câu
Hận bởi quân hèn như muỗi đốt
Đau vì lũ khốn tựa ruồi bâu
Ôi đời cũng chỉ là canh bạc
Để cõi hồn ta trút lệ rầu!",sự đời,,Đinh Kim Chung,https://poem.tkaraoke.com/64406/.html
"(Nguồn báo chí trong nước)
Lịch sử vốn rất cần sòng phẳng (1)
Nhạy cảm không, cũng chẳng hận thù (2)
Máu cha ông tạc thiên thu
Vết lần theo bước chinh phu thuở nào
Người Trung Quốc khơi mào cuộc chiến
Tháng hai năm bảy chín xảy ra
Vì sao súng dậy sơn hà
Thử xem bối cảnh địch ta bấy giờ
Quan hệ Việt - Trung - Xô phức tạp
Cảm nhận hơi lửa giáp bao vây
Khi Xô - Việt nắm chặt tay
Chống Xô ta đã chối ngay thẳng thừng (3)
Trung Quốc thử khả năng tiếp sức
Và đong đo tiềm lực quân cơ
Nhằm ngăn hiểm họa Liên Xô
Bao vây chiến lược rồi cô lập mình
Khi Trung - Việt tình hình căng thẳng
Campuchia cũng chẳng ngồi yên
Được Tàu bảo trợ ưu tiên
Leo thang xâm lấn khắp miền Nam ta
Môi nếu hở ắt là răng lạnh
Người dân thường sao tránh lầm than
Sống trong địa ngục trần gian
Khmer Đỏ sát hại dân quá nhiều
Trong đó có cả kiều dân Việt
Lũ tội đồ cần diệt bỏ ngay
Trung Hoa căm hận việc này
Tiến hành cuộc chiến để xoay thế cờ
Phía biên giới bấy giờ bất ổn
Và biển Đông xáo trộn khôn lường
Việt Nam cải tạo công thương
Hoa Kiều ồ ạt hồi hương từng đoàn
Bên ngoài mặt mưu toan là vậy
Nhưng còn điều che đậy bên trong
Việc tranh quyền lực chưa xong
Ắt dân tình cuốn vào vòng chiến chinh
Vị thế Đặng Tiểu Bình khi đó
Đang giữ ba chức phó trong tay (4)
Thâu quyền lực hết khó thay
Nếu không đảo chính ắt bày chiến tranh
Vì xu hướng tả khuynh trong nước
Vẫn còn đang chạy trượt theo đà
Chương trình cải cách mở ra
Có nhiều tiền bối không hòa với ông
Quyết đột phá từ trong Quân đội
Đặng Tiểu Bình mở lối chiến tranh
Để nhằm thay máu quân binh
Quả nhiên việc đó đã thành công ngay
Trung Quốc đã bắt tay với Mỹ
Nhưng mục tiêu cũng chỉ vì mình
Kẻ thù bỗng hóa đồng minh
Cuộc trăng mật ấy trung bình 10 năm (5)
Trung Quốc cũng âm thầm chứng tỏ
Liên Xô tuy khó bỏ đồng minh
Nhưng khi bất lợi cho mình
Họ đâu tham chiến lúc tình hình căng
""Dạy bài học"" thay bằng đi học
Hai vạn quân xác bọc chiến trường
Hơn ba vạn khác bị thương (6)
Chưa đầy một tháng lên đường ngoại xâm
Không ép được Việt Nam rút khỏi
Campuchia lửa khói mịt mờ
Không làm thế giới nghi ngờ
Khả năng sức mạnh Liên Xô thế nào
Không chấm dứt được bao đụng độ
Nơi biên thùy máu đổ đạn rơi
Không lôi được Mỹ vào chơi
Liên minh quân sự xa rời Liên Xô
Không xóa được diễn trò hổ giấy
Gây chiến tranh sập bẫy chiến tranh
Một dân tộc Việt hùng anh
Đã mười bốn trận chiến phanh xác thù
Cuộc chiến tạc thiên thu vạn đại
Để lại bao tác hại khôn lường
Nhưng vì gác lại đau thương
Vài dòng ghi nhớ máu xương một thời.
(1), (2): Lời phát biểu của Phó chủ tịch nước Trương Mỹ Hoa và thiếu tướng Lê Văn Cương.
(3): Cố TBT Lê Duẩn đã thẳng thừng từ chối tham gia Liên minh chống Liên Xô.
(4): Phó chủ tịch nước, phó chủ tịch Quốc vụ viện, phó chủ tịch Quân ủy Trung ương
(5) Mỹ bên ngoài cô lập nhưng đã ngầm giúp Trung Quốc trong cải cách về tiền bạc và kỹ thuật. Nhờ những yếu tố này, Trung Quốc tiếp tục đứng vững sau khi Liên Xô sụp đổ. - Lời Lưu Á Châu
(6): Số liệu tương đối của wikipedia. Theo báo Quân đội nhân dân số Trung Quốc chết và bị thương là 62.500 người.",góc nhìn cuộc chiến,,Đinh Kim Chung,https://poem.tkaraoke.com/64407/.html
"(Ngũ độ thanh, thủ vĩ ngâm)
Khi đời vỡ giấc mộng phù du
Mới hiểu rằng yêu cũng hận thù
Bởi nghĩa vừa xanh ngày cuối Hạ
Nhưng tình đã bạc buổi đầu Thu
Buồng tim khúc nhạc trào lơ đãng
Kẽ lá màn sương phủ mịt mù
Tủi đắng trong hồn câu tiễn biệt
Khi đời vỡ giấc mộng phù du",giấc mộng phù du,,Đinh Kim Chung,https://poem.tkaraoke.com/64408/.html
"Thà rằng gặp giữa chiêm bao
Còn hơn diện kiến mà chao đảo hình
Thà rằng vạn lý đa tình
Còn hơn má ấp mà khinh khỉnh lòng
Thà rằng mép nhếch, môi cong
Còn hơn cười toét mà mong mỏi hoài
Thà rằng tình chẳng phôi thai
Còn hơn nửa đậm nửa phai nhạt màu
Thà rằng không phút ban đầu
Còn hơn kết thúc mà đau điếng hồn
Thà rằng tình đắp mồ chôn
Còn hơn sống giữa héo mòn thịt da
Thà rằng người chẳng yêu ta
Còn hơn yêu đấy mà qua quýt tình.",thà rằng,,Đinh Kim Chung,https://poem.tkaraoke.com/64409/.html
"(Thơ vui)
Cúng em một đĩa CHÂN giò
Mà nhai sao cứng như cho CHÂN gà
Ngày xưa em bóp CHÂN ta
Giờ em bám cẳng thằng cha CHÂN khuỳnh
Nhớ không bài hát ""CHÂN tình""
Hát xong mình lại bùng binh CHÂN giường
Dồn em vào tận CHÂN tường
CHÂN dài em quắp toàn xương úi giời!
Có hôm ra tận CHÂN đồi
Miệng em còn nói CHÂN hôi quá mà
CHÂN thon em dạng hết ra
Ta quờ gốc mít ngỡ là CHÂN em
Em rằng CHÂN cứng đá mềm
CHÂN thành mình sẽ kề bên suốt đời
Giờ em xa tựa CHÂN trời
Cái thằng CHÂN gỗ nó chơi xỏ mình
Nó vờ tụng niệm CHÂN kinh
Tung CHÂN nó đá phát mình bay ra
Cuỗm luôn mất cặp CHÂN ngà
Nghĩ mình CHÂN thật mới là thằng ngu
Bây giờ sống kiếp CHÂN tu
Mới hay chỗ tối âm u CHÂN đèn
Quên sao được cặp CHÂN quen
Nhưng tình đã chết CHÂN chen được gì
Chỉ cay CHÂN nó đen sì
Thế mà nó vẫn tình si CHÂN dài
Bây giờ biết bóp CHÂN ai
Tức sùi bọt mép ra ngoài CHÂN răng
Tự dưng mất cặp CHÂN căng
Giờ đi thất thểu như thằng...cụt CHÂN",chân gỗ,,Đinh Kim Chung,https://poem.tkaraoke.com/64410/.html
"gió cuốn bao sương cây lá khô
lác đác mưa tuôn trăng bóng ngô
trời  đông tuyết đổ trắng cây tô
long bong lờ lửng phất phơ ngát
trăng vờn lóng lánh mảnh tình khô
chim non mơn miết hạt tuyết trắng
một buổi chiều đông nhánh lá thô
hiu hiu lành lạnh hương màu ô
duyên tình nảy nảy xuông như trúc
tuyệt sáo mướt nốt sắc thiên thu
trổi gieo  ngất ngây  phương Nam tôi
nghìn năm chiếc bóng tuyệt đỉnh du ..........
HƯƠNG CAU THÔN GIẢ
hoa cau hương ngọc mùi bát ngát
vầng trăng thôn giả sắc PHONG LAN
hương xuân, hương thắm, hương ngây ngất
quyến rủ màu trăng em nhớ anh
Châu Pha hoa bút hàn tinh tú
chiếu rạng màu trời suốt muôn năm
rạt rào thăm thẩm thơ  HOÀNG HẠT
bến sông TIỀN chảy chia chín nhánh.
don't missing understand  reading !
December 21, 2016
Wednesday",mưa sương tô bóng,,Tlan Mưa,https://poem.tkaraoke.com/64411/.html
"Đã biết vì dân đổ máu xương
Ngại chi mưa nắng chỗ quân trường
Biên cương lũ giặc đang nhòm ngó
Hải đảo quân thù mộng bá vương
Tổ quốc nghìn cân treo sợi tóc
Thân trai một dạ quyết lên đường
Trót mang dòng máu con dân Việt
Đâu dễ e dè chút gió sương!
December 20, 2015",trách nhiệm,,Trần Bảo Kim Thư,https://poem.tkaraoke.com/64412/.html
"Vang vang nhạc Thánh khắp nơi nơi
Mừng Chúa minh linh giáng xuống đời
Sắc đỏ Trạng Nguyên mầu nhiệm phép
Cành xanh Thông Lớn lộc ơn trời!
Lòng thành con trẻ xin ban phúc
Đức tín bề trên dạy giữ lời
Ấm áp tâm hồn đêm dẫu lạnh
Ngoài trời hoa tuyết nhẹ nhàng rơi!
December 20, 2015",mừng giáng sinh,,Trần Bảo Kim Thư,https://poem.tkaraoke.com/64413/.html
"Từ tâm biển lớn chứa muôn dòng
Sóng cả thuyền con vẫn cứ dong
Khổ ải ngàn trùng đâu nản chí
Cam go vạn nẻo chẳng thay lòng
Đường xa biết rõ lừa thua ngựa
Thác ngược hay rằng cá hóa long
Dạ sắt gan đồng luôn vững chãi
Từ tâm biển lớn chứa muôn dòng
July 19, 2016",nhẫn,,Trần Bảo Kim Thư,https://poem.tkaraoke.com/64414/.html
