Edited,Title,Genre,Author,URL
"Anh trở thành một thằng say ngốc nghếch
Giữa màn đêm lếch thếch đến nhà em
Đèn còn treo nhưng cửa đóng cài then
Người bủn rủn lòng nặng thêm chín núi
Nghe như thể gặp gỡ nhau lần cuối
Chẳng chia ly, không khát đói gì tình
Anh trở thành thằng ngây dại riêng mình
Tim mục rữa và bập bềnh ngọn sóng
Đường về nhà ngắn bằng hai bàn cẳng
Anh thấy mình bay chốc thoáng thần tiên
Ôi chao ôi! Anh bỗng hóa thằng điên
Từ cái thuở biết yêu em sâu đậm
03.02.2020",thằng say,,Peter Hy Tấn,https://poem.tkaraoke.com/107713/.html
"Noel này em đã có ai chưa?
Trời sẽ lạnh và giăng mưa đó nhé
Anh thương em tấm hình hài nhỏ bé
Tựa vào vai anh thỏ thẻ đôi lời
Noel này em đừng để đơn côi
Đi dự lễ lẻ loi buồn lắm đấy
Trái tim khô chẳng bóng hình đọng lại
Đừng để lòng tê dại nữa nghe em
Noel này người xa vắng đôi bên
Xin gởi gắm tình lâu bền, em nhỉ
Chúa thương tình cho mình nên tri kỷ
Vạn mùa sau thêm ý nghĩa em ơi.
22.12.2019",lời tình mùa đông,,Peter Hy Tấn,https://poem.tkaraoke.com/107714/.html
"Rồi lâu dần ta cũng sẽ quên đi
Bảo cảm xúc có ùa về chăng nữa
Chẳng còn yêu liệu có còn lần lữa?
Bước qua nhau cũng đau khổ một thời
Tình đã qua không day dứt tình trôi
Như mây úa bên xa xôi hẻo lánh
Chẳng thèm mơ một chiều đông lơ đễnh
Nhạc không lời không ai sánh đôi chung
Lâu dần rồi anh cũng hóa người dưng?
Đông lại đến nhưng tình thương chẳng có
Anh dại khờ một lần yêu dang dở
Để bây giờ duyên lỡ chẳng lờI than
13.12.2019",mùa trống trải,,Peter Hy Tấn,https://poem.tkaraoke.com/107715/.html
"Anh yêu rồi mà chưa nói đấy thôi
Nhưng chờ đợi đến khi người gặp lại
Khi nắng xuân nở vàng hoa trên rẫy
Lúc ôm người người sẽ thấy tình yêu
Anh thương em nhẹ một thoáng mây chiều
Đời lặng lẽ và diều bay ngược gió
Anh sẽ chờ khi hoàng hôn lần nữa
Nắm tay em rồi sẽ ngỏ lời tình
Anh muốn nâng niu cho trọn đời mình
Bằng yêu mến chẳng mong manh lá cỏ
Nhưng sẽ là ngàn năm tươi máu đỏ
Nuôi sống tình bằng những khối yêu thương.
24.11.2019",anh sẽ nói yêu em,,Peter Hy Tấn,https://poem.tkaraoke.com/107716/.html
"Tràng Chuỗi Mân Côi em bỏ quên
Giữa đêm tăm tối mắt cay thêm
Sao em nỡ để hồn nguội lạnh
Nỡ hoang mạc hóa cả con tim
Tháng mười, tháng Mẹ qua quá nửa
Tràng Chuỗi bụi mờ vẫn nằm im
Em hỡi tham gì nhân thế nữa
Hạnh phúc hồn em đừng lãng quên
Nhắm mắt lại em, nghĩ về em
Hãy cầm Tràng Chuỗi, hãy đọc lên
Ngủ đủ lâu rồi. Em! tỉnh dậy!
Đừng để linh hồn khô héo thêm
Rồi em sẽ thấy mình đổi mới
Rạng ngời ánh mắt với bình minh
Ngọc quý là đây, là Tràng Chuỗi
Yêu Mẹ hồn em có an lành
19.10.2019",nhắc em,,Peter Hy Tấn,https://poem.tkaraoke.com/107717/.html
"THƠ CÓ LÀ HẠNH PHÚC
Thơ có là hạnh phúc
Sao em mãi đi tìm
Anh một đời nhẫn nhục
Thắp lửa hồng lặng im
Thuyền qua sông sợ chìm
Bên bến bờ lơ đãng
Em hiền như hoa tím
Anh khật khùng lang thang
Như đắng cay bẽ bàng
Cháy hồn người miên viễn
Em là hoa ánh sáng
Anh là mùa vô biên
Gió thổi qua đường viền
Ru ngoan tình không đến
Em hãy là ánh điện
Để anh còn lãng quên
Trần Minh Hiền Orlando ngày 27 tháng 6 năm 2020
ALL THE WAY
We can go all the way to the end of rainbow
To see what you can do to show
Love is ridiculously messy to grow
Let it go and let it be slow
Trần Minh Hiền Orlando June 27, 2020",thơ có là hạnh phúc,,Trần Minh Hiền,https://poem.tkaraoke.com/107718/.html
"TÔI.
Tôi là kẻ mộng mơ
Đi lang thang trời đất
Đi tìm ánh trăng mờ
Và tình yêu ngây ngất
Tôi là kẻ lang thang
Trong cuộc đời thơ lạc
Yêu hoa và ý nhạc
Yêu cả bầu trời hương
Và tôi thích yêu đương
Trong tôi một tình cảm
Cho lữ khách qua đường
Nhưng lòng không can đảm
Một tiếng yêu biến mất
Một con người đã đi
Tôi ở lại nghĩ gì
Mà tim đau_đau thật !",tôi,,Lê Đức,https://poem.tkaraoke.com/107719/.html
"TIẾNG CHIỀU
Chiều chiều ngồi nâng li bôi
Đôi mắt lấp đầy bóng tối
Hoàng hôn rã rời cánh mỏi
Còn ai lưu luyến bên đời
Chiều chiều ôm eo lưng thon
Ta còn em , vài sợi nhớ
Ta còn em , màu muôn thuở
Dăm câu nhỏ nhẹ tươi giòn
Chiều chiều trôi trôi hồn reo
Nghe lá bay vèo góc vắng
Mùa đi ngả nghiêng dốc nắng
Tình yêu rách rưới bèo nhèo
Chiều chiều tâm tư đi hoang
Dối gian , dối gian mọc cánh
Ai còn thả câu so sánh?
Ai còn bay bổng mây ngàn?
Chiều chiều giận dỗi buồn đau
Giọt lệ ngân sâu đáy mắt
Hiu hắt nằm bờ hiu hắt
Thời gian đã bạc mái đầu
Ngày 15/6/2020
Thiên Ân ( Bình Dương)",tiếng chiều,,Thiên Ân,https://poem.tkaraoke.com/107720/.html
"Xưa là Em Bé quậy
Ngu ngơ và thơ ngây
Lớn móng tâm Sư Tử
Ý hàng phục sơn hà
Trung niên là hiểu chuyện
Chuyễn hóa tánh Lạc Đà
Nặng bao nhiêu cũng chở
Mặc bảo cát đường xa
Sa mạc đêm lạnh giá
Ta kham nhẫn bước qua
Giờ tóc bạc tuổi già
Giả từ ngày sa mạc
An phận trong tháp ngà
Bé Ngoan giờ là ta...
PQT",em bé ngoan,,Phùng Quang Thuận,https://poem.tkaraoke.com/107721/.html
"Những con kiến nhỏ đứng huơ râu
Bên xác một con kiến không đầu
Chúng đứng vài giây rồi rời đi
Tiếp tục những bước chân buồn rầu
Không biết chúng nói gì với nhau
Mà trái tim tôi nghe rạn nứt
Tôi hiểu đó cũng là nghi thức
Dù vài giây cũng đủ thương đau...
PQT",nghi thức của kiến,,Phùng Quang Thuận,https://poem.tkaraoke.com/107722/.html
"Mưa trên núi Đại Bình
Mưa xuống Đại Lào
Mưa về Đại Nga...
Mưa trên những đồi trà
Nằm nghiêng lâu trong trí nhớ
Mưa lê thê
Mưa não nề
Mưa nhớ những hồn hoa
trong đại mộng
Mưa khóc cánh rừng già
mãi mãi hư không.
Đêm B'Lao
Không biết sao
Không ngủ
Nằm nghe khúc hòa âm dạ vũ
Bổng mênh mang
Giàn hoa cũ hiện về...
PQT",mưa b’lao,,Phùng Quang Thuận,https://poem.tkaraoke.com/107723/.html
"Phù Vân.
Năm năm thắm thoát trôi qua
Cầu ao, biển suối... la đà khói sương
Không gian chầm chậm về phương
Từ từ tan rã trên đường mù khơi...
Biết bao khung cảnh dưới trời
Từng say sưa ngắm, từng hồi ngẩn ngơ
Kia dòng sông chảy lững lờ
Nước xanh biên biếc, thẫn thờ gió trăng
Nọ mây phủ trắng đỉnh ngàn
Rừng thiêng tĩnh mịch vô vàn âm u
Ngọn hoang bất chợt vụt vù
Đong đưa rậm rạp nhẹ ru êm đềm
Đó khu vườn vắng canh đêm
Cành nghiêng lá rũ, lặng yên giấc nồng
Du dương thoang thoảng phập phồng
Lắc lư hạt đọng, long lanh chập chờn
Lắm ai ôm lấy cây đàn
Hiên khuya trầm mặc, mơ màng tiếng ca
Nỉ non khúc nhạc đậm đà
Gieo hồn lữ thứ ngân nga câu thề
Đầy dẫy khắp. theo hướng đi
Ẩn tàng, bộc lộ lê thê ảnh hình
Có nơi chan chứa hữu tình
Chỗ thì lấp loé, rung rinh, vật vờ...
Ta nay đã nát sau bờ
Bởi vì mỏng mảnh ơ hờ phút giây
Dẫu rằng cũng trải, cũng bay
Chỉ là một thoáng kéo dài chơi vơi...
28/06/2020
Nguyễn Thành Sáng",phù vân.,,Nguyễn Thành Sáng,https://poem.tkaraoke.com/107724/.html
"NỖI LÒNG HỒN LANG VỀ CÕI THẾ (18)
Choàng tỉnh mộng chập chờn nơi tâm não
Ảnh Mẹ hiền yêu dấu thuở ngàn xưa
Mắt Mẹ buồn, nhẹ đưa lời dạy bảo
Man mác lòng đau đáu, nỗi ngân nga...
Lang ngồi dậy nhìn tà dương trải bóng
Nghe gió chiều lồng lộng lắc nhành cây
Hình dĩ vãng chuỗi ngày trên biển sóng
Lần lượt về lởn vởn, tím trời mây
Cả Bộ Tộc bị bao vây cuồng sát
Sức thế cô, loạn lạc rã hàng binh
Cha giải tán đội hình rồi ẩn mặt
Nuôi dưỡng lòng sức bật nẻo sơn lâm
Khuya đêm ấy giặc truy tìm tận chỗ
Khí thế hừng, lố nhố giáo gươm khiên
Mở đường thoát Cha Con liều quyết tử
Đánh quân thù nghiêng ngả máu me tuôn
Lạc Mẹ Chị, băng đường sau trở lại
Gặp được rồi, giặc thấy đuổi nà theo
Bè lánh nạn đã neo gần đám sậy
Lẹ cả nhà xuống đẩy giữa hò reo
Phía sau lưng vèo vèo tên xối xả
Dưới xa xa mỏm đá nhấp nhô làn
Vượt, tránh né muôn phần đều mệt lả
Cuối cùng rồi cũng có được bình an
Dọc theo bờ biển, phăng phăng luồng nước
Xuôi hướng dòng, êm ả lững lờ trôi
Bất ngờ đâu lưng trời vang dội thét
Mây kéo đùn, sấm sét, ngập mưa rơi
Từng khoảnh khắc sóng nhồi cao hạ xuống
Đảo xoay tròn dữ tợn khối không gian
Giập mạnh cái! Lật ngang, đờ động đậy
Mé lam chiều tỉnh dậy, bóng lang thang...
""Hồn lang thổn thức theo nỗi nhớ…""
23/1/2016
Nhất Lang
(Nguyễn Thành Sáng)",nỗi lòng hồn lang về cõi thế (18)..,,Nguyễn Thành Sáng,https://poem.tkaraoke.com/107725/.html
"NỖI LÒNG HỒN LANG VỀ CÕI THẾ (19)
Trầm mặc ngước nhìn không gian diệu vợi
Lởn vởn hình, rười rượi hãy còn đây
Từng khoảnh khắc theo vòng xoay chuyển tới
Xuôi lững lờ gió thổi dạt làn mây...
Ánh mắt Mẹ Cha, bao lời dạy bảo
Cảm động tràn thấm thấu trọn vào sâu
Chút nhòe nhoẹt giọt sầu vương ửng khoé
Sâm sẫm màu dưới xế nhẹ tay lau
Day dứt nhớ thương bào mòn năm tháng
Chất ngất lòng, hụt hẫng khối tâm tư
Tất cả nầy cũng từ từ ngước thẳng
Phía lưng tầng rụng nắng thả trôi xa
Vi vu thoảng, ngân nga lời lá cỏ
Ánh lân tinh đâu đó lập loè phương
Tim giữa trái ứ buồn như muôn thuở
Mênh mang niềm lặng lẽ gửi hàn sương...
Lang tỉnh táo rồi vươn vai đứng dậy
Hướng dặm ngàn thoải mái lướt đi nhanh
Đỉnh rậm tán hình bâng khuâng lưu luyến
Giữa ngọn luồn rung chuyển bóng chiều đang...
Bầu nhàn nhạt tối dần, trùm hoang tịch
Loáng thoáng đâu rả rích điệp sầu ai
Vài nhánh đổ lắt lay màn mờ mịt
Chầm chậm dừng giây phút ngắm mây bay
Có con đường trải dài về cửu ngục
Nhiều quỷ quân kéo thúc tội đồ qua
Nơi cõi lạnh phơi bày ra tội phúc
Cán cân trời đến lúc xử hồn ma.
""Hồn lang lần về dương thế…""
24/1/2016
Nhất Lang
(Nguyễn Thành Sáng)",nỗi lòng hồn lang về cõi thế (19)..,,Nguyễn Thành Sáng,https://poem.tkaraoke.com/107726/.html
"MÓN SỨ GIẢ MÙA XUÂN
Xuân về mà én đi đâu
Lang thang tìm kiếm hồi lâu giật mình
Quán hàng zô nhậu linh đình
Mùa xuân mất sứ giả mình món zô
Mười nghìn một chú hét hô
Cánh đồng xanh lạc lẫn ngô ngút tầm
Chim mồi đặt bẫy âm thầm
Trẻ già trai gái tay cầm bẫy khua
Bẫy dài sáu mét lưới thưa
Rộng ba mét lận đủ vừa bắt thôi
Hay cho lũ én kia ơi
Thấy đồng loại khổ bỏ rơi việc mình
Sứ giả sập bẫy thất kinh
Xù lông gãy cánh hiếm hình hài nguyên
Đúng mùa ba bốn trăm tên
Mệnh danh sát thủ dấu tên mở lời
Lặng nhìn sứ giả xuân ơi
Mốt mai kí ức én thời báo xuân...
27/01/2014
Nguyên Hữu",món sứ giả mùa xuân,,Nguyên Hữu,https://poem.tkaraoke.com/107727/.html
"Phận số bi sầu lẫn trái ngang
Bao nhiêu nước mắt chực tuôn tràn
Niềm đau uất nghẹn buồn xơ xác
Nỗi khổ lưu đày hận chứa chan
Bạc bẽo tình duyên hồn lẻ bóng
Trầm ngâm số phận lệ hai hàng
Tơ lòng lỗi nhịp ôm hờn tủi
Tự trách sao đời lắm dối gian.
VÕ QUANG HÂN
Đà Nẵng 28 - 06 - 2016",đời lắm dối gian?,,VÕ QUANG HÂN,https://poem.tkaraoke.com/107728/.html
"(Ngày GIA ĐÌNH VIỆT NAM-TẶNG NHỮNG
MẢNH ĐỜI CÔ PHỤ)
Đêm ngọt ngào như xứ sở thần tiên
Hương thoang thoảng góc bình yên dung dị
Đan mộng ước trao nồng nàn kỳ vĩ
Kết duyên lành thi vị những vần thơ
Nối đôi bờ hạnh phúc đẹp như mơ
Con tim nhỏ vẫn hằng giờ rung động
Tình son sắt ngập tràn vương nhựa sống
Nỗi khát thèm trào lộng kiếp ba sinh
Ngọn lửa lòng trao gửi đón bình minh
Dòng suối tóc kết ân tình sâu đậm
Duyên thắm đượm vun trồng xây tổ ấm
Thu mơ màng cảm nhận khúc yêu thương
Góc yên bình rợp bóng mát quê hương
Lời ước hẹn vấn vương đầy xao xuyến
Tìm tri kỷ suốt cuộc đời tâm nguyện
Sống chung tình hoà quyện mãi không vơi
Nỗi khát thèm một tiếng gọi ""Mình ơi!""
Bờ môi mọng gọi mời trao ân ái
Niềm hạnh phúc sao vẫn còn xa mãi
Mối tơ sầu xin gửi lại người xưa!!!
VÕ QUANG HÂN
Đà Nẵng 28 - 06 - 2017",nỗi lòng cô phụ,,VÕ QUANG HÂN,https://poem.tkaraoke.com/107729/.html
"Mừng ngày Gia đình Việt Nam 28 - 06
Thương cha mẹ tuổi già sức yếu
Phận làm con chữ hiếu dạt dào
""Lên non mới biết non cao
Có con mới biết công lao mẹ già""
Ơn cha mẹ đậm đà luôn nhớ
Nghĩa sinh thành lúc thuở còn thơ
Mẹ ru hai tiếng ầu ơ...!
Trong vòng tay mẹ con thơ yên lòng
Cha mãi bận trăm công nghìn việc
Nhưng tình cha tha thiết thương con
Vì con sức khoẻ hao mòn
Tuổi già sức yếu sống còn bao lâu
Ơn cha mẹ tìm đâu cho thấy
Vì đàn con chẳng ngại gian lao
Công cha vời vợi núi cao
Vì con khổ cực chẳng nao phận mình
Chưa tròn giấc bình minh đã thức
Lo đàn con lao lực hình hài
Tảo tần lam lũ sớm mai
Con đau thức trọn canh dài bên con
Con khôn lớn không còn thơ dại
Lưng mẹ còng nắng dãi dầm mưa
Bàn chân chạy chợ sớm trưa
Bàn tay ấm áp nâng đưa thành người
Nhìn con nở nụ cười xinh xắn
Là mẹ quên cay đắng xác xơ
Dạy con từ thuở còn thơ
Mong con chắp cánh mộng chờ ươm mơ
Theo năm tháng mắt mờ tai điếc
Mẹ nuôi con không tiếc tấm thân
Mẹ hiền quảy gánh phong trần
Lo đàn con dại tảo tần ước ao
Bao cay đắng làm sao kể xiết
Bao mến thương chẳng viết nên lời
Mẹ cha đánh đổi cuộc đời
Cho con khôn lớn rạng ngời công danh.
VÕ QUANG HÂN
Đà Nẵng 28 - 06 - 2015",công đức sinh thành,,VÕ QUANG HÂN,https://poem.tkaraoke.com/107730/.html
"BÀI THƠ NIỆM PHẬT 06282020
(Gồm 1001 khổ thơ với 4004 câu thơ)
Trần Minh Hiền Orlando ngày 30 tháng 10 năm 2017
321.
Đoá sen bừng nở
Sáng trong tâm hồn
Giúp người cực khổ
Sống đời mênh mông
322.
Niệm Phật ở trong lòng
Niệm Phật ở trong tâm
Thương người và thông cảm
Giúp người và lắng nghe
323.
Thắp ngọn nến soi bóng đêm
Tu tâm dưỡng tánh hướng thiện
Sám hối ăn năn, ở hiền
Giúp đỡ mọi người thành công
324.
Bài thơ Niệm Phật thiết tha
Cho con hạnh phúc đi xa vào đời
Thương người đau khổ chơi vơi
Ước mong nhân thế mọi thời đều vui
325.
Mùa xuân em lễ Phật
Mùa hè em viếng Chùa
Mùa thu tâm Bồ Tát
Mùa đông thương chúng sanh
326.
Đoá vô ưu hé nở
Lòng con học lắng nghe
Cảm ơn Phật Bồ Tát
Cho cuộc đời chở che
327.
Như dòng suối nhân từ
Chảy trong hồn nhân thế
Bốn mùa qua ánh sáng
Nguyện cầu người bình an
328.
Thông cảm với mọi người
Con nghe lời Phật dạy
Giúp nhau cùng tinh tấn
Làm việc thiện, thẳng ngay
329.
Thương yêu cả cuộc đời
Thông cảm cho chúng sanh
Cùng nhau xây đời mới
Thắp sao trời long lanh
330.
Niệm câu kinh Di Đà
Từ bi và hỷ xả
Thông cảm và thứ tha
Yêu thương cõi ta bà
Trần Minh Hiền Orlando ngày 28 tháng 6 năm 2020",bài thơ niệm phật 06282020,,Trần Minh Hiền,https://poem.tkaraoke.com/107731/.html
"Nỗi nhớ khôn cùng em biết không?
Nhiều đêm thức trắng lệ tuôn dòng
Âu sầu dạ rũ vì trông ngóng
Ảo não thân gầy bởi đợi mong
Gác vắng đìu hiu đau xót phận
Phòng đơn lạnh lẽo tái tê lòng
Nên hoài nguyện ước câu duyên nợ
Kết chỉ se tình buổi cuối đông...!!!
VÕ QUANG HÂN
Đà Nẵng 26 - 06 - 2018",nỗi nhớ 03,,VÕ QUANG HÂN,https://poem.tkaraoke.com/107732/.html
"🤩TÌNH GIÀ..KẾT ÁI SE DUYÊN🤩
Chỉ hồng đẹp sắc tươi màu
Thời gian có chảy trước sau vẹn tình
Ta Em nhờ phước thần linh
Dẫn đường đưa lối chúng mình se tơ...
*
Dẫu rằng bóng ngã lặng lờ
Vào thu lá đổ nên thơ mặn nồng
Mặc cho đời cõi hư không
Ước ao tình mộng mây hồng bay cao...
*
Tình già gắn bó ngọt ngào
Phỉ lòng dầu muộn chiêm bao ta cùng
Nhặt về vạn lá xây chung
Ta Em dệt lấy tương phùng mai sau...😝🤩
*
Thu về nhuộm sắc trăm màu
Tình thu bóng xế qua mau cõi này
Nắm tay cùng ngắm mây bay
Hưởng ân ngọt ái tháng ngày còn đây...
*
Bỏ qua dĩ vãng hao gầy
Tình xưa lỡ hẹn tuổi ngây mất rồi
Bây chừ mình hết đơn côi
Tương lai mộng cuối bồi hồi tim yêu...
*
Nơi này thương nhớ em yêu
Thơ hành đôi khổ mỹ miều anh trao
Gởi mây theo gió mời chào
Đọc vui em nhé chiêm bao mặn mà...
*
Ta Em nồng ấm hoan ca
Tình già duyên cuối ngọc ngà..tiền duyên...🤩
Nguyễn Ngọc René  - Paris - 27/06/2020",🤩tình già..kết ái se duyên🤩,,-N3- Nguyễn Ngọc René,https://poem.tkaraoke.com/107733/.html
"MƯA BAY XÔ MÙA
Mưa bay ngoài hiên vắng
Anh vạn dặm mây ngàn
Tâm hồn em khoảng lặng
Đau đáu chuyện hợp tan
Mưa bay một vòng nhớ
Màu thời gian úa tàn
Con người muôn nặng nợ
Dấu chân sầu lang thang
Mưa bay tình khép lại
Tan chảy vào trang buồn
Những ngày xưa thân ái
Ngẫm lại thiệt là thương
Mưa bay ngày quay gót
Gượng gạo một nụ cười
Tình ai lên dây cót
Chôn vùi kỉ niệm rơi
Mưa bay mùa chật hẹp
Áo em thuở hững hờ
Mở ra rồi vội khép
Anh chân trời bơ vơ
Mưa bay thương yêu rụng
Tí tách chút hương thừa
Cung đàn thôi vỡ vụn
Nhặt một chùm chát chua
Ngày 16/6/2020
Thiên Ân ( Bình Dương)",mưa bay xô mùa,,Thiên Ân,https://poem.tkaraoke.com/107734/.html
"MỘT THOÁNG VU VƠ
Vu vơ ai thả lưng trời
Em còn ngồi đợi giữa trời mênh mông
Hạ về đỏ rực cháy lòng
Chiều hoang hoải nhớ long đong nửa vời
Lật trang lưu bút đầy vơi
Thương dòng suối tóc một thời ngây thơ
Tinh khôi áo trắng học trò
Đời trong trẻo , ai biết cho lòng mình?
Vu vơ vốn dĩ vô tình
Bến bờ chờ đợi còn in dấu hài
Mùa thi chạm ngõ bên tai
Chim non tung cánh hờn ai nhánh sầu?
Một ngày muốn nói thương nhau
Nghìn năm sau , nghìn năm sau ...u hoài
Bàn tay chưa nắm bàn tay
Bóng cây hạnh phúc bên ngoài ru thương
Vu vơ gói gọn đêm trường
Đeo mang góc tối phong sương mái đầu
Sông kia chảy mãi về đâu ?
Em gieo nhung nhớ dồn câu hẹn hò
Ngày 16/6/2020
Thiên Ân ( Bình Dương)",một thoáng vu vơ,,Thiên Ân,https://poem.tkaraoke.com/107735/.html
"DÀY THƯA NỖI NHỚ
Chiều hiu hắt lạnh trở phương này
Cảnh khói mây buồn vụn vỡ bay
Chốn cũ người đi tình ở lại
Nhà xưa ngõ đợi nắng qua ngày
Thương tà lụa mỏng vàng hoa cúc
Tiễn giọt mưa hồng héo cỏ may
Dọc hẻm thu choàng sương trắng vỡ
Vần thơ chửa ấm mộng thưa dày ./.
Lê Cảnh Tiến 29/06/2020",dày thưa nỗi nhớ,,Lê Cảnh Tiến,https://poem.tkaraoke.com/107736/.html
"Lên ông ngoại chính thức
Háo hức như trẻ con
Mon men tiến lại gần
Véo trộm má bé con.
******
Bé con nhoẻm miệng cười
Như muốn chào ông ngoại
Bé ơi bé ngoan nhé
Lớn ông dắt đi chơi.
(TT)",ông ngoại,,Trần Thản,https://poem.tkaraoke.com/107737/.html
"Hôm nay sao lòng thấy
Thẫn thờ chẳng thấy vui
Đứng đứng ngồi ngồi đó
Thì thào phủ bờ môi
Hôm nay sao lòng thấy
Lòng bơ vơ chẳng vui
Như nhớ ai đâu đó
Một bờ bến xa nơi
Hôm nay sao lòng thấy
Nhớ em nhớ chẳng vơi
Ngồi xuống tô nét chữ
Dòng thơ chẳng vui tươi
Hôm nay sao lòng thấy
Lạnh lùng giá lòng ơi
Rồi ánh chiều buông tới
Như yêu vẫn xa người
11.00 đêm 11.06.2017
hôm nay thơ thẩn đứng
lại ngồi",sao lòng thấy,,Bounthanh Sirimoungkhoune,https://poem.tkaraoke.com/107738/.html
"Ngó mây phủ đầy trời
Trong lòng chẳng thấy vui
Như lòng sầu xa vắng
Thương nhớ một bóng người
Ngó mây phủ đầy trời
Một mình ngồi nói ai
Ai an ủi mình đó
Ai cho mình tiếng cười
Ngó mây phủ đầy trời
Man mắc giờ phút trời
Mình ngồi qua đêm vắng
Hạt sường phủ thân người
Ngó mây phủ đầy trời
Nhớ rồi nhớ em ơi
Đêm nay lòng thầm gọi
Tên em xa cuối trời
07.50 đêm 12.06.2017
ngồi thơ thẩn ngó sương đông
lòng nhớ người",ngó mây,,Bounthanh Sirimoungkhoune,https://poem.tkaraoke.com/107739/.html
"Đừng quên một ngày mình quen nhau
Đừng quên lời nói khi ban đầu
Đừng quên thời gian mấy năm đã
Đừng quên từng đêm mình có nhau
Đừng quên mình quen đã bấy lâu
Đừng quên đừng để cho phai màu
Đừng quên từng mùa từng năm đến
Đừng quên mai ngày mình có nhau
Đừng quên lời hứa hẹn bao lâu
Đừng quên đường đi đã vắng nhau
Đừng quên lời an ủi khi sầu
Đứng quên lá vàng thu rụng đó
Đừng quên mình anh nhặt từng năm
Đừng quên mình cách cõi xa xăm
Đừng quên mình quen đã mấy năm
Đừng quên từng ngày ngập bão tố
Đừng quên từng giờ lòng có nhau
11.45.giờ đêm 12.06.2017
quen nhau thì cầu đừng có
quên nhau",đừng quên 5,,Bounthanh Sirimoungkhoune,https://poem.tkaraoke.com/107740/.html
"Chiều hôm ngắm nắng hạ vàng
Chiều buồn dạo bước lang thang tình sầu
Chiều nay dạo bước về đâu
Chiều nay lòng thấy thương sầu tiếc xa
Chiều nay ngó lá thu đưa
Chiều nay hạt gió lưa thưa cây cành
Chiều nay đường vắng phố hoang
Chiều nay ngó ánh nắng vàng chiều buông
Chiều nay lòng thấy thêm buồn
Chiều nay lòng đổ nhớ thương một người
Chiều nay bối rối bờ môi
Chiều nay như thấy đứng ngồi nhớ em
09.00 đêm 13.06.2017
chiều nay thơ thẩn đứng lại ngồi",chiều 5,,Bounthanh Sirimoungkhoune,https://poem.tkaraoke.com/107741/.html
"Tiếng ai bên trời đó
Sao lòng nhớ chẳng quên
Đêm nay lại nghe nữa
Tiếng lòng đổ qua đêm
Tiếng ai bên trời đó
Vọng vọng nghe qua đêm
Tiếng thở dài trôi tới
Gợn lòng đêm nhớ người
Tiếng ai bên trời đó
Nhập sâu cả trong tim
Để lòng anh buồn nhớ
Thẫn thờ lòng nhớ em
Tiếng ai bên trời đó
Như kêu gọi yêu thương
Lòng anh thêm buồn bã
Thiết tha qua đêm dài
11.00 đêm 13.06.2017
đêm thì thào gọi tên em",tiếng ai 4,,Bounthanh Sirimoungkhoune,https://poem.tkaraoke.com/107742/.html
"Không hãm được đêm nay
Hồn anh trôi cuối trời
Sao hãm được lòng ấy
Lòng thấy yêu một người
Không hãm được đêm nay
Yêu thương nặng vai gầy
Khi mình xa nhau đó
Không rượu mà lòng say
Không hãm được đêm nay
Sương đông trắng phủ đầy
Phủ ngập cả đường ngõ
Thêm nhớ em đêm nay
Không hãm được đêm nay
Man mắc lòng yêu say
Ngồi ngó về nơi đó
Nơi có mối yêu người
08.00 đêm 14.06.2017
sao hãm được lòng nhớ
người đêm nay",không hãm được,,Bounthanh Sirimoungkhoune,https://poem.tkaraoke.com/107743/.html
