Edited,Title,Genre,Author,URL
"QUÊ HƯƠNG
Dù ở đâu
Dù ở     chốn nơi nào.
Tôi vẫn nhớ
Về quê hương yêu dấu.
Ôi nỗi nhớ	da diết    khôn nguôi
Và trái tim	nhỏ nhoi   thường nhắc,
Quê hương ơi
Một thời thơ trẻ
Một thời vấn vương
Một thời nhớ thương,
Một thời   ta đã có
Một tình yêu nồng cháy.
Quê hương ơi
Tôi đã tới muôn nơi
Nhưng làm sao	tôi thể quên Người
Người đã chiếm    một phần rộng lớn
Cứ lan dần    trong    trái tim tôi.
Quê hương ơi
Người là tất cả
Là tất cả   trong  trái tim tôi
Là tất cả   trong tâm hồn   tôi đó.
Bởi vì Người      cho tôi đôi cánh lớn
Cho tôi bay  đến tận trời  xanh,
Rồi dang tay      Người lại đón tôi về
Trong tình yêu    rộng mở là   quê hương…
03.2000
Nguyên Hữu",quê hương 2,,Nguyên Hữu,https://poem.tkaraoke.com/123746/.html
"CHIỀU TAN TRƯỜNG
Chiều tan trường ta không chờ nhau nữa
Hàng phượng trở sầu, chiếc lá hư hao
Trách móc nhau chi ngày nao em hứa
Nương tựa bờ vai, đầu sát mái đầu
Chiều tan trường ai đạp mùa vụng dại?
Cỏ cây guộc gầy từ độ người đi
Đôi hài nâng niu vừa chân con gái
Tiếng thời gian chầm chậm chẳng nói gì?
Chiều tan trường ngẩn ngơ tà áo đẹp
Hương bốn mùa còn quấn quýt đâu đây
Trái tim một thời mở ra rồi khép
Ngày  cuối tuần ai liếc mắt nhìn ai?
Chiều tan trường bóng chim non vỗ cánh
Bỏ lại phương trời một góc yêu thương
Điệu bộ ỡm ờ nhánh tình sang chảnh
Ngọn gió đi hoang đâu chốn thiên đường
Chiều tan trường em trôi vào hun hút
Chuỗi hư không chẳng chịu mọc lá mầm
Bánh xe tình yêu lăn đi vùn vụt
Ngẫm cười đau nhoi nhói cả nghìn năm
Ngày 3/12/2023
Thiên Ân ( Bình Dương)",chiều tan trường,,Thiên Ân,https://poem.tkaraoke.com/123747/.html
"VỀ THĂM TƯƠNG BÌNH HIỆP
Viết theo yêu cầu của D.T.K ( Bí thư Đảng ủy phường Tương Bình Hiệp ) .
Thương Tương Bình Hiệp đất lành chim đậu
Làng sơn mài truyền thống đã bao năm
Bàn tay người thợ kì công in dấu
Nét đẹp tài hoa cảm xúc lặng  thầm
Đây sông Sài Gòn ngày đêm cuộn chảy
Bồi đắp phù sa cây trái ngọt lành
Thời thiếu nữ khoe đường cong mềm mại
Mặt trời lên bừng sáng  một bức tranh
Đây là Suối Giữa, Rạch Nai, Rạch Nhảy...
Mát mẻ những vùng sinh thái yêu thương
Đi qua chiến tranh vươn vai sống mãi
Tuổi hai mươi ươm giấc mộng đời thường
Đây những con đường ngược xuôi , đây đó
Nguyễn Chí Thanh, Hồ Văn Cống, Lò Lu
Lê Chí Dân, Phan Đăng Lưu... muôn thuở
Ngọn cỏ gió đùa đường Bùi Ngọc Thu...
Nghề làm lu ăn sâu trong kí ức
Bốn mùa trôi mau chiếc bóng quê hương
Đôi tay nâng niu, trau dồi  kiến thức
Hoàng hôn ùa về ôm ấp tình thương
Thương ngôi đình đã rêu phong cổ kính
Theo thời gian mưa gió đã già nua
Mái ngói thâm nâu một trời bịn rịn
Hàng cây nghiêng mình bóng lá trêu đùa
Ngày mai nơi đây khoác mình áo mới
Người với người sống hòa nhã ,thủy chung ...
Tổ ấm êm đềm ngày xanh vời vợi
Phù Đổng vươn vai bay cao muôn trùng
Ngày 22/12/2023
Thiên Ân ( Bình Dương )",về thăm tương bình hiệp,,Thiên Ân,https://poem.tkaraoke.com/123748/.html
"MỘT GÓC HẸN HÒ
Thân tặng : L.B.P.L ( GV trường THPT BÌNH PHÚ ) & "" Phu nhân"" B.T.H.G .
Trời xanh, mây trắng vờn bay
Một ngày tóc ngắn, tóc dài bên nhau
Lòng Hồ Dầu Tiếng nghiêng chao
Lắng nghe sóng vỗ nôn nao tâm hồn
Vòng tay hạnh phúc bồn chồn
Gam màu cuộc sống tươi non bốn mùa
Êm đềm, ngọn cỏ gió đùa
Thương đàn cá lội sớm trưa dòng đời
Về đây gom nét tinh khôi
Đôi chân vạn dặm rong chơi miệt mài
Chim trời vỗ cánh tung bay
Hương thời gian rụng đắm say lòng người
Đi qua lứa tuổi đôi mươi
Đó đây, đây đó tiếng cười giòn tan
Lang thang , mòn mỏi, lang thang
Cuối năm nhật kí sang trang bao giờ ?
Về đây sống đẹp giấc mơ
Quê hương chiếc bóng đợi chờ tháng năm
Mặt hồ một thoáng xa xăm
Khoan thai, dìu dặt , bổng trầm mơn man
Về đây lượm lặt mộng vàng
Ngân nga muôn tiếng cung đàn reo vui
Sẻ chia, cay đắng bùi ngùi ...
Cảm ơn trời đất, đất trời thanh tân !
Một ngày , hò hẹn xa gần
Bức tranh nhân thế bâng khuâng muôn đời
Ngày 1/1/2024
Thiên Ân ( Bình Dương )",một góc hẹn hò,,Thiên Ân,https://poem.tkaraoke.com/123749/.html
"KHÚC NHẠC TÌNH BUỒN – 1
“Thơ Nhạc”
Mây đen… lắc vạt lưng trời
Hồn hoang nửa mảnh… ngậm ngùi, bâng khuâng…
ngậm ngùi, bâng khuâng…
Lệ hờn… rụng bóng thời gian…
Sông Tương đôi ngả…ngàn năm u hoài…
ngàn năm u hoài…
Đường anh…. sỏi đá nát hài…
Đời em rung chuyển…ánh xoay chập chờn…
ánh xoay chập chờn…
Mưa rơi… đẫm ướt cung đờn
Bầu phơi rực nắng… từng cơn vật vờ…
từng cơn vật vờ…
Đẩy anh… sát nách quạnh bờ….
Lôi em mỏm đá… bơ phờ gió sương…
bơ phờ gió sương…
Trăng nghiêng… vướng xám trăng buồn
Tình đau dang dở… tình vương vấn sầu…
tình vương vấn sầu…
Để kia… khóc mối duyên đầu
Một đời nỗi nhớ… lòng nào chơi vơi…
lòng nào chơi vơi…
Cho đây… khúc nhạc không lời
Ru treo tuyết lạnh… đầy vơi ảnh hình…
đầy vơi ảnh hình…
Sông dài…. sóng nước lênh đênh
Thuyền thơ một chiếc… thuyền quên mái chèo…
thuyền quên mái chèo…
Yêu thật nhiều… yêu lắm điều…
Dẫu nay đã mất…niềm yêu chẳng dừng…
Niềm yêu chẳng dừng…
Cây già… rũ nhánh hoàng hôn…
Tình anh lỡ chết…tình chôn thể nào?…
Tình anh lỡ chết…tình chôn thể nào?…
Thương em… thương biết là bao
Giờ thương chẳng thấy… giờ đau mấy lần?…
giờ đau mấy lần?…
Ô hay! Ô hay… giữa giấc muộn màng
Hồn em nức nở… hồn anh thẫn thờ…
hồn anh thẫn thờ…
Đâu rồi… con nhện giăng tơ?…
Cho tình hai đứa… vườn mơ trở về…
vườn mơ trở về…vườn mơ trở về…
05/12/2023
Nhất Lang
(Nguyễn Thành Sáng)
—————————————-
KHÚC NHẠC TÌNH BUỒN – 1
“Thơ Lục Bát”
Mây đen lắc vạt lưng trời
Hồn hoang nửa mảnh ngậm ngùi, bâng khuâng
Lệ hờn rụng bóng thời gian
Sông Tương đôi ngả, ngàn năm u hoài…
Đường anh sỏi đá nát hài
Đời em rung chuyển, ánh xoay chập chờn
Mưa rơi đẫm ướt cung đờn
Bầu phơi rực nắng, từng cơn vật vờ
Đẩy anh sát nách quạnh bờ
Lôi em mỏm đá, bơ phờ gió sương
Trăng nghiêng vướng xám trăng buồn
Tình đau dang dở, tình vương vấn sầu
Để kia khóc mối duyên đầu
Một đời nỗi nhớ, lòng nào chơi vơi
Cho đây khúc nhạc không lời
Ru treo tuyết lạnh, đầy vơi ảnh hình
Sông dài sóng nước lênh đênh
Thuyền thơ một chiếc, thuyền quên mái chèo
Yêu thật nhiều, yêu lắm điều
Dẫu nay đã mất, niềm yêu chẳng dừng
Cây già rũ nhánh hoàng hôn
Tình anh lỡ chết, tình chôn thể nào?
Thương em, thương biết là bao
Giờ thương chẳng thấy, giờ đau mấy lần?
Ô hay ! Giữa giấc muộn màng
Hồn em nức nở, hồn anh thẫn thờ
Đâu rồi con nhện giăng tơ
Cho tình hai đứa vườn mơ trở về…
05/12/2023
Nhất Lang
(Nguyễn Thành Sáng)
Một phong cách sáng tạo mới trong thơ ca đó là ""THƠ NHẠC"",
do nhà thơ Nhất Lang (Nguyễn Thành Sáng) mới sáng tạo.
Ngoài Thể Thơ Lục Bát căn bản, cấu trúc từ vựng sao cho đúng
vần điệu, đúng nghĩa trong câu thơ, bài thơ.
Còn có thêm một nghệ thuật đặc biệt nữa là cấu trúc từ vựng theo
các dấu làm sao để người đọc có thể ngân nga bài thơ âm điệu
trầm bổng, réo rắt, du dương...gần giống như một bản nhạc vậy!
Tác giả đã sáng tác ra loại THƠ NHẠC này, đã thu âm lúc ngân
nga và ngồi thưởng thức dẫu chỉ là những lời ngân nga không có
kèm theo nhạc khí vậy mà vẫn cảm nhận được sự lâng lâng cảm
xúc hay khi nghe...
Ở một góc tĩnh lặng nào đó, bạn vừa ngân nga vừa thưởng thức
tin chắc rằng Tập Thơ ""THƠ NHẠC"" sách điện tử này sẽ là người
bạn tinh thần gần gũi tạo cho bạn có thêm được sự thư giãn tinh
thần sau những giây phút mệt mỏi với bao công việc trong cuộc
sống hàng ngày.
Đang chờ bạn!
Đường link copy nhập lên Google:
https://play.google.com/store/books/details/Nh%E1%BA%A5t_Lang_Nguy%E1%BB%85n_Th%C3%A0nh_S%C3%A1ng_T%E1%BA%ADp_Th%C6%A1_TH%C6%A0_NH%E1%BA%A0C?id=p7brEAAAQBAJ
Những tập thơ hay tuyển lựa của Nhất Lang (Nguyễn Thành Sáng)
xuất bản sách điện tử trên Google Play sách bán với giá khuyến mãi
đặc biệt.
Đang chờ bạn!
Đường link copy nhập lên Google:
https://play.google.com/store/books/author?id=Nh%E1%BA%A5t+Lang+%28Nguy%E1%BB%85n+Th%C3%A0nh+S%C3%A1ng%29",khúc nhạc tình buồn – 1,,Nhất Lang (Nguyễn Thành Sáng),https://poem.tkaraoke.com/123750/.html
"KHÚC NHẠC TÌNH BUỒN – 2
“Thơ Nhạc”
Năm xưa… mình dưới trăng thề…
Niềm thương nỗi nhớ… lê thê tiếng đàn…
Giờ đây…mây vắt lưng tầng
Đường em phủ tím… đời anh thẫn thờ…
đời anh thẫn thờ…
Thu chiều ngọn gió lửng lơ
Hồn yêu giãy chết… hồn xơ xác hồn
Cây buồn… lặng đứng hoàng hôn
Nhìn ngang một phía…vườn chôn lá sầu…
Mơ đang… mơ bước qua cầu
Cầu cao lỗi nhịp…cầu đau lòng người…
Duyên tan… duyên đã lỡ rồi
Tình ơi tình hỡi… tình thôi chớ đừng…
Rung rung… kéo sợi dây chùng
Dây đà khoảng nứt…ơi dùng sao đây?…
Ô hay!... Ô hỡi!... Ô này
Lời ca dang dở…thì tay thể nào?…
Thương em… anh biết làm sao?
Làm sao khỏi nhớ…làm sao khỏi buồn?
Nhưng ôi…nhạc khúc đoạn trường…
Phũ phàng dâu bể…để hờn con tim…
Đành thôi…khoảnh khắc lặng yên…
Thả hồn phương ấy…tìm duyên lỡ làng...
Vườn mơ…ngợp đoá hoa vàng…
Có chàng trong nở….có nàng trong hương…
Đôi ta…hai cánh hồn sương…
Cùng nhau trở lại…con đường năm xưa…
Đôi ta…hai cánh hồn sương…
Cùng nhau trở lại…con đường năm xưa…
06/12/2023
Nhất Lang
(Nguyễn Thành Sáng)
———————————————————
KHÚC NHẠC TÌNH BUỒN – 2
“Thơ Lục Bát”
Năm xưa mình dưới trăng thề
Niềm thương nỗi nhớ, lê thê tiếng đàn
Giờ đây mây vắt lưng tầng
Đường em phủ tím, đời anh thẫn thờ…
Thu chiều ngọn gió lửng lơ
Hồn yêu giãy chết, hồn xơ xác hồn
Cây buồn lặng đứng hoàng hôn
Nhìn ngang một phía, vườn chôn lá sầu…
Mơ đang…mơ bước qua cầu
Cầu cao lỗi nhịp, cầu đau lòng người
Duyên tan, duyên đã lỡ rồi
Tình ơi tình hỡi, tình thôi chớ đừng…
Rung rung kéo sợi dây chùng
Dây đà khoảng nứt, ơi dùng sao đây?
Ô hay! Ô hỡi! Ô này!
Bài ca dang dở, thì tay thể nào?
Thương em anh biết làm sao
Làm sao khỏi nhớ, làm sao khỏi buồn?
Nhưng ôi! Nhạc khúc đoạn trường
Phũ phàng dâu bể để hờn con tim…
Đành thôi khoảnh khắc lặng yên
Thả hồn phương ấy tìm duyên lỡ làng
Vườn mơ ngợp đoá hoa vàng
Có chàng trong nở, có nàng trong hương
Đôi ta hai cánh hồn sương
Cùng nhau trở lại con đường năm xưa…
06/12/2023
Nhất Lang
(Nguyễn Thành Sáng)
Một phong cách sáng tạo mới trong thơ ca đó là ""THƠ NHẠC"",
do nhà thơ Nhất Lang (Nguyễn Thành Sáng) mới sáng tạo.
Ngoài Thể Thơ Lục Bát căn bản, cấu trúc từ vựng sao cho đúng
vần điệu, đúng nghĩa trong câu thơ, bài thơ.
Còn có thêm một nghệ thuật đặc biệt nữa là cấu trúc từ vựng theo
các dấu làm sao để người đọc có thể ngân nga bài thơ âm điệu
trầm bổng, réo rắt, du dương...gần giống như một bản nhạc vậy!
Tác giả đã sáng tác ra loại THƠ NHẠC này, đã thu âm lúc ngân
nga và ngồi thưởng thức dẫu chỉ là những lời ngân nga không có
kèm theo nhạc khí vậy mà vẫn cảm nhận được sự lâng lâng cảm
xúc hay khi nghe...
Ở một góc tĩnh lặng nào đó, bạn vừa ngân nga vừa thưởng thức
tin chắc rằng Tập Thơ ""THƠ NHẠC"" sách điện tử này sẽ là người
bạn tinh thần gần gũi tạo cho bạn có thêm được sự thư giãn tinh
thần sau những giây phút mệt mỏi với bao công việc trong cuộc
sống hàng ngày.
Đang chờ bạn!
Đường link copy nhập lên Google:
https://play.google.com/store/books/details/Nh%E1%BA%A5t_Lang_Nguy%E1%BB%85n_Th%C3%A0nh_S%C3%A1ng_T%E1%BA%ADp_Th%C6%A1_TH%C6%A0_NH%E1%BA%A0C?id=p7brEAAAQBAJ
Những tập thơ hay tuyển lựa của Nhất Lang (Nguyễn Thành Sáng)
xuất bản sách điện tử trên Google Play sách bán với giá khuyến mãi
đặc biệt.
Đang chờ bạn!
Đường link copy nhập lên Google:
https://play.google.com/store/books/author?id=Nh%E1%BA%A5t+Lang+%28Nguy%E1%BB%85n+Th%C3%A0nh+S%C3%A1ng%29",khúc nhạc tình buồn – 2,,Nhất Lang (Nguyễn Thành Sáng),https://poem.tkaraoke.com/123751/.html
"NIỀM VUI TẶNG MẸ
Xôn xao	xôn xao
Lòng con   xôn xao
Như lá thu rơi
Rơi rơi
Trong nắng mai   ngập tràn.
Mẹ ơi		con xa quê
Trong con     trống trải   cô đơn,
Nhớ quê hương
Con   nhớ mẹ	vô    cùng.
Nhớ kỉ niệm	     buồn vui     ngày bên   mẹ
Cứ ngập tràn nhảy   múa trong con…
Và    mẹ ơi	hôm nay    lòng con vui
Một niềm vui nhỏ nhỏ    thôi mẹ ơi
Nhưng con vẫn    gửi về cho mẹ
Để mẹ của con	luôn  vui tươi
Luôn rạng rỡ	nụ 	cười…
04.2000
Nguyên Hữu",niềm vui tặng mẹ,,Nguyên Hữu,https://poem.tkaraoke.com/123752/.html
"Mưa Đầu Nặm
Đầu năm gío bão bơ vơ
Trời đông giẫy chết mà xơ xác hồn
Cây buổn gío cứ xô luôn
Ngất ngư thờ thẫn, nước tuôn dầm dề
Đầu năm lạnh lẽo tái tê
Phố phường thưa thớt, pháo chê mưa nhiều
Chúc vui mà cảnh cô liêu
Chúc may, ướt sũng tiêu diêu mất rồi.
Đầu năm mưa qúa đi thôi!
Chẳng đi chẳng tới, đành ngồi gõ thơ
Ngoài kia mưa vẫn phủ mờ
Chữ cao chữ thấp, thẫn thờ vào Face...  CH2",mưa đầu năm.,,Cong Chinh (CH2),https://poem.tkaraoke.com/123753/.html
"Sống vì Nghĩa Nhân...
Còn suy còn nghĩ, còn tình.
Hết suy cạn nghĩ ta mình cách xa
Cảm thông thì hãy bỏ qua
Chấp nhất bực bõ, né xa cũng đành
Người ta coi trọng chữ danh
Ta nên coi trọng tình quanh Gia đình
Vua kia nào có đẹp xinh.
Mà người ôm lấy dáng hình ngông nghênh
Nhân cách thấy rõ nhẹ tênh
Mà người ca tụng rồi khênh về thờ
Ai tỉnh thì chẳng ngu ngơ
Kẻ say thì mới bơ phờ ngả nghiêng...
Cuộc sống gẫm thấy rất thiêng
Suy ngay hiểu thấu: Hồn riêng mỗi người
Trăm năm cũng chỉ một thời
Sống ngay nên nghĩa kẻo đời uổng đi
Vào đời không để chạy thi
Nhưng là cơ hội: Sống vì Nghĩa Nhân...  CH2",sống vì nghĩa nhân...,,Cong Chinh (CH2),https://poem.tkaraoke.com/123754/.html
"Ngày Cuối năm.
Hôm nay ngày cuối cuả năm
Nhìn lại sinh hoạt, tình thâm quanh mình
Trân trọng cuộc sống văn minh
Rũ bỏ những cái miệt khinh cuả đời.
Dâng lời Cảm tạ Chúa Trời
Đã Ban Ơn Phước, được lời lãi thêm
Che chở gìn giữ ngày đêm
Gia đình bằng hữu, ấm êm mọi bề.
Tuy rằng con vẫn u mê,
Vẫn còn yếu đuối, lỗi về bản thân
Xin Ngài hãy đến thật gần
Để mọi phần tử hiểu chân cuộc đời
Xin ban ơn Lành khắp nơi
Soi sáng Thế giới, loài người thương nhau...  CH2",ngày cuối năm.,,Cong Chinh (CH2),https://poem.tkaraoke.com/123755/.html
"THƯƠNG VẦNG TRĂNG KHÓC
Thương vầng trăng khóc bên đồi
Đêm sâu tiếng nấc nghẹn lời thi ca
Buồn ơi cho chị Hằng Nga !
Âm thầm chú Cuội nôm na nỗi lòng
Thương vầng trăng khóc ròng ròng
Cơn đau giãy giụa tơ hồng ở đâu?
Tình yêu tan chảy biển sâu
Và nghìn năm đợi bắc cầu trái tim
Thương vầng trăng khóc rơi thềm
Đường xưa lối cũ tình duyên rã rời
Đào sâu suy nghĩ trăm nơi
Ai gieo hương mật xa rồi ngày xanh ?
Thương vầng trăng khóc mong manh
Lá vàng bỗng chốc lìa cành trối trăng
Mai sau về ngõ âm thầm
Lắng nghe ngày tháng xoay vần trôi mau
Thương vầng trăng khóc bao lâu
Nằm nghe trái đất nghẹn ngào than van
Gió mây từ độ lang thang
Bỏ tình vạn nẻo cung đàn đứt dây
Thương vầng trăng khóc heo may
Tiếng cười trong đục lạc bầy lẻ loi
Nhẩm xem sỏi đá buồn vui
Năm năm, tháng tháng rạch ròi trắng đen
Ngày 9/12/2023
Thiên Ân ( Bình Dương)",thương vầng trăng khóc,,Thiên Ân,https://poem.tkaraoke.com/123756/.html
"RƠI RỤNG TRÁI BUỒN
Trái buồn rụng xuống sân si
Anh chẳng còn gì lốm đốm ngày xanh
Tiếc thời chiếc lá lìa cành
Đâu rõ ngọn ngành vội vã chia tay
Trái buồn mặn đắng, chua cay
Than vắn thở dài hơi thở chìm sâu
Thời gian biển hóa nương dâu
Ai đã cúi đầu giấu lệ rèm mi?
Trái buồn nứt nẻ phân li
Hỏi tuổi xuân thì còn lại bao nhiêu?
Nao lòng hồn lại xanh rêu
Ngày tháng trở chiều giọt nhớ mênh mông
Trái buồn rớt giữa bầu không
Rách nát đôi dòng giẫm bóng thi ca
Đâu còn hương vị đậm đà
Giọt nắng la đà ai cõng đi đâu ?
Trái buồn chầm chậm trở sầu
Lạc dấu chân nào ngày đó xa xôi
Ôm mùa mưa gió rã rời
Đắng đót tuổi đời ăm ắp buồn vui
Trái buồn ru thoáng ngậm ngùi
Man mác chuỗi cười dè dặt đòi nơi
Muộn màng nhìn chiếc lá rơi
Lưu luyến trăm lời ngõ vắng ngày xưa
Trái buồn ngủ gật sớm trưa
Ngày tháng nợ mùa nào muốn tiễn đi
Ngày 9/12/2023
Thiên Ân ( Bình Dương )",trái buồn,,Thiên Ân,https://poem.tkaraoke.com/123757/.html
"TÔI VÀ EM
Khi tôi sống đời bụi phấn
Em còn bập bẹ trong nôi
Trái tim mọc mầm vương vấn
Em cất tiếng khóc chào đời
Ngày đêm âm thầm bục giảng
Chuyến đò kiến thức sang sông
Ý đẹp, lời hay duyên dáng
Mơ theo bảy sắc cầu vồng
Khi tôi tập tành gieo nhớ
Trần gian lắm kẻ dại khờ
Nhổ giò, em vào muôn thuở
Trăng tròn, trăng khuyết đòi thơ
Ngõ hồn hoang vu ngủ muộn
Bến bờ xa lắc, xa lơ
Mong manh giọt sương đến sớm
Môi em tôi khát vô bờ
Khi tôi nhìn em day dứt
Bên ngoài song cửa mây trôi
Phương trình chưa về vô cực
Ẩn số chẵn , lẻ đã rồi
Khi tôi sống đời thi sĩ
Mê say cái đẹp đất trời
Thả thơ muôn vàn ý vị
Chuồn chuồn xếp cánh gãy đôi
Đi qua bốn mùa mưa nắng
Nửa đời lốm đốm khói sương
Gió mây vẫn trôi vô tận
Bẻ nhánh tương tư cuối đường
Ngày 3/12/2023
Thiên Ân ( Bình Dương)",tôi và em,,Thiên Ân,https://poem.tkaraoke.com/123758/.html
"LÂU ĐÀI TÌNH YÊU
Lâu đài tình yêu ai xây trên cát?
Ngàn năm sau bỗng mang tiếng dại khờ
Mộng vỡ đôi những gam màu rời rạc
Ôm gói lạnh lùng một góc bơ vơ
Lâu đài tình yêu cuồng phong xô ngã
Lòng hoang vu như đồng lúa gặt xong
Ta bỗng thấy mình tựa như rơm rạ
Vụn vỡ chân mây đau đáu chạnh lòng
Lâu đài tình yêu như là thần thoại
Biến hóa khôn lường đổi trắng thay đen
Thời Phật, Bụt, Tiên...ngậm ngùi không nói
Cám dỗ ùa về mặc sức bon chen
Lâu đài tình yêu bóng mây lơ lửng
Đôi lúc ngập ngừng, thiên hạ gièm pha
Cho mùa thi ca dạt dào cảm hứng
Bờ vai ngày xưa ngoan ngoãn, nõn nà...
Lâu đài tình yêu quay cuồng vô hướng
Muôn hình vạn trạng thăm thẳm mù xa
Khen thời gian ai giàu óc tưởng tượng ?
Đánh rơi ngày xanh một cõi hiền hòa
Lâu đài tình yêu đoạn đành đánh mất
Giọt lệ thiên thu ướt cả đời người
Vùng trời bình yêu kẻ Nam , người Bắc
Mạch suối lòng chảy sang tuổi đôi mươi
Ngày 3/12/2023
Thiên Ân ( Bình Dương )",lâu đài tình yêu,,Thiên Ân,https://poem.tkaraoke.com/123759/.html
"CÂU HỎI TÌNH YÊU
Tình yêu đến
Đến    từ đâu nhỉ?
Từ đôi mắt     long lanh trong   xanh ấy
Hay đến từ    đôi môi chúm chím
Nở nụ cười
Làm hồn tôi   khờ dại    hóa trẻ thơ.
Tình yêu đến	có phải	từ ước mơ
Của đôi ta    trên đường đời    trắc trở.
Ôi	tình yêu
Tình yêu thật diệu kì
Mang đến cho tôi	bao nhiêu là hương vị
Trong cuộc đời     mặn  chát  đắng cay.
Bao nồng nàn    và những mê say
Tôi uống nhiều
Trong tình yêu     cả những điều     chua cay,
Rũ bỏ	   rồi lại yêu
Yêu rất nhiều
Nhưng có điều
Mãi bây giờ	vẫn không hiểu	tình		yêu…
04.2000
Nguyên Hữu",câu hỏi tình yêu,,Nguyên Hữu,https://poem.tkaraoke.com/123760/.html
"CẢNH CŨ NGƯỜI XƯA
Cảnh cũ còn đây, người ở đâu ?
Dòng yêu rớt nhẹ một nhánh sầu
Ngọn gió vô tình rong ruổi mãi
Chiếc thuyền tình ngày đắm biển sâu
Đôi hài vạn dặm giẫm đời nhau
Lá cỏ ngày xưa vội úa màu
Xao xác chim trời đôi cánh mỏi
Ơi cuộc đời mòn gót thương đau !
Cảnh cũ còn đây , người bỏ ta
Phũ phàng đè nén giọt lệ sa
Và câu chuyện cũ ôm đồm quá !
Thuở ấy ai gieo chất thật thà
Đời ngẩn ngơ đời, đời ngẩn ngơ
Bọt bèo tan nhẹ vào giấc mơ
Tắm gội thời gian men cay đắng
Nhặt lá ngoài song ươm hững hờ
Cảnh cũ còn đây, mùa dấu yêu
Mùi da phấn người , vội trở chiều
Nhắn dùm năm tháng xa vời vợi
Giật mình ai bẻ nhánh quạnh hiu ?
Rối rắm tơ vò một vòng quay
Kỉ niệm vùi chôn trong ngõ lầy
Rao bán cuộc tình trong mưa nắng
Ai ngờ trời đất vội đổi thay ?
Ngày 11/12/2023
Thiên Ân ( Bình Dương )",cảnh cũ người xưa,,Thiên Ân,https://poem.tkaraoke.com/123761/.html
"TIỄN EM
Tiễn em ngày ấy quên mùa
Con đường xưa, con đường xưa...lá vàng
Ngập ngừng, nhật kí sang trang
Đắn đo nét chữ vội vàng ai ghi ?
Tiễn em thiên hạ xầm xì
Trở mình ngọn gió cuồng si chạnh lòng
Ước mong, một thoáng ước mong
Se se chút lạnh lập Đông ùa về
Tiễn em , anh khóc não nề
Đời không nuôi dưỡng câu thề đôi ta
Tựa vầng Nhật Nguyệt vời xa
Muôn lời ai oán mặn mà ở đâu ?
Tiễn em nốt nhạc dạo đầu
Ôm chi một đống tinh cầu lẻ loi
Trắng đen, phải trái rạch ròi
Ngày xưa, ngày xửa ai đòi thương em ?
Tiễn em vào cõi bình yên
Em vào viên mãn nỗi niềm bâng khuâng
Đôi hài vừa vặn gót chân
Ai khen cái đẹp niu nâng giữa trời ?
Tiễn em vò võ phương trời
Gió mây, mây gió buông trôi lạnh lùng
Mong manh ranh giới người dưng
Thôi em ai lại dè chừng với nhau !
Tiễn em oan trái mộng đầu
Nghìn đêm tự kể mai sau bạc màu
Thay đen đổi trắng vì đâu ?
Hanh heo tuổi đá dạ sầu ngẩn ngơ
Ngày 2/12/2023
Thiên Ân ( Bình Dương )",tiễn em,,Thiên Ân,https://poem.tkaraoke.com/123762/.html
