Edited,Title,Genre,Author,URL
"Nắng nóng trông ngóng mưa rơi
Ngồi buồn viết gởi đôi lời đến nơi...
Thương em nhớ lắm em ơi!
Nhớ từng hơi thở, nhớ tơi tả lòng
Tình đầu tôi đợi tôi mong
Yêu em tôi giữ bên trong bóng hình
Đôi lúc sợ nói linh tinh
Sợ em hờn dỗi một mình đơn côi
Thế rồi ngày tháng dần trôi
Qua miền hư ảo chia phôi thật rồi
Có lẽ cũng tại ông Trời
Xui chi gặp gỡ để rồi biệt ly
Khóc thương kẻ ở người đi
Đành chôn kỷ niệm sầu bi tháng ngày
Nhớ em nỗi nhớ ngất ngây
Nhớ bao câu nói sum vầy trước đây
Giờ thì em tận trên mây
Bỏ tôi ở lại mang đầy nỗi đau
Thôi thì ta mãi mất nhau
Chôn vùi quá khứ...đậm sâu ái tình...!
VÕ QUANG HÂN
Đà Nẵng 28 - 05 - 2015K",chôn vùi quá khứ,,VÕ QUANG HÂN,https://poem.tkaraoke.com/107959/.html
"Dòng suối tóc bồng bềnh bay theo gió
Ánh trăng tròn lồng gác nhỏ mộng mơ
Nhạc du dương ru nỗi nhớ mong chờ
Làn môi thắm nối đôi bờ khao khát
Hương dạ lý toả mùi thơm ngào ngạt
Tay trong tay theo điệu nhạc đắm say
Tiếng ai ca nghe nhè nhẹ đêm này
Nhịp đều bước ngất ngây lời hẹn ước
Chung lối mộng chốn thần thiên rảo bước
Lời hẹn thề ao ước mấy mùa qua
Trọn niềm tin hạnh phúc thắm chan hoà
Nghe khúc nhạc lời ca đầy chan chứa
Anh sẽ đến dìu em về đất hứa
Từ phương xa thắp ánh lửa cõi lòng
Đã bao lần anh trông ngóng mùa đông
Cùng say đắm trao ái ân ngây ngất!
VÕ QUANG HÂN
Đà Nẵng 02 - 06 - 2015",đêm mơ,,VÕ QUANG HÂN,https://poem.tkaraoke.com/107960/.html
"THƯƠNG EM HIỀN THẦM LẶNG
Thương em hiền thầm lặng
Cho anh cả cuộc đời
Em đoá hồng trong nắng
Cho thuyền anh ra khơi
Yêu em hiền phơi phới
Cho anh những ngọt ngào
Em cánh buồm tươi mới
Cho tình anh vút cao
Yêu em hiền nhiên hạo
Cho anh hiểu nhiều điều
Em sao trời huyền ảo
Soi đường anh tình yêu
Yêu em hiền vi diệu
Cho anh sống thiện lành
Em nhiệm mầu thấu hiểu
Cho đời anh ngát xanh
Trần Minh Hiền Orlando ngày 9 tháng 7 năm 2020",thương em hiền thầm lặng,,Trần Minh Hiền,https://poem.tkaraoke.com/107961/.html
"Tháng bảy về cơn gió gọi thu sang
Làn nắng ấm trải vàng trên bến nhỏ
Dòng nước chảy êm đềm khua cánh vó
Chuyến đò ngang lời quan họ ru tình.
Lũ ve sầu cũng đã chịu lặng thinh
Hàng phượng vỹ thu mình thôi trỗ nụ
Chiều bảng lảng áng mây hồng giăng phũ
Phía trời xa chim di trú lượn lờ.
Hạ sắp tàn khơi dậy những vần thơ
Đàn trẻ nhỏ vui chờ năm học tới
Trang giấy trắng lừng thơm nằm im đợi
Bút mực xanh đang còn mới chưa dùng.
Tháng bảy về bao nỗi nhớ mông lung
Ngày xưa đó tụi mình chung lớp học
Hạ tiễn biệt tay choàng ôm nhau khóc
Mãi đến giờ hương tóc vẫn đọng vai.
Chiều nay thấp thỏm thở dài
Trong lòng cứ nhớ về ai một thời.
Rùa Vàng 9/7/2017",thu về nhớ hạ xưa,,Trần Đình Sơn,https://poem.tkaraoke.com/107962/.html
"NGỌN GIÓ VÔ TÌNH
Ngọn gió vô tình bay mãi
Lãng quên trăm mối hẹn hò
Biển chiều sóng đưa mềm mại
Tâm hồn rối rắm tơ vò
Cát vàng ôm chân kỉ niệm
Quá khứ đau thương ùa về
Dã Tràng một thời tan biến
Lâu đài hạnh phúc ru mê
Ngọn gió trở mùa giấc trẻ
Em xa , ta hết tầm tay
Ngày xưa vốn hay giữ kẽ
Muôn chiều lá đổ nhạt phai
Dòng nước ấp ôm chân ngọc
Mát mẻ tháng ngày rong chơi
Môi hoa ai hay mời mọc
Hơi thở gần nhau bồi hồi
Ngọn gió vô tình xa lạ
Tình yêu bay vào hư vô
Từ đó dòng đời mặc cả
Lắng nghe muôn chuyện mơ hồ
Đợi chờ tiếc công ngày tháng
Buồn vui tăm tắp buồn vui
Hỡi người về đâu tản mạn
Câu ca buông tiếng ngậm ngùi
Ngày 30/6/2020
Thiên Ân ( Bình Dương)",ngọn gió vô tình,,Thiên Ân,https://poem.tkaraoke.com/107963/.html
"NGỌN GIÓ VÔ TÌNH
Ngọn gió vô tình bay mãi
Lãng quên trăm mối hẹn hò
Biển chiều sóng đưa mềm mại
Tâm hồn rối rắm tơ vò
Cát vàng ôm chân kỉ niệm
Quá khứ đau thương ùa về
Dã Tràng một thời tan biến
Lâu đài hạnh phúc ru mê
Ngọn gió trở mùa giấc trẻ
Em xa , ta hết tầm tay
Ngày xưa vốn hay giữ kẽ
Muôn chiều lá đổ nhạt phai
Dòng nước ấp ôm chân ngọc
Mát mẻ tháng ngày rong chơi
Môi hoa ai hay mời mọc
Hơi thở gần nhau bồi hồi
Ngọn gió vô tình xa lạ
Tình yêu bay vào hư vô
Từ đó dòng đời mặc cả
Lắng nghe muôn chuyện mơ hồ
Đợi chờ tiếc công ngày tháng
Buồn vui tăm tắp buồn vui
Hỡi người về đâu tản mạn
Câu ca buông tiếng ngậm ngùi
Ngày 30/6/2020
Thiên Ân ( Bình Dương)",ngọn gió vô tình 2,,Thiên Ân,https://poem.tkaraoke.com/107964/.html
"ĐIỀU QUAN TRỌNG
Điều cốt yếu.. là quý điều  đáng quý
Quan trọng là biết trân trọng nâng niu
Biết giữ gìn tôn tạo, biết đề cao..
Hạnh phúc chẳng phải có đầy mọi thứ
Ta có em!
Quá là người sang phú
Nửa bầu trời nửa biển nửa  là em
Cánh đồng hoa với triệu triệu bông hồng
Hương quấn lấy một tâm hồn ngây đắm
Nói đơn giản: Hạnh phúc là thỏa mãn
Cảm xúc về ve vuốt cả đơn sơ
Cứ thấy lòng thoải mái giữa thương yêu
Tin vào những điều tốt lành là đủ
Tin cậy một vòng tay ôm rực lửa
Tin tình yêu nuôi đủ cuộc đời nhau
Tin có nhau sẽ có cả đất trời
Có tất cả, gom về trong ân ái
THI YÊN ĐÌNH NGUYÊN",điều quan trọng,,THI YÊN ĐÌNH NGUYÊN,https://poem.tkaraoke.com/107965/.html
"ĐỔI THAY
Tin rằng chuyện kể có đầu đuôi
Bởi cuộc tình kia đã chín muồi
Những tối trăng tàn đôi kẻ ngược
Bao chiều lá rụng đủ người xuôi
Rồi hôm lối muộn sầu mưa đổ
Lại buổi đường khuya vỡ đá chuồi
Bến lạ em tìm hương ảo huyễn
Ta cùng chén rượu để lòng nguôi ./.
Lê Cảnh Tiến 10/07/2020",đổi thay,,Lê Cảnh Tiến,https://poem.tkaraoke.com/107966/.html
"SAO ANH NỠ VÔ TÌNH
Em là con gái ngoại thành
Thương anh từ thủa tóc xanh buông dài
Gian nan trĩu nặng đôi vai
Nuôi con khôn lớn nên người hôm nay
Thương chồng lo việc luôn tay
Một mình vun vén những ngày vắng anh
Lấy chồng khi tóc còn xanh
Khổ đau nhuộm bạc đã thành tóc mây
Mắt xưa lúng liếng đắm say
Giờ mang gọng kính… đôi tay vụng về…
Anh đi tìm những đam mê
Hồn bay về những miền quê xa vời
Đi tìm những mái tóc dài
Nụ cười lúng liếng… một thời của em…
Cuộc đời đâu có bình yên
Em buồn, em khóc… lo duyên bẽ bàng
Ước… quay về thủa gian nan
Để anh lại được lo toan cho mình…
Tỉnh ra… trời rạng bình minh…
Sao anh lại nỡ vô tình với em?
Văn Liêm - 7/2017",sao anh nỡ vô tình,,Văn Liêm,https://poem.tkaraoke.com/107967/.html
"NỖI LÒNG HỒN LANG VỀ CÕI THẾ (42)
Ôi! Đêm nay nguyệt toả sáng lưng trời
Bầu cảnh vật tuyệt vời say êm ả
Vậy mà lòng ta vẫn cứ từng hồi
Rung lắc nhịp, ngậm ngùi theo trăn trở...
Trầm lặng lẽ, vật vờ bên góc vắng
Da diết buồn trĩu nặng cố phôi phai
Ngước mặt lên cao hơi dài hít mạnh
Tiếp thẳng đường vỗ cánh nhẹ nhàng bay
Xuống miền Nam lần tới lui tìm kiếm
Từ Vũng Tàu, Gia Định đến Sài Gòn
Có đôi lúc chập chờn giông giống ảnh
Nhưng cũng rồi hụt hẫng, nghẹn sầu đơn
Gác bỏ miên man, lượn vờn xuôi ngược
Chợ Long Thành, Sa Đéc, xứ Mỹ Tho
Vòng miệt Trà Vinh qua vùng Châu Đốc
Rạch Chiếc Cầu... Trằn trọc bóng chơ vơ
Gần ba năm từng giờ trên đất Việt
Nỗi khát khao tha thiết gặp lại người
Nhưng mảng tối muôn đời nào thấu hiểu
Vẫn vô tình phủ chiếu ánh trăng trôi...
Thầm cung bậc nhẹ vơi hờn ứ đọng
Tiếp trở mình vụt phóng, lững lờ bay
Cần Thơ đẹp ghé đây, tìm tán rộng
Đợi cuối chiều thả bóng ngắm nhìn ai...
Ô kìa! Ba vóc dáng nầy trước mặt
Bước thong dong dạo mát dưới màn đêm
Trông như thể hình quen thời vạn kỷ
Hồi hộp tràn, rộn rã cả con tim...
""Bất ngờ Lang thấy trước mặt
ba vóc dáng tợ Cha, Mẹ, Chị…""
16/2/2016
Nhất Lang
(Nguyễn Thành Sáng)",nỗi lòng hồn lang về cõi thế (42)..,,Nguyễn Thành Sáng,https://poem.tkaraoke.com/107968/.html
"NỖI LÒNG HỒN LANG VỀ CÕI THẾ (43)
Lần theo sát để nhìn cho thật rõ
Hình thể nầy! Thật đó của Mẹ Cha?
Lang chầm chậm lướt vòng qua thẳng ngó
Mặt, nói, cười…Chẳng có lạ gì đâu...
nhatlang.com",nỗi lòng hồn lang về cõi thế (43)..,,Nguyễn Thành Sáng,https://poem.tkaraoke.com/107969/.html
"Thơ hoạ Nguyễn Thành Sáng & Tam Muội (2103)
Thổn Thức Cảnh Đời
Gia đình nghèo khó, con đông
Mẹ cha tần tảo sớm hôm chợ đời
Hụt sau, thiếu trước dập vùi
Mỏi mòn thân xác, rã rời tâm tư...
Cây cao mọc cận mé bờ
Nửa phần rễ bám, nửa chơ vơ ngoài
Gió giông vùn vụt kéo dài
Cành rung đổ lá, góc lồi ngả nghiêng
Loang sâu hụt hẫng triền miên
Dòng nuôi lựng khựng, đảo điên tháng ngày
Chùm đeo lủng lẳng, quả sai
Từ từ thiếu chất héo gầy tóp teo
Sông xanh kinh rạch vòng vèo
Lững lờ con nước chảy theo hướng luồng
Lên cao nặng gối khó bường
Dốc xuôi đi xuống dễ chân lấy đà...
Miếng ăn, cái mặc cả nhà
Quay quần, tất bật cứ mà trôi qua
Nhọc nhằn, khốn đốn, nặng lo...
Biết bao luẩn quẩn, mẹ cha bơ phờ
Thời gian gần gũi ngây thơ
Chăm nom hoạn dưỡng, hững hờ gió đưa
Sum sê, óng mượt đầu mùa
Chỉ trong giữa độ, chát chua lỡ làng...
Gần kế bên, thấy họ hàng
Rơi vào cảnh ấy, để ngàn khổ đau
Âm vang một khúc tiêu sầu
Lan man thổn thức, dàu dàu, xót xa...
10/2/2020
Nguyễn Thành Sáng
Nào Phải Bách Tùng
Vừa lọt lòng nội tổ rạng nét tươi
Vì trút được hết mười phân gánh nặng
Bấy lâu phấp phỏng, ưu sầu lo lắng
Nối dõi tông đường, chẳng thể vô sinh
Kể từ hôm nay, gió lặng nước bình
Sự cầu nguyện hiển linh vào gia tộc
Trai quý tử giúp băng đèo vượt dốc
Âu cũng thời phước lộc đã gầy nên
Theo tháng ngày đứa trẻ trổ mã lên
Sống ngoan ngoãn, hiếu đền ơn dưỡng dục
Dẫu quạnh quẽ vắng thân tình thủ túc
Nhưng bù trì hạnh phúc thật ấm êm
Bỗng một chiều phát hiện…Dạ nhói rêm
Ngoài tùng bách…trong mềm như lá liễu
Ôi miệng lưỡi! Thế nhân lời đàm tiếu
Mỉa mai hoài chế giễu những gì đang
Nào bấy ai muốn rớt cảnh bẽ bàng
Đâu lựa chọn thiên đàng mà đi tới
Cửa địa ngục giam cầm luôn chờ đợi
Tê tái hồn, chuyện giới tính vòng vây
Mọi người xa lánh, tủi phận canh chầy
Trách tại đất trời, gây chi bồi lở
Hoặc tiền kiếp vụng tu thành mắc nợ
Nay lệ hàng… duyên cớ định hình không
Biết tỏ bày, hỏi mấy kẻ cảm thông?
Hay dậy sóng lộng lồng cơn cuồng vũ
Chưa toả sắc vội xanh xao héo nụ
Hận cao dày lại phú nghiệt oái oăm.
June 22, 2020
Tam Muội",thơ hoạ nguyễn thành sáng & tam muội (2103),,Nguyễn Thành Sáng,https://poem.tkaraoke.com/107970/.html
"Thơ hoạ Nguyễn Thành Sáng & Tam Muội (2104)
Xa Rồi Kỷ Niệm Dấu Yêu
Nâng rượu mừng chúc phúc bạn “cố giao”
Lại bỗng thấy nghẹn ngào loang ngập quả
Luồng khí quyển chực trùm khơi băng giá
Dải ngân hà nay đã vắng vào đêm
Lặng lẽ rời rón rén gót nhẹ êm
Giờ hụt hẫng vai mềm mang nặng trĩu
Tìm đâu nữa hương xưa thời nũng nịu
Nhoi nhói lòng bám víu mỗi bước chân
Văng vẳng hoài vi vút giọng sáo ngân
Bài não nuột rót lần xuyên tâm khảm
Trời xuân sắc sao giăng ngàn mây xám
Khiến không gian ảm đạm đến lạ thường
Cứ ngỡ rằng chỉ mối dệt uyên ương
Nuôi hoài bão dặm trường luôn tiếp nối
Vậy mà gió lạnh lùng mau thay đổi
Rẽ sang miền khác thổi phiến lá bay
Nào khiên trì ước thệ sẽ chung tay
“Đồng cam cộng khổ”, cày lâu, gánh vác
Dẫu góc bể, cuối trời, hay loạn lạc
Chẳng thể lìa bởi tạc dạ khắc sâu
Lời còn đây…chừ ngấn lệ cung sầu
Chim đơn lẻ về đâu khi chiều tím
Nghe rụng vỡ trái hồng đang ngất lịm
Đứt dây xề bật phím đoản tình ca
Con đò nghiêng ngả, dưới bóng xế tà
Có kẻ sĩ xót xa phần duyên số
Hoa đỏ thắm trên lưng đồi nở rộ
Thôi tránh đường, nhường chỗ để vượt qua.
April 9, 2020
Tam Muội
Niềm Đau Dĩ Vãng
Tám năm qua, chẳng về nơi ấy nữa
Khoảng cuộc đời nhẹ thả cõi trăng sao
Có những lúc từ sâu trồi nhớ lại
Một cái gì tê tái gợn luồng đau...
Kia! Kỷ niệm ngọt ngào, yêu dấu hỡi
Nọ! Lắm lần lui tới viếng thăm Ai
Đó! Những con đường, vai kề, tim nói
Đấy! Thư tình mở vội, chén ngần say
Trông cho mau đến ngày mai chủ nhật
Để nôn nao tấc dạ được nằm yên
Khi loáng thoáng dáng hiền gần trước mặt
Thẹn cúi đầu man mát gửi nụ duyên
Tay trong tay, êm đềm hồ vọng nguyệt
Bờ cỏ mềm, ấm áp, nỗi lâng lâng
Trên lóng lánh ánh vàng soi đáy nước
Dưới dạt dào, tha thiết chuỗi...Em...Anh!
Bịch đậu phộng bên cầm, bên bóc vỏ
Há miệng nầy! Đỏ bỏ...Nhẹ nhàng “Bơi”
Nghiêng khúc khích phía cười vui rạng rỡ
Phía men tình rỉ rả thắm đầy vơi...
Có ngờ đâu! Xe đời quay ngược hướng
Kẻ trở về bậu bạn với mây sương
Người ở lại tơ vương sầu vọng tưởng
Sớm trưa chiều lởn vởn khúc âm chuông
Em lấy chồng, nỗi buồn xưa cố xoá
Bởi mịt mù tăm cá bóng chim bay
Còn ở tôi dẫu nầy muôn thương nhớ
Nhưng mảnh vườn vàng võ xác xơ cây...
22/06/2020
Nguyễn Thành Sáng",thơ hoạ nguyễn thành sáng & tam muội (2104),,Nguyễn Thành Sáng,https://poem.tkaraoke.com/107971/.html
"Day Dứt
Lặng lẽ em ngồi đếm giọt thương
Bao nhiêu đọng đấy, bấy nhiêu buồn
Ảnh hình, kỷ niệm dài năm tháng
Tất cả chỉ còn nỗi vấn vương...
Người về phương ấy đã bao thu
Biền biệt, xa xăm, cõi mịt mù
Tiếng hẹn câu thề chưa điểm dấu
Mà luôn ấp ủ, dạ mong chờ
Để những bất ngờ mai mối tới
Treo tranh thuỷ mặc, ánh trăng đầy
Để từng lo lắng tình cha mẹ...
Cớ nọ, kia nầy, vội vã quay
Vì sao như vậy, hiểu không anh?
Bởi có loài cây chỉ một lần
Hoa nở rồi thôi, không nở nữa
Lụn tàn vĩnh viễn dưới thời gian
Trót đã yêu thầm, biết nói chi
Chỉ hoài tưởng nhớ bóng người đi
Ngân nga nhịp đập từ sâu thẳm
Tin tưởng mai đây “Ảnh” sẽ về...
Vậy mà nào gặp lại Ai đâu
Từ mái nhung xanh đến bạc đầu
Tăm cá cánh chim, trời viễn xứ
Mỏi mòn trông ngóng, chuỗi ngần đau...
Anh không trở lại kiếm tìm em
Mãi mãi thênh thang lạc mảnh thuyền
Lờ lững âm thầm vào diệu vợi
Nào hay làm héo một con tim...
09/07/2020
Nguyễn Thành Sáng",day dưt.,,Nguyễn Thành Sáng,https://poem.tkaraoke.com/107972/.html
"Con đường là của anh
Các chàng trai
Không cần quắt mắt nhe nanh
Không cần nẹt pô hù dọa
Không cần vượt nhanh
Ép mấy ông già quờ quạng
Con đường này là của Anh
Xin đừng leo lề
bóp kèn inh ỏi
Đuổi một ông già nép mình đi bộ
Không biết tránh vào đâu
Ngoài cách bay lên trời
Con đường là của Anh
Đừng quá vội
Không cần giành
Các chàng trai thời đại
Nhiều thế hệ chúng tôi
Nộp thuế xây con đường này
Giờ chúng tôi về
Xin trao lại các Anh
Đừng quá vội
các Thanh Niên
Đừng leo lề ,bóp kèn
Xua đuổi ông già đi đúng luật
Xin đừng chửi thề
Với người già đáng tuổi cha anh
Đi quờ quạng trên đường
Họ đã làm nên  phố phường
cho các Anh đi...
Đừng quá vội
Các chàng trai hào hoa thời đại
Chúng tôi rồi sẽ đi
Dù có mời
Cũng không ai ở lại
Còn các Anh
Rồi cũng sẽ già
Không  trẻ mãi được đâu...
PQT",đừng quá vội,,Phùng Quang Thuận,https://poem.tkaraoke.com/107973/.html
"Như con voi già
Sắp chết
Theo bản năng
Tách đàn
Đi về phương Bắc
Vào Mộ Tượng
Chôn giấu cặp ngà
Ta cũng nghe tiếng gọi
Trên núi cao
Gọi về
Ẩn cư dưỡng lão
Chôn giấu
Tri kiến tuổi già...
Gió mát
mưa rào
Và mây trắng
Ta trồng rau
Nhiều hoa
Dành tặng quí lão bà góa bụa
Thỉnh thoảng ghé qua
Ta xây nhà
Chào đón những mảnh đời
Rách vá
Về nương tựa vai nhau
Bốn mùa
Nắng mưa
qua cửa
lặng lẽ
Lánh cỏi người
Không có tương lai
Không quá khứ
Chỉ có hiện tại
Từng ngày cùng thiện hữu
ngó mây bay...
PQT",bản năng,,Phùng Quang Thuận,https://poem.tkaraoke.com/107974/.html
"Thơ vui
Trọn đời yêu thơ
Gần cả đời làm thơ
Mỗi năm làm nhiều bài
Chọn được bốn năm bài hay
Mười năm khổ sở
In được một tập thơ
Vài mươi trang mỏng
Một ngàn quyển nhỏ xíu
Đọc tới đọc lui ngây ngất
Mang tặng vài bạn thân
nể tình nên anh nhận
Môt ngàn tâp thơ
Tặng mươi quyển
Còn lại giấu kỷ trong thư phòng
môt trăm triệu người biết chữ Việt
Ai đọc thơ ta ,ai biết thơ ta ?
Ai khen thơ ta hay..?
Chỉ biết chính xác
có một người
Chân thành khen thơ ta
Ngất ngây khi đọc thơ của ta
Tỷ lệ một trên một trăm triệu người
Thật sự thấy thơ ta rất hay
Người đó chính là ta
Ha ha ha....
PQT",thơ vui,,Phùng Quang Thuận,https://poem.tkaraoke.com/107975/.html
"THẮP NGỌN NẾN HỒNG ĐỢI BÌNH MINH
Thắp ngọn nến hồng đợi bình minh
Hồn anh khao khát tìm yên tĩnh
Em là sao sáng miền thanh tịnh
Lặng lẽ dịu dàng vẫn lặng thinh
Thắp ngọn đuốc vàng đợi hồi sinh
Hồn anh lãng đãng chẳng nhục vinh
Em là trăng thức trong chánh định
Khắc khoải thời gian nước trong bình
Thắp ngọn lửa hiền đợi lung linh
Hồn anh tỉnh thức giữa ân tình
Em là sương đọng đầy linh tính
Lơ lửng trời khuya chỉ đôi mình
Thắp ngọn đèn buồn đợi trung trinh
Hồn anh thao thức đọc tạng kinh
Em là nước chảy qua vùng vịnh
Cho cánh buồm anh vẽ ảnh hình
Trần Minh Hiền Orlando ngày 10 tháng 7 năm 2020",thắp ngọn nến hồng đợi bình minh,,Trần Minh Hiền,https://poem.tkaraoke.com/107976/.html
"🌺PÉTRUS-Ký - 12B4 - KHOÁ TÚ TÀI IBM🌺
Kìa bê bốn mười hai khi trước (12B4)
Ai Bê Em (IBM) lũ lượt ra trường (1)
Tú tài Trắc Nghiệm lập phương
Khoá đầu và cuối dặm đường chia xa...
*
Ai còn nhớ ngọc ngà bạn cũ
Lúc tuổi thơ chất ngụ nơi tim
Bạc đầu mái tóc đi tìm
Chốn xưa ngày ấy đàn chim tung trời...
*
Ôi kỷ niệm giờ khơi nhớ lại
Danh sách này còn mãi nơi trường
Lớp chung mà tám, mười phương..
Tú tài bỏ túi dặm đường chia tay...
*
Bao năm, tháng,..vạn ngày cách biệt
Sống hay còn ai biết tin nhau
Bể dâu lẫn lộn muôn màu
Cuộc đời thắm thoát qua mau kiếp này...
*
Tên họ đó trường nay còn giữ
Danh bộ kìa thứ tự chưa phai..
Học xong đạt được tú tài
Mây trời thẳng cánh mấy ai quay về.?..
*
Sài Gòn vẫn là quê hương đấy
Dẫu cho trời đưa đẩy lưu vong
Bạc đầu mái tóc lưng còng
Gặp nhau một chuyến ước mong sum vầy.?..
*
Thôi hẹn nhé về đây hội ngộ
Sài Gòn chờ nắng đổ đợi mưa
Cùng nhau hưởng vị nước dừa
Hàn huyên tâm sự lưa thưa chuyện đời...
*
Xong rồi tiếp tục ngàn khơi
Cánh bằng tung gió đất trời chia xa...
Nguyễn Ngọc René - Paris - 10/07/2020
(Bùi Thế Mẫn chắc thuộc làu danh sách này...Vì điểm danh cả lớp mỗi ngày...)
(1) IBM : Phát âm đúng là 'ai bi em'...Tác giả chọn 'Ai Bê Em' cho có ý trào phúng.",🌺pétrus-ký - 12b4 - khoá tú tài ibm🌺,,-N3- Nguyễn Ngọc René,https://poem.tkaraoke.com/107977/.html
"HAI QUẢ BẦU
Bầu nhà một cặp vẫn non xanh
Quấn quýt bên nhau cắt chẳng đành
Giữ mãi ngày nào ra cứ ngắm
Trông hoài tối lại đến mà canh
Eo thon dáng nhỏ ngồi cùng chỗ
Bụng bự mông to dính một cành
Trẻ quý già ưa từ thượng cổ
Xin đừng phụ rẫy kẻo tàn nhanh
Nguyễn Thuyền",hai quả bầu,,Nguyễn Thuyền,https://poem.tkaraoke.com/107978/.html
"THĂM THẲM DẤU BUỒN
Nắng hạ vàng rưng rưng mây trắng
Những con đường im lặng không tên
Ai ơi hãy cố mà quên!
Tình xưa nghĩa cũ êm đềm còn chăng?
Mùa run rẩy dùng dằng nỗi nhớ
Những hố sâu muôn thuở thở than
Đào sâu kỉ niệm lan tràn
Bến lòng chôn giấu mơn man vết buồn
Những sợi dây tơ vương vun vén
Bao năm xa rón rén dấu chân
Xa dần thương nhớ xa gần
Đó đây , đây đó đôi lần nhìn nhau
Những kỉ niệm xô mau tan biến
Trăm dòng sông ra biển bao giờ?
Đi qua lớp bụi mờ mờ
Cay cay bờ mắt vu vơ tuổi đời
Ai chạm ngõ đôi môi năm ấy!
Cơn đau nào thức dậy trong tim
Ngỡ ngàng giây phút bình yên
Bay vèo xô đẩy về miền tóc tơ
Ngày 25/6/2020
Thiên Ân ( Bình Dương)",thăm thẳm dấu buồn,,Thiên Ân,https://poem.tkaraoke.com/107979/.html
"MÙA HẠ NĂM SAU
Mùa hạ năm sau , thế đó
Sân trường chiếc lá tìm quên
Ghế đá , hàng cây vội bỏ
Mộng xưa vỡ bóng êm đềm
Nhí nhảnh , hồn nhiên , nghịch ngợm
Thuở ấy kỉ niệm đong đầy
Sách đèn ấp ôm khuya sớm
Ngập ngừng khi chạm bàn tay
Mùa hạ năm sau xa vắng
Tiếng ve rời rạc đôi bờ
Chuỗi cười bay về vô tận
Khoảnh khắc ngồn ngộn giấc mơ
Bài thơ tình chưa ráo mực
Một năm người lại xa người
Một năm mềm môi kí ức
Phương trời ai đã ngược xuôi?
Mùa hạ năm sau ai biết?
Nhặt chi mấy cánh phượng rơi?
Ta còn tìm nhau ráo riết
Chim bay mỏi cánh muôn đời
Khóc thầm râm ran lồng ngực
Nức nở se lòng đớn đau
Đêm sâu nhớ nhau day dứt
Nghẹn ngào trăm ý , nghìn câu
Ngày 30/6/2020
Thiên Ân ( Bình Dương)",mùa hạ năm sau,,Thiên Ân,https://poem.tkaraoke.com/107980/.html
"PHÍA CUỐI ĐƯỜNG
Kẻ ở riêng mang giọt lệ lòng
Người về xác lá rụng ven sông
Trăng khuya mộng mị đầu dòng suối
Gió tối miên man dọc ruộng đồng
Mặn ngọt ngày nào tan giữa bão
Nồng bùi dạo nọ nát sau giông
Duyên xưa nửa mảnh đành rời bỏ
Những nỗi cô đơn ướt gối hồng ./.
Lê Cảnh Tiến 11/07/2020",phía cuối đường,,Lê Cảnh Tiến,https://poem.tkaraoke.com/107981/.html
