Edited,Title,Genre,Author,URL
"Cánh phượng vô tình vương nhòa nét chữ
Nên trọn đời chẳng ghép được tên nhau.
Nếu hai đứa mình không thể thành đôi
Câu thơ ấy mãi vẫn là dang dở
Em khẽ nói cũng là duyên chưa đủ
Đừng trách phượng hồng, tội lắm anh ơi.
(TT)",đừng trách phượng hồng.,,Trần Thản,https://poem.tkaraoke.com/107451/.html
"THẮP ĐÈN ĐỢI ĐẾN BÌNH MINH
Thắp đèn đợi đến bình minh
Chờ em nói tiếng ân tình nở hoa
Ngày mai trời đất dung hoà
Ngất ngây sương khói, vỡ oà thanh âm
Mơ trăng rụng bến dương cầm
Mơ sao nhấp nháy âm thầm tình yêu
Em xinh đẹp rất mỹ miều
Tóc mây hư ảo, gió chiều thoảng bay
Cho anh ám ảnh đoạ đày
Yêu em mà sợ tháng ngày phôi pha
Chạy quanh trong cõi ta bà
Nguyện làm nô lệ thật thà của em
Trần Minh Hiền Orlando ngày 14 tháng 6 năm 2020.
OBSESSION
I am painting my soul the color of obsession
Love permeates my mind for recession
This is the the flip side of depression
You are my angel of definition
Trần Minh Hiền Orlando ngày 14 tháng 6 năm 2020.",thắp đèn đợi đến bình minh,,Trần Minh Hiền,https://poem.tkaraoke.com/107452/.html
"Tuy em buồn nhưng chẳng trách gì anh
Bởi tình cảm chân thành đâu còn nữa
Người bỏ mặc quên bao lời thề hứa
Để riêng ta lạc lõng giữa hồng trần
Ôi cuộc đời ! quấn quyện chữ nghĩa ân
Cứ ngỡ tưởng sẽ được gần êm ấm
Nào ai biết thăng trầm ghim mệnh hẩm
Khóe mi gầy ướt đẫm nỗi sầu tương
Thế nhân ơi ! Sao cách trở đôi đường
Để bèo bọt mãi hoài vương phận gái
Trời bạc bẽo đắm hồn si ngây dại
Suốt kiếp đành mê mải nuốt đắng cay
Hỏi chốn kia có thấu hiểu phương này
Từng canh vắng vẫn thầm say khát vọng
Luôn ước nguyện vai kề nương cánh võng
Chung mái nhà tròn giấc mộng uyên ương .
14/6/2020",tiếng lòng 1,,YÊU THOÁNG QUA,https://poem.tkaraoke.com/107453/.html
".....NHÁNH LAN RỪNG.....
""Thơ : MC Quang Sáng""
(...Chàng trai xứ nghệ...)
Sinh ra sống giữa đại ngàn
Nắng mưa chẳng thể lụi tàn sắc hương
Dòng người xuôi ngược bốn phương
Vì mê nên đã lên đường tìm lan.
Bao nhiêu mệt nhọc tiêu tan
Hồn thơ cứ thế nhẹ nhàng vụt bay
Ngắm lan dẫu tỉnh cũng say
Người dưng cũng ghé vào đây ngước nhìn.
Giấc mơ cuộc sống êm đềm
Nhẹ nhàng theo đuổi với niềm thanh tao
Cuộc đời có được là bao
Phong lan đúng thật người nào cũng mê.
Quang Sáng. 14 _ 06 _ 2020",nhánh lan rừng,,Lê Sáng,https://poem.tkaraoke.com/107454/.html
"TRÁI TIM KHÔ HÉO
Cuộc tình như áng mây bay
Một lần quen biết qua ngày tan mau
Dấu nào lưu luyến trong nhau?
Anh quên lãng lẹ em sầu đơn côi
Xin đừng than trách cuộc đời
Tại em nông nổi tin lời bướm ong
Thẫn thờ buồn bã đợi mong
Vai người lãng tử ai hòng tựa nương?
Tình anh ôm ấp gío sương
Nhạt nhòa dáng ngọc bên đường tiếc thương
Thôi đành bước tiếp như thường
Không tìm bến đậu không mường tưởng chi
Trắng tay duyên nợ nghĩa gì
Trái tim khô héo đã tì vết đau
Mắt nhìn hút mãi giọt sầu
Bởi hình bóng cũ in sâu đáy lòng.
hoanghoon
11.06.20",trái tim khô héo,,Hoanghoon,https://poem.tkaraoke.com/107455/.html
"XẾ CHIỀU
Ngẫm nghĩ tình yêu tuổi xế chiều
Lưng còng tóc bạc dáng liêu xiêu
Thèm câu quyến rũ nồng nàn thiếu
Ngại tiếng lơ là nhạt nhẽo trêu
Điệu mới thời gian nào thấu hiểu
Dòng quen thế kỷ chẳng nuông chiều
Mai này hiện diện mình xin kiếu
Mặt đất vô tình để bám rêu.
hoanghoon
11.06.20",xế chiều...,,Hoanghoon,https://poem.tkaraoke.com/107456/.html
"TÌNH MẸ TRONG CON
Giữa trưa hè oi ả
Đường cát lún bàn chân
Những bước đi mệt mỏi
Sau lưng mẹ ướt dần
Luôn nhớ ngày hai buổi
Trời không cần điểm danh
Dáng gầy guộc trung thành
Hấng nắng mưa chăm chỉ
Sức chịu đựng bền bỉ
San ruộng mới nước ngang
Đẩy xe cút kít tàng
Đắp đê ngăn nước mặn
Buồn có năm trời hạn
Cây lúa đuối cỏ chen
Mặt đất đóng lớp phèn
Bỏ công gặt đồng gío
Nét mặt u sầu đó
Đọng tình mẹ nhà quê
Thương con khổ chẳng nề
Trăm việc tự lo liệu
Tới ngày con báo hiếu
Mẹ kiệt sức theo cha
Thân trôi dạt miền xa
Thiếu nén hương kính viếng.
hoanghoon
11.06.20",tình mẹ trong con,,Hoanghoon,https://poem.tkaraoke.com/107457/.html
"NHẬN BIẾT THÁNH TÂM CHÚA GIÊSU
Ngài yêu chăm sóc tận tình
Chúa là mục tử chăn mình bước xa
Trao ban đón nhận giao hòa
Trái tim lộ rõ thiết tha gọi mời
Hy sinh máu đổ tả tơi
Chết trên Thập Gía rạng ngời tình yêu
Đổ ơn cứu chuộc xuống đều
Cho người tốt xấu hưởng nhiều ơn linh
Xin Ngài tha thứ tội tình
Sống đời thực dụng tim mình héo khô
Mất đi cảm xúc nên thơ
Nhẹ nhàng êm ái bến chờ khiêm nhu
Con xin thoát khỏi lao tù
Bao quanh cám dỗ ngơ ngu giam cầm
Đón luồng ánh sáng Thánh Tâm
Chiếu tan bóng tối lỗi lầm thế nhân
Trái tim che chở ân cần
Như không thể thiếu trần gian dại khờ
Cả đời ước vọng kính thờ
Giống trái tim Chúa phúc giờ lâm chung.
hoanghoon
12.06.20",nhận biết thánh tâm chúa giêsu,,Hoanghoon,https://poem.tkaraoke.com/107458/.html
"Thơ hoạ Nguyễn Thành Sáng & Tam Muội (2072)
Thẫn Thờ
Hoàng hôn nắng rụng khuất sau đồi
Mây trắng bồng bềnh lờ lững trôi
Đàn cá nhởn nhơ đùa ngụp lặn
Chú chim gõ kiến lục săn mồi
Hương nhài ngan ngát gió lao xao
Khoe dáng mảnh mai kế cận đào
Sa mạc bỗng dưng chìm nỗi nhớ
Sanh tình hữu cảnh, dạ hanh hao
Bởi chẳng gần nhau được vỗ về
Mi hờn ngọc rớt khảy lê thê
Vần thơ da diết niềm chan chứa
Vẫn đợi thời gian! Ôi não nề!
Mình hỡi! Võ vàng Mình biết không
Trời khuya lạnh lẽo bạc tơ hồng
Thẫn thờ đối bóng trong hiu quạnh
Thắc thỏm ưu hoài rũ rượi trông
Mình hỡi! Bẽ bàng Mình thấu chăng
Những đêm thao thức đón hàn băng
Cô liêu đơn độc trùm tâm khảm
Duyên nợ chi đâu, thống khổ hằng
Nhức nhối tháng ngày quặn xót xa
Từ sâu huyết mạch mãi ngân nga
Đôi khi em muốn tìm quên lãng
Một bước sang ngang, ấy vậy mà
Thiếu Mình phím lạc thể nào vui
Cuối kiếp trầm kha chuỗi ngậm ngùi
Cuộc sống đoạ đày mong lối thoát
Vầng dương ngoảnh mặt ảnh ma khui
Bày vẽ trớ trêu giăng đỉnh đầu
Thôi đành gối mộng dệt canh thâu
Biều thi, mực, giấy, dòng mơ tưởng
Trải khúc tương tư lấp bể sầu.
July 2, 2019
Tam Muội
Chơi Vơi
Rớt hạt, xuân tàn, hạ đến đây
Ngàn hương, vạn sắc đã tan phai
Giờ muôn rộ lá chìm trong gió
Rung lắc theo đưa chuỗi tháng ngày...
Dòng đời luôn mãi bánh xe lăn
Vạn vật mênh mông vẫn cứ hằng
Lúc biển trập trùng cơn sóng vỗ
Khi chìm tĩnh lặng, gợn lăn tăn
Sáo sậu nhốt lồng, sáo sậu kêu
Niềm thương nhớ bậu biết bao nhiêu
Rồi trưa hôm ấy bầu hanh nắng
Quá mỏi, co ro, sáo rũ nhiều...
Lập loè đom đóm quyện lân tinh
Ửng sáng tha ma khoảnh khắc hình
Khiến những linh hồn đang vất vưởng
Ngậm ngùi vương vấn kiếp phù sinh?
Lác đác mưa rơi chiều ráng tắt
Chao lòng trăn trở kẻ cô đơn
Buồn buồn hướng vọng về xa vợi
Bất chợt âm vang chạnh mất còn...
Ôi! Thay đổi lắm, nắm con tim
Bóp chặt, bóp lơi, cái gọng kềm
Tê tái, hững hờ, khung luẩn quẩn
Tợ màn lam khói trói sương đêm
Biết khóc, biết cười hay trách ta
Bút màu chẳng có, giấy đâu ra
Lại say nét vẽ, say hình mộng
Tha thiết vô vàn một đoá hoa...
09/06/2020
Nguyễn Thành Sáng",thơ hoạ nguyễn thành sáng & tam muội (2072),,Nguyễn Thành Sáng,https://poem.tkaraoke.com/107459/.html
"Giây Phút Suy Tư
Sương bảng lảng, loang dần về diệu vợi
Tắt nắng rồi, chi đợi để cho ai
Đàn tim khảy nhịp dài quanh sẫm tối
Khúc u hoài rười rượi nghẹn trời mây...
Trăng mỏng mảnh hướng tây chìm khuya trước
Nay đông trồi, vươn vượt đỉnh thênh thang
Vẫn lấp lánh khuyết vầng soi nẻo bước
Và phu nghèo quay ngược, trở lều tranh
Kia! Chim cú trên cành nhìn con chuột
Ánh lạnh lùng, móng vuốt chực sà quơ
Còn chuột ta thì chờ xơi sâu nhỏ
Biết một hồi nào có hoặc nào đơ
Lão mèo hoang cũng núp bờ rình ếch
Ếch đang giương cặp mắt hướng chàng giun
Giữa chạng vạng mịt mùng đầy rẫy chết
Cuộc dây chuyền điểm vết dưới không trung
Chân thả gót, bâng khuâng hình kỷ niệm
Bất ngờ đâu cảnh hiện lẽ tồn sinh
Bên sức mạnh phần mình tìm được miếng
Phía yếu bề gắng gượng, lịm hồn kinh...
Chạnh ngao ngán, chán chường dòng nhân thế
Sống đây là! Là để đấu tranh hơn
Kẻ thua thiệt, hoàng hôn treo ánh lệ
Người thắng, thành, bóng xế mát đầu non
Nhưng tất cả cũng mỏi mòn tuổi tác
Chuỗi thời qua được mất lững lờ trôi
Khi chầm chậm xe đời vào xa lắc
Nẻo vân phù cuốn cất chuyện tan phôi...
14/06/2020
Nguyễn Thành Sáng",giây phút suy tư,,Nguyễn Thành Sáng,https://poem.tkaraoke.com/107460/.html
"HỒN HOA (Thơ)
Trần Minh Hiền Orlando ngày 14 tháng 6 năm 2020
Anh ngồi ngắm những đoá hoa nhỏ bé
Ngắm hồn hoa nghe từng tiếng ân tình
Như dòng suối tự đầu nguồn của Mẹ
Đến cho em thông cảm đôi mình
Anh ngồi ngắm vũ trụ màu thanh tịnh
Nghe hồn hoa lặng lẽ nhiệm mầu
Như tiếng sóng của đại dương yên tĩnh
Đến cho em hạnh phúc bên cầu
Anh ngồi ngắm những đoá hoa hiền hậu
Ôm hồn hoa ôm những muộn phiền
Như ngọn gió vuốt ve đời hậu đậu
Đến cho em hiểu biết hành thiền
Anh ngồi ngắm bốn mùa miên viễn
Vẽ hồn hoa vẽ ánh sao trời
Như tia nắng sáng soi lòng hướng thiện
Đến cho em giác ngộ rạng ngời
Trần Minh Hiền Orlando ngày 14 tháng 6 năm 2020",hồn hoa (thơ),,Trần Minh Hiền,https://poem.tkaraoke.com/107461/.html
"ÁO DÀI VỜI XA
Áo dài đã giẫm nát hồn tôi
Mây nghiêng gió ngả góc xa xôi
Lí thuyết bao giờ hết màu xám
Xưa nay ai ôm hết bóng đời
Áo dài vương nhớ tóc buông lơi
Trái tim ấp úng mãi không lời
Nương náu đôi môi, vươn vai sống
Nhánh phượng thèm yêu cháy rực trời
Áo dài mềm mại , chút hạ rơi
Búp lá non tơ , cây đâm chồi
Lật trang lưu bút , chùm dĩ vãng
Lắng nghe trái đất luống bồi hồi
Áo dài nhón gót vạn phai phôi
Văng vẳng đâu đây tiếng ve sôi
Hoài cảm mọc đầy muôn kẽ lá
Sỏi đá nằm mơ ngõ vào đời
Áo dài đeo bóng đến hụt hơi
Nụ hôn ngây dại chẳng rao mời
Nụ cười bẽn lẽn đùa cánh gió
Oán trách vòng tay điệu ru hời
Áo dài xếp mộng đỉnh chơi vơi
Rạo rực trái tim hứng rã rời
Từ độ bướm vàng say hoa cỏ
Bến thuyền xé nắng tít mù khơi
Đêm 10/6/2020
Thiên Ân ( Bình Dương)",áo dài vời xa,,Thiên Ân,https://poem.tkaraoke.com/107462/.html
"GIẤC MƠ NGÀY SAU
Giữa nẻo phù vân sống lạc loài
Mai về cát bụi hỏi bằng ai
Cùng thơ khoả lấp hồn trăng cũ
Với tửu vùi chôn chuỗi mộng dài
Nhặt những âm đàn rơi hẻm vắng
Gom từng sợi nắng rã chiều phai
Mời em vớt điệu hò ven biển
Của mẹ ngày xưa xoã sóng cài ./.
Lê Cảnh Tiến 15/06/2020",giấc mơ ngày sau,,Lê Cảnh Tiến,https://poem.tkaraoke.com/107463/.html
"Chúa dấu một con quỷ và một thiên thần
Vào bên trong của mỗi con người chúng ta
Và trong mỗi khoảnh khắc khó mà nhận ra
Chỉ chờ ngày phán xét cuối cùng mới biết ...",chỉ chờ ngày phán xét cuối cùng mới biết ...,,Mr.Smile,https://poem.tkaraoke.com/107464/.html
"EM CÓ LÀ ĐOÁ HOA BIẾT YÊU
Em có là đoá hoa biết yêu
Cho anh mê mẩn ước mơ nhiều
Đất trời lãng đãng vùng hoang vắng
Ngày tháng mơ màng bến quạnh hiu
Ao ước niềm vui không tả xiết
Khát khao hạnh phúc biết bao nhiêu
Em là ánh sáng mùa xuân mộng
Em đẹp thần tiên quá mỹ miều
Trần Minh Hiền Orlando ngày 15 tháng 6 năm 2020.
WONDERFUL
You are beautiful and wonderful
I can't stop loving you, oh my hopeful
Life is marvellous and love is lovely
You are the best, absolutely
Trần Minh Hiền Orlando ngày 15 tháng 6 năm 2020.",em có là đoá hoa biết yêu,,Trần Minh Hiền,https://poem.tkaraoke.com/107465/.html
"( mạ đề )
Thổn thức từng đêm nỗi nhớ lùa
Mơ hoài một bóng khiến hồn chua
Thời gian chẳng đổi người xa mặt
Kỷ niệm còn nguyên gió trở mùa
Chỉ ước yên bình quên giận dỗi
Thầm cầu hạnh phúc rũ hơn thua
Yêu nhau trọn kiếp tình bền chặt
Há phải lời ngoa thích cợt đùa.
15/6/2020",xa xôi nỗi nhớ,,YÊU THOÁNG QUA,https://poem.tkaraoke.com/107466/.html
"TA VỀ CHỐN CŨ
Ta về qua ngõ hoàng hôn
Khói sương bàng bạc ru mòn lẻ loi
Khóc thương áo trắng một thời
Giã từ chôn giấu bao lời nhỏ to
Ta về say mắt học trò
Thuở em cắp sách tò mò mát chân
Dìu em dưới bóng nợ nần
Biết rằng gặp gỡ , biết rằng chia tay
Ta về mây gió một , hai...
Học bài ngao ngán thiệt dài , khổ ghê...
Nheo nheo đôi mắt ép phê
Đôi khi ngáp vặt ngủ mê kiếp nào?
Ta về hoa phượng thay màu
Đôi hài thầm lặng gõ vào tim đau
Tơ lòng dìu dịu mau mau
Những năm đèn sách bay vào không gian
Ta về tìm đống tro tàn
Tương tư đốt cháy lá vàng reo thi
Em vào mơn mởn xuân thì
Đắng lòng cho kẻ trồng si cỗi già
Ta về nơm nớp lệ sa
Cánh đồng trinh nữ xót xa dặm ngàn
Dừng chân nheo nhéo tuổi vàng
Ầu ơi số kiếp đa đoan ví dầu!
Ngày 7/6/2020
Thiên Ân ( Bình Dương)",ta về chốn cũ,,Thiên Ân,https://poem.tkaraoke.com/107467/.html
"Ô gò má chói lòa bóng bẩy
Trong như gương lộng lẫy hơn trăng rằm
Gió gẩy cười, lúm đồng tiền hóp lại
Hun hút hố sâu chấp chóa rừng tình
Những mắt xích cháy thành dung nham đỏ rực
Hai bờ má lấp lánh cung mây
Khi hây hây hóa hồn sa mạc
Đưa tôi lạc, tầng cung điện mê say
Tôi ở đây, em nơi nào thế nhỉ?
Sao gò má ấy cứ phập phồng trong tim?
Tôi ngơ ngẩn đóng băng bên vòm sương lạnh
Khao khát tìm em nuốt trọn cả nắng chiều
Chưa bao giờ hiu hắt dài đến thế
Đành kéo dây yêu từ mép lòng trời ban
Rồi chẳng có gì - chẳng có gì - trống rỗng
Chỉ gò má hồng chảy mật phất hương
Kia má em, đó má em - đầy đặn
Hiện hữu hoài nơi tâm thức phiêu diêu
Tôi miên man tay chân hằn thâm từng đốt
Gắt gỏng la, ngọn núi chợt rùng mình.
NN
7/6/2020",gò má,,Dũng Lê Ngọc,https://poem.tkaraoke.com/107468/.html
"HỒN HOANG
mây
mân mê eo trăng
Cửa gió quên không cài
góc đêm đèn trời mắc võng
những ngôi sao lấp loáng cười
ngón tay nụ
mở vệt sương
đêm hạ
ai tưới nước dòng sông
quệt mảng xanh lưng núi
tô màu mây bay
nghìn trùng
xa xăm
hồn đã hoang đến lạ
dấu ấn một nhà thơ bằng ngôn ngữ
ngày mai
liêu phiêu trang giấy
thời gian sao mênh mang
không gian thì
bồng bềnh mái tóc
lời người cứ bay
lời cỏ cây lung bung đi hoang.
10/6/2020
N.N",hồn hoang,,Dũng Lê Ngọc,https://poem.tkaraoke.com/107469/.html
"EM NGƯỜI CON CAO NGUYÊN
Lửa thiêng soi đêm
Nhịp chiêng ngân, hòa dòng suối hát
Cao nguyên hừng hừng trăng
Mênh mang
Một làn hương rừng chấp chới
Trên vòi rượu cần hân hoan
Điệu Xoang rộn ràng say sưa
Em hoang vu như dòng sông Xê-Xa
Tươi duyên ca khúc B'rao:
Bầy chim liêng phiêng nương rẫy
Gùi nghiêng nghiêng
Tóc mẹ đỏ như màu đất
Tay cha mơn man mặt trời
Lời núi đung đưa đại ngàn
Lời rừng vọng vang thung lũng
Đam San ơi! Ban Mê ơi
Kèn Đinh Năm xông xênh
Cha ông vuốt hồn theo gió vớt nắng du dương
Em yêu ơi! Ban Mê ơi!
Từng chùm cà phê cháy bỏng
Từng chén cơm rau ấm nồng
Từng ánh mắt nâu son sắt
Em người con Cao Nguyên.
13/6/2020
N.N",em người con cao nguyên,,Dũng Lê Ngọc,https://poem.tkaraoke.com/107470/.html
"EM HIỀN NHƯ SƯƠNG KHÓI
Em hiền như sương khói
Anh u mê dại khờ
Nói hay là không nói
Có phải là tình thơ
Sóng say mê vỗ bờ
Nhớ con thuyền xa bến
Em ngây thơ duyên nợ
Anh một đời lênh đênh
Như mây trôi bồng bềnh
Anh-em vào tiên cảnh
Thắp cho vàng ngọn nến
Khói sương nào mong manh
Em đẹp xinh thiện lành
Cho anh ngàn điều ước
Anh chỉ xin phước hạnh
Để thơ mình long lanh
Trần Minh Hiền Orlando ngày 16 tháng 6 năm 2020",em hiền như sương khói,,Trần Minh Hiền,https://poem.tkaraoke.com/107471/.html
"....ĐƯỜNG VỀ NƠI XA...
""Thơ : MC Quang Sáng""
(...Chàng trai xứ nghệ...)
Phật cũng là người tu trọn kiếp mà nên
Cũng phải trải qua ba chìm bảy nổi
Cũng có lúc sai tự nhìn thấy lỗi
Nhưng Phật tự mình biết sửa lầm sai.
Một kiếp sinh tồn thử hỏi được mấy ai
Chưa tới trăm năm đã bốn dài hai ngắn
Xuân hạ thu đông nửa chừng  đứt đoạn
Vứt bỏ lại đời cõi tạm phần dư.
Đừng nghĩ lên chùa là thánh thiện tâm tu
Vái lạy xin tha Phật đại từ xóa tội
Nghiệp của ta mang chẳng Phật nào rước nổi
Ta phải tự mình sám hối với ta.
Cũng bởi nhân duyên tử sinh cõi tà bà
Chẳng ai thấy được phải trải qua mấy vận
Hãy tự tìm cho một lối đi bằng phẳng
Tránh cái gập ghềnh bớt nặng về sau.
Quang Sáng. 16 _ 06 _ 2020",thơ phật,,Lê Sáng,https://poem.tkaraoke.com/107472/.html
"....ĐỒNG TIỀN MỒ HÔI....
""Thơ : MC Quang Sáng""
(...Chàng trai xứ nghệ...)
Thế gian lừa lọc người ta
Đồng tiền mang lại chỉ là cái chông
Mang theo vấp ngã thôi xong
Tự vương tự níu tự đâm vào mình.
Thế gian soi chiếu vô hình
Tưởng che mắt được thiên đình chiếu soi
Lọc lừa ba chốn bốn nơi
Không thể che mắt ông trời được đâu.
Đồng tiền là thứ gươm đao
Tay luôn phải biết cán đâu mà cầm
Gươm đao dù lưỡi đã cùn
Cũng đừng có dại vung đòn múa tay.
Lọc lừa sống tạm qua ngày
Của thiên trả địa, có đầy cũng vơi
Chắt chiu bằng giọt mồ hôi
Tiền đong hóa ""đá"" muôn đời vẫn nguyên.
(""..."" Mua vàng mua đá kim cương để dành)
Quang Sáng. 16 _ 06 _ 2020",đồng tiền mồ hôi,,Lê Sáng,https://poem.tkaraoke.com/107473/.html
"MƯA SẦU NHÂN THẾ
Mưa sầu giăng giăng nhớ
Tình rơi vào chiêm bao
Vòng tay nào bỡ ngỡ
Nghìn năm , nghìn năm sau...
Mưa sầu sâu hơi thở
Màu thời gian in đau
Con đường nằm nức nở
Mái ngói thời đẫm nâu
Mưa sầu đeo bóng nhỏ
Em xa rồi tuổi mơ
Đạp chân chiều vụn vỡ
Nát vụn một trời thơ
Mưa sầu đầy giông tố
Từng hạt rơi tròn , đều
Trái tim đã nhầm chỗ
Níu rã mòn rong rêu
Mưa sầu khơi đau khổ
Đắng cay ngập bến hồn
Thềm yêu chưa thổ lộ
Thời gian bóng mỏi mòn
Mưa sầu đành cau có
Rơi rụng triệu yêu thương
Chiếc lá vàng từ độ
Nhớ ai ngâp con đường
Đêm 10/6/2020
Thiên Ân ( Bình Dương)",mưa sầu nhân thế,,Thiên Ân,https://poem.tkaraoke.com/107474/.html
"MỘT THỜI ÁO DÀI
Một thời mân mê áo dài
Thương nhớ đong đầy cảm xúc
Ta về bến bờ trong đục
Nhặt nhành một chùm rủi may
Hoa tím rụng rơi thềm sân
Môi hồng,  ru miền xa vắng
Nỗi buồn dây dưa vô tận
Ai còn níu bóng nợ nần?
Một thời mân mê áo dài
Tóc thơm mượt mà ai chải?
Đôi lần nhìn nhau ái ngại
Đất trời mặc sức tỉnh say
Lá cỏ hết tuổi yêu đương
Những con đường mòn hun hút
Ngọn gió tàn hơi côi cút
Đậu vai ngần ấy vui buồn
Một thời mân mê áo dài
Ai khổ vì ai nào biết?
Ta còn dại khôn da diết
Trải lòng dốc nắng hồn bay
Chuyện tình đi qua song mây
Lắc léo muôn vàn cám dỗ
Dấu chân non tơ từ độ
Khóc than sợ giẫm bùn lầy
Ngày 11/6/2020
Thiên Ân ( Bình Dương )",một thời áo dài,,Thiên Ân,https://poem.tkaraoke.com/107475/.html
"Người Bán Hoa Dạo
Hội An thuở nọ bão bùng khơi
Cây ngã, cỏ nghiêng, sấm sét trời
Là lúc Mẹ hiền đau chuyển dạ
Oe oe bật tiếng, lão ra đời
Bởi cảnh neo đơn, bặt trống trường
Thân cò lặn lội nắng dầm sương
Tinh mơ vác cuốc băng đồng ruộng
Khắc lậu canh khuya tự học đường
Năm vừa trổ mã nhập tòng quân
Từ giã căn lều, trĩu bước chân
Nhiệt huyết căm hờn, nung nấu chí
Mong đền tấc đất…nghĩa thâm ân
Thảm khốc chiến tranh chóng hạ màn
Rồi người cửa biển, kẻ lầm than
Riêng bèo phận hẩm mang què quặt
Một mảnh đạn bom trúng…phế tàn…
Tháng nay Đà Lạt nhuốm sầu bi
Chính phủ ban hành, giãn cách li
Do dịch bệnh truyền gieo chết chóc
Phố thương mại vắng…hậu duy trì
Khốn đốn lại còn gặp cái eo
Ngỡ đâu góp vốn lượm lèo tèo
Sớm chiều bươn chải, trông no đủ
Còn chút tiền dư bố thí nghèo
Ngày rê đôi dép vượt ngàn xa
Tối đến đắp sao, gối ánh tà
Nhả khói vẽ hình ôm mộng tưởng
Hẹn mùa kỳ ngộ…đợi thời qua
Nhưng hỡi! Giang cầu héo thúng hoa
Gió sông lạnh thổi mái loà xoà
Đăm chiêu hiển hiện trên nền trán
Nhọc xác, bụng cào, chạnh xuýt xoa…
Phút giây tiếp chuyện, cảm nao lòng
Kiếp chẳng huệ, đào, chỉ tuyết phong
Tần tảo mưu sinh, chừ bóng xế
Vẫn hoài lam lũ, chuỗi long đong
Bấy khổ cho xong để thoát vòng!
April 16, 2020
Tam Muội",người bán hoa dạo,,TamMuội,https://poem.tkaraoke.com/107476/.html
"Phút Sa Cơ
Trong huyết quản chảy dòng Âu Lạc
Nên ẩn tiềm ngọn thác vọng ngân
Quê Cha đất Tổ muốn lần
Nghĩa ân đáp trả, lòng trân trọng lòng
Bỗng một sớm xuân phong luyến láy
Cánh thiệp mời Thầy dạy trường tư
Chẳng đắn đo, chút ngần ngừ
Hành trang thẳng tiến, định cư Sài Thành
Thuê gác trọ, ứng nhanh hội nhập
Cưỡi ngựa thồ, dáng dấp uy nghi
Trên bục giảng, dõng dạc thì
Dưới ong vò vẽ rầm rì ê a
Tưởng cuộc sống điệu đà thanh thản
Ai có ngờ vướng nạn dịch lây
Lịnh nghiêm đã bấy nguyệt gầy
Những đồng dành dụm, giờ mây khói rồi
Thân tứ cố phù bôi nghịch cảnh
Đành ngửa tay xin mạnh thường quân
Trót đang ngấp nghé ngũ tuần
Tóc sương muối bạc vẫn truân chuyên hoài
Góc Nguyễn Trãi mệt nhoài bởi nắng
Nhễ nhại người, cặp cẳng rung rung
Ngẫm đời luân lạc khốn cùng
Tương lai đổi dạng bịt bùng tối tăm
Trời chạng vạng đăm đăm cỏ lá
Chực lưng tròng…khách lạ tấp vô
Cảm thương hỗ trợ gói đồ
Gửi tiền đùm bọc, tặng khô phở bò
Ôi xúc động! Kẻ cho người nhận.
April 17, 2020
Tam Muội",phút sa cơ,,TamMuội,https://poem.tkaraoke.com/107477/.html
