Edited,Title,Genre,Author,URL
"Thơ hoạ Nguyễn Thành Sáng & Tam Muội (972)
Tình Hoài Vọng
Đêm sương lạnh, lạnh cả bầu tâm sự
Ý sương buồn, buồn cứ mãi theo ta
Có phải chăng thương nhớ bóng hình xa
Để da diết, ngân nga từ sâu thẳm…
Đây vọng nguyệt nhẹ nhàng, êm ả nắm
Đó tửu hồng sưởi ấm giấc vu sơn
Kia ngọt ngào, thắm thiết, nụ trao hôn
Nọ dào dạt ngàn cơn say ngây ngất…
Nhưng tất cả có nào đâu ảnh thật
Chỉ long lanh vằng vặc giữa trời mơ
Là bức tranh thuỷ mạc ẩn vần thơ
Là nhẹ thổi bên bờ du dương mộng
Hỡi tinh tú đỉnh không gian lồng lộng
Hỡi mây chiều khuấy động dạ sầu đau
Cớ vì sao kết chỉ dưới canh thâu
Nguyện son sắt vẹn câu thề vạn kỷ?…
Để lòng ta lửa thâm trầm âm ỉ
Canh cánh hoài, ghì ghị níu con tim
Nhìn dòng sông thấy lơ lửng mảnh thuyền
Ngắm lam khói, gợi niềm đau chua xót
Không vướng nặng thì tại sao vàng vọt
Dưới thu chiều lối ngõ phủ đìu hiu
Không bâng khuâng vương vấn thật là nhiều
Sao tĩnh mịch nghe kêu từ diệu vợi…
Nhưng hỡi ôi! Vậy mà không thể đợi
Không thể gần, thể nói tiếng yêu “Ai”
Chỉ được làm chiếc bóng giữa tầng mây
Trôi chầm chậm tháng ngày theo ngọn gió…
23/2/2019
Nguyễn Thành Sáng
Cuộc Tình Không Đoạn Kết
Chiều sương lạnh bến sông xưa quạnh vắng
Nước lững lờ mây lẳng lặng dòng trôi
Thán chim cuốc từng hồi nghe mặn đắng
Em thẫn thờ dưới rặng liễu đơn côi
Đời ngang trái nên đôi mình dang dở
Để con đò nức nở trước mù giăng
Xa ánh tỏ chị Hằng buông nhung nhớ
Anh đi rồi trăn trở đọng giá băng
Anh có cảm ánh trăng giờ nhợt nhạt
Đám lục bình xuôi giạt giữa lênh đênh
Lối vào mộng bồng bềnh trong bát ngát
Gió đông luồn man mát chuỗi buồn tênh
Chân thất thểu chênh vênh đường qua suối
Chạnh nỗi niềm những buổi đón đưa nhau
Chiếc cầu nhỏ cũng dàu dàu tiếc nuối
Bởi bóng hình rong ruổi khiến lệ đau
Nét nguệch ngoạc bạc màu vì nước mắt
Lời Mẹ Cha ép bắt phải lấy chồng
Phận hiếu nữ dẫu không theo sắp đặt
Nhưng cuộc đời khe khắt mãi cùm gông
Bầu u tịch bỗng giông từ đâu đến
Sấm sét đùn đang nện xuống trần gian
Như giày xéo tâm can bờ hổn hển
Sóng dập dềnh ngọn nến lịm miên man
Đành lỗi hẹn cung đàn im phím lạc
Tiết xuân về sao lác đác vàng rơi
Thuyền năm ấy ra khơi vào biển bạc
Dẫu xót lòng cũng thác đổ tình lơi.
February 24, 2019
Tam Muội
NHẤT LANG THƯ QUÁN:  nhatlang.com",thơ hoạ nguyễn thành sáng & tam muội 972.,,Nhất Lang (Nguyễn Thành Sáng),https://poem.tkaraoke.com/120996/.html
"24-Trích Đoạn Bài Thơ:   NỖI SẦU MA NỮ
Trong TẬP THƠ TRUYỆN HỒN LANG VỀ CÕI THẾ
Của Nhất Lang (Nguyễn Thành Sáng)
Hoa ơi! Có thấy dòng châu lệ
Giọt nhỏ xuống đây cảm nhớ hoài
Và nước! Ngươi trườn theo ngọn sóng
Có nghe da diết cõi lòng ai?
Giữa trái tim đau đầy nỗi nghẹn
Hết rồi nồng ấm tiếng yêu em
Không gian ảm đạm, tình tan tác
Liễu héo, nguyệt tàn, rũ bóng đêm…
Em thương nhớ quá hồn lang ạ
Đâu nỡ lòng nào muốn cách xa
Nhưng bởi nhìn anh buồn khoé mắt
Thôi đành dang dở nhịp ngân nga
Trăm năm dương thế chàng còn nhớ
Một ảnh hồn ma ở chốn nầy
Mòn mỏi đợi chồng bên giá lạnh
Dấu yêu, kỷ niệm…tím trời mây?…
nhatlang.com",24- thơ hay ngắn trích đoạn,,Nhất Lang (Nguyễn Thành Sáng),https://poem.tkaraoke.com/120997/.html
"Ngày anh đến, gặp em Đà Lạt
Đồi Mộng Mơ nắng trải, hoa vàng
Chiều thung lũng nồng nàn gió hát
Trời  nhẹ buông mây trắng dịu dàng
Anh chẳng biết nói gì đây nữa
Nụ cười em quyến rũ anh rồi
Cả Đà Lạt ngát trời hoa nở
Bỏ bùa anh say đắm, bồi hồi
Anh bối rối, bên em lặng lẽ
Ngắm bàn tay, không dám lại gần
Ước thế giới bỗng nhiên nhỏ lại
Chỉ đủ cho hai chúng ta ngồi
Rằng anh chẳng muốn rời Đà Lạt
Sợ lòng buồn khi phải xa em
Anh nhận thấy tim mình khẽ hát
Có phải là đang yêu, đang yêu?
Ôi Đà Lạt ru lòng vời vợi
Hoa thắm tươi thơm ngát bốn mùa
Và anh muốn tình ta mãi mãi
Đẹp như trời Đà Lạt và em.",đà lạt và em,,Tạ Thăng Hùng,https://poem.tkaraoke.com/120998/.html
"40 NĂM,  MỘT CUỘC ĐỜI
40 năm vui buồn trôi chóng vánh
Ta bạc đầu mấy thuở tóc  phong sương ?
Bục giảng ươm mầm nghìn đêm so sánh
Muôn tiếng lòng rơi chiếc bóng sân trường
40 năm mang ""Nỗi buồn hoa phượng ""
Con ve sầu than khóc gọi mùa thi
Mùa hạ áo trắng bay về vô hướng
Dấu chân nào gõ chiếc bóng thầm thì
40 năm tiếng giảng bài đứt quãng
Bến đục trong là một cõi đi về
Nghiệt ngã bức tường một quầng tối sáng
Chuyến đò kiến thức biền biệt sơn khê
40 năm rã rời câu mơ ước
Người giã từ bụi phấn bóng xa xôi
Kẻ rong ruổi những dặm đường xuôi ngược
Những vòng tay âu yếm đã rã rời
40 năm ngồi rêu rao câu hát
Ông Trời già biết còn có ghen tuông ?
Thuở ấy ai mắt nai vàng ngơ ngác ?
Lá cuối mùa thu đỏng đảnh tơ vương
40 năm màu tươi non đánh mất
Thoi thóp chiều , hoàng hôn rụng kẽ tay
Xin ai đó đừng quay lưng ngoảnh mặt !
Thời gian trôi nhanh chong chóng cuồng quay
40 năm dòng thơ tình có cạn ?
Bóng sân trường ai nhón gót vội xa
Khơi dòng lệ tan theo mùa dĩ vãng
Ơi cuộc đời đá sỏi chớm phong ba
Ngày 18/11/2022
Ân Thiên ( Bình Dương )","40 năm , một cuộc đời",,Thiên Ân,https://poem.tkaraoke.com/120999/.html
"Bao nhiêu yêu dấu tình đầu,
Phai theo những giọt mưa ngâu cuộc đời.
Vẫn còn,dẫu đến tàn hơi,
Tâm tư đeo mãi một thời vấn vương.
Về đâu hình bóng người thương?
Từ mùa xa cách,tơ vương mộng sầu,
Tình này rồi sẽ về đâu?
Khi hồn còn mộng tình đầu luyến mê.
Sang ngang phụ mối duyên thề.
Người ơi,sao để tái tê lòng này.
Bàn tay muốn níu bàn tay
Hồn mơ kéo lại những ngày có nhau...
Lê thê ngày tháng u sầu.
Khối tình u uẩn làm đau tấc lòng.
Cô đơn ôm những ước mong,
Thôi tình đừng mãi long đong ba đào,
Truân chuyên ở góc trời nào?
Thầm chờ một chút âm hao vọng về....
...
Tình đầu,muôn thuở u mê,
Si mê chuốc lấy ê chề ,còn thương!",yêu dấu tình đầu,,Trần Lê Tú,https://poem.tkaraoke.com/121000/.html
"ĐỜI CHIỀU
(Thuận nghịch độc)
➡️
Quanh quẩn bước già lão nhớ quên
Sớm hôm trà cảnh ngắm chim chuyền
Lành mây khói nhạt chiều im sáo
Lạnh gác trăng mờ ngõ vắng uyên
Ranh cuối nở hồng tươi thắm nhụy
Cảng trên chờ sóng nhẹ êm thuyền
Cành vươn lá chật vườn sai trái
Xanh mướt nụ đời mộng bén duyên...
⬅️
Duyên bén mộng đời nụ mướt xanh
Trái sai vườn chật lá vươn cành
Thuyền êm nhẹ sóng chờ trên cảng
Nhụy thắm tươi hồng nở cuối ranh
Uyên vắng ngõ mờ trăng gác lạnh
Sáo im chiều nhạt khói mây lành
Chuyền chim ngắm cảnh trà hôm sớm
Quên nhớ lão già bước quẩn quanh./.
Lê cảnh Tiến 19/11/2O22",đời chiều 3,,Lê Cảnh Tiến,https://poem.tkaraoke.com/121001/.html
"CẢM ƠN EM ĐÃ HIỂU NHIỀU LÒNG ANH
Tình là sương khói mùa thu
Phải em là gió vi vu giữa trời
Anh còn mê mẩn chơi vơi
Say em đắm đuối ngàn khơi đợi mùa
Hồng trần đầy những hoa mua
Long lanh nước mắt lưa thưa nụ cười
Hoa hồng nở thắm hồng tươi
Yêu em mãi mãi yêu hoài em thôi
Nghe thơ cất tiếng rạng ngời
Nghe trăng lặng tiếng tuyệt vời em yêu
Nghe âm hưởng tiếng thuỷ triều
Cảm ơn em đã hiểu nhiều lòng anh
Trần Minh Hiền Orlando ngày 19 tháng 11 năm 2022",cảm ơn em đã hiểu nhiều lòng anh,,Trần Minh Hiền,https://poem.tkaraoke.com/121002/.html
"NÚI SÔNG MỘT THỦA OAI HÙNG
Sông núi ta thật là hùng vỹ
Nhớ thủa nào ông cha đánh giặc
Đổi máu xương dành lấy quê hương
Trong đêm tối hành quân không nghỉ
Đường ghập ghềnh, thăm thẳm, mênh mông…
Súng trên vai vũng bước oai hùng
Dẫu lên cao hay là xuống thấp
Dẫu mưa nguồn nắng chám xạm da
Vẫn tiến bước không nề hà chi hết
Quên tất cả vì ngày mai phía trước
Có nhớ - buồn, nén – hét một tiếng vang
Tạm quên hết, hướng lòng vững hơn
Thêm sức mạnh giương cao họng súng
Đuổi hết giặc thù – dành lấy tụ do
Cho lớp lớp dân nghèo cùng khổ
Cho hòa bình nở rộ hoa thơm
Cho núi sông đẹp tươi hùng vỹ
Niềm tự hào luôn sẵn trong tim…
10-2000
Nguyên Hữu",núi sông một thủa oai hùng .,,Nguyên Hữu,https://poem.tkaraoke.com/121003/.html
"Kính thưa thi sĩ Vinh Hồ,
Bài thơ LƯƠNG TÂM của thi sĩ Vinh Hồ thật tuyệt vời xuất sắc, bài thơ gồm 4 khổ viết về lương tâm con người, thi sĩ VH viết  từ những câu danh ngôn của các danh nhân và ca dao. Đây là những điều mà ai ai cũng biết cũng được học nhưng không phải ai cũng hiểu rõ và làm được và đặc biệt diễn đạt thành một bài hay như vầy như thật đáng bái phục đáng tán thán.
ĐỌC BÀI THƠ LƯƠNG TÂM CỦA THI SĨ VINH HỒ
Trần Minh Hiền Orlando ngày 18 tháng 11 năm 2022
Mời quý vị hãy cùng chúng tôi thưởng bài thơ mới nhất của thi sĩ Vinh Hồ mang tên LƯƠNG TÂM
Bài thơ gồm 4 khổ tổng cộng 16 câu mỗi câu 7 chữ lấy từ cảm hứng của những câu danh ngôn của các danh nhân và của ca dao nói về Lương Tâm. Cái tài của thi sĩ Vinh Hồ là bằng những cảm xúc cảm hứng từ những câu danh ngôn mà ông viết thành một bài thơ rất thi vị và rất ý nghĩa có tính nhân bản nhân văn cao nhưng nhẹ nhàng không lên giọng dạy đời mà rất bình dị nhưng sâu sắc làm người đọc thấm thía và cảm động. Cảm ơn thi sĩ Vinh Hồ.
Trong 16 câu tôi (TMH) thích nhất là
Hãy giữ một lương tâm trong sạch
Đừng làm gì trái với lương tâm
Lương tâm con người bị đánh mất
Khác nào ác thú với dã cầm
Cả bài thơ câu nào cũng hay diễn tả đầy đủ chi tiết những câu danh ngôn bằng nghệ thuật thi ca. Cảm ơn thi sĩ Vinh Hồ cho mọi người đọc 1 bài thơ rất hay rất độc rất lạ.
Trần Minh Hiền Orlando ngày 18 tháng 11 năm 2022
CẢM ƠN
(Viết trên cảm hứng bài thơ Lương Tâm của thi sĩ Vinh Hồ)
Nhân danh tự do người ta cầm tù kẻ khác
Nhân danh lòng tốt người ta làm những điều xấu xa
Nhân danh chống cái ác người ta làm chuyện thậm ác
Nhân danh đức tin người ta làm chuyện thối tha
Cuộc đời vẫn dẫy đầy những điều nghịch lý
Đôi khi vì quá yêu nhau lại làm khổ lòng nhau
Chúng ta mãi u mê lầm lạc từ vô thỉ
Đắng cay trần gian quay quắt nát nhàu
Thiện và ác tốt và xấu đùng và sai
Tất cả chỉ là hai mặt cua đồng xu
Chỉ có lòng yêu thương thắp lửa ngày mai
Chỉ có lòng bao dung xóa tan hận thù
Cảm ơn em cho anh niềm hy vọng
Cảm ơn người cho ta niềm vui sống
Cảm ơn Mẹ cho con lòng học hỏi
Cảm ơn Phật cho con thôi vọng động
Trần Minh Hiền Orlando ngày 18 tháng 11 năm 2022",cảm ơn 11182022,,Trần Minh Hiền,https://poem.tkaraoke.com/121004/.html
"The Killing Fields Of Ukraine
The dead bodies of people floating in the rivers
Corpses scattered on the wheat fields
Many of these bodies drying on the rooftops
Or rotten in the small alleys.
They felt so cold on the step stones of the cathedrall hall.
And lay motionless behind the porch of deserted houses
The rain is falling on them, like the tears of their souls
Weeping in the darkness of these haunted towns.
They died old and young,
the children still wrapped inside their mothers’ arms.
They died in their sleep by artillery and missile explosions
They died screaming with burns from white phosphorus dropped from the sky.
Spring will certainly come again
And these human  flesh and bones will make a good fertilizer
For the growing sun flowers and the green wheat fields
The sun will rise every morning, the moon and stars still shining as ever.
Triệu Nguyên Tâm
November 3, 2022.",the killing fields of ukraine,,Triệu Nguyên Tâm,https://poem.tkaraoke.com/121005/.html
"Ánh dương tàn gợi nhớ người yêu
Mơ ngày tháng nuông chiều ấp ủ
Hoàng hôn xuống mây mù giăng phũ
Chỉ mình ta ...dáng cũ xa rồi.
Mảng trăng gầy nhạt bóng đơn côi
Cơn gió thổi từng hồi buốt lạnh
Sương lắng đọng trên cành sóng sánh
Tiếng chim gù xé mảnh lòng đau.
Nghĩa mờ phai duyên rạn nát nhàu
Mình đôi ngã rời nhau trọn kiếp
Tình dĩ vãng chôn vùi giấc điệp
Chúc cho người bước tiếp đời vui.
Cứ mặc ta ôm nỗi ngậm ngùi
Hồn chết lịm buông xuôi nhịp thở
Tâm cạn héo con tim vụn vỡ
Để đêm về... mộng... nhớ... rồi đau.
19/11/2017",hoàng hôn nhớ,,Trần Đình Sơn,https://poem.tkaraoke.com/121006/.html
"Trên đời có lắm thứ lầm
Lầm than, lầm lũi, lầm ngầm, lầm yêu
Lầm nào cũng khổ ít nhiều
Lầm yêu khổ nhất, làm điêu đứng mình
Trước yêu mọi thứ đều xinh
Sau yêu mọi thứ như chình mắm nêm
Nỉ non than khóc nhiều đêm
Trời liền khuyên nhủ: ""Chớ lầm kiếp sau.”",lầm yêu,,Sa Thi,https://poem.tkaraoke.com/121007/.html
"Cô
Chủ nhiệm lớp chúng tôi suốt ba năm trung học
Ngày ấy, lũ học trò chúng tôi trắng trong như ngọc
Lơ ngơ bước vào trường với những dấu chân son!
Cô ngày ấy
Tuổi chỉ chừng hai mươi mấy
Sinh viên mới ra trường với nhiều ước vọng, khát khao!
Mong chắp cho tụi học trò những đôi cánh bay cao
Để khám phá vùng trời kiến thức không bờ không bến!
Nhớ những tháng ngày
Cô tận tuỵ
Với đám học trò mê chơi hơn học
Ưa nhìn đất ngắm trời, suốt ngày mơ với mộng
Xem việc ngoài lề còn quan trọng hơn những kỳ thi
Cô ân cần tăng tiết
Phụ đạo thêm giờ không quản gian lao
Chỉ mong cho những chồi xanh lớn mạnh vươn cao
Hầu để lại cho đời những vườn cây sum suê quả ngọt!
Những lúc bọn học trò quậy phá
Những khi kết quả học hành không được khả quan
Nước mắt cô lăn dài theo nỗi muộn phiền của ngày tháng cưu mang
Đã làm lũ học trò chúng tôi gục đầu hối lỗi!
Cô
Cả đời chắt chiu
Truyền thụ, vun bồi cho chúng tôi biển cả mênh mông tri thức
Hơn ba mươi năm làm người chèo đò lặng thầm bền bỉ đêm khuya thao thức
Để từng chuyến đò yên bình đỗ bến, bao lượt khách sang sông!
Cô
Người chèo đò vĩ đại trên bến sông đời không nệ hà sóng to gió lớn
Với trái tim nồng nàn chan chứa, độ lượng,  bao dung
Với lòng yêu nghề mãnh liệt, với lý tưởng, niềm tin
Đã tạo nên bao thế hệ học trò toả đi muôn hướng
Xây đắp tương lai!
Nhớ về cô
Với lòng biết ơn sâu sắc!
Nhớ những kỷ niệm về cô, cùng bảng đen phấn trắng
Cô đã chỉ đường dẫn lối, chuẩn bị hành trang vững chắc
Cho chúng tôi dấn bước vào đời thực hiện ước mơ!
Cầu chúc cô
Luôn mạnh khoẻ, bình an
Lòng tận tâm, bầu nhiệt huyết vẫn mãi mãi đầy tràn!
Nhớ mãi câu ca muôn đời vẫn còn nguyên giá trị:
""Muốn sang thì bắc cầu Kiều
""Muốn con hay chữ phải yêu lấy thầy""!
(Kính tặng cô T.T.C.T - đứa học trò ngày xưa, nvpk)
Nhân ngày Nhà giáo Việt Nam, kính chúc Quý Thầy Cô luôn dồi dào sức khỏe, hạnh phúc, an khang!",cô chủ nhiệm,,Nvpk,https://poem.tkaraoke.com/121008/.html
"Đêm nay sao lòng quá nhớ ơi
Đêm trăng vàng vọt chẳng thấy vui
Thơ thẩn ngó về khung trời đó
Gợn mù thương xa thương một người
Đêm nay thấy lòng sầu sầu vơi
Ánh sao nhấp nháy phủ khắp trời
Chỉ có mình anh với trà đó
Trà trộn tiếng tim đổ nhớ người
08.00 đêm 07.06.2018
nghe tiếng tim đổ nhớ người",đổ nhớ người,,Bounthanh Sirimoungkhoune,https://poem.tkaraoke.com/121009/.html
"Ngó nơi nào mới vui
Bao giờ êm ấm ngồi
Ly trà nồng thơm đó
Lòng mong muốn đó thôi
Ngó cuối trời chẳng vui
Lòng lại thêm nhớ người
Từng đêm hồn đi kiếm
Chốn bình an bên người
11.00 đêm 07.06.2018
quá nhớ em đêm nay",chốn bình an,,Bounthanh Sirimoungkhoune,https://poem.tkaraoke.com/121010/.html
"Bóng ai cho nhớ cho thương
Cách xa ngàn dặm cuối đường đêm mơ
Nhiều đêm lòng thấy thẩn thơ
Cầu xin cầu khấn bao giờ bên nhau
Thêm đêm thêm nhớ thêm sầu
Đã thời gian vẫn xa nhau từng mùa
Hỏi ai vẽ bóng đêm khuya
hỏi ai vẽ cả trong mơ có nàng
08.00 đêm 08.06.2018
thời gian trong mơ vắng em",trong mơ có nàng,,Bounthanh Sirimoungkhoune,https://poem.tkaraoke.com/121011/.html
"Bỗng nghe tiếng lòng đêm
Dưng dưng đổ qua rèm
Sao đêm nay lại thấy
Ngập lời nhớ thương em
Bỗng dưng mở lời than
Nửa đêm chợt nhớ nàng
Ngó về cuối trời đó
Sao gửi tiếng tim sang
12.00 đêm 08.06.2018
bỗng dưng nửa đêm nhớ nàng",bỗng,,Bounthanh Sirimoungkhoune,https://poem.tkaraoke.com/121012/.html
"Cho anh một chút đợi mong
Để giảm từng tiếng gọi thầm qua đêm
Quen nhau đã mấy năm sang
Lòng vẫn thương tiếc một nàng hơn ai
Yêu thương vân vướng lòng này
Ngắm hình trên giấy loay hoay đợi chờ
Đêm sang nhiều lúc thẩn thơ
Cầu cho yêu nhớ từng giờ gần nhau
08.00 đêm 09.06.2018
xa nhau lòng đêm thêm tiếc thương",từng giờ gần nhau,,Bounthanh Sirimoungkhoune,https://poem.tkaraoke.com/121013/.html
"Tạnh rồi lại mưa trong đêm nay
Lác đác ngoài hiên từng giọt rơi
Cứ mãi đua nhau qua đêm đổ
Ngồi ghi dòng thơ quá sầu vơi
Ngó từng hạt mưa lạnh giá rơi
Hạt dài hạt ngắn đổ khắp trời
Hạt tim hạt lòng thêm buông đổ
Ẩm cả hạt tim đêm đổ rơi
11.00 đêm 09.06.2018
tròng lòng lạnh giá với hạt
mưa đêm",đêm đổ rơi,,Bounthanh Sirimoungkhoune,https://poem.tkaraoke.com/121014/.html
"Tê tái ngó mùa trôi
Bóng sao đừng khắp trời
Đêm nay trời thanh tĩnh
Lòng người chẳng an lành
Tê tái lòng nhớ thương
Quen nhau xa xa đường
Cách hồn xa bóng đó
Đêm chợt nhớ chợt thương
08.00 đêm 10.06.2018
chợt choàng nhớ nhau đêm",tê tái,,Bounthanh Sirimoungkhoune,https://poem.tkaraoke.com/121015/.html
"Lời thơm tiếng thảo bên tai
Từng đêm ngồi xuống nghe hoài tiếng tim
Đôi bên đêm xuống chẳng im
Yêu thì cách trở ai khuyên nhủ lòng
Đôi bên đôi ngóng chờ mong
Thương thầm nhớ trộm đêm nằm sao vui
Cầu đêm hồn tới cuối trời
Bên mình bên bóng khỏi vơi lòng chờ
11.00 đêm 10.06.2018
sao vơi khi yêu mà xa nhau",khỏi vơi lòng chờ,,Bounthanh Sirimoungkhoune,https://poem.tkaraoke.com/121016/.html
"Ăn không cái gì cũng ngon
Tiêu tiền ăn phở chẳng ngon chút nào
Lá rụng nối lại sao tươi
Chẳng học chẳng giỏi chê người lấy danh
Càng quen càng nhớ tới nhau
Càng làm càng giàu lại càng ghen đua
Thừa ăn một miếng chẳng bòn
Thừa tiền thừa bạc lại bòn cho trai
Đường đời nhiều lúc chẳng no
Hai chân chẳng bước lại co lên nằm
Hai tay đã có chẳng sài
Sài hai chân bước đêm ngày lang thang
Tán gái thì lại chẳng chăm
Đến khi thăm nàng nàng đã có con
Chăm học có ngày giỏi giang
Như cát gió thổi thì vàng hiện ra
Phận gái lo điểm lo trang
Lo hoa nở muộn lo già hết duyên
Sanh con mà chẳng có chồng
Kiếm tìm cả làng chẳng biết con ai",ca dao (156),,Bounthanh Sirimoungkhoune,https://poem.tkaraoke.com/121017/.html
"Lấy bùn mà phết lên tay
Lấy chuyện thiên hạ mà gây nhọc lòng
Gần rệp cho biết mùi hôi
Gần người cho biết bên người ra sao
Quen chim nên biết chim bay
Quen người nên biết đường xa thế nào
Ai đốt cháy được mây trời
Ai đốt cháy hạt sương rơi từng mùa
Ngó trăng trăng đẹp trà say
Ngó người người đẹp loay hoay đi tìm
Miếng ngon thì nhớ chẳng quên
Gái đẹp thì vẫn nhớ em chẳng mòn
Má hồng thì để tặng chồng
Má hồng nào tặng người dưng hàng ngày
Hết duyên ham sắc ham son
Tô rồi chẳng khác quỷ non ma già
Má hồng hãy tặng cho chồng
Đừng tặng nhiều chàng ham nịnh ham vui
Mai sau sao giỏi với đời
Bây giờ ngồi xuống ham chơi cả ngày",ca dao (157),,Bounthanh Sirimoungkhoune,https://poem.tkaraoke.com/121018/.html
"Thơ hoạ Nguyễn Thành Sáng & Tam Muội (973)
Giây Phút Miên Man
Xuân đã về sao trống trải quạnh hiu
Trên bến vắng liu riu con sóng bạc
Cơn gió thoảng lá khô rơi lác đác
Chạnh u hoài tan tác ngõ hồn đau
Mấy năm dài âm ỉ lạc mất nhau
Đường đê nhỏ dàu dàu chân lê bước
Miền cay đắng thuở xưa ai thấu được
Vẫn nồng nàn hẹn ước mối tơ duyên
Rồi thời gian thêu dệt khúc phỉ nguyền
Ngàn thắm thiết mủi xuyên vào trái cấm
Yêu chân thật chẳng màng nhung lụa gấm
Hay đắn đo vì đậm thấm nghĩa tình
Em đâu ngờ giông bão gợn lung linh
Cho mặt nước xoá hình đôi chung bóng
Vỗ tan vỡ cát lầu xây tuyệt vọng
Cuộn theo dòng lỏng bỏng trải không gian
Những âm thầm ray rứt giữa miên man
Đêm thắc thỏm lệ tràn đơn chăn gối
Tiếng gà gáy trách hờn sao nỡ vội
Lạnh khuê phòng nhức nhối vọng sơn khê
Miệt mài trông ngày tháng bước anh về
Treo đằng đẵng tái tê luôn giục giã
Để trăn trở siết mòn sâu cõi dạ
Lệch chỉ hồng buồn bã biết bao nhiêu
Duyên mỏi mòn chiếc bóng dưới cô liêu
Bầu ảm đạm tuỵ tiều buông se sắt
Ngập thương nhớ xót xa trong dằn vặt
Giọt tình sầu héo hắt nỗi niềm mang.
February 15, 2019
Tam Muội
Vạt Bóng Lững Lờ Trôi
Gió vùn vụt thổi ngược sát bên tai
Cảnh u ám kéo dài vào xa thẳm
Ngồi lặng lẽ nghiêng đầu qua nhẹ ngắm
Man mác buồn trĩu nặng khối tâm tư…
Hàng cây xanh loáng thoáng cặp mé bờ
Trải cành nhánh vật vờ xuôi vận tốc
Xe đò chạy quẹo cua rồi leo dốc
Xuống từ từ rẽ bọc hướng dòng sông
Dãy cát nâu ẩn chứa cả mùa đông
Đang ngủ đó giữa lòng băng giá lạnh
Ta trầm mặc, mơ màng theo chầm chậm
Trên đường mòn lăn bánh hướng về đâu…
Kẻ chơ vơ đứng trước một khung sầu
Nhìn kín mít chìm thâu canh tĩnh mịch
Như cái xác vô tri nằm thin thít
Dưới từng hồi nhúc nhích khoảng mờ đen
Từ phương xa lặn lội đến tìm em
Nay chỉ thấy đọng thêm niềm da diết
Tim ấp ủ, bao năm dài rung lắc
Lại tiếp lần chất ngất nỗi đăm chiêu…
Bỗng bất chợt cửa sổ bị ngọn khều
Vang kẻo kẹt tiếng kêu hờn ghẹo phá
Bừng thức giấc trong dư âm buồn bã
Của nửa đời tơi tả vỡ yêu đương
Để tận cùng sâu thẳm mãi vấn vương
Khiến mộng mị trên đường tìm ảnh mộng…
Giờ tất cả chỉ còn là vạt bóng
Giữa khung trời lồng lộng lững lờ trôi…
24/2/2019
Nguyễn Thành Sáng
NHẤT LANG THƯ QUÁN:  nhatlang.com",thơ hoạ nguyễn thành sáng & tam muội 973.,,Nhất Lang (Nguyễn Thành Sáng),https://poem.tkaraoke.com/121019/.html
